,title,wos,clean_abstract
357,Exploring a strategy for tall office buildings based on thermal energy consumption from industrialized perspective: An empirical study in China,WOS:000522383500073,faced urban high density environment current energy saving measure focused climatic design technical improvement might align well china national policy extending longevity high rise building realize life cycle sustainability therefore explores energy efficient strategy tall office building response time varying operational parameter realize spatial malleability industrialized perspective result case show first model office multi courtyard positive impact climatic term ventilation air temperature thermal radiation environment effectiveness thermal energy conservation second average energy efficiency rate model office multi courtyard 12 8 4 7 interior space coverage 20 80 third interior space coverage range 50 60 average energy efficiency rate appears substantial fluctuation 10 3 6 5 appears point interior space coverage 58
358,Systematically retrofitting city streets: Meeting the demands of climate change through multifunctional climate-responsive street gardens,WOS:000746543800004,reintroduction green infrastructure recognized approach mitigating heat island flash flood urban area depending type extent green infrastructure gi reduce local urban temperature significantly time reduce risk flooding view streetscape important area activity gi based intervention two main reason serf conduit urban human activity mobility act significant heat store approach proposed unites key element form basis future public realm streetscape design promoting truly responsive urban environment these include reduction sealing essential area decentralized water management using rain garden technology low maintenance aesthetic planting supporting biodiversity sensor based monitoring thermal comfort parameter optimize measure it utilizes low cost sensor obtaining thermal comfort data locate urban heat island it also proposes gi based decision tool bringing together relevant data set temperature level surface sealing flood risk well aspect location service traffic urban planning a pilot application part ongoing austrian government funded project described methodology applied
359,Life-Cycle oriented development of opaque wall elements in various climate zones in China,WOS:000368507100005,energy resource demand building stock china total many time e higher building rapid construction activity mean effort made relevant similar target adopted also country like china adapted measure implemented locally in sense simulation typical residential room module conducted order identify adapted lifecycle optimized wall construction 26 climate china therein opaque wall element improved stepwise insulation capacity for constant room operation configuration energy demand heating cooling determined following selected material assigned external wall it calculated layer thickness last added centimetre energy payback time within useful life 30 60 100 year furthermore room turned four compass point thickness determined it shown climate certain insulation capacity required southern china monolithic wall example made aerated concrete optimal sufficient it concluded large part global new construction volume could constructed energy resource optimized wall element also able recycled
360,Bridging the Gap: Hazard Mitigation in the Global Context,WOS:000339394800001,natural hazard mitigation recent field name for decade various professional practicing hazard mitigation example emergency manager working architect city planner update building code disaster resistant construction civil engineer working local official design flood resistant urban drainage system forester working state official enact effective prescribed burning practice yet often natural hazard mitigation taken place isolated activity scattered within daily duty diverse profession accidentally cross disciplinary effort recognized vitally important protect individual community yet recognized multidisciplinary field crucial importance natural hazard mitigation requires coherent approach consistent accessible technical information training formal informal discourse among hazard mitigation professional interaction greater public awareness social component recognition hazard mitigation profession right simultaneously hazard mitigation professional need strengthen multidisciplinary tendency continue collaborate key field public health various science today many professional starting bridge gap disaster risk reduction hazard mitigation discus benefit emergency management professional working others community partnership achieve resilience
361,Operation of climate-adaptive building shells utilizing machine learning under sparse data conditions,WOS:000697165700002,conventional machine learning ml technique based big data difficult integrate directly building operation due curse dimensionality caused data sparsity while number feature variable building considerable many case reliable dataset obtained target building operation unique feature result insufficient data building operable ml model in proposed methodology applying robust algorithm carefully selected feature variable based building physic an operation using adaptive building shell presented case energy simulation utilizing generic office building model equipped electrochromic glass performed 2016 2019 weather data tokyo fukuoka japan k nearest neighbor algorithm employed ml application robustness regarding small datasets feature variable prearranged carefully chosen set adequate combination number feature objective variable without ml air conditioning system operation became unstable intermediate season ml application successfully solved problem 95 undesired cooling operation avoided result prove simple ml algorithm could become better solution complex one case building physic based building engineer knowledge effectively utilized it expands ml application various building operation even case respond direct application complex ml technique require large datasets known big data
362,THE PARADOX OF CLIMATE CHANGE MITIGATION AND ADAPTATION IN DANISH HOUSING,WOS:000313387800003,mean building must greatly reduce energy consump tion it however paradoxical mitigation denmark created negative energy indoor problem housing may made worse a literature carried housing scheme mitigation sought reduced space heating demand shown extensive problem overheating exist a theoretical regulative design strategy mitigation new build housing therefore carried shown reducing space heating high level thermal insulation passive solar energy result overheating growing demand cooling expected reduce space heating increase cooling demand housing an analysis new build housing using passive solar energy mitigation strategy therefore carried relation future scenario it shown severe indoor comfort problem occur questioning relevance passive solar energy mitigation strategy in conclusion theoretical interplay mitigation strategy carried cross disciplinary focus user passive design active technology it shown cumulative use strategy create buffer thus eliminating problem overheating reducing energy consumption new build housing therefore designed relation current future scenario show mitigation strategy ensure
363,Optimization of Design Parameters for Office Buildings with Climatic Adaptability Based on Energy Demand and Thermal Comfort,WOS:000537476200039,according chinese building energy demand report 2016 building consumption accelerating spectacular rate especially urban public building in various design parameter meet principle proposed achieve unity energy utilization indoor thermal comfort level according local energy conservation code five typical benchmark geometric model established open studio sketch up plug site representative various climate meanwhile adopting engine energy plus ep launch calculate instrument definition file idf respectively assessing coupling relationship energy consumption well thermal comfort result implied based time proportion 8760 h met level 1 comfort range total energy reduction different chinese region different among severe cold zone scz changchun hot summer cold winter zone hscw shanghai appeared greatest energy saving potential 18 24 16 19 respectively cold zone cz beijing mild zone mz kunming approximately equaled 15 12 15 saving space hot summer warm winter zone hsww haikou appeared relatively low around 5 7 although simulation result may limited number parameter setting main one consideration seriously indication still much room appropriate improvement local public building energy efficiency code
364,A back-end view to climatic adaptation Partitioning weather-induced cement demand variance in wet humid environment,WOS:000526048500001,purpose investigates level variance real time demand bagged cement induced response climatic sequence humid tropic support best practice call weather responsive supply chain strategy design methodology approach data consumption cement site work 100 ongoing building construction site gathered period 12 month variance partitioning capability ordinary least square hierarchical linear modelling form regression analysis comparatively used evaluate sensitivity cement demand meteorological profile wet humid finding outcome provides statistical evidence demonstrating meteorological profile wet humid induces significantly high percentage variance real time demand bagged cement construction site however nested within variance fixed effect cement footprint building architecture inherent locality particularly positive change reduce wet trade composition building compensating change technological bias necessary combat weather interference humid tropic limitation implication finding exploratory purpose holistically forecasting cement demand therefore form part comprehensive decision support system bespoke area practical implication outcome provides back end view climatic wet humid setting making compelling case localized risk adaptive supply chain strategy policy geared towards sustainability cement usage originality value delineates confounding impact weather distinct local building architecture technological bias thus creating methodological platform replication comparative productivity study diverse geographical area
365,A Framework for Introducing Climate-Change Adaptation in Pavement Management,WOS:000484472500126,greenhouse gas emission caused global temperature rise since mid 20th century accompanied sea level rise slr temperature increase slr induced groundwater rise shown cause premature pavement failure many roadway structure hybrid bottom top hybrid approach shown promise initially investigating asset response incremental environmental identifying timing critical effect budgetary planning improves practitioner understanding asset resiliency informs plan development minimize cost risk in hybrid approach pavement induced temperature groundwater rise demonstrated case site coastal new hampshire hot mix asphalt hma thickness achieves minimum 85 reliability calculated 70 combination incremental temperature groundwater rise increasing base layer thickness improves resiliency rising temperature rising groundwater diminishes improvement demonstrating hma base layer thickness increase needed thirteen pathway evaluated pavement performance life cycle cost road surface inundation 60 year pavement management period a stepwise flexible plan developed includes hma overlay prescribed thickness application timing base layer rehabilitation option evaluation opportunity
366,Beyond Threshold Approaches to Extreme Heat: Repositioning Adaptation as Everyday Practice,WOS:000446977500001,one certain impact increasingly frequent extreme heat heat management policy generally utilize temperature humidity threshold identify constitute extreme condition in workplace threshold used trigger reduction work intensity duration in region routinely exceed proposed threshold however approach deeply problematic raise critical question frequently exposed population already manage mitigate effect extreme heat drawing social practice theory reposition everyday engagement extreme heat term practice work it find body absorb produce heat practice challenging view extreme heat external risk body exposed theoretical starting point also challenge utility threshold based strategy demonstrating heat actively coproduced living performing body weather argument exemplified case outdoor manual worker monsoon tropic work practice adapted reduce thermal load more specifically find worker weather work work weather enable work done extreme condition our analysis everyday heat draw attention generative capacity body unsettles two established separation 1 climatic exposure sensitivity calling embodied experiential performed perspective 2 climatic impact mal calling understanding located everyday practice management body weather
367,Review of energy conservation technologies for fresh air supply in zero energy buildings,WOS:000460845100053,people spend 90 time indoors fresh air supply building improve indoor air quality become concern due sick building syndrome sb outbreak sars common method cooling heating fresh air use air handling unit however often large enthalpy difference outdoor fresh air indoor air lead large amount energy consumption fresh air system in order achieve goal zero energy building passive waste heat recovery equipment active waste heat recovery system earth air heat exchanger developed handle fresh air present comprehensive energy conservation technology fresh air supply including theoretical experimental simulation work advantage disadvantage economy adaptability different energy conservation technology fresh air supply building analyzed discussed and challenge future direction fresh air supply technology discussed aim pave way future development fresh air supply technology zero energy building
368,The Impact of Regeneration and Climate Adaptations of Urban Green-Blue Assets on All-Cause Mortality: A 17-Year Longitudinal Study,WOS:000549268600001,urban waterway underutilised asset provide benefit ranging mitigation e g reducing flood risk promoting health well urban setting indeed urban waterway provide green blue space increasingly associated health benefit present observational used unique 17 year longitudinal natural experiment canal regeneration complete closure dereliction north glasgow scotland u k explore impact green blue canal asset cause mortality widely used indicator general health health inequality official data death socioeconomic deprivation small area data zone period 2001 2017 analysed distance data zone population weighted centroid canal calculated create three 500 distance buffer spatiotemporal association proximity canal mortality estimated using linear mixed model unadjusted adjusted small area measure deprivation result showed overall decrease mortality time beta 0 032 95 confidence interval ci 0 046 0 017 closing gap mortality le affluent area annual rate decrease mortality rate largest 0 500 buffer zone closest canal 3 12 95 ci 4 50 1 73 smaller decrease found buffer zone removed canal 500 1000 3 01 95 ci 6 52 0 62 1000 1500 1 23 95 ci 5 01 2 71 a similar pattern result found following adjustment deprivation finding support notion regeneration disused blue green asset adaption positive impact health health inequality future study needed using larger sample individual level data including environmental socioeconomic health variable ascertain specific element regeneration effective promoting health health equity
369,Root Growth Adaptation to Climate Change in Crops,WOS:000536769100001,threatening crop productivity worldwide new solution adapt crop environmental change urgently needed elevated temperature driven affect developmental physiological plant process ultimately impact crop yield quality plant root responsible water nutrient uptake change soil temperature alters process limiting crop growth with predicted variable climatic forecast development efficient root system better adapted changing soil environmental condition crucial enhancing crop productivity root trait associated improved rising temperature increasingly analyzed obtain suitable crop variety in summarize current knowledge effect increasing temperature root growth impact crop yield first describe main alteration root architecture different crop undergo response warmer soil then outline main coordinated physiological metabolic change taking place root aerial part modulate global response plant increased temperature discus main regulatory mechanism controlling root warmer soil including activation heat oxidative pathway prevent damage root cell disruption root growth interplay hormonal regulatory pathway global change gene expression protein homeostasis also consider field increasing temperature usually associated abiotic biotic stress drought salinity nutrient deficiency pathogen infection present recent advance root system able integrate respond complex different stimulus order adapt increasingly changing environment finally discus new prospect challenge field well promising pathway future
370,"How do urban spatial patterns influence the river cooling effect? A case study of the Huangpu Riverfront in Shanghai, China",WOS:000647739700004,urban river play important role mitigating surrounding temperature contribution influencing factor still unclear using remote sensing data captured summer evaluates river cooling effect rce huangpu river central area shanghai china examines influence urban spatial pattern found 1 average river cooling intensity rci ranged 1 72
371,The Evolution of Cold Adaptation Technology within Ancient Buildings in Amur River Basin Viewed from Archaeology,WOS:000882209500001,amur river basin located china high latitude cold border area while inheriting characteristic chinese traditional building combined unique geographical climatic environmental condition local residential building unique architectural feature cold adaptability outstanding insulation technology become main feature area greatly affected development modern vernacular architecture according archaeological report document selects ancient architectural site different historical period object based building restoration airpak software used simulate analyze indoor temperature building site explore effect active heating measure different form fire hypocaust system passive cold protection measure different type wall structure according archaeological information simulation data summarizes characteristic cold adaptability technology ancient building china cold border area different historical period because relatively lagging development background amur river basin modern time construction vernacular building continued use traditional low tech insulation technology ancient building adapt cold environment therefore attention insulation technology ancient building provide new perspective architectural heritage protection cold region establishing development model combine archaeology cultural heritage protection effective way achieve goal architectural cultural heritage protection
372,Short-term effect of simulated salt marsh restoration by sand-amendment on sediment bacterial communities,WOS:000466131200021,coastal strategy needed build salt marsh resiliency maintain critical ecosystem service response impact caused although resident microbial community perform crucial biogeochemical cycle salt marsh functioning response restoration practice still understudied one promising restoration strategy placement sand sediment onto marsh platform increase marsh resiliency a previous examined ground structure soil carbon dioxide emission pore water constituent spartina alterniflora vegetated natural marsh sediment sand amended sediment varying inundation regime here analyzed sample experiment test effect sand amendment microbial community 5 month along previously observed change biogeochemistry sand amendment drastically modified bacterial community decreasing richness diversity dominant sulfur cycling bacterial community found natural sediment replaced one dominated iron oxidizer aerobic heterotroph abundance correlated higher co2 flux in particular relative abundance iron oxidizing zetaproteobacteria increased sand amended sediment possibly contributing acidification formation iron oxyhydroxides our data suggest bacterial community structure equilibrate inundation regime maintained within optimal range s alterniflora while long term effect change bacterial community growth s alterniflora clear result suggest analyzing microbial community composition could useful tool monitor restoration effort
373,"Quantitative estimation of the impact of climate change on residential electricity demand for the city of Greater Accra, Ghana",WOS:000681288900001,purpose purpose investigate impact temperature residential electricity demand city greater accra ghana it believed increasing trend temperature may significantly affect people life demand electricity national grid given recurrent electricity crisis ghana investigate current future residential energy demand light temperature fluctuation inform future power generation using renewable energy resource mix find sustainable solution recurrent energy demand challenge ghana help government ghana better understand temperature dependence residential energy demand turn help developing behavioral modification program aimed reducing energy consumption monthly data temperature residential electricity consumption greater accra region january 2007 december 2018 obtained ghana meteorological service gm ghana grid company gridco respectively used analysis design methodology approach used monthly time series data 2007 2018 data monthly electricity demand temperature obtained ghana grid company gm theoretical framework residential electricity consumption log linear demand equation time series regression approach used to demonstrate certain desirable property produce good estimator analysis technique ordinary least square measurement also applied finding showed impact residential electricity requirement selected region greater accra owing temperature analysis suggests substantial positive response increase temperature demand residential electricity thus indicates growth region demand electricity future temperature change a analysis project growth electricity demand seems small concern perhaps incoherence mechanism used regulate temperature resident however two point considered drawing conclusion even case greater accra alone first growth demand electricity shown present growth demand due increasing temperature consider change factor driving growth demand electricity demand future increase beyond induced temperature due increasing demand population mechanization socioeconomic factor second power consumption understated genuine electricity demand owing massive shedding load dumsor occurred ghana 2012 2015 analysis period also applies greater accra region given factor growth demand electricity set increase response draw authority prepare critically capacity building load balancing result also revealed monthly total residential electricity consumption particularly monthly peak electricity consumption city accra highly sensitive temperature therefore rise temperature different scenario would high impact residential electricity consumption reveals monthly total residential electricity demand greater accra increase 3 1 limitation implication data largely restricted one region ghana inconsistency data region variable use temperature proven literature dominant variable affect electricity demand place use variable however extended capture entire region country sponsorship accurate data obtained practical implication government policy law making authority play influential role ensure level toward impact residential consumer it main responsibility government arrange enough support help residential consumer adapt try make consumer self sufficient modification certain behavior rather supply dependent government body need carefully define support incentive program influence residential level consumption practice demand management here energy policy investment need strategic critical problem identify appropriate policy favor vulnerable sector residential sector social implication to evaluate mitigation policy important estimate effect energy usage around world existing empirical figure however concentrated western nation especially usa to predict electricity usage shift city greater accra ghana author used regular household electricity consumption data originality value motivation particular empirical analysis ghana originality literature demonstrates adequate understanding relevant literature modern time
374,Improving Comfort and Health: Green Retrofit Designs for Sunken Courtyards during the Summer Period in a Subtropical Climate,WOS:000699403300001,sunken courtyard long used underground space provides important outdoor environment it introduces natural element create pleasant space human activity however measured typical sunken courtyard found potential problem excessive solar radiation accumulated air pollutant summer acceptable outdoor temperature human activity to improve comfort health sunken courtyard proposes green retrofit design firstly compared green wall water tree sunshade primary measure improve thermal comfort combining sunshade green wall water reduces temperature 5 6 degree
