,title,wos,clean_abstract
558,"Climate Adaptation and Indoor Comfort Improvement Strategies for Buildings in High-Cold Regions: Empirical Study from Ganzi Region, China",WOS:000751347100001,improvement building living condition high cold area always issue worthy attention currently using field survey data evaluation ganzi region based western plateau china typical example restricted factor natural condition economic level winter indoor thermal environment western plateau house generally poor taking new residential house ganzi region case author conducted field analysis first author analyzed construction technology functional layout building thermal environment testing investigation second author analyzed user activity path according production lifestyle thirdly author comprehensively evaluated indoor thermal comfort questionnaire predicated mean vote pmv predicted percentage dissatisfied ppd evaluation model result showed 1 construction technology functional layout temperature distribution new residential building consistent user activity path could effectively improve thermal insulation ability thermal comfort 2 compared developed eastern region user building showed stronger tolerance wider acceptable temperature range extreme environment 3 certain cooperative work condition indoor temperature 10 14 degree
559,Impact of local adaptation measures and regional climate change on perceived temperature,WOS:000321561600004,perceived temperature pt measure quantification human thermal comfort developed german meteorological service dwd in present sensitivity pt air temperature water vapour pressure wind speed mean radiant temperature street canyon width building height investigated mesoscale atmospheric model metras integrated domain covering city hamburg 250 horizontal resolution calculate meteorological input data pt sensitivity pt determined automatic differentiation basic dwd program sensitivity show local measure regional influence pt sensitivity also allow estimate accurate different input variable need known order achieve desired accuracy pt result discussed detail 10 june 2007 cloudless day advection warm air mass south east a comparison result obtained different synoptic situation summer made sensitivity pt air temperature water vapour pressure mean radiant temperature higher warm humid condition situation thermal comfort sensitivity pt wind speed highest low wind speed around noon increasing building height 5 reduce pt 2 4 k due shading effect street canyon aspect ratio 0 5 after sunset increasing building height 5 tends moderately increase pt due increased longwave radiation
560,Effects of urbanization on regional meteorology and air quality in Southern California,WOS:000463512700001,urbanization profound influence regional meteorology air quality megapolitan southern california influence urbanization meteorology driven change land surface physical property land surface process these change meteorology turn influence air quality changing temperature dependent chemical reaction emission gas particle phase partitioning ventilation pollutant in characterize influence land surface change via historical urbanization human settlement present day meteorology air quality southern california using weather forecasting model coupled chemistry single layer urban canopy model wrf ucm chem assume identical anthropogenic emission simulation carried thus focus effect change land surface physical property land surface process air quality historical urbanization led daytime air temperature decrease 1 4 k evening temperature increase 1 7 k ventilation air la basin decreased 36 6 daytime increased 27 0 nighttime these change meteorology mainly attributable higher evaporative flux thermal inertia soil irrigation increased surface roughness thermal inertia building change ventilation drive change hourly no concentration increase 2 7 ppb daytime decrease 4 7 ppb night hourly o 3 concentration decrease 0 94 ppb morning increase 5 6 ppb time day change o 3 concentration driven competing effect change ventilation precursor no x concentration pm2 5 concentration show slight increase day decrease 2 5 mu g m 3 night process driver change pm 2 5 include modification atmospheric ventilation temperature impact gas particle phase partitioning semi volatile compound chemical reaction understanding process driver related land surface change effect regional meteorology air quality crucial decision making urban planning megapolitan southern california achieve regional air quality improvement
561,Development of subsurface drainage systems: Discharge-retention-recharge,WOS:000803796700003,sufficient freshwater needed water dependent sector agriculture nature drinking water industry however even low lying flood prone country like netherlands weather extreme economic growth urbanization land subsidence increased food production make complex guarantee sufficient freshwater sector furthermore frequency amplitude extremely dry wet weather condition expected increase current dutch water management system designed anticipate extreme over last decade drained dutch agricultural field land consolidation urbanization resulted declining groundwater table additionally fresh water demand different sector agriculture industry drinking water increased causing increased pressure regional groundwater system a consequence annual groundwater table sandy soil area dropped time effect nowadays fresh water becoming scarce dry period in provide insight shifting water management strategy netherlands 1950 2020 corresponding drainage system developing conventional drainage approx 1950 1990 controlled drainage 1990 onwards adaptive drainage 2010 onwards subirrigation system 2018 onwards furthermore provide insight effect subirrigation groundwater level crop yield based international literature measurement dutch field pilot although subirrigation contribute improved soil moisture condition crop growth field scale show water volume needed subirrigation large could put significant pressure available regional water source therefore efficient responsible use available external water source subirrigation e g surface water treated waste water groundwater required finally implementation controlled drainage subirrigation asks correct implementation regional balance requires integral catchment wide approach
562,Impacts of climate change on wind energy power - Four wind farms in Spain,WOS:000494885700113,there growing interest may affect energy sector including change wind energy generation build existing adding economic component considers affect operating margin investment value specific wind farm spain a projection wind speed carried using ensemble three model two scenario rcp 4 5 8 5 two time period 2018 2041 2042 2065 per plant using historical power curve change wind speed converted production output result show variation production 8 change operating margin 10 seasonal generation may fluctuate well increase summer decrease winter an investment analysis also conducted consider may influence future development sector
563,Climate change shifts the trade-of between lower cooling and higher heating demand from daylight saving time in office buildings,WOS:000922224900001,original intention daylight saving time dst save energy required artificial lighting one hour shift working hour however also impact current future heating cooling demand building yet thoroughly investigated here daylight saving time induced heating cooling demand archetype office across united state simulated 15 city different representative concentration pathway rcp trajectory dst reduces cooling increase heating maximum saving 5 9 cooling 4 4 increase heating simulated current climatic condition noting cooling dominates building demand dst period increase future cooling demand significantly affect combined heating cooling potential reducing energy demand dst introduced however relative reduction e decrease percentage total cooling demand smaller considering impact dst cooling heating energy demand depends geographical location determines amount temporal pattern cooling heating demand for considered case study introducing dst generally resulted overall combined saving maximum saving 3 port angeles assuming rcp 4 5 scenario policy shift working hour need evaluated considering impact building energy demand necessary establish whether saving cooling saving heating energy demand achieve higher co2 emission reduction
564,Estimating the future energy efficiency and CO2 emissions of passive country housing applying domestic biogas reactor: A case study in Egypt,WOS:000454548400197,investigates role passive design strategy using biogas reducing energy consumption annual energy cost co2 emission new productive country housing model ongoing sustainable community development project near cairo egypt country housing character follows vernacular architecture hot arid area application courtyard vault dome two different material building envelop traditional 25 cm red brick used first case whilst second sustainable one prefabricated sandwich panel construction 15 cm grc wall opportunity using 2 3 biogas reactor promising housing project area raising domestic animal along waste supply house agriculture zone design builder simulation took place present future showed considerable reduction energy consumption annual energy cost co2 emission estimation sustainable option biogas passive house
565,"Simulating the cooling effects of water spray systems in urban landscapes: A computational fluid dynamics study in Rotterdam, The Netherlands",WOS:000392687200010,heat wave related heat stress increase human morbidity mortality decrease human productivity increase building energy consumption cooling there need sustainable system reduce heat stress urban area evaporative cooling water spray system increasingly used purpose however evaluation cooling potential system difficult to knowledge systematic investigation cooling potential system actual urban area yet performed present high resolution computational fluid dynamic cfd simulation based 3d unsteady reynolds averaged navier stokes equation ass cooling potential water spray system 15 hollow cone nozzle system numerically implemented courtyard bergpolder zuid region rotterdam netherlands operated heat wave period july 2006 simulation validated based wind tunnel measurement evaporative cooling process satellite imagery data heat wave period universal thermal index utci used ass heat stress reduction due evaporative cooling result show given value injected water flow rate overdot w 9 01 min height spray system h 3 maximum temperature reduction utci reduction 7 5 degree
566,Impact of climate change on yield and water use efficiencies of potato in different production regions of South Africa,WOS:000543265200001,in south africa potato produced region different climate expected result higher temperature thus increasing incidence heat stress lowering risk frost mid altitude area increasing ambient carbon dioxide level enhance photosynthetic rate reduce water use potato assessed impact potential yield water use efficiency wue twelve potato production region south africa using lintul potato crop model with current planting time simulated yield 1 961 2 050 increased 0 02 0 40 ha 1 1 wue 0 00 0 08 g l 1 1 evapotranspired improvement yield wue close zero crop grown hot period increasing incidence heat stress higher evapotranspiration largely discounted benefit higher co 2 level particularly case interior production region expected temperature increase severe in many region potato grower likely respond advancing planting time often trade existed maximising yield wue a compromise could achieved planting early possible optimum spring planting window summer crop
567,"Green bonds in the world-ecology: capital, nature and power in the financialized expansion of the forestry industry in Brazil",WOS:000624640200010,2008 financial crisis opened door green capitalism financially sound approach saving planet worst effect emergency emphasis role finance promoting green growth permeated mainstream political academic business approach mitigation assuming multiple form carbon market kyoto protocol paris agreement environmental social governance taxonomy green investment proliferation sustainable label several economic sector present offer critical appraisal one prominent argument upholds idea possible desirable achieve sustainability economic growth finance green bond green bond debt instrument whose proceeds earmarked fund project supposedly environmental benefit after year background occupy central position green recovery narrative political framework world most academic literature tends naturalize green bond eminently technical solution reconcile economic growth environmental sustainability filling epistemological gap present leverage world ecology approach embed financial phenomenon green bond within broader picture capitalist political economy expansion ecological frontier in light ongoing experience author following brazilian legal financial political context unpacks make sense green bond tool hand finance reproduces global pattern north south uneven development shifting ecological cost to test potential interpretative framework offered world ecology approach mobilize concrete case green bond issuance directed fund forestry sector brazil aware current phenomenon represents blip comparison largeer temporal longue duree spatial world system scale usually deployed world ecology nonetheless discus ideological technical power dynamic behind issuance green bond unleash capital accumulation produce financialized subordinated construction nature entail institutional arrangement organized around 3 main section after introduction section 1 describes green bond one fashionable financial topic moment one promotes shift discourse towards need actively building green economy although legal standpoint green bond embody significant difference regular bond focus describe promise around current private governance structure trend issuance debt instrument global north south specific focus case brazil in section 2 look operation green bond emission ground e taking example context green debt underpinning brazilian forestry sector analysis reveals emission made predominantly large multinational company actively present global market feed great effort deployed public private sector constructing image sector key player emergent bioeconomy strengthening brazil goal paris agreement however describe green bond revenue officially committed implementation sustainable management forest associated expansion ecological frontier brazilian territory stretching boundary area dedicated tree plantation amplifying social environmental tension backstage emission show capital accumulation green bond associated coproduction nature purpose accumulation generating concern often diluted transformed procedural requirement debt generated subscription green bond argue financial also social ecological in section 3 put forward private accumulation successful green bond forestry sector demand institutional arrangement combine state support private governance debt financial social ecological dimension rather result idealized spontaneous market set institutional transformation considered order comprehend feasibility green bond brazilian forestry sector thus describe historic connection forestry state endless public incentive put nature work functional adaptation brazilian environmental legislation regulation concerning demarcation access use land in context argue green bond add yet new institutional layer process creating validating specific form nature governance structure dilutes tension promise environmental benefit concrete negative social environmental impact conclude reassembling finding part capitalist world ecology dialectical unity capital accumulation co production nature power suggest world ecology approach allows u grasp green bond complex form far ignored relevant literature a phenomenon financialization green bond understood isolation material basis since basis social environmental condition contradiction appropriates value a example brazilian forestry sector illuminates greenness financial debt inscribed green bond may come existence expense social environmental debt underlie forestry sector productive model hence although explicit inclusion environmental concern financial consideration project implementation praised step towards recognition finance material impact planet externality shall accounted warns typical green arithmetic move put forward green bond green bond inevitably co produce nature social relation unequal way emphasizes capital accumulation necessarily protect environment even standard introduced much contrary green bond may come expense way living ecologically restoring injustice past creating regenerative future word creating debt
568,"Solar radiation prediction using improved soft computing models for semi-arid, slightly-arid and humid climates",WOS:000801988100010,in monthly solar radiation predicted semi dry dry wet climate adaptive neurofuzzy interface system anfis radial basis function neural network rbfnn multi layer perceptron mlp model used predicting solar radiation sr grasshopper algorithm goa utilized improve performance anfis rbfnn mlp model three station iran namely rasht humid yazd semi arid tehran slightly arid considered case study accuracy goa benchmarked particle swarm optimization pso salp swarm algorithm ssa result reveal best input combination relative humidity wind speed rainfall temperature three station a comprehensive performed select best input combination main contribution create new hybrid anfis model predicting monthly solar radiation different climate besides effect different parameter comprehensively investigated solar radiation indicates temperature effective parameter estimating sr dry semi dry it found rainfall play key role estimating sr wet region main finding determination suitable input scenario predicting sr important issue different input scenario different climate provide different performance besides use robust optimization algorithm training method significant step modeling process sr result indicate mean absolute error mae anfis goa 3 8 8 9 le comparison mlp goa rbfnn goa respectively training stage yazd station besides mae anfis goa 26 31 le mlp goa rbfnn goa respectively training stage tehran station result indicate nse value anfis goa anfis ssa anfis pso anfis model 0 94 0 88 0 84 0 79 respectively testing stage rasht station it found anfis goa attains higher accuracy predicting sr different climate
569,THE INFLUENCE OF CLIMATE CHANGE ON ELECTRICITY DEMAND. CASE STUDY IN THE BASQUE COUNTRY,WOS:000518391500018,analyzes sensitivity electricity demand sector temperature context outline methodology incorporate variable energy decision making methodology based evolution thermal distance cold warm day respect established threshold heating degree day cooling degree day influence demand approach tested basque country result show residential sector sensitive change future demand projected according multiple scenario due greater statistical significance temperature difference cold day current limited use air conditioning estimated residential demand could fall much 4 could translate nearly 20 million euro annual saving emission reduction around 30 000 co2 per year
570,Extreme Heat and COVID-19 in New York City: An Evaluation of a Large Air Conditioner Distribution Program to Address Compounded Public Health Risks in Summer 2020,WOS:000931764400001,in summer 2020 new york city nyc implemented free air conditioner ac distribution program response threat extreme heat covid 19 program distributed installed ac home nearly 73 000 older low income resident public private housing to evaluate program impact survey data collected october 2020 february 2021 via mail online 1447 program participant 902 non participating low income nyc adult without ac comparison group data examined calculating frequency proportion logistic regression model participant 3 time likely report staying home hot weather summer 2020 compared non participant adjusted odds ratio aor 3 0 95 confidence interval ci 2 2 4 1 difference group summer 2019 aor 1 0 ci 0 8 1 3 participant le likely report 2020 hot weather made feel sick home compared non participant aor 0 2 ci 0 2 0 3 program helped participant low income resident primarily people color stay home safely hot weather these result relevant health effort heat health intervention
571,Aboveground carbon loss associated with the spread of ghost forests as sea levels rise,WOS:000574639000001,coastal forest sequester store carbon terrestrial counterpart greater risk conversion due sea level rise saltwater intrusion sea level rise convert freshwater dependent coastal forest salt tolerant marsh leaving ghost forest standing dead tree behind although recent investigated driver rate coastal forest decline associated change carbon storage across large extent quantified mapped ghost forest spread across coastal north carolina usa using repeat light detection ranging lidar survey multi temporal satellite imagery field measurement aboveground biomass quantify change aboveground carbon between 2001 2014 15 167 km 2 unmanaged public land region changed coastal forest transition ghost forest characterized salt tolerant shrub herbaceous plant salinity proximity estuarine shoreline significant driver change conversion resulted net aboveground carbon decline 0 13 0 01 tgc because saltwater intrusion precedes inundation influence vegetation condition advance mature tree mortality suggest aboveground carbon decline used detect leading edge sea level rise aboveground carbon decline along shoreline offset inland aboveground carbon gain associated natural succession forestry activity like planting 2 46 0 25 tgc net aboveground carbon across area our highlight combined effect saltwater intrusion land use aboveground carbon dynamic temperate coastal forest north america by quantifying effect multiple interacting disturbance measurement mapping method applicable coastal landscape experiencing saltwater intrusion a sea level rise increase landward extent inundation saltwater exposure investigation large scale requisite effective resource allocation in changing environment human intervention whether land preservation restoration reforestation may necessary prevent aboveground carbon loss
572,A tool for easily predicting short-term phosphorus mobilization from flooded soils,WOS:000381636400001,construction restoration riparian temporarily flooded wetland water storage flood protection area play central role adaptive water management in general arable ex arable land used type water storage however inundation may lead problem excess phosphorus p stored soil may released result eutrophication overlying surface water clearly water nature manager need able determine area temporary water storage would feasible option without causing eutrophication problem here using controlled experimental approach simple predictive tool p mobilization rate soil upon short term inundation developed a large suite soil characteristic p mobilization rate determined flooding different soil type peat sand two different depth mimic topsoil removal topsoil soil 30 60 cm ground level two temperature test seasonal influence 8 degree
573,ON THE RELIABILITY OF COMPUTER-BASED CLIMATE MODELS,WOS:000482645100006,since 1850 global surface temperature earth warmed 0 9 degree
574,Varying Inundation Regimes Differentially Affect Natural and Sand-Amended Marsh Sediments,WOS:000389604900036,altering sea level rise rate precipitation pattern worldwide coastal wetland vulnerable change system response stressor important resource manager environmental steward understand order best manage thin layer sand sediment application drowning eroding marsh one approach build elevation resilience ground structure soil carbon dioxide emission pore water constituent vegetated natural marsh sediment sand amended sediment examined varying inundation regime mean sea level mean high water 0 82 navd88 1 49 navd88 field experiment law point part plum island sound estuary ma significantly lower salinity ph sulfide phosphate ammonium measured sand amended sediment natural sediment in natural sediment pattern increasing salinity increasing elevation sand amended sediment trend reversed showing decreasing salinity increasing elevation sulfide concentration generally increased low high inundation highest concentration highest inundation e lowest elevation high pore water phosphate concentration measured low elevation natural sediment sand amended treatment mostly low concentration phosphate consistent pattern elevation at end experiment lowest elevation generally highest measure pore water ammonium soil carbon dioxide emission greatest sandamended mesocosms higher elevation difference coarse root rhizome abundance volume among sediment treatment detected ct imaging 20 week natural sand amended treatment showed similar total belowground biomass intermediate high elevation although difference pore water nutrient concentration ph salinity belowground root rhizome morphology detected natural sand amended sediment similar belowground productivity total biomass measured end growing season since belowground productivity support organic matter accumulation peat buildup marsh result suggest thin layer sand sediment application viable action build elevation coastal resiliency especially area low natural sediment supply
