,title,wos,clean_abstract
195,"The Impact of Variable Retention Harvesting on Growth and Carbon Sequestration of a Red Pine (Pinus resinosa Ait.) Plantation Forest in Southern Ontario, Canada",WOS:000731452900001,a atmospheric carbon dioxide concentration continue rise global temperature increase growing concern sustainability health carbon sequestration potential forest ecosystem variable retention harvesting vrh suggested potential method increase forest biodiversity growth carbon
196,"Native pedunculate oaks support more biodiversity than non-native oaks, but non-native oaks are healthier than native oaks: A study on street and park trees of a city br",WOS:000862777400018,tree city provide multiple ecosystem service however simultaneously ensuring healthy tree high habitat di versity challenging harsh urban environment compared health microhabitats bat activity native quercus roburl non native quercus rubral oak growing different urban habitat street v park karlsruhe southwestern randomly selected 167 oak tree diameter breast height dbh 20 cm across city urban tree registrar performed tree health assessment dendrometric microhabitatinventory recorded four day bat activity 45 native non native oak acoustic logger installed thetrees found non native oak healthier native oak provided le abundance richness micro habitat tree size positive effect pruning negative effect strongly influence microhabitat richness abundance in addition park tree hosted significantly microhabitats street tree recorded activity 9 bat speciesfrom 4 genus pipistrellusbats active park tree street tree long eared bat plecotus weremoreactivenear native non native oak bat likely favored bymicrohabitatssuchasforksplit lightning scar wood peckerflutethat common le healthy tree conclude non native red oak planted alongsidestreets condition harsher park better adapt climatic change stay healthy le main tenance preservation native pedunculate oak tree especially within park paramount urban biodiversity conservation potential provide microhabitats supporting bat
197,The role of small scale sand dams in securing water supply under climate change in Ethiopia,WOS:000347952400008,community based water storage semi arid area help adapt mitigate household water shortage since little known downstream effect local water storage employ water balance model perform catchment scale assessment upscaling local scale water storage sand dam impact increasing water storage evaluated current condition future scenario survey information used estimate current future water demand ass benefit derived current sand dam ethiopian area using indicator environmental flow concept downstream hydrological impact simulated different scenario storage 613 dam supplying water 555 000 people impact environmental flow downstream sand dam storage 2190 dam lead modest increase number month low flow 4 9 projected lead larger increase number low flow month 0 29 joint maximum storage scenario cause increase low flow month 4 50 under extreme projection 4 5 wet season discharge stored sand dam because local benefit improved water supply acceptable range downstream impact sand dam appear viable way supplying drinking water catchment well semi arid region similar condition
198,"Assessment of Urban Growth and Variation of Aerosol Optical Depth in Faridabad District, Haryana, India",WOS:000759076700006,sustainable urbanization sustainable development goal requires quantitative information urban landscape despite fastest growth urban area poor air quality faridabad constituent district national capital region fails gain much attention present based multi temporal freely available satellite image indicated 3 increase built 2 decrease arable land 2008 2018 further spatial metric shanon entropy class area ca number patch np largest patch index lpi indicated scattered development built increase ca 11470 ha 2008 13806 ha 2018 np 221 2008 476 2018 indicated isolated development built small area coverage increase lpi 12 5 2008 13 5 2018 built indicated compact growth dense built southern eastern side leading vertical expansion city area linear expansion residential builtup industrial commercial area along highway road railway vehicular emission contributed high aerosol concentration while rural region high aerosol loading also observed extensive use fertilizer stubble burning present land use land cover change impact air quality could contributed significantly urban policy making mitigation strategy
199,Sustainability of Egyptian Cities through Utilizing Sewage and Sludge in Softscaping and Biogas Production,WOS:000809033400001,national egyptian agenda 2030 recently adopted concept sustainable city mitigating adapting responded concept treating sewage reuse softscaping recycling sludge reduce energy consumption support heating system producing biogas of limitation focus compound propose model increase sustainability egyptian city used many technology biological treatment process activated sludge trickling filter fixed bioreactors however membrane bioreactors mbrs seemed suitable technology low cost footprint additionally pilot laboratory established simulate sewage treatment plant it consisted primary sedimentation tank followed mbr tank chlorine disinfection tank sludge fed cylindrical anaerobic digester amount sludge collected generated 41 5 ml day biogas application large scale batch reactor produce around 38 m3 day biogas applying finding treatment reuse domestic sewage sludge provide 50 water needed green area compound
200,Thermal comfort investigation of stratified indoor environment in displacement ventilation: Climate-adaptive building with smart windows,WOS:000460039900001,impact combination passive ventilation system smart window adaptive building studied a 3d steady state rans cfd simulation sst k omega turbulence model used evaluate temperature distribution age air two case heat source smart window two ventilation opening model first validated first case full scale experimental data for window wall ratio wwr range 20 40 four different room outlet opening location validated model used determine thermal comfort metric studied building smart window case mixed environmental condition atlanta ga used setting boundary condition result thermal comfort analysis showed wwr 30 40 preferred studied window smart window electrochromic glazing respectively it also showed 50 temperature difference reduction floor ceiling achievable electrochromic window smart window without electrochromic glazing reduced maximum relative air temperature floor ceiling 87 30 compared regular window provides resource designing adaptive building improving occupant thermal comfort existing building enhancing building aesthetic view characteristic
201,"The US Blue New Deal: What does it mean for just transitions, sustainability, and resilience of the blue economy?",WOS:000757753800001,ocean coast largely absent green new deal proposal in response limited attention paid sustainability equitable governance approach blue economy u blue new deal proposed aiming protect health ocean support coastal community blue new deal emerged central policy proposal 2020 democratic presidential candidate elizabeth warren enhance role blue economy simultaneously addressing crisis through transition analysis evaluates proposal u blue new deal designed senator elizabeth warren would applied towards enhancing socioeconomic resiliency environmental justice addressing social inequity a part critical policy analysis evaluating area focus warren blue new deal present environmental justice sustainability central success managing enhancing role blue economy challenge facing blue new deal reflect one size fit federal approach implication addressing multifaceted obstacle key sector blue economy governance tackling interconnected crisis exacerbate socioeconomic inequity vulnerability marginalised coastal community proposes blue justice framework blue new deal seek address tension contradiction exist current form indicates comprehensive policy framework enhance sustainability equitable involvement blue economy
202,"Summertime impacts of climate change on dwellings in Wales, UK",WOS:000808464300001,wale predicted warmer wetter hot summer expected become commonplace middle century whilst focus wale wintertime decarbonisation introduction energy efficiency measure welsh government want understand summertime impact occupant welsh housing aim project test hypothesis summertime indoor housing condition wale diminish consequence a six week period 22nd july 31st august modelled using uk 2018 local projection baseline 2030 2070 respectively result reveal increased incidence summertime overheating majority dwelling poorest performing dwelling post 1990 dwelling flat property internal wall insulation result show cooling strategy reduce indoor air temperature increasingly required indoor vulnerability modelled moisture result demonstrate potential poorer indoor environmental quality due increased relative humidity every location experience increase relative humidity regardless dwelling typology relative humidity highest pre 1919 dwelling dwelling solid stone wall result show ventilation strategy improve extraction moisture laden air whilst diluting concentration pollutant present indoors required dwelling avoid increased incidence condensation damp mould growth adverse impact allergen particle pollutant
203,Diurnal and seasonal trends and associated determinants of surface urban heat islands in large Bangladesh cities,WOS:000702901900001,many surface urban heat island suhi study conducted around globe however still lack information available regarding intensity suhi suhii bangladesh city focused diurnal seasonal suhi variability temporal trend possible driver five major city mean annual daytime suhii ranged 2 88 degree
204,The value of the shading function of urban trees: A replacement cost approach,WOS:000663729200004,cooling one important benefit street tree yet city planner lack estimate value benefit estimation value cooling effect could help strengthen case investment tree cover part urban infrastructure aim address gap presenting novel application replacement cost method using cost parasol estimating value shade provided urban tree using method calculated net present value shade generic tree used estimate case prague czech republic result showed cost tree planting maintenance higher estimated shading benefit short term 20 30 year situation reversed tree life expectancy increased 40 year street tree hence long term investment term microclimate regulation proposed approach assist city planner assessment microclimate regulation urban tree easily applied local data complement method show wider benefit urban tree
205,Systematic Comparison of the Influence of Cool Wall versus Cool Roof Adoption on Urban Climate in the Los Angeles Basin,WOS:000446542100032,first time ass influence employing solar reflective cool wall urban energy budget summertime los angeles basin systematically compare effect cool wall cool roof heat mitigation strategy widely studied employed using consistent modeling framework weather forecasting model adoption cool wall lead increase urban grid cell albedo peak early morning late afternoon ratio solar radiation onto vertical wall versus horizontal surface maximum in los angeles county daily average increase grid cell reflected solar radiation increasing wall albedo 0 80 9 1 w 2 43 increasing roof albedo cool wall reduce canyon air temperature los angeles 0 43 k daily average peak reduction 0 64 k occurring 09 00 lst secondary peak 0 53 k 18 00 lst per 0 10 wall roof albedo increase cool wall roof reduce summertime daily average canyon air temperature 0 05 k 0 06 k result reported used inform policy urban heat island mitigation
206,Effects of Heat Stress on Working Populations when Facing Climate Change,WOS:000314383700002,it accepted earth changing accelerating pace already documented implication human health environment literature provides overview existing finding effect heat stress working population relation in light purpose literature explore recent previous impact heat stress human occupational setting heat stress workplace researched extensively past however contemporary context information lacking extent implication main factor found exacerbate heat stress current future workplace urban heat island effect physical work individual difference developing country context technological fix often applicable there also lack information effect vulnerable group elderly people pregnant woman a increasing temperature reduce work productivity world economic productivity could condensed affecting developing country tropical zone disproportionately future needed taking interdisciplinary approach including social economic environmental technical aspect
207,Passive warming of indoor space induced by tropical green roof in winter,WOS:000335874300030,thermal energy performance green roof winter seldom investigated with poor building thermal insulation lacking artificial heating indoor space winter subtropics become uncomfortably cold health implication elderly weak people experimental established two extensive green roof residential building humid subtropical hong kong broadleaved perennial peanut arachis pintoi succulent mexican sedum sedum mexicanum plot compared bare concrete tile control plot temperature sensor installed along holistic vertical temperature profile three apartment plot left vacant permit undisturbed monitoring at control plot notable heat loss especially nighttime induces upward heat flux cool indoor air vegetated roof provide receptor repository solar energy sensible heat generate green roof heat sink effect ghe porous substrate store interstitial water augment thermal capacity conductivity ghe warmer green roof vi a vi cooler ceiling generates thermal gradient induce downward heat flux warm indoor space peanut plot thicker substrate creates stronger ghe sedum extensive green roof subtropical area offer passive warming indoor space winter implication indoor heating energy consumption progressively aging population
208,Does fragmentation contribute to the forest crisis in Germany?,WOS:000924624900001,intact forest contribute ecosystem functionality landscape storing sequestering carbon buffering cooling microclimate providing range related ecosystem function forest fragmentation pose threat many organism also reduces resistance resilience ecosystem especially relevant ongoing crisis effect recent extreme heat year forest studied detail influence fragmentation investigate relation forest fragmentation temperature vitality per ecoregion canopy level using satellite imagery 1 km 30 resolution compiled correlated forest map connectivity based thiessen polygon canopy temperature hottest day based land surface temperature forest vitality based maximum normalized difference vegetation index per growing season differentiated ecoregions main forest type in 2022 larger intact tree covered area le fragmented relatively low temperature hot day higher overall vitality nearly 98 almost 1 95 million forest fragment 30 resolution smaller 1 km 2 cover nearly 30 total forest area to counteract forest crisis forest landscape management aim reduce fragmentation maintain tree biomass forest cover landscape increasing size continuous forest fragment contributes ecosystem based
209,Unintended consequences of climate-adaptive fisheries management targets,WOS:000940487500001,projected affect productivity global fishery management based maximum sustainable yield msy effective eliminating overfishing many region however continuing use yield maximizing target driven change productivity result higher anthropogenic pressure population subject related stress maintaining status quo management target demonstrate effect using theoretical example case study snow crab eastern bering sea global marine fishery database in example conservation gain e biomass ocean maintaining status quo management target larger small gain harvest made msy based management aggregate conservation gain maintaining management target increase harmful impact productivity worsen instead adaptive msy based target new management tool needed balance conservation food production ecosystem population displaying non stationary productivity
210,Industrial Structure Transformation and Layout Optimization of Beijing-Tianjin-Hebei Region under Carbon Emission Constraints,WOS:000612086800001,to address issue global warming trend towards low carbon economy world economic development china rapid economic growth high carbon energy structure contribute large carbon emission to achieve sustainable development china must transform industrial structure conserve energy reduce emission adapt measured carbon entropy carbon emission efficiency 25 industry beijing tianjin hebei region 2000 2015 building carbon entropy model total factor industrial carbon emission efficiency evaluation model showed priority development industry beijing tianjin hebei region expanding regional competitiveness moderate development industry improving proportion restricted development industry dropped significantly b spatial distribution three type industry presented pattern concentric ring priority industry core surrounded moderate restricted development industry
211,Towards Sustainable Shifts to Healthy Diets and Food Security in Sub-Saharan Africa with Climate-Resilient Crops in Bread-Type Products: A Food System Analysis,WOS:000750676200001,massive urbanization increasing disposable income favor rapid transition diet lifestyle sub saharan africa ssa a result ssa population becoming increasingly vulnerable double burden malnutrition obesity combined increasing pressure produce sufficient food provide employment growing population together threat induced declining crop yield requires urgent sustainable solution can increase cultivation resilient crop crcs utilization produce attractive convenient nutritious bread product contribute healthy sustainable diet a food system analysis bread food value chain ssa indicates replacement refined mostly imported wheat attractive bread product could 1 improve food nutrition security 2 bring shift nutritionally balanced diet 3 increase economic inclusiveness equitable benefit 4 improve sustainability resilience food system food system analysis also provided systematic insight challenge hurdle need overcome increase availability affordability uptake crcs proposed intervention include improving agronomic yield crcs food product technology raising consumer awareness directing policy overall integrated program involving stakeholder food system needed
212,Cooling effects of different wetlands in semi-arid rural region of Northeast China,WOS:000521069300001,wetland ecosystem play important role regulating local regional climate evaporative cooling effect affect exchange energy water atmosphere a lot research focused wetland cooling effect especially mitigating urban heat island effect however intensity influencing factor wetland cooling effect currently cannot thorough explained in assessed cooling effect wetland different type rural area northeast china using split window algorithm swa estimate land surface temperature lst landsat 8 thermal infrared sensor used correlation analysis examine relationship characteristic wetland cooling effect our result showed paddy field largest cooling effect lake followed marsh human disturbance size shaped complexity important characteristic determine wetland cooling effect although result suggested larger size wetland might higher intensity spatial extent cooling effect small size wetland might large almost similar amount cooling effect larger one our finding important implication land manager policy maker design effective plan conservation
213,Social-environmental analysis of methane in the South China Sea and bordering countries,WOS:000548350000005,preliminary assessment greenhouse effect methane ch4 emission south china sea sc human welfare using driver pressure state impact response dpsir framework system approach framework saf sc surrounded nation asia pacific region currently experiencing rapid urbanization industrialization economic growth one contested maritime area world may aggravate regional tension promote natural disaster create refugee reduce food security reducing size fish catch crop international environmental protection well mitigation protect environmental sustainability also provide international platform cooperation country around sc analyzed economic driver human activity cause pressure environment increase ch4 emission region in addition possible future impact human welfare also discussed finally identified eight management response across various spatial temporal scale useful addressing issue greenhouse gas ch4 sc
214,Assessment of Central Asian heat extremes by statistical downscaling: Validation and future projection for 2015-2100,WOS:000777167800002,increasing heatwaves extreme temperature recently observed across central asia ca accurately assessing projecting changing extreme local station scale required risk management therefore highly important however global regional model often fail represent statistical distribution observed daily extreme variable hence extreme complex terrain in work developed statistical downscaling sd model project summer daily maximum temperature tmax heatwave index 65 meteorological station ca toward 2100 sd model involves first order autoregression multiple linear regression using large scale tmax circulation index ci predictor model cross validated historical observation local tmax heatwave index projected 2015 2100 driven output global model cnrm cm6 1 four shared socioeconomic pathway ssp126 ssp245 ssp370 ssp585 application sd model significantly improves forecasting probability distribution 10th 90th percentile tmax station particularly across mountainous region model also capture interannual variability long term trend tmax consistent synoptic scale input sd projection demonstrate strong warming trend summer tmax ca toward 2100 rate 0 35 0 64 degree
215,Preferential elution of ionic solutes in melting snowpacks: Improving process understanding through field observations and modeling in the Rocky Mountains,WOS:000511088800108,preferential elution ion melting snowpacks complex problem linked temporary acidification water body however understanding process snowpacks around world including polar region experiencing unprecedented warming melting remains limited despite instrumental supporting in data collected snowmelt lysimeter snowpits meadow forest gap site high elevation watershed colorado combined pulse multi phase snowpack chemistry model investigate control meltwater chemistry preferential elution snowdepth meadow site 64 forest gap site snowmelt rate greater meadow snowpit due higher solar irradiance cation ca2 nh4 deposited mostly within upper layer meadow forest gap snowpacks acid anion no3 so42 evenly distributed snow ion concentration generally greater forest gap snowpit except nh4 indicates wind erosion wet dry deposited ion meadow may reduced concentration residual snow furthermore forest gap site snow interception scavenging process sublimation ventilation throughfall led particular ion enrichment ca2 mg2 k cl so42 no3 model simulation observation highlight preferential elution enhanced low snowmelt rate model indicating due lower dilution rate increased contact time area percolating meltwater snow result suggest low snowmelt rate cause multiple early meltwater ionic pulse ion subject lower ion exclusion ion exclusion rate grain size level estimated first time
216,Urban Green Infrastructure Monitoring Using Remote Sensing from Integrated Visible and Thermal Infrared Cameras Mounted on a Moving Vehicle,WOS:000606106200001,forecast higher temperature urban environment worsening urban heat island effect uhi green infrastructure gi city could reduce uhi regulating reducing ambient temperature forest city e melbourne aimed large scale planting tree adapt next decade therefore monitoring city green infrastructure requires close assessment growth water status tree tree resolution proper maintenance need automated efficient project proposed novel monitoring system using integrated visible infrared thermal camera mounted top moving vehicle automated computer vision algorithm used analyze data gathered elm tree avenue city melbourne n 172 tree obtain tree growth form effective leaf area index laie tree water stress index twsi among parameter result showed tree tree variation tree monitored 5 04 km 2016 2017 growth water stress parameter obtained mapped using customized code corresponded weather trend urban management proposed urban tree monitoring system could useful tool city planning gi monitoring graphically show diurnal spatial temporal pattern laie twsi monitor effect gi city
