,title,wos,clean_abstract
181,"Dynamic metabolism modelling of urban water services - Demonstrating effectiveness as a decision-support tool for Oslo, Norway",WOS:000340336300002,urban water service challenged many perspective different stakeholder demand performance improvement along economic social environmental dimension sustainability in response urban water utility systematically give attention criterion water safety mitigation environmental life cycle assessment lca total cost efficiency improve operation within water energy carbon nexus author collaborated development dynamic metabolism model dmm model developed generic use sustainability assessment urban water service initially tested city oslo norway purpose adopt holistic systemic perspective analysis metabolism environmental impact resource flow urban water wastewater system order offer tool examination future strategy intervention option system describes model application city oslo analysis time period 2013 2040 external factor impacting decision making intervention introduced along realistic scenario developed testing consultation official oslo water wastewater work norway possible intervention utility intends set motion defined numerically interpreted incorporation model change indicator value time period determined aim demonstrate effectiveness usefulness dmm decision support tool water wastewater utility scenario considered intervention identified include possible scenario intervention relevant water wastewater utility
182,Assessment of the climate preparedness of 30 urban areas in the UK,WOS:000324830500007,city increasingly aware need mitigate greenhouse gas emission adapt change weather pattern leading production urban plan existing systematic study plan focused either mitigation issue typically based survey completed city official rather analysis documented evidence to gain insight status mitigation action across uk document 30 urban area representing similar 28 uk population analysed an urban preparedness score could applied urban area outside uk devised comparative analysis analysis characterizes progress assessment ii planning iii action iv monitoring mitigation preparedness score allows quantitative comparison strategy across urban area analysed methodology transferred country make international comparison urban area mitigation plan possible found area acknowledge threat mitigation planning action required however two urban area official mitigation plan typically mitigation activity across city advanced plan emission reduction target ranged 10 80 differing baseline timeframes scope defining meeting target similar variability observed across plan several reason difference considered particularly notable combination incentive regulation seem stimulate comprehensive strategy action many urban area
183,Signaling climate resilience to municipal bond markets: does membership in adaptation-focused voluntary clubs affect bond rating?,WOS:000767786000001,examines whether u city membership voluntary club improves municipal bond rating issued s p moody fitch suggest club focused could help city signal resilience risk ability service municipal bond yet club membership signal intent by offer concrete evidence city adopted policy enhanced resilience risk examine three club iclei whose membership obligation cover environmental issue c40 whose scope cover mitigation 100 resilient city 100rc focus employing two way fixed effect model panel 80 u city 1995 2018 find 100rc membership lead small improvement bond rating important policy implication assurance implementing policy opposed evidence reduces risk could spillover effect municipal finance in case could tangible implication city level finance
184,Government by experiment? Global cities and the governing of climate change,WOS:000320181400001,in argue approach go beyond institutional reading urban governance engage way government accomplished social technical practice central exercise government manner argue experiment purposive intervention urban socio technical system designed respond imperative mitigating adapting city drawing three different concept governance experiment socio technical experiment strategic experiment first develop framework understanding nature dynamic urban experiment use conceptual analysis frame scoping global dimension urban experimentation database 627 urban experiment 100 global city analysis chart experiment occur relationship social technical aspect experimentation governance urban experimentation including actor involved governing extent new political space experimentation emerging contemporary city find experiment serve create new form political space within city public private authority blur primarily enacted form technical intervention infrastructure network drawing attention importance site urban politics these finding point emerging agenda urban experiment need engage diversity experimentation different urban context conducted practice impact implication urban governance urban life
185,Lack of Cross-Sector and Cross-Level Policy Coherence and Consistency Limits Urban Green Infrastructure Implementation in Malawi,WOS:000595416600001,quality quantity accessibility urban greenspaces green infrastructure offer multiple benefit city dweller environment urban sustainability green infrastructure provides wide range environmental social cultural mitigation benefit however green infrastructure need integrated national policy city planning strategy way recognize value importance consequently consistency coherence policy sector level essential prominent urban green infrastructure national level policy easier ensure coherence consistency sector level well avoid national local initiative hindering effectiveness integrating urban green infrastructure planning process priority city even sub saharan africa undergoing rapid expansion here focus malawi one rapidly urbanizing country sub saharan africa collated reviewed national level city level policy strategy ranging housing transport biodiversity order determine based vertical horizontal integration process whether urban greenspaces green infrastructure incorporated planning management priority found little evidence urban greenspaces green infrastructure incorporated national level decision making process in contrast promoting enhancing urban greenspace green infrastructure priority planning strategy document produced lilongwe mzuzu city council better institutional coordination policy coherence across national level sector affect urban greenspaces green infrastructure required multiple benefit realized
186,"Climate change, urban energy and planning practices: Italian experiences of innovation in land management tools",WOS:000315426600036,energy saving challenging city territorial organization innovative spatial urban planning method procedure required new approach instrument must elaborated applied order shift building scale urban territorial one in fact energy saving emission control measure usually applied single building plant technological system urban territorial scale fully considered although energy consumption greenhouse gas reduction connected urban form density activity allocation mobility etc thus involving spatial land use planning decision it therefore urgent overcome divide energy urban planning elaborating using new implementation tool in general usual top public led action longer politically economically viable whereas new method based public private partnership progressively adopted major may set new objective planning practice term urban quality equity energy efficiency perspective requires redefinition usual method development right assignment activation new planning procedure based assessment action term performance instead conformance pre defined rule expected result regard efficient land market better performing development development choice focus italian case analyzes possibility integrating energy planning spatial planning effectiveness plan implementation mechanism prospect integrate public led intervention market tool recent innovation legislative framework support inclusion energy saving mitigation goal plan implementation procedure
187,Assessing the environmental performance of plastic-based and felt-based green wall systems in a life-cycle perspective,WOS:000766801800009,with remarkable growth city increase built area mitigation urban heat island effect become one crucial challenge social environmental sustainability significant impact public health led increasing development urban green infrastructure among nature based solution green wall system receiving growing attention passive technology ability reduce greenhouse gas emission adapt improve air quality reduce heat island effect urban environment despite growing interest studying function feature green system various type living wall nowadays available study evaluate energy efficiency performance use phase aimed ass overall environmental performance two type green wall life cycle perspective considering embodied energy greenhouse gas emission material energy consumption embodied carbon after collecting inventory data related component process system life cycle assessment cradle gate approach performed compare performance felt based system without organic growth medium system based plastic module organic growth medium main impact detected production stage material used system structure by comparing result achieved 16 impact category analyzed felt based system showed highest overall impact use fertilizer aluminum component playing crucial part polypropylene used produce panel water used plant irrigation potting soil composition main environmental impact contributor plastic based system result pointed importance accurate choice material design production green wall
188,(Mis-)belonging to the climate-resilient city: Making place in multi-risk communities of racialized urban America,WOS:000935975000001,through planning city transforming place relation recently via green resilient infrastructure gri yet gri incorporation existing racialized infrastructure system urban development regeneration finance raised question socio cultural impact justice dimension recent direction planning urbanism while critical scholar highlight exclusion historically marginalized resident analysis impact gri driven planning sense belonging reveals complex multi faceted experience gentrification displacement racialized settler colonial city drawing insight civic actor lived experience green resilient project boston massachusetts develop novel understanding belonging entail degree mi belonging our analysis uncovers three pathway urbanism shape belonging various alienated subordinated assimilated emancipated form reveals kind political subject socio cultural relation emerge lived experience project more broadly shed light le visible placemaking practice alternative mode addressing socio vulnerability contribute justice injustice dynamic
189,"Green regeneration for more justice? An analysis of the purpose, implementation, and impacts of greening policies from a justice perspective in Lodz Stare Polesie (Poland) and Leipzig?s inner east (Germany)",WOS:000860763400012,greening green regeneration developed major strategy improving quality life city neighbourhood greening policy project applied citywide neigh bourhood level various reason improvement housing living condition well wellbeing health urban policy plan programme increasingly employed greening strategy make urban neighbourhood attractive improve quality life provide resident recreational space at time greening increasingly exploited market oriented regeneration construction strategy new critical debate eco gentrification distribu tional procedural interactional injustice discussing emerging conflict trade offs green regeneration social housing market impact well analysing role greening green regeneration respect production socio spatial inequality injustice set background provides comparative analysis two case l acute accent odz acute accent stare polesie poland leipzig inner east threefold purpose first seek analyse terconnections greening policy justice concern to operationalise aforementioned terconnections second develop operational model look interconnection process applies justice perspective focus multidimensional intersectional relational context policy sensitive understanding justice third seek detect contrasting comparison help u come better comprehensive understanding interconnection green regen eration justice build primary two case earlier project
190,"Impact of the implementation of EU, national and local policies and legislation on the transition towards eco-cities in Poland",WOS:000729177000002,transforming city towards eco city constitutes significant effort mitigating adapting implementation legal act diverse environmentally oriented sectoral policy play important role process objective determine antecedence effect transformation city accordance eco city concept poland context implemented policy legislation initiative review normative act programme strategic document provide framework shift towards eco city international eu level well identifying change legislation policy initiative resulting implementation national local level a set 24 original index referring six aspect eco city waste management water wastewater management transport urban mobility application re energy engineering air quality urban green area applied multi criterion analysis selected case study permitted u identify key factor power transition towards eco city legal policy measure implemented top approach action usually initiated national level implemented local authority operate according assigned task using dedicated tool e g leps sump significant effect implementation eco city solution identified waste management sustainable transport urban mobility air quality improvement recommendation future measure include implementing plan demonstrative project eco city eco district conducting complex pro ecological measure increasing role bottom action
191,Mapping Urban Green and Its Ecosystem Services at Microscale-A Methodological Approach for Climate Adaptation and Biodiversity,WOS:000839245000001,current awareness high importance urban green lead stronger need tool comprehensively represent urban green benefit a common scientific approach development urban ecosystem service ues based remote sensing method city district level urban planning however requires fine grained data match local management practice hence linked local biotope tree mapping method concept ecosystem service methodology tested inner city district sw comparing publicly accessible area non accessible courtyard result provide area specific 2 information green inventory microscale whereas derived stock ues indicator form basis comparative analysis regarding biodiversity in case ten time micro scale green space private courtyard public space well twice many tree approach transfer scientific concept municipal planning practice enables quantitative assessment urban green microscale illustrates importance green stock data private area enhance decision support urban development different aspect concerning data collection data availability critically discussed
192,Upscaling urban data science for global climate solutions,WOS:000769810800002,non technical summary manhattan berlin new delhi need take action adapt reduce greenhouse gas emission while case study city provide valuable insight comparability scalability remain sidelined it therefore timely state art data infrastructure including earth observation social medium data could better integrated advance science city urban area present three route expanding knowledge global urban area main streaming data collection amplifying use big data taking advantage computational method analyse qualitative data gain new insight these data based approach potential upscale urban solution effect global scale technical summary city increasingly integral role addressing to gain common understanding solution require adequate representative data urban area including data related greenhouse gas emission threat socio economic context here current state urban data science context investigating contribution urban metabolism study remote sensing big data approach urban economics urban weather study outline three route upscaling urban data science global solution 1 mainstreaming harmonizing data collection city worldwide 2 exploiting big data machine learning scale solution maintaining privacy 3 applying computational technique data science method analyse published qualitative information systematization understanding first order effect solution collaborative effort towards joint data platform integrated urban service would provide quantitative foundation emerging global urban sustainability science
193,Recording Urban Land Dynamic and Its Effects during 2000-2019 at 15-m Resolution by Cloud Computing with Landsat Series,WOS:000559066700001,city core global economic development high impact land cover land use lcluc hotspot comprehensive record land cover land use dynamic urban region essential strategic adaption mitigation sustainable urban development aim develop google earth engine gee application high resolution 15 urban lcluc mapping novel classification scheme using pan sharpened landsat image with approach quantified annual lcluc changchun china 2000 2019 detected abrupt change turning point lcluc ancillary data social economic status used provide insight potential driver lcluc examining correlation rate also examined impact lcluc environment specifically air pollution using approach classify annual lcluc changchun high accuracy 0 91 detection based high resolution wall wall map show intensive urban expansion compromise cropland 2000 2019 also found growth green space urban region result green space development management recent year changing rate different land type largest early year observation period turning point land type primarily observed 2009 2010 further analysis showed economic industry development population migration collectively drove urban expansion changchun increasing built area could slow wind velocity air exchange ultimately led accumulation pm2 5 our implement pan sharpened landsat image facilitates wall wall mapping temporal land dynamic high spatial resolution primary use gee mapping urban land make replicable transferable user approach first crucial step towards understanding driver supporting better decision making sustainable urban development mitigation
194,"Verona Adapt. Modelling as a Planning Instrument: Applying a Climate-Responsive Approach in Verona, Italy",WOS:000666378400001,in response global challenge brought city around world adapting innovating nature based strategy sustainable development requires new interdisciplinary approach different discipline well practice proactively co create collaborate reduce ongoing effect anthropogenic although awareness rise new approach urban development still development moreover existing approach mainly focus local scale level lack crossover urban landscape planning present contribution offer example integrated approach bridging urban climatology landscape planning governance ass develop solution linking city district level city verona taken case test approach implication development green blue infrastructure responsive master plan district verona south through critical reflection application approach case aimed identify potential barrier based reflection provide herein recommendation modelling integrated planning well urban planner urban climatologist support making credible salient solution
195,The Improvement of the Comfort of Public Spaces as a Local Initiative in Coping with Climate Change,WOS:000508186400018,being vital element successful city public space play important role achieving sustainable development goal coping new urban agenda considers public space indispensable sustaining productivity city social cohesion inclusion civic identity quality life accordingly doubt importance public space quality generated symbiosis various element on basis normative theory urban design several public space design framework established order define make good public place such framework public space quality evaluation developed tested chair planning design landscape architecture university belgrade faculty forestry framework cover six criterion illuminate key aspect public space safety security accessibility legibility comfort inspiration sensitivity liveability in special attention paid criterion comfort analysed two scale level belgrade serbia in past belgrade affected extreme weather event caused serious sometimes disastrous consequence pronounced challenge among heat wave summer due shortage vegetation combined proliferation tarmac concrete surface reduced air ventilation particularly threaten densely populated central municipality stari grad sayski venac vracar first scale level cover analysis public space network degree establishment green infrastructure lower dorcol quartier located municipality stari grad using quantitative qualitative indicator gi geographic information system digital tool aim observe actual state public space network define future scenario development line challenge jevrejska street element mentioned public space network subject next phase scale level cover qualitative quantitative analysis public space element paving urban equipment greenery lighting water facility etc next using envi met platform actual proposed improvement street explored final part include discussion methodology used order improve public space design process point need careful consideration comfort important aspect good public space
196,Cascades of green: A review of ecosystem-based adaptation in urban areas,WOS:000370992100010,impact increase pressure challenge sustainability developmental need city conventional hard measure often associated high cost inflexibility conflicting interest related dense urban fabric ecosystem based eba emerged potentially cost efficient comprehensive multifunctional approach review systematises urban eba propose analytical framework draw theory ecosystem service sustainability science it conceptualises eba term five linked component ecological structure ecological function benefit valuation ecosystem management practice our identified 110 article reporting 112 city analysed using quantitative statistical qualitative content analysis found eba urban context fragmented due different disciplinary approach concept most article focus heat flooding studied ecological structure reducing risk hazard green space wetland tree park eba usually evaluated bio geophysical term use economic social valuation rare while article mention specific practice managing ecological structure imply urban eba strategy increasingly integrated institutional structure few article considered issue equity stakeholder participation eba identified following challenge future eba first large amount data generated isolated case study contributes system knowledge lack system perspective position eba relation wider socio economic bio geophysical context second normative ethical aspect eba require thought winner loser especially relation process put people risk related hazard third room forward looking eba including consideration future scenario experimentation creation new ecological structure role eba transformative
197,Sustainable Urban Drainage Systems: Themes of Public Perception-A Case Study,WOS:000785061300001,measure address challenge densification impose urban environment sustainable urban drainage system suds construct include introduction natural element riparian buffer vegetative filter rain bed water spill watermark filter retainer dam integral part measure suds commonly undertaken municipal level norway unfortunately implementation suds project lagged behind expectation norway normative egalitarian society public resistance local project factor delayed adoption suds that greater understanding public perception priority needed build consensus support measure looked blaklibekken suds case trondheim norway a cross section interview municipality user undertaken establish theme within local perception project theme environmental benefit child related activity maintenance site funding established provide better understanding public expectation aspect project correlated public acceptance resistance work provides starting point establish public theme interest provide decision maker greater insight public priority
198,Urban Design Storm Hyetograph Analysis Based on a New Method Considering Spatiotemporal Variations,WOS:000853929800007,design storm guarantee uniformity regarding quality operation standard engineering project employed widely urban drainage system design commonly used urban design storm chicago k
