,title,wos,clean_abstract
101,Developing and implementing a targeted health-focused climate communications campaign in Ontario-#MakeItBetter,WOS:000562329300001,setting public health practitioner called effectively communicate public crisis requires swift action start public awareness related health impact lead public support individual community systemic action mitigate adapt intervention discus learning public opinion communication strategy health focused communication campaign makeitbetter could help increase awareness engage new audience including public health partner conversation order reduce related health impact current future generation makeitbettercampaign grounded evidence informed messaging sensitive health inequity emerging pre campaign testing suggest framing health issue promising practice outcome makeitbettercampaign appeal parent caregiver learn related health impact take protective action child support multi level action campaign launch secured 89 news story including multicultural medium coverage longer term evaluation required determine campaign effectiveness building public support action implication an innovative approach communication draw intersection behavioural science engages multi sectoral collaboration spur action health protection aiding public health practitioner partner effectively communicating urgency action more work needed support communication inequity multiplier promote action community resilience health equity co benefit
102,Adaptive Asset Management for Flood Protection: The FAIR Framework in Action,WOS:000623644600005,uncertainty consequence changing societal requirement system complexity require flood protection asset manager continuously evaluate asset management policy practice manage risk improve resilience asset however many challenge asset operator often facing conflicting interest major uncertainty future need asset performance in eu interreg iv fair project flood protection asset owner operator scientific partner north sea region europe collaborated develop practical guidance adaptive asset management flood protection infrastructure central component guidance fair framework presented framework combine insight principle iso 55000 asset management iso 14090 asset operator experience provide practical guide integration asset management consideration within strategic operational context via tactical handshake mean avoid common lack connection strategic plan operational practice applicability framework illustrated example pilot case within fair project value term improved asset management reduced cost demonstrated
103,"Devising urban ecosystem-based adaptation (EbA) projects with developing nations: A case study of Port Vila, Vanuatu",WOS:000508756500027,a linked impact degradation ecosystem continue felt particularly developing country vital method development concurrently address rapid urbanisation ecosystem degradation explored further development approach participatory embedded understanding importance symbiotic relationship sociocultural ecological system particularly important ecosystem based eba one method gaining recognition momentum area developing nation face converging pressure driver eba methodology date often ill defined urban context lack consideration future social ecological scenario however in response describes methodology developing urban eba project small island developing nation context methodology developed applied multi disciplinary team working auspex secretariat pacific regional environment programme sprep application methodology port vila vanuatu indicated need local people must forefront project planning requiring participatory design process ii eba solution development must multidisciplinary iterative iii appropriate quantitative qualitative data vital basis eba project development requiring adequate time data gathering iv urban coastal eba project must developed holistically recognising socio ecological system extend beyond urban area v complex overlapping landscape governmental international aid financed project must inform development new eba project vi potential monetary non monetary benefit cost risk across multiple factor must carefully assessed eba project development vii project implementation requires ongoing engagement readiness adapt ground reality
104,Mainstreaming climate adaptation into social protection: The issues yet to be addressed,WOS:000665766600001,a consequence become better understood growing agreement among development practitioner academic need mainstreaming social protection ass progress mainstreaming effort revealing considerable progress made date however number critical issue relating challenge mainstreaming context developing country conceptual framework needed ass outcome developmental programme yet addressed these issue examined
105,Ecological public health and climate change policy,WOS:000274084300027,fact health disease product complex interaction factor long recognized public health circle more recently term ecological public health used characterize era underpinned paradigm come health well everything matter challenge policy maker one navigating complexity deliver better health greater equality health recent work scotland concerned develop strategic approach environment health seek embrace complexity within agenda recognize subtle relationship health place remain practical relevant traditional hazard focused environmental health approach good place better health initiative underpinned new problem framing approach using conceptual model developed purpose requires consideration wider social behavioural etc context approach also used configure core system strategy gather relevant intelligence subject process evaluation direct output broad policy constituency extending beyond health environment highlight approach conceived developed deliver better health greater equality health action physical environment also speaks wider public health agenda specifically offer way help bridge gap paradigm policy public health author considers development system based approach close attention problem framing situational modelling may prove useful orchestrating necessarily complex policy response mitigate adapt
106,Methodology for development of a data and knowledge base for learning from existing nature-based solutions in Europe: The CONNECTING Nature project,WOS:000607661900016,within connecting nature dealing developing innovative nature based solution nb health well social cohesion sustainable economic development european city in order enable learning comparing generating new knowledge multiple nb related study novel data knowledge base needed requires specified methodological approach development provides conceptual methodological context technique constructing data knowledge base systematically support process nb monitoring assessment a methodology present comprehensive multi step approach nb data knowledge development help guide work influence quality information included describes methodology main step phase developing large data knowledge base nb allow systematic suggested methodology explains build nb related database conceptualization requirement phase implementation maintenance in regard methodology iterative extensive nb stakeholder end user involvement packaged reusable template deliverable offering good opportunity success used practitioner end user nb data knowledge base gather information different nb model generation one easy find easy use place provides detailed description 1490 nb case urban center europe data knowledge base thus help user identify best appropriated nb model type addressing particular goal time considers local context potential data obtained used meta analysis applying statistic searching specific sample case thus enables generate expand knowledge multiple nb related study qualitative quantitative way
107,Climate-driven vulnerability and risk perception: implications for climate change adaptation in rural Mexico,WOS:000529997300001,major issue rural community developing country thus better understanding related vulnerability risk belief unlock action necessary by focusing rural community located mexican lagoon system el carmen el pajonal la machona first investigate different source vulnerability exposure sensitivity adaptive capacity derive aggregated vulnerability index integrating information hence link different vulnerability source top additional cognitive experiential element related individual risk perception on one hand result identify municipality community endangered reveal existence level vulnerability along lagoon deserving prioritization action on hand relationship greater vulnerability higher perception risk applies while exposure sensitivity cognitive component found shape related risk perception adaptive capacity experiential factor appear statistically significant influence
108,The Maturing Interdisciplinary Relationship between Human Biometeorological Aspects and Local Adaptation Processes: An Encompassing Overview,WOS:000505556200008,to date top approach played fundamental role expanding comprehension existing future climatological pattern in liaison focus attributed climatic mitigation shifted towards identification climatic specifically prepare era prone climatological aggravation within progress growing opportunity interdisciplinary integration human biometeorological aspect within existing future local effort assessed encompassing assessment existing literature likewise scrutinises existing scientific hurdle approaching existing future human thermal wellbeing local urban context respective hurdle subsequently framed new opportunity concerning human biometeorology increasing interdisciplinary significance multifaceted urban thermal process it assembly solidification scientific bridge acknowledged within multifaceted ambition ensuring responsive safe thermally comfortable urban environment amongst aspect deliberates upon numerous scientific interference must strengthened inclusively climatic assessment top bottom approach local human thermal wellbeing ii rooted association qualitative quantitative aspect thermal comfort outdoor indoor environment iii efficiency easy understand communication non climatic expert play equally fundamental role consolidating effective response era
109,Towards Transformative Climate Relocation Initiatives,WOS:000869925500001,induced change become increasingly important factor development pattern people choose live assisting resident make decision staying whether move go become critical dimension policy using global case relocation initiative examines adaptive relocation policy facilitate community led opportunity frontline community community color lower income people move stay risky environment it summarizes factor consider designing relocation initiative lead outcome improve people well
110,Ten Priority Science Gaps in Assessing Climate Data Record Quality,WOS:000467646800096,decision maker need accessible robust evidence introduce new policy mitigate adapt there increasing amount environmental information available policy maker concerning observation trend relating however data hosted across multitude website often inconsistent metadata sparse information relating quality accuracy validity data subsequently task comparing datasets decide appropriate certain purpose complex often infeasible in support european union copernicus service c3s mission provide authoritative information past present future europe rest world dataset provided service must undergo evaluation relevance scientific quality help data comparison present framework evaluation quality control eqc data product derived satellite situ observation catalogued within c3s data store cd eqc framework implemented c3s part operational quality assurance programme it build past present international investment quality assurance earth observation initiative extensive user requirement gathering exercise well broad evaluation 250 data product depth evaluation selection 24 individual data product derived satellite situ observation across land ocean atmosphere essential variable ecv domain a prototype content management system cm facilitate process collating evaluating presenting quality aspect status data product data user also described development eqc framework highlighted cross domain well ecv specific science knowledge gap relation addressing quality data set derived satellite situ observation discus 10 common priority science knowledge gap require investment ensure quality aspect data set ascertained provide user range information necessary confidently select relevant product specific application
111,Infrastructure Financing for Climate Change Adaptation in Australia: Practitioners' Perspectives,WOS:000898972700001,with increased related risk natural disaster impact infrastructure asset intensifying a need action increase finance used enable play vital role resilience infrastructure aim understand infrastructure measure carried focusing financing used aid effort exploratory interview infrastructure finance practitioner broad range organisation conducted understand dynamic infrastructure occurs finding reveal infrastructure agency conduct activity maintain serviceability asset risk financing targeting mitigation rather most action taken individual asset agency level little collaboration across agency sector result illustrate need holistic system level approach across infrastructure sector
112,Setting priorities for adapting to climate change,WOS:A1997YL58300004,it likely effort control greenhouse gas emission completely eliminate risk thus policymakers eventually address effect given uncertainty timing direction magnitude regional might seem preferable postpone adaptive measure change yet may produce satisfactory result impact irreversible catastrophic long lived resource system affected current trend make le likely succeed future in case policy change anticipation may justified anticipatory measure need flexible absorb impact enable system quickly recovery wide variety situation in addition economically efficient benefit exceed cost although many measure appropriate anticipatory measure need implemented those need immediate implementation meet least one following criterion 1 address irreversible costly impact 2 urgent e reverse trend make adoption measure difficult time 3 address long term decision building infrastructure a method proposed natural resource policymakers use analyzing need anticipatory policy effectiveness policy option anticipate method enables policy maker identify anticipatory policy need immediate implementation
113,A National Power Infrastructure for Charge-on-the-Move: An Appraisal for Great Britain,WOS:000459697700068,electrification road transportation necessary step coping charge move considered key enabling factor moving toward electric vehicle development individual charging device implementing motion charging rapid integration road infrastructure national scale still need comprehensive consideration aim outline performance requirement national power infrastructure suitable implementing charge move from estimation electric vehicle power requirement conjunction great britain road traffic data anticipated power demand expected augmented 16 gw furthermore simulation tool proposed investigate application dynamic charging effect system design variable based possible charging layout suggested such infrastructure involves 30 kw charger 1 5 length apiece installed every 2 1 4 3 motorway rural section road respectively finally strategic overview great britain suggests installation nationwide charging infrastructure type could economically viable indeed cost develop infrastructure enable electrification 86 car mile great britain around 76 pound billion present price
114,Towards future-oriented conservation: Managing protected areas in an era of climate change,WOS:000467642800002,management protected area must adapt impact prepare ongoing ecological transformation future proofing conservation dialogue based multi stakeholder learning process support conservation manager consider implication governance management it take participant series conceptual transition identify new management option robust range possible biophysical future step take prepare ecological transformation outline future proofing conservation process demonstrate application pilot programme colombia process applied adapted wide range context support practitioner developing positive way forward management decision making by acknowledging scientific uncertainty considering social value rethinking rule shape conservation governance participant identify new strategy towards future oriented conservation long term
115,Measuring Success: Improving Assessments of Aggregate Greenhouse Gas Emissions Reduction Goals,WOS:000447388800006,long term success paris agreement depend effectiveness instrument set place key among nationally determined contribution ndcs elaborate country specific goal mitigating adapting one role academic community civil society supporting paris agreement ass consistency near term action ndcs agreement long term goal thereby providing insight chance long term success here ass strength weakness current method estimate effectiveness mitigation component ndcs identify scientific political advance could made improve confidence evaluating ndcs long term goal specifically highlight 1 influence post 2030 assumption estimated 21st century warming 2 uncertainty arising lack published integrated assessment modeling scenario long term moderate effort reflecting continuation current political situation 3 challenge using carbon budget approach identify aspect improved coming year clearer communication regarding meaning likelihood timeframe ndc consistent warming estimate additional modeling long term moderate action scenario identification metric assessing progress based solely emission infrastructure investment energy demand installed power capacity plain language summary under paris agreement country came together strengthen commitment limit warming well 2 degree
116,Shifting the conservation paradigm: a synthesis of options for renovating nature under climate change,WOS:000457652200004,change earth accelerating prompting increasing call ensure investment ecological restoration nature conservation accommodate change to acknowledge need propose term ecological renovation describe ecological management nature conservation action actively allow environmental to evaluate progress development ecological renovation related intervention option context reviewed literature established typology option proposed explored option address emerging principle underpinning adapted conservation goal whether balance approach reflected typology likely sufficient given expected rapid rate our typology recognizes matrix 23 intervention option type arranged basis underpinning ecological mechanism ameliorate changing condition build adaptive capacity one axis nature tool used manipulate low regret targeted despite burgeoning literature since 2008 found majority effort consistently focused low regret approach aim build adaptive capacity many way desirable paradigm shift enabling greater attention targeted approach likely needed accelerates when assessed five emerging principle setting nature conservation goal changing one option type could deliver five identified conflict targeted option wildness value call deeper evaluation importantly much inference 473 reviewed study drawn ecological reasoning modeling 16 offering new empirical evidence also noted significant bias toward north america europe forest ecosystem tree vertebrate to address limitation help shift paradigm toward human renovator rather restorer prior world propose ecological researcher contribute 1 informing societal discourse toward adapting nature conservation goal 2 adjusting upscaling conservation planning accommodate suite adapted goal 3 reconceptualizing experimental approach increase empirical evidence expedite innovation tool address
117,"Public support for local adaptation policy: The role of social-psychological factors, perceived climatic stimuli, and social structural characteristics",WOS:000730862700011,present serious risk human community around world to ensure rapid widespread equitable risk government policy must enacted support community wide public support policy key passage to date study focused factor motivate public support policy especially subnational level to address gap develop conceptual model draw synthesizes past conceptual framework literature related environmental behavior specifically using structural equation modeling latent variable examine model drawing data statewide survey 2700 individual state indiana midwestern united state ass driver two distinct measure policy support support policy support tax find threat appraisal risk perception perceived efficacy government respondent belief perceived descriptive dynamic norm around policy support social structural characteristic political affiliation important driver support policy effect differ across two outcome measure these finding point opportunity better engage public policy discourse also suggesting distinct motivation shape support policy compared tax likely needed support new program
118,COMMUNITY-BASED ADAPTATION TO CLIMATE CHANGE: Strengthening Resilience through Development,WOS:000267621300005,a newly forming approach address community development need way increase resilience poor vulnerable people impact early example community based bangladesh highlight success limitation approach
119,Adapting to climate change through urban water management: a participatory case study in Indonesia,WOS:000333261900029,benefit integrated approach risk study increasingly recognised thus increasing need practical example work literature describes practical application integrated framework impact regional surface water resource urban water system mamminasata metropolitan region indonesia two main feature framework integration physical social consideration assessment high stakeholder involvement project implementation although concerned mamminasata region overall methodology transferable region indonesia internationally key outcome 1 creation information mamminasata planner water resource manager condition water supply may may meet demand 2 clear consensus shared learning problem facing region among cross institutional stakeholder 3 identification option urban water system knowledge gap strategy implementation result stakeholder survey conducted mid point end indicate output provide valuable guidance future planning management mamminasata regional water resource
120,Towards operational predictions of the near-term climate,WOS:000456994900011,near term prediction operate annual decadal timescales offer benefit resilience thus important society although skilful near term prediction possible particularly coupled model initialized current state importantly ocean several scientific challenge remain including gap understanding modelling underlying physical mechanism perspective discus challenge overcome outlining concrete step towards provision operational near term prediction progress endeavour bridge gap current seasonal forecast century scale projection allowing seamless service delivery chain established
121,Predicting and Adapting to Climate Change: Challenges for the Historic Environment,WOS:000411291500002,our changing pose risk historic environment also brings opportunity new discovery way people engage at historic england part responsibility understand future change might expect impact may ability protect historic building archaeological remains landscape describes project used spatial analysis ass risk vulnerability site flooding coastal erosion it summarises responded recent uk risk assessment outline believe needed strengthen evidence base time next cycle reporting historic environment better served process finally outline adaptive measure proposed enable historic england address risk make opportunity created
122,Towards a research agenda for adapting to climate change,WOS:000183419700009,view publication related building design reviewed generic term outset order identify number question potential avenue in particular link role building design implication occupant behaviour addressed context environmental performance building emphasis integration energy efficient design term building designed increase adaptive potential significance occupant adaptive opportunity
123,The Role of Natural Disaster Insurance in Recovery and Risk Reduction,WOS:000490121800019,natural disaster loss increasing worldwide insurance thought play critical role improving resilience event promoting recovery providing incentive investment hazard mitigation first examines functioning disaster insurance market broadly turn reviewing empirical study role natural disaster insurance recovery impact disaster insurance incentive ex ante hazard mitigation land use rigorous empirical work topic limited work done suggests insurance coverage improve recovery outcome impact risk reduction may modest more study comparing outcome across insured uninsured property needed particularly better understanding role insurance
124,Migration and climate change: towards an integrated assessment of sensitivity,WOS:000289178200013,set new approach understanding relationship migration based understanding migration significant growing also complex phenomenon approach seek address sensitivity existing migration driver specific context in contrast existing approach sought generate global level estimate number migrant integrated assessment approach seek instead understand existing flow specific location may future provide practical tool planning example application approach provided ghana bangladesh
