,title,wos,clean_abstract
0,Assessing the impact of the securitization narrative on climate change adaptation in Nigeria,WOS:000692468300001,in nigeria threat posed leading policymakers medium frame security threat warrant support adaptive action draw upon securitization theory examine security narrative affect using primary secondary data find although securitization argument easily identified policy action plan nigeria implication securitization policy practice harder discern find urgent policy would expected logic securitization transformation security framing urgent action appears difficult urgent measure also find people level vulnerability function deeper socio political dynamic process defy political theatre securitization
1,Integration of ecosystem-based adaptation to climate change policies in Viet Nam,WOS:000400095700008,there growing recognition importance ecosystem based approach cost effective measure multiple benefit overcome many drawback common engineering option viet nam rich biodiversity also one vulnerable country impacted policy adopted national local level well sector making viet nam one nation systematically fulfill obligation united nation framework convention consequently used viet nam case ass integration ecosystem based approach found ecosystem based implemented project overall inadequately considered viet nam policy instead policy predominantly rename infrastructure project focus hard solution disaster reduction rather responding long term ecosystem based moreover ecosystem based project focused relevant type ecosystem viet nam revise existing policy sectoral strategy integrate ecosystem based across different scale governance a nation develop policy different scale lesson viet nam engineering measure need balanced ecosystem based affordable effective response
2,"How do planners deal with barriers to climate change adaptation? A case study in Queensland, Australia",WOS:000428493300010,spatial planning local government level widely recognized role responsibility address impact however significant barrier planning institution professional forefront confronting obstacle document planner responded barrier professional level focus condition uncertainty volatility institutional policy framework low prioritization among competing institutional objective investigates planner respond condition resulting impact decision local level report case experience perspective local planner across queensland contribution document planner respond conflict institutional constraint professional responsibility case identifies strategy employed planning professional overcome common institutional barrier planner responded problematic condition engaging alternative authority identifying substitute rationale employing existing mechanism altering framing terminology establishing regional coordination forum these strategy provide option professional overcome barrier within work political environment
3,Public health and climate change: How are local authorities preparing for the health impacts of our changing climate?,WOS:000745546500133,background local authority crucial role preparing impact however extent health impact prioritized acted well understood method investigated role public health adapting content analysis local authority strategy south west england ii semi structured telephone interview local authority public health consultant sustainability officer regional public health england representative n 11 result strategy plan varied existence scope public health consultant explicit remit although related action often aligned public health emergency planning function key barrier health related financial constraint lack leadership limited public professional awareness health impact conclusion local authority south west england differing approach tackling health impact prominence public health argument varies improved public health intelligence concise communication targeted support visible local national leadership clarity economic cost benefit would useful local authority preparing health impact
4,Adaptation planning and the use of climate change projections in local government in England and Germany,WOS:000394276200010,planning often regarded local imperative considered effective grounded solid evidence base recognisant relevant projection already documented challenge making information usable decision making yet sufficiently reflected role wider institutional regulatory context examines impact external institutional context use usability projection local government analysis 44 planning document 54 semi structured interview planner england conducted july 2013 may 2014 show little demand projection local planning either country due existing policy legal regulatory framework local government england experienced decline use projection also waning agenda widely amidst change planning regulatory framework severe budget cut in spatial planning make substantial use past present data strictly regulated nature planning prevents use projection due inherent uncertainty finding two country highlight better understand usability projection need aware institutional context within planning decision made otherwise run risk continuing provide tool information limited use within intended context
5,Including quality in Social network analysis to foster dialogue in urban resilience and adaptation policies,WOS:000457508000001,capacity organizational actor increase linked network relationship especially confronting complex problem development resilience social network analysis sna organization working resilience territory montreal conducted provide insight implementation policy area analysis reveals fairly uniform network organizational link gravitating around two pole one focused local action policy design density relationship weak overall medium centralization around city montreal while centralization beneficial coordination structure involving distinct sub network linked central actor boundary broker organization would improve prospect innovation efficiency analysis quality relationship highlight important difference foster good relation pole reducing chance policy developed policy oriented pole implemented action oriented pole overall emphasizes relevance network analysis understanding prospect policy implementation complex area resilience
6,"How and why: complementary analyses of social network structures and cultural values: improving flood response networks in Queensland, Australia",WOS:000347533200013,social network analysis sna well recognized tool informing however methodology limited focus quantitative structural analysis many node tie exist rather accessing richer information meaning value content tie one way improve usefulness sna purposefully complement structural analysis cultural element drawn field datasets in network governance case queensland organization involved water management flood response event showed cultural value important influencing network connection preferred approach flood pre planning response for example difference organizational preference number type link rooted different value from mary douglas cultural theory category individualist hierarchists egalitarian extended analyze type tie network node preferred approach different type organization problematic link missing link among network node work illustrates analysis structural sna cultural value used improve regional level activity disaster management here increased knowledge social network network tie cultural value facilitate process social learning help society adapt impact
7,Exploring the Scope of Public and Private Responsibilities for Climate Adaptation,WOS:000307926400005,although practice division responsibility often explicitly decided upon government appear primary actor planning however literature suggests governance requires role public private actor responsibility shared society resource fully exploited active involvement societal actor might overcome problem inefficiency raise legitimacy action present framework enables characterization explanation existing governance arrangement term responsibility division among public private actor facilitates search alternative responsibility division associated advantage disadvantage framework illustrated example governance arrangement green roof measure storm water retention rotterdam netherlands merit framework promotes conscious deliberation consideration public private divide taking account specific challenge governance it may therefore support well informed decision responsibility division local government
8,Climate stress tests as a climate adaptation information tool in Dutch municipalities,WOS:000689657300011,information play key role providing using effective way challenge information often remains underutilized even used influence policy making far clear in netherlands stress test introduced inform stimulate policy municipal level in stress test risk vulnerability estimated scenario extreme precipitation heat stress drought flooding examines whether new tool effectuated mainstreaming information municipal policy based interview municipal official document analysis show stress test along two general pathway in applied pathway stress test used instrumental way influence policy goal measure in configuring pathway stress test primarily used learning persuasion mostly influenced problem perception actor involvement in applied pathway accuracy resolution information key factor configuring pathway influence depended accessibility information kind interaction policy formulation which pathway predominated depended problem fitted existing policy arrangement finding show stress test promising tool policy mainstreaming promoting local they also highlight importance identifying pathway information use order increase impact information
9,Barriers and enablers to climate change adaptation in hierarchical governance systems: the case of Vietnam,WOS:000434336800008,government fulfil important role increasing adaptive capacity local community respond impact particularly developing country existing study government enable constrain way local level community learn build adaptive capacity however generally adopt network market oriented type governance however vulnerable region impact world generally governed hierarchical policy system aim understand hierarchical policy system vietnam creates enables constrains policy capacity policy actor contribute effective conducted interview n 26 key actor multiple level government our finding show importance clear legal institution available financing implementing policy training governmental staff particularly district commune level policy capacity generally low deal impact conclude effort support local actor e smallholder farmer include investment policy capacity ensure uptake upscaling action broadly
10,A critical exploration of adaptation heuristics,WOS:000663363000006,a large body knowledge evolving guide effort adapt knowledge underpinned set standardised rule thumb heuristic define mean for example widely accepted local issue best achieved urgent anticipatory action using participatory process yet validity relevance heuristic rarely tested questioned if heuristic based sound empirical evidence inclusion use scientific study policy development planning implementation process generate inappropriate solution highly complex problem critically examines test set common heuristic investigates extent correspond lived experience practitioner engaged planning queensland finding provide new insight applicability heuristic point several new rule thumb underpin practice for example mainly seen regional transboundary issue broader stakeholder involvement best pursued incremental learn go approach retaining flexibility policy decision making system preferred regret value risk based approach future needed explore different type heuristic best support science policy planning decision making process
11,Climate Change Adaptation in Natural World Heritage Sites: A Triage Approach,WOS:000488008500014,certainty degree rate well impact change highly site specific natural world heritage site represent treasure managed sustained humankind each world heritage site designated basis one outstanding universal value because impact site specific sustain universal value also must specific a wicked problem clear action strategy available further resource limited every site each site management team must decide adaptation appropriate investment a triage approach guide evaluation some impact large uncertain highest probability success come series uncertain action reduce investment risk others small certain comfortable yet low probable impact universal value a triage approach guide management team toward highest probable return investment involving stakeholder surrounding landscape advancing engagement communication increasing transparency accountability
12,Identification and analysis of uncertainty in disaster risk reduction and climate change adaptation in South and Southeast Asia,WOS:000384836900021,address mainstreaming uncertainty disaster risk reduction drr cca using case south southeast asia region highly vulnerable wide range natural disaster improvement implementation drr cca community regional level realized underlying uncertainty understood made transparent involved science practice decision making natural hazard management theme explored think tank fashion knowledge elicitation sharing among expert community well practitioner policy adviser extensive experience insight drr cca regional local level intended result identification mean capacity integrate uncertainty developed in elicitation process source uncertainty associated implementation best practice drr cca regional local level result presented considered stakeholder involved valuable expanding capacity plan implement effective drr cca policy measure particularly community level uncertainty play central role vulnerable current future extreme event socio economic constraint change
13,"Climate change, relational vulnerability and human security: rethinking sustainable adaptation in agrarian environments",WOS:000324726000006,with reference agrarian environment southern india argues insight political ecology provide important way move forward debate human security while current human security perspective helpfully situate pursuit adaption within question social justice le forthcoming providing suitable analytical tool conceptualize relationship power inequality vulnerability to address gap insight political ecology used specify relational dynamic vulnerability e way marginalized people adversely incorporated political social economic relationship produce vulnerability simultaneously creating relative security others perspective elaborated example andhra pradesh india differential control key productive asset including land water labour credit key hierarchical displacement security insecurity across agrarian population by foregrounding relational dynamic vulnerability provides analytical tool offer fuller account possibility limit public policy aimed sustainable
14,Governing borderless climate risks: moving beyond the territorial framing of adaptation,WOS:000476608600002,despite increasing relevance cross border flow good capital people shaping risk opportunity today still live bordered world nation state play key role planning governance yet impact contained within country border meaning governance also consider borderless risk cascade international system relatively simple highly complex way in demonstrate notion borderless risk challenge dominant territorial framing problem structure to advance knowledge ask territorial framing national sub national scale dominated governance how borderless risk challenge framing possible governance response draw constructivist international relation theory propose epistemic community developed interpret decision maker certain feature e g strong environmental science foundation reliance place based case established subsequently reinforced territorial framing framing reinforced international norm primarily national local responsibility paradoxically also informed call international responsibility funding conclude identifying type governance response three different scale national bilateral transnational international regional invite systematic evaluation ir community
15,Evaluating behavioural changes for climate adaptation planning,WOS:000756250500001,most plan expect stakeholder behavior part building resilience given long term complex nature monitoring evaluation key requisite planning so far behavioral aspect received limited attention evaluation approach planning proposes theory based evaluation approach based theory planned behavior evaluation a local programme watershed development rural india provides illustrative case approach for case approach helped uncover important factor influence behavioral intention different different group farming community additionally helped put behavioral longer term perspective illustrative case also suggests certain improvement evaluation based theory planned behavior
16,Is Local Community the Answer? The Role of Local Knowledge and Community for Disaster Prevention and Climate Adaptation in Central Vietnam,WOS:000366894800007,critically examines claim local community local traditional knowledge vital contribution safeguarding socio economic stability securing sustainable resource us time stress empirical focus central vietnam argument relevant broader context specifically question approach disaster risk reduction see local community knowledge vital mean achieving resilience socio ecological system argue rural village central vietnam characterised highly dynamic local actor eagerly exploit new income opportunity arising internal external source although wide range knowledge available cope adverse environmental condition knowledge hardly resilience equilibrium oriented rather found anthropocentric externally oriented sometimes opportunistic ultimately oriented towards urban lifestyle trait strongly rewarded vietnamese state conclude present local aspiration may necessarily part solution may form part social political complex exacerbates risk particularly weaker population segment instead new non state actor play larger role
17,Embracing Complexity and Uncertainty,WOS:000385398600013,geographer meaningfully uniquely contribute problem solving assist vulnerable population making informed decision contemporary environmental social problem complex accompanied uncertainty decision must made face uncertainty in address geographer encouraged embrace rather minimize complexity uncertainty interaction decision maker used illustrate ubiquitous uncertainty surrounding problem solving choice assessment framework overemphasize source uncertainty ignore others a challenge communicate information complexity uncertainty decision maker need robust flexible decision making time prevent uncertainty equated lack consensus used reason inaction geographer need open plurality approach decision making acknowledge uncertainty reframing communication uncertainty development novel educational tool learning material decision maker facilitate decision making sustained engagement decision maker including coproduction knowledge also lead greater consideration complexity uncertainty improved decision making rather keeping simple geographer keep complex
18,Climate rights: feasible or not?,WOS:000318772600003,scholar argued compelling reason combat threatens human right referred right prospect right analysed assuming two basic desideratum accuracy concept capturing normative dimension reason prevent mitigate adapt ability generate political measure in order right meet desideratum certain condition must satisfied important human interest put risk global identified right holder obligation bearer relationship codified legitimate formal structure feasible claim right enforcement mechanism necessarily legal character could strengthen compliance when asserting right insufficient consider moral ground actual enforcement possibility normative practical aspect closely interlinked must studied tandem
19,Making the Right to Social Security a Reality for All Workers,WOS:000828919200002,right social security strong anchoring international human right law form critical component international labour standard while social security sometimes portrayed inimical economic dynamism much larger body work posit positive relationship social welfare economic progress covid 19 crisis revealed stark gap social protection worker informal economy particularly hard hit excluded formal work related protection eligible social assistance often target poor outside labour force social assistance scheme flat rate benefit element right based national social protection system eligibility criterion benefit level modality set national legislation ensure transparency accountability however social assistance scheme part broader social protection system usually combine tax financed scheme social insurance guarantee social protection floor provide higher level benefit line international social security principle inspired vision seek formalize economic unit especially micro small medium sized enterprise make right social protection reality worker type employment point number country example extended social protection combining contributory non contributory element vision particularly needed time digital transition driver transformative call formalization job enterprise making possible state mobilize maximum available resource build universal comprehensive adequate social protection system facilitate inclusive transition
20,Is adaptation a local responsibility?,WOS:000352248100009,firmly embedded societal discourse regarding management risk in discourse planning implementation local level seen particularly important developing robust response however clear whether mantra local hold true given multi level nature risk governance using multi method approach examines extent framed local issue specifically role local government relative actor in first explores extent local framing embedded international literature followed specific case southeast queensland focus critical examination process responsibility shifting taking among actor involved coastal planning result indicate assumption local remains widely held science although counter argument readily identified interview actor revealed unclear division responsibility significant constraint actor willingness implement furthermore attributing responsibility local actor might necessarily robust strategy due existence particularly strong constraint value conflict local level governance greater appreciation researcher practitioner interaction local actor higher level governance shaping response capacity may contribute equitable effective allocation responsibility action
21,The future is behind us: traditional ecological knowledge and resilience over time on Hawai'i Island,WOS:000394276200022,local traditional ecological knowledge tek system thought particularly valuable fostering resilience environmental investigates role tek social ecological community level it unique take longitudinal perspective draw historical contemporary data focus case hawai tek cultural identity relationship environmental stewardship locally seen basis social resilience describe coping strategy indicator social resilience changed time role tek resilience implication our result show relative contribution strategy cope social ecological decreased e g forecasting storage mobility others maintained adapted e g livelihood diversification knowledge transmission storage communal pooling cultural identity underscoring importance considering multiple strategy together promote community resilience argues understanding people responded past suggest relevant culturally appropriate way specific language value reference point indicator expressed narrative proverb song situating framing planning also show tek vital environmental broadly particular subsistence based indigenous rural community well place based community living mixed economy thus relevant larger pacific island region area represent continuum rural urban traditional global economy lifeways
22,"Whose voices, whose choices? Pursuing climate resilient trajectories for the poor",WOS:000647044300003,resilient trajectory route development progress take account aspect mitigation sustainability context offering way explicitly consider impact development choice different sector scale socio economic effect due scope relevance resilient trajectory great interest scientist government private sector based urgent need consider different strategy decarbonize economy pursuing trajectory may also beneficial process implement un sustainable development goal sdgs 2030 beyond communication describes concept resilient trajectory clarifies relevance particular attention poor it also outline necessary consideration ensure one left behind it highlight need design resilient trajectory flexible enough accommodate specific complex context poor marginalized people operate involvement relevant stakeholder e g government business private organization policy maker whole community necessary order ensure trajectory yield expected benefit it demonstrates critical consider short long term time frame prioritizing implementing development agenda poor
