,title,wos,clean_abstract
0,Mainstreaming adaptation to climate change in a federal state setting: Policy changes in flood protection and tourism promotion in Austria?,WOS:000338804400003,since became clear mitigation effort suffice halt government complemented effort while unitary state mainly concerned mainstreaming integrating respective goal measure horizontally variety sector federal state austria add vertical dimension challenge anywhere else also requires coordination federal provincial government while literature environmental federalism suggests federal state ill equipped protect global public good advantage solving local environmental problem unclear helpful federalism addressing local impact global problem address gap exploring extent two sector highly vulnerable rarely subject policy analysis flood protection tourism embrace across federal provincial local level government austria with regard horizontal mainstreaming show sector struggle issue way with regard vertical mainstreaming reveals strong coordination support function province particular flood protection since municipality often overwhelmed complexity conclude federal system could prove helpful mediating national guidance local adaption measure
1,"Cross-Comparison of Climate Change Adaptation Strategies Across Large River Basins in Europe, Africa and Asia",WOS:000282585800018,a cross comparison strategy across region performed considering six large river basin case area three basin namely elbe guadiana rhine located europe nile equatorial lake region orange basin africa amudarya basin central asia evaluation based mainly opinion policy maker water management expert river basin strategy evaluated considering following issue expected expected impact driver development strategy barrier state implementation range water management measure status strategy implementation analysis response cross comparison performed rating response possible according expert opinion understanding six region happening different impact expected basin whereas decreasing annual water availability increasing frequency intensity drought lesser extent flood expected according response two important driver development strategy related disaster national international policy following important barrier identified responder spatial temporal uncertainty projection lack adequate financial resource lack horizontal cooperation evaluated water resource management measure relatively high level elbe rhine basin followed orange guadiana it lower amudarya basin lowest nel region many measure planning stage regarding level strategy implementation concluded started basin progress rather slowly
2,Climate change adaptation strategies and fish catchability: The case of inland artisanal fishers along the Volta Basin in Ghana,WOS:000553385900043,pattern climatic condition fishery sub sector currently alarming interfered many productive fishing activity in response fisher resorted using strategy ccas assessed whether strategy used inland artisanal fisher improve fish catchability along volta lake ghana used primary cross sectional data a conditional mixed process cmp ordered probit outcome used estimate effect strategy fish catchability strategy used fisher area increasing daily fishing time increasing fishing effort changing fishing time aquaculture production migrating another fishing area fishing away deep inside water catching smaller fish participation alternative non fishing livelihood taking moratorium fishing it evident strategy fisher use fish catch per unit man effort it prudent stakeholder promoting strategy sustainable fishing especially ministry fishery aquaculture development promote strategy fishing more emphasis placed sustainable adaption strategy aquaculture production implementation close fishing season
3,Climate change adaptation and local government: Institutional complexities surrounding Cape Town's Day Zero,WOS:000472978500001,challenge associated local government growing daily one challenge water security aspect draw u subject matter discus finding institutional complexity surrounding day zero concept associated water tap running dry drought condition aggravated city cape town south africa thrust institutional complexity deliberate affect crisis situation like day zero handled data generated mainly actor actant network theory event well document discourse analysis method actor actant network theory used widely trace actor human actants non human phenomenon interact space time network following narrative like day zero act related matter analysis applied element grounded theory resulting category theme emerging discussion found narrative surrounding day zero embedded political administrative dilemma red tape despite challenge concludes day zero remains one landmark learning point water security cape town south africa city across world recommends day zero experience continue embraced positively documented enhance local government water security currently future well
4,Groundwater use in North Africa as a cautionary tale for climate change adaptation,WOS:000410689700007,recent history groundwater use north africa provides cautionary tale even though short term threat groundwater overexploitation clear territorially bounded involve comparatively player recent decade agricultural intensification consistently increased pressure available resource groundwater governed dynamic interplay formal rule informal practice focused maintaining fragile socio political compromise ensuring environmental sustainability if effective need muster sort political legitimacy sustainable groundwater management currently lacking
5,Climate change adaptation as a development challenge to small Island states: A case study from the Solomon Islands,WOS:000525353800017,small island developing state sids known particularly vulnerable pose challenge economic social development vulnerability expressed several way exposure sea level rise salt intrusion extensive drought area despite rather negative trend example initiative vulnerability sids reduced resilience may increased based paucity literature concrete example successful initiative sids present overview pertinent challenge faced introduces two case study solomon island illustrate much achieved systematically pursuing strategy lesson learned case study outlined useful insight provided may help sids better foster development opportunity offer
6,Climate Change and Water and Sanitation: Likely Impacts and Emerging Trends for Action,WOS:000398214100010,represents significant challenge twenty first century pose risk water sanitation service concern water supply include damage infrastructure flooding loss water source due declining rainfall increasing demand change water quality water source within distribution water sanitation concern include damage loss service flood reduced carrying capacity water receiving wastewater key action reduce risk include integration measure resilience water safety plan well improved accounting management water resource policy prescription technology service delivery change management model offer potential reduce risk particularly low income setting water sanitation service contribute greenhouse gas emission choice wastewater treatment technology improved pumping efficiency use renewable source energy within system generation energy offer potential reducing emission overall greater attention required understand plan adapt water sanitation service a many adaptation likely benefit regret solution likely outweigh cost investment
7,Evaluating the climate change adaptation barriers of critical infrastructure in rural Alaska,WOS:000859134400001,a impact intensify community rural alaska undergoing adapting change infrastructure increased permafrost thawing flooding erosion needed address structural failure safety concern despite recognizing need support stakeholder infrastructure level activity remains limited inconsistent across region community rural alaska address need identifying barrier community wide infrastructure based stakeholder perspective make decision government agency nonprofit engineering firm academic institution rural alaska barrier identified qualitatively interview n 25 validated quantitatively survey n 30 qualitative quantitative result identified validated 17 barrier infrastructure spanning sociocultural institutional economic physical environmental dimension based sustainable livelihood framework slf result demonstrate need national funding policy specific diverse cultural landscape extreme weather rural location limited transportation high cost rural alaska funding policy needed support collaboration alaska based institution nonprofit organization engineering firm tribal entity rural alaska community representative
8,Construction of Climate Change-Adapted Seaweed Beds on the Japanese Coast,WOS:000441173100079,japanese coastal seaweed bed experiencing long term decline area coverage phenomenon called isoyake massively impacted fishery industry therefore performed seaweed bed restoration consequent measure implemented along promulgation relevant technology meanwhile increasing seawater temperature environmental change associated one cause isoyake spreading globally become increasingly severe recent year with respect method coping effect intergovernmental panel fifth assessment report 2014 call effect already occurred unavoidable medium long term effect in context discus present state future forecast seaweed bed japanese coast considers future trend adapted seaweed bed construction
9,"THE RELATIONSHIP BETWEEN GREEN, SUSTAINABLE AGRICULTURAL DEVELOPMENT, CLIMATE CHANGE ADAPTATION, AND DIGITAL TRANSFORMATION IN DONG THAP, VIETNAM",WOS:000896846800010,issue agriculture rural area digital transformation major policy party state dong thap vietnam locality continuing affected environmental pollution epidemic these greatly affect agricultural development if issue resolved timely significant impact future initially study relationship green clean sustainable agricultural development agricultural digital transformation dong thap inevitable objective trend key foundation sustainable development dong thap agricultural sector thereby contributing successful implementation resolution party congress dong thap province term xi
10,A bridge over troubled water: A contextual analysis of social vulnerability to climate change in a riverine landscape in south-east Norway,WOS:000383870400002,local community gudbrandsdalen region norway increasingly exposed induced hazard flood landslide a core question community member respond factor contribute resilient community author used contextual approach analyze data semi structured interview along five dimension in gaustad muncipality found individual motivation adapt depended largely subjective value identity place attachment cultural value social network among individual mean crucial strategic plan different policy level experienced relevant community member while studied community experienced heavy flood river system stream little evidence observed instead appeared adopt coping strategy landowner may limited incentive adapt due contraproductive policy measure economic compensation direct loss without requiring improved practice effective local level likely require making compensation mechanism contingent upon landowner showing willingness coping adaptive practice well contextualized approach integrating local scientific form knowledge
11,Anticipatory planning: Finding balance in climate change adaptation governance,WOS:000663366600002,a progress local government forced find way adapt worsening environmental economic infrastructure impact city fredericton new brunswick long history river overland flooding however recent change local weather pattern led increase flood risk area for decade decision maker fredericton worked mainstream action within municipal policy order address growing flood risk through anticipatory spatial planning incremental infrastructure upgrade city aim proactively mitigate impact day day life framed evolutionary governance investigates relationship actor institution well power knowledge order uncover long standing path dependency hinder comprehensive action while fredericton considered success story many way reveals flawed multi level governance structure economic development goal major barrier effective practice a impact worsen balancing economic political interest action require new approach governance
12,"Redevelopment or retreat for informal settlers? A case study in Shezidao, Taipei, Taiwan",WOS:000649211700002,explores managed retreat option small scale yet complicated informal settlement flood prone urban area shezidao located confluence keelung tamsui river heart taiwan capital city taipei since flood common shezidao dweller attempted mitigate risk improvised structure fall short comprehensive solution suggests issue informal settlement flood plain must solved managed rather haphazard retreat suggests aligning central local government public objective connecting social housing policy potential relocation informal settler main strategy provide solution community risk a continues unabated measure planned mitigate future disaster risk might occur urban informal settlement
13,Adaption to Climate Change through Water Trading under Uncertainty - An Inexact Two-Stage Nonlinear Programming Approach,WOS:000207620000005,shilling hydrological phenomenon changing would lead decreased water availability thus would worse water supply demand conflict resulting penalty local economy to tackle water shortage problem water trading proved efficient economical method however complexity uncertainty water trading system may result poor efficiency improper management to address concern inexact two stage stochastic nonlinear programming itsnp model proposed water resource management water trading uncertainty itsnp model reflect nonlinearity problem incorporate uncertainty expressed probability distribution discrete interval provide linkage predefined policy associated economic implication developed model applied case water resource management agricultural system without water trading scheme obtained modeling solution indicate water resource management efficient water trading without water trading particularly dry season moreover found water trading suitable method impact water scarcity
14,IMPACTS OF CLIMATE CHANGE ON WATER RESOURCES IN TURKEY,WOS:000340483100012,global affect temperature precipitation these change serious impact availability water resource regional basis turkey located mediterranean basin predicted severely affected adverse effect global particularly term water resource it important figure situation country term water scarcity induced anthropogenic order provide rational measure investigates impact water resource turkey national level collaborating related literature considering past observation future prediction legal status turkey term greenhouse gas emission turkey effect temperature precipitation turkey effect water resource potential sea level rise flood turkey example different region country measure impact investigated extensively
15,"Estimating the non-market benefits of climate change adaptation of river ecosystem services: A choice experiment application in the Aoos basin, Greece",WOS:000346548000009,mountain important global reservoir water resource however highly vulnerable limited alteration temperature precipitation may cause harmful effect water system southern europe especially greece expected undergo drought trend next decade resulting le recharge aquifer water service reduction thus may distort natural socioeconomic characteristic freshwater ecosystem service deteriorating general social welfare related examines economic impact river us aoos basin greece in regard choice experiment conducted estimate value change different ecological economic service mountain community econometric simulation using conditional logit random parameter logit latent class model reveal despite existing preference heterogeneity respondent average derive positive significant welfare effect measure finding survey may assist planning aoos river basin possible extension river system enduring similar indication
16,A climate adaptation strategy for Mai Po Inner Deep Bay Ramsar site: Steppingstone to climate proofing the East Asian-Australasian Flyway,WOS:000585943400041,ecological functionality east asian australasian flyway threatened loss wetland provide staging wintering site migrating waterbird disappearance wetland ecosystem due coastal development prevents bird completing migration resulting population decline even eventual collapse migration phenomenon coastal wetland also threat global consequence notably sea level rise slr extreme storm event accompanying wave tidal surge impact slr compounded coastal subsidence decreasing sedimentation result coastal development thus important wetland along flyway assessed impact coastal subsidence plan implement proactive strategy include habitat migration possibility coastal squeeze modelled impact decreasing sedimentation rate important bird habitat mai po inner deep bay ramsar site support strategy continue host migratory bird located inner deep bay pearl river estuary mai po tidal flat coastal mangrove marsh fishpond provide habitat 80 000 wintering passage waterbird applied sea level affecting marsh model slamm simulate habitat conversion two slr scenario 1 5m 2 0m 2050 2075 2100 four accretion rate 2mm yr 4 mm yr 8 mm yr 15 mm yr result showed discernible impact habitat 2075 projection 2100 show mangrove marsh tidal flat could impacted almost scenario slr accretion under 1 5m slr scenario even low tide accretion level decrease 4 mm yr tidal flat inundated 2 mm yr accretion mangrove also inundated thus important shorebird habitat lost during high tide pond inside nature reserve intensively managed provide high tide roosting site habitat waterbird also inundated thus 1 5m slr declining sedimentation migratory shorebird lose habitat including high tide roosting habitat inside nature reserve model also indicates fishpond inland ramsar site le impacted most fishpond privately owned could developed future including high rise apartment thus securing conservation important strategy mai po since provide essential habitat bird future scenario but mai po one steppingstone along eaaf hundred wetland also threatened encroaching infrastructure thus similar analysis wetland recommended develop flyway wide conservation strategy available option become lost wetland conversion
17,More rapid and severe disease outbreaks for aquaculture at the tropics: implications for food security,WOS:000314520500024,aquaculture replacing capture fishery supplying world dietary protein although disease major threat aquaculture production underlying global epidemiological pattern unknown analysed disease outbreak severity across different latitude diverse range aquaculture system disease lower latitude progress rapidly result higher cumulative mortality particular early stage development shellfish tropical country suffer proportionally greater loss aquaculture disease outbreak le time mitigate loss synthesis application disease present major problem food production security equatorial region fish shellfish provide major source dietary protein a incidence infectious disease may increase strategy must consider global pattern disease vulnerability aquaculture develop option minimize impact food production
18,"CLIMATE CHANGE, POVERTY AND AGRICULTURAL RESOURCE DEGRADATION: A CASE STUDY OF DISTRICT D.G. KHAN",WOS:000317480500025,global development agenda bonded sustainable biodiversity community closely associated depletion natural resource adversely affect living standard people rapid climatic change intervention regulate water resource indus delta pakistan put life million people residing near indus river belt stake therefore designed inquire socio economic condition people residing near indus river bank perceived impact river belt agricultural resource specifically district d g khan based primary data employed univariate bivariate analysis suggested flood wind storm temperature significant parameter affecting land fertility forest fishery foster greer thorbeck technique calculating poverty indicated majority 82 population poverty line entirely depend river belt agricultural resource found depleting due rapid
19,"Increasing Risks for Armed Conflict: Climate Change, Food and Water Insecurity, and Forced Displacement",WOS:000484938700002,interrelated factor decreased access freshwater forced displacement heightening risk armed conflict higher temperature extreme precipitation contributing food water insecurity forced displacement sociopolitical tension health professional help address problem education advocacy activity aim mitigate adapt minimize risk armed conflict
20,"The politics of defining maladaptation: enduring contestations over three (mal)adaptive water projects in France, Spain and South Africa",WOS:000737044600001,in ever larger area world increasing water demand shrinking water supply a result many effort underway define whether given water project decrease increase water user vulnerability especially agricultural sector a number challenge making assessment routinely discussed including lack yardstick varying local circumstance role subjective judgment however common assumption maladaptation constitutes least theory phenomenon ultimately fully objectified agreed upon scientific data by contrast qualitative comparative analysis advance non positivist conception maladaptation by comparing three water project aiming south africa western cape spain andalusia france occitanie argue qualifying mal inescapably political process much scientific endeavour a consequence advocate putting scholarly emphasis governance project especially capacity governance arrangement produce legitimate compromise multiple policy domain actor enhance higher level conflict management necessary ensure regular policy evaluation effective bearing subsequent policy decision
21,Improvement of Integrated Watershed Management in Indonesia for Mitigation and Adaptation to Climate Change: A Review,WOS:000845407700001,major challenge indonesia due impact food water energy sustainability environmental health almost indonesian region exposed flood landslide soil erosion drought heavy rain in response challenge government indonesia determined integrated watershed management iwm one key program reduce greenhouse gas ghg emission stated updated indonesian nationally determined contribution ndc intends indonesia effort mitigating adapting iwm approach attempt realize decent life environment community improvement iwm conducted strengthening synergy responsible institution watershed management responsible institution handling mitigation impact in addition important prioritize coordination participation collaboration national government level also international level since numerous problem may exist transboundary country finding solution involve planning implementation monitoring evaluation implementing micro watershed model mwm supported culture local wisdom traditional knowledge community used improve current iwm
22,Challenges of Resilience to Reducing Environmentally Induced Migration from Central America,WOS:000646552900002,resilience already one important analytical approach socio ecological problem forced migration environmental reason one main consequence global environmental socio ecological resilience identifies factor would diminish effect environmental migration especially concerning governance issue draw attention fact recent wave migration made central america hotspot environmentally induced displacement in response international aid geared towards could reduce displacement inhabitant central american dry corridor however favored practice ha avocado cultivation controversial term environmental sustainability
23,Integration of water management and land consolidation in rural areas to adapt to climate change: Experiences from Poland and the Netherlands,WOS:000442067100047,rural area face major challenge adapting impact particular flood drought call rural function proof water resilient design rural area often implying improvement water retention flood protection implementation related goal spatial planning often involves adaptation water management perhaps even leading land consolidation water management land consolidation thus form important tool spatial land consolidation also tool support integration claim need room agriculture nature landscape tourism function investigates history approach land consolidation water management poland netherlands illustrates integration land consolidation water management realize multi functional resilient rural area two example country qualitatively compared extent planned activity water retention flood protection realized planned result achieved function found two measure water retention flood protection effective netherlands stemming ample attention impact incorporation goal water policy furthermore water retention flood protection measure netherlands better serve multiple function agriculture nature recreation landscape infrastructure reason multidisciplinary participatory approach attention public awareness communication promotion process on hand dutch much learn poland vast undisturbed natural area contribute resilient landscape both poland netherlands could therefore benefit bringing together idea experience regarding proofing rural area
