,title,wos,clean_abstract
235,Assessing the consequences of climate change for food and forest resources: A view from the IPCC,WOS:000230265100008,important finding consequence agriculture forestry recently completed third assessment report tar intergovernmental panel ipcc reviewed emphasis new knowledge emerged since second assessment report sar state pressure response model used organize major finding constant declining food price expected least next 25 yr although food security problem persist many developing country country deal population increase political crisis poor resource endowment steady environmental degradation most economic model projection suggest low relative food price extend beyond next 25 yr although confidence projection erodes farther 21st century although deforestation rate may decreased since early 1990s degradation loss forest productivity biomass occurred large spatial scale result fragmentation non sustainable practice infrastructure development according united nation estimate approximately 23 forest agricultural land classified degraded period since world war ii at worldwide scale global pressure land use practice change atmospheric chemistry increasingly affecting supply good service forest realistic experiment date free air experiment irrigated environment indicate
236,Landuse experience does qualify for adaptation to climate change,WOS:000263817900011,need implement sustainable resource management regime semi arid rangeland acute non adapted grazing strategy lead irreversible environmental problem desertification associated loss economic support society in sensitive ecosystem traditional sectoral disciplinary approach work attain sustainability achieving collective vision attain sustainability requires interactive effort among discipline integrated approach therefore developed integrated ecological economic approach consists ecological economic module combine relevant process either level parameter module adjusted dwarf shrub savannah southern namibia economic module used analyse decision different virtual farmer type annual stocking rate depending knowledge ecosystem work climatic condition used dynamic linear optimisation model simulate farm economics livestock dynamic ecological module used simulate impact farmer land use decision derived economic module ecosystem dynamic resulting carrying capacity system livestock vegetation dynamic based concept state transition model forage productivity module derived small scale spatially explicit vegetation model mechanistic approach guarantee data collected process estimated smaller scale included application simulation result ecological module successfully compared simulation result optimisation model time series 30 year revealed sustainable management semi arid rangeland relies strongly rangeland manager understanding ecological process furthermore simulation result demonstr n result demonstrate projected lower annual rainfall due add additional layer risk ecosystem already prone land degradation
237,Adaptation to climate change in Uganda: Evidence from micro level data,WOS:000295666500012,employed data 2005 06 uganda national household survey identify strategy factor governing choice uganda agricultural production factor mediate hinder across different shock strategy include age household head access credit extension facility security land tenure there also difference choice strategy agro climatic zone appropriate policy level response complement autonomous strategy facilitating technology adoption availing information farmer regard related forecast available weather pest resistant variety
238,Pathways for climate change adaptations in arid and semi-arid regions,WOS:000608902800011,variability coupled small landholding low land productivity water scarcity arid semi arid region contribute environmental degradation reduced agricultural productivity increased vulnerability rural community with aid fuzzy cognitive map constructed 427 community group 4 5 member group drawn 96 village 12 district arid semi arid india evaluates effectiveness various pathway ongoing adaptation arid semi arid india face deficit fcm based simulation revealed integrated measure embrace nature based solution including integrated water resource management natural farming assisted soil rejuvenation improved agricultural productivity likely enhance resilience small marginalised farming community variability facilitation measure requires inclusive adaptive local institution sufficient financial assistance information service besides gender nuanced inclusive adaptive governance process would helpful implementation appropriate intervention arid semi arid drylands worldwide hence policy maker must enable polycentric adaptive governance inclusive institution process emphasis multiple factor socio ecological system often make difficult understand critical role particular factor however fcm based simulation helped u overcome limitation
239,Behavioral models of climate change adaptation and mitigation in land-based sectors,WOS:000397287800007,model land system essential understanding magnitude impact these model required represent large number process different sector face particular challenge describing individual social behavior underpin mitigation ass description behavior existing model commonality difference us put find behavioral model distinct important role play currently suffer strongly sectoral nature agricultural model common behaviorally rich there also clear convergence economic based decision making remaining dominant behavior diffusion interaction anticipation learning remaining relatively neglected active also rarely modeled mitigation generally represented response economic driver static climatic condition furthermore dynamic behavior objective decision making process almost entirely absent despite clear relevance response conclude model successful identification important process implementation behavioral process may remain impossible model behavioral model mitigation land based sector substantial unexplored potential suggest greater attention paid cumulative coverage model field improvement representation certain key behavior prioritized
240,"Translating Climate Change: Adaptation, Resilience, and Climate Politics in Nunavut, Canada",WOS:000350107100005,examines translation key term english inuktitut considering literal translation also broader context within word make sense argue notion resilience mean something fundamentally different inuktitut english implication policy politics to extent translated inuktitut wholly environmental phenomenon human control resilience come seen appropriate distinctly inuit mode relating shifting climatic condition calling practice patience observation creativity forbearance discretion if translated matter unethical harm sila however inuit framework justice relationality healing would activated in context broader global shift away mitigation toward enhancing adaptive capacity resilience particular population current mode translating argue deeply political
241,Climate change and n-3 LC-PUFA availability,WOS:000792922100003,omega 3 long chain polyunsaturated fatty acid n 3 lc pufa essential fatty acid growth development survival virtually organism there increasing evidence anthropogenic direct indirect impact availability natural n 3 lc pufa however information fragmented well organized therefore reviewed published data laboratory experiment field experiment model simulation reveal impact global supply natural n3 lc pufa limit availability n 3 lc pufa future food web in general significantly reduce availability natural n 3 lc pufa grazing food web following way 1 decrease total biomass phytoplankton shift plankton community structure smaller size also reduce biomass animal higher trophics 2 reduce n 3 lc pufa content quality n 3 n 6 ratio marine organism 3 reduce transfer efficiency n 3 lc pufa grazing food web in addition anthropogenic measure also proposed alternative source n 3 lc pufa determined direction future information useful providing critical analysis impact supply natural n 3 lc pufa such information aid establish management measure determine direction future
242,Efficient water management policies for irrigation adaptation to climate change in Southern Europe,WOS:000366793000022,evaluates economic environmental effect two incentive based water management policy address impact irrigated agriculture water market irrigation subsidy a southern european case ass farmer long short run response policy intervention discrete stochastic programming model result indicate likely negative impact irrigation activity water dependent ecosystem southern europe however severity impact depends government policy setting farmer response comparison water market irrigation subsidy policy show advantage water market irrigation subsidy term private social benefit these finding could guide policymakers design efficient water institution policy address irrigated agriculture southern europe
243,Factors Affecting Adaptation to Climate Change through Agroforestry in Kenya,WOS:000643227000001,environmental effect significantly decreased agricultural productivity agroforestry technology applied solution promote sustainable agricultural system evaluates factor influencing adoption agroforestry technology kenya a multistage sampling technique employed collect data 239 household west pokot county kenya a probit model k mean algorithm used analyze factor affecting farmer agroforestry technology adoption decision based sampled household socio economic demographic farm characteristic found total yield maize crop farm size extension frequency farm income access training access credit access transport facility group membership access market gender distance nearest trading center household education level significant effect adoption agroforestry technology finding important informing policy formulation implementation promotes agroforestry technology adoption
244,"Hygrothermal performance, energy use and embodied emissions in straw bale buildings",WOS:000658233300001,straw bale low embodied energy technically acceptable thermal insulation material a per today lack standardized technical data utilizing straw bale building construction existing study rather focus limited specific experimental computational scenario without summarizing organized way behaviour straw bale construction different condition assembly configuration comparative present systematically hygrothermal energy performance straw bale building different exterior cladding finishing mortar sheathing board exposed various representative climate finding provide insight optimal selection material furthermore highlight importance straw bale wall construction overall straw bale building show robust hygrothermal performance properly designed achieve low energy use minimum embodied emission
245,Climate change and total factor productivity in the Tanzanian economy,WOS:000297288900003,economic impact induced adjustment performance tanzanian economy analysed using countrywide computable general equilibrium cge model effect overall agricultural productivity modelled reduced land productivity projected relatively limited 2030 thereafter becoming worse simulation result indicate despite projected reduction agricultural productivity negative impact potentially quite limited timescales involved well low starting point economy leave ample room factor substitutability increased overall productivity indicates policy give farmer opportunity invest autonomous well improve overall performance economy important reducing impact economy direct government policy
246,Ecology and Evolution of Marine Fungi With Their Adaptation to Climate Change,WOS:000697658800001,agitates interaction organism environment force adapt migrate get replaced others extinct marine environment extremely sensitive influence ecological function microbial community including fungi fungi marine habitat engaged adapted perform diverse ecological function marine environment several study focus complex interaction surrounding environment affect fungal evolution however addressing marine fungi still lacking here discussed adaptation fungi marine environment example hortaea werneckii aspergillus terreus may help reduce risk impact marine environment organism address ecology evolution marine fungi effect explain mechanism a marine fungal adaptation show widespread effect evolutionary biology mechanism responsible p
247,Perspectives of forest practitioners on climate change adaptation in the Yukon and Northwest Territories of Canada,WOS:000248715600030,forestry practitioner yukon northwest territory asked complete questionnaire examining likely impact forest sector sustainability option practitioner asked self ass knowledge various aspect ranked level knowledge generally poor fair despite past educational effort area change intensity severity magnitude forest insect outbreak change extreme weather event change intensity severity magnitude forest fire three impact frequently identified impact sustainability more half respondent indicated commodity price availability timber trade policy environmental regulation ability secure needed capital presently negative impact sustainability assessment 65 potential option structured according criterion montreal process majority respondent considered goal synonymous criterion sustainable forest management indicating montreal process criterion provide suitable framework assessing option forest sector intensity severity magnitude forest insect outbreak future condition forest growth productivity precipitation variability intensity severity magnitude forest fire ranked important area information would assistance decision making
248,Examining limits and barriers to climate change adaptation in an Indigenous reindeer herding community,WOS:000324726000007,based recognized gap begin identifying need empirically investigate governance drawing kooiman interactive governance framework examines collaborative methodology agency space constructed restricted case indigenous reindeer herding community sweden finding demonstrate variability currently matter concern greatest problem however diminishing space due accumulated pressure predation competing land us combination herder lack direct indirect power influence actor institutional factor currently limiting option carry relevance reindeer herding community sweden also general literature demonstrating limit barrier essentially political requiring making hard choice hence active governmental intervention it also show marginalized group even context adaptive capacity considered high likely remain highly vulnerable restricted opportunity unless deliberate structural institutional transformation initiated
249,Technologies for adaptation to climate change. Examples from the agricultural and water sectors in Lebanon,WOS:000358179100006,increasing attention given technology international agenda least agricultural sector water sector technology however investment technology based seed dam irrigation etc complicated fact remains difficult predict future impact especially local scale in addition evidence cost benefit implementing technology relatively limited analysis presented show large potential integrating technology planning implementation going future project based local level data technology need assessment project lebanon present two example economic feasibility implementing technology agricultural water sector result show technology applied low cost relatively little effort
250,Water Use Efficiency in Rice Production: Implications for Climate Change Adaptation in the Vietnamese Mekong Delta,WOS:000582493400007,water scarcity competition vietnamese mekong delta becomes great matter concern context tributary dam construction upstream country moreover water productivity water use efficiency rice production quite low region due free rider problem therefore aimed measuring water use efficiency farm level investigating factor affecting water use efficiency applied stochastic frontier analysis estimate water use efficiency 159 rice farmer upstream vietnamese mekong delta show average water use efficiency 18 81 indicating rice farmer consume water inefficiently on average rice farmer could reduce water consumption 81 19 keeping output level input constant to improve water use efficiency found land accumulation large scaled production essential
251,Can Farmer Adapt to Climate Change - An Evidence from Shandong in China,WOS:000454073800033,given field survey data 524 peasant household 64 village 32 county shandong province applies ricardian model make empirical analysis influence peasant household it indicated warming obvious negative effect peasant household net income unit land area may continue exist long run might aggravated in contextual model future peasant household net income unit land area greatly reduced except temperature rise autumn positive effect peasant household net income unit land area temperature rise winter spring summer reduces peasant household income when temperature rise 1 degree
252,The landscape-level effect of individual-owner adaptation to climate change in Dutch forests,WOS:000365082400004,severely impact forest landscape ecosystem service provided forest management decision without anticipation made forest owner individually within forest landscape anticipation thus reflect different attitude different owner many forest based ecosystem service integrate effect management strategy different owner landscape scale some ecosystem service enjoyed privately forest owner others enjoyed publicly without clear feedback individual owner here use spatially explicit simulation forest landscape netherlands landscape managed patchwork different forest owner different objective strict nature reserve timber production oriented simulate development forest landscape different climatic scenario different management scenario adapt forest anticipated evaluate impact scenario using indicator six ecosystem service both anticipation severely affect provisioning ecosystem service forest landscape precautionary management designed minimise damage able balance landscape level effect change ecosystem service avoids landscape shift privately publicly enjoyed ecosystem service on hand scenario mainly consisting management scheme tried extract extra private benefit anticipated would greatly reduce supply publicly enjoyed ecosystem service landscape level
253,Producer Responses to Surface Water Availability and Implications for Climate Change Adaptation,WOS:000413548300005,predicted bring change weather water availability effect agriculture depends ability producer modify practice response changing distribution develop two stage theoretical model planting irrigation decision use unique dataset empirically estimate producer respond change expected water availability deviation expectation a water supply decrease producer respond planting fewer acre concentrating application water highlighting importance context failure account behavioral response overstates impact 17
254,Climate change adaptation in agriculture: A computable general equilibrium analysis of land-use change in Nepal,WOS:000387519600022,investigates feasibility change cropland use strategy minimise economy wide cost agriculture nepal make interesting case one vulnerable agricultural economy within south asia develop comparative static multi household computable general equilibrium cge model nepal nested set constant elasticity transformation cet functional form model allocation land within different agricultural sector land transformation elasticity cet function allowed reflect ease switching one crop another based agronomic characteristic result suggest long run farmer nepal tend allocate land crop comparatively le impacted paddy thereby minimising economy wide impact furthermore result reveal land use tends reduce income disparity different household group significantly moderating income loss marginal farmer therefore suggested policy maker nepal prioritise scheme providing smart paddy variety e resistant heat drought flood farmer subsidising fertilizer improving agronomic practice educating farmer switch crop highly impacted paddy
255,Modeling farmer adaptations to climate change in South America: a micro-behavioral economic perspective,WOS:000375375800001,evaluates behavioral model using south american agricultural data find ricardian model spatial effect lead 20 loss land value uk hadley center ukmo hereafter model 11 loss milder u goddard institute gi hereafter model middle century micro portfolio model g map hereafter hand result much smaller damage estimate 1 loss land value gi model 3 4 loss ukmo model even g map model however land value crop system fall sharply much 9 5 gi scenario in contrast ricardian model g map model explicitly explain decision choose one agricultural system well conditional land value function system agriculture under gi model choice crop farm decline 3 3 offset increase mixed system 2 1 increase livestock system 1 2 although land value crop system fall 9 5 land value mixed system fall 3 5 livestock system increase large percentage find difference impact estimate two model result treatment sunk cost result ricardian model would deviate g map model sunk cost significantly large
256,The crucial role of domestic and international market-mediated adaptation to climate change,WOS:000633376200005,effect agricultural yield uneven world a country mostly high latitude may experience gain see average yield decrease aim quantify role market mediated adjustment attenuating effect allowing expression new induced pattern comparative advantage within country to develop quantitative general equilibrium trade model representation land use choice inspired modern ricardian trade model use spatially explicit information agronomic literature potential yield calibration counterfactual simulation result show induced yield change generate large price movement incentivize adjustment production trade both production trade adjustment contribute reducing welfare loss globally production adjustment making larger contribution
257,Behavioural adaptation to climate change among winter alpine tourists: an analysis of tourist motivations and leisure substitutability,WOS:000375868400003,understanding market response impact important implication sustainability winter tourism destination utilising framework incorporating push pull tourist motivation theory leisure substitutability sought explore winter tourist adapt change snow cover alpine region future scenario result questionnaire completed 231 respondent indicated tourist motivation related behavioural general preference among current winter market spatial substitution event poor snow those motivated recreation specialisation snow related attribute likely opt spatial substitution tourist motivated self expression apres ski activity displayed resilience poor snow condition result demonstrate clear division leisure driven tourist valued participation sport experience driven tourist displayed higher resilience reduced snow projected scenario these result practical implication winter tourism destination term targeting experience driven tourist case reduced snow well longer term sustainability viability winter tourism destination
258,Temperature effects on development of three cereal aphid parasitoids (Hymenoptera: Aphidiidae),WOS:A1995UC89300001,temperature important climatological variable influence biology ecology insect poor climatic limit effectiveness parasitic insect biological control two exotic parasite syrian diaeretiella rapae m intosh argentinean aphidius colemani viereck imported biological control russian wheat aphid diuraphis noxia mordvilko one native parasite diaeretiella rapae reared growth chamber three fluctuating temperature regime average daily temperature 12 18 24 degree
259,Assessing climate change adaptations for community-scale water resources using a low-frequency weather generator,WOS:000426322400005,water strategy necessary decreasing impact local society model community water supply system distributed measure decreasing loading centralized water supply system modeled community water supply system address supply demand community scale using constructed wetland rainwater harvesting system household storage paddy field purpose evaluate community water supply system various scenario using three performance indicator water saving efficiency wse tolerance duration td water use efficiency wue a low frequency weather generator lf wgen proposed used produce future weather data evaluating impact lf wgen generates future weather data based scenario derived output general circulation model gcms hadgem2 ao csiro mk3 6 0 project current future based different representative concentration pathway rcps result indicate low impact development lid module better performance first growth period may maintain domestic functionality all indicator show positive correlation rainfall scenario however slight decrease predicted rainfall wue wseagri showed negative correlation rainfall rcp 2 6 hadgem2 ao rcp 4 5 csiro mk3 6 0 scenario could due lower number consecutive dry day predicted lf wgen causing slightly increased wetland inflow would decrease irrigation water supply overall community water supply system showed strong performance various scenario further community water supply system need include optimization measure practical application
