,title,wos,clean_abstract
24,Climate change and coastal environmental risk perceptions in Florida,WOS:000328869600004,understanding public perception risk prerequisite effective communication many study risk perception either analyzed general operationalization risk employed case approach specific adaptive process take different approach examining attitude toward 17 specific related coastal risk cognitive affective risk specific predictor risk perception a survey 558 undergraduate revealed risk physical environment greater concern economic biological risk perception greater physical environment risk significantly associated pro environmental attitude female democratic leaning perception greater economic risk significantly associated negative environmental attitude female republican leaning perception greater biological risk significantly associated positive environmental attitude finding suggest focusing physical environment risk maybe salient audience communication general result demonstrate belief risk perception multifactorial complex shaped individual attitude basic belief risk communication need apply knowledge better target cognitive affective process specific audience rather providing simple characterization risk
25,"Legal and Policy Pathways of Climate Change Adaptation: Comparative Analysis of the Adaptation Practices in the United States, Australia and China",WOS:000438047900008,to successfully respond impact imperative government structure law policy around country existing legal framework united state u china made attempt legislative executive judicial action however system law governance three country differ way issue managed vary state local planning function leading pathway u whereas judicial intervention influential executive action by contrast china relies primarily policy manage issue argues difference response result complex combination factor include politics awareness status environmental principle role judiciary analysis help identifying opportunity barrier associated different solution also contributes cross jurisdictional learning
26,"Prospect theory, mitigation and adaptation to climate change",WOS:000402412100005,prospect theory pt widely accepted theory decision uncertainty however far systematic application policy cp exist one important postulation pt outcome perceived gain loss relative reference point when come cp different decision maker may different reference point for example one decision maker perceives current reference point whereas another decision maker may another one say 100years for former damage loss benefit cp reduction loss for latter benefit cp gain pt suggests former place higher value cp latter after critical whether pt may applied cp systematically present case pt offer new insight related analysis notwithstanding importance well known aspect discounting altruism political economic cost it shown accounting pt may contribute better understanding well known puzzle debate including different preference cp amongst individual nation role technical v financial apparent preference hard protection measure coastal finally concrete possibility empirical effect proposed
27,Adapting to Climate Change: What We Owe to Other Animals,WOS:000478610700005,in i expand existing discourse justice drawing implication taking animal right seriously context human induced more specifically i argue nonhuman animal owed adaptive assistance help cope ill effect i advance defend four principle justice derive general duty lastly i suggest even one successfully argue protection human interest ought prioritised nonhuman animal right continue place significant constraint action
28,IUPA: a tool for the evaluation of the general usefulness of practices for adaptation to climate change and variability,WOS:000267542000001,a prototype multi purpose index proposed use evaluation practice variability index usefulness practice iupa allows user assign weight score set user defined evaluation criterion individual criterion score aggregated final index value both final value individual parameter score provide useful information improved decision making context an innovative aspect iupa guidance given user inclusion recommendation evaluation criterion criterion specific weight factor these defined panel expert latin american caribbean region lac application index demonstrated existing practice coquimbo region chile iupa tool recommended use evaluation practice design implementation post implementation phase it practical quick first assessment limited financial resource available making tool especially useful practitioner developing world index flexible perspective construction use additional expert opinion easily included future version tool
29,"Adaptation to climate change as social-ecological trap: a case study of fishing and aquaculture in the Tam Giang Lagoon, Vietnam",WOS:000363264300016,way people respond frequently analyzed explained term conventionally understood adjustment behavior either mitigate harm exploit opportunity emerging idea feature prominently scientific analysis well policy program despite growing popularity year concept also received critique social scientist particular take issue implicit assumption human behavior fitness advantage optimal behavior come term clearly human animal behavioral response optimal display fitness advantage to contrary sub optimal maladaptive behavior rather widespread explaining possibility maladaptive sub optimal behavior led scholar introduce idea trap trap situation refer mismatch behavior social ecological condition behavior take place review analytical value trap human response it first lay theoretical assumption underpinning concept a case tam giang lagoon central vietnam used evaluate well trap concept capture sub optimality variety human response
30,Making index insurance attractive to farmers,WOS:000282554300005,there several factor influence whether people want participate index insurance program a number influence attractiveness economic ground including size timing premium potential payouts degree risk aversion potential customer other factor make program attractive reason economic le valid these trust people insurance product organization involved selling managing indeed data india africa south america show factor may important economic one influencing demand index insurance pilot project order estimate demand alternative product typically involved great deal interaction potential customer it important recognize interaction crucial tool also mean build understanding trust product when scaling isolated pilot operational program vital recognize trust building function replicating participation effort every community in examine role field game establishing building trust three important aspect project participant trust insurance product trust participating organization trust ability make good decision while game previously used way gauge interest product identify design feature argue game also valuable tool constructing kind trust
