,title,wos,clean_abstract
80,The roads ahead: Narratives for shared socioeconomic pathways describing world futures in the 21st century,WOS:000394634500016,long term scenario play important role global environmental community developing new scenario integrating future change society investigate impact well option mitigation one component new scenario set alternative future societal development known shared socioeconomic pathway ssps conceptual framework design use ssps call development global pathway describing future evolution key aspect society would together imply range challenge mitigating adapting here present one component pathway ssp narrative set five qualitative description future change demographic human development economy lifestyle policy institution technology environment natural resource describe method used develop narrative well pathway hypothesized produce particular combination challenge mitigation development narrative drew expert opinion 1 identify key determinant challenge essential incorporate narrative 2 combine element narrative manner consistent scholarship inter relationship narrative intended description plausible future condition level large world region serve basis integrated scenario emission land use well impact vulnerability analysis
81,Geographical proximity and renewable energy diffusion: An empirical approach,WOS:000468012900039,in era achieving economic growth environmental sustainability paramount role technology diffusion remains important one recent literature explores link geographical proximity adoption diffusion policy however generally focused restricted set developed country focused diffusion policy instrument rather outcome policy in argue domestic intensity adoption renewable energy technology likely affected adoption pattern neighbouring country additionally effect likely stronger important trade partner intensive adopter renewable energy to test hypothesis construct index capture distance weighted measure intensity renewable energy country apply fixed effect framework panel 116 country 1980 2012 period our result confirm existence geographic spill effect intensity adoption renewable energy technology moreover effect stronger intensive adopter renewable energy also important trading partner highlighting relevance trade channel potential catalyst diffusion renewable energy across country
82,Landscape visualisation and climate change: the potential for influencing perceptions and behaviour,WOS:000233817200010,urgent need mitigate adapt becoming widely understood scientific policy circle public awareness lag behind potential visual communication accelerate social learning motivate implementation substantial policy technological life style change needed begun recognised in particular realistic landscape visualisation may offer special advantage rapidly advancing people awareness possibly affecting behaviour policy bringing certain possible consequence home people compelling manner however application yet use theoretical basis effectiveness visualisation role clearly established ethical concern elicited adopting persuasive approach deliberately engages emotion visual imagery these question policy implication discussed context theoretical framework effect landscape visualisation spectrum response information drawing part evidence application landscape visualisation author concludes persuasive use visualisation together approach may effective justified could vital helping communicate effectively given ethical standard based disclosure drama defensibility
83,Role clarification for local institutions: a missing link in multi-level adaptation planning? Insights from a multiple case study in Botswana,WOS:000658207600001,meaningful engagement community based actor planning crucial effective plan achieving ongoing challenge even participatory method in explore different approach using shared value crystallization pre process standard vulnerability risk assessment vras recently reported significant impact plan produced posit could due learning via changed local perception role use multiple case work five village development committee vdcs north east district botswana examine vra output pre post vra interview transcript evidence finding indicate vdc member took part shared value pre process significantly clarified prioritized general role subsequently engaged deeply planning process taking responsibility ownership final plan they related risk local lived reality better producing quality action plan funding innovation mainstreaming wider local plan alongside eagerness present idea higher governance level these finding suggest shared value pre process could immediately valuable multilevel planning practice concept role clarification deserves specific consideration academic study participation
84,Local initiatives and adaptation to climate change,WOS:000235693900010,expected lead increase number strength natural hazard produced climatic event present example experience community based organisation cbos non governmental organisation ngo variation look incorporated finding design implementation local strategy local organisation integrate climatic hazard design development project mean adapting new climatic situation project designed boost resilience local livelihood good example local strategy to upscale initiative need improve information exchange cbos ngo academia moreover need bridge gap scientific local knowledge order create project capable withstanding stronger natural hazard
85,Toward a standardized framework for thermal resilience modelling and its practical application to futureproofing,WOS:000764960000001,recent extreme weather event expert forecast sharp increase frequency severity future extreme weather event due signaled need futureproof building make resilient thermal resilience among many aspect overall building resilience co benefit reducing energy demand carbon emission thermal resilience building commonly assessed using two indicator thermal autonomy ta passive habitability ph an emerging body identified two indicator significantly correlated energy efficient building performance however remains need achieve consensus coherently consistently model ta ph early stage design better inform decision making proposes framework establish common set building energy modeling convention comfort habitability threshold selection criterion weather data promote useful ta ph indicator it concludes proposing practical application thermal resilience modeling help address futureproofing code standard
86,Understanding the transformation of climate futures. A conceptual framework illustrated with urban adaptation policy,WOS:000372388300004,project science based future produced indicating relevant impact climatic change proliferating tandem increasing attention constructionist science study put forward concept co production understand knowledge claim become stable authoritative get institutionalised reorder science society moreover knowledge structure power co evolutionary exercise constructing future interesting practice ought enmeshed knowledge claim may turn performative societal reordering present conceptual framework understand transformation knowledge claim future analytical detail five concept suggested aid analysis transformation reduction extension rhetorical packaging modification redefinition conceptual framework used present qualitative depth transformation volatile issue urban warming face netherlands related knowledge claim future issue a case make clear constant erosion legitimacy urban warming matter collective concern important understand transformation knowledge claim also context organisational embedding project originated direct consequence construction relevant knowledge future urban warming moreover pre existing methodology science brings production knowledge functioned important template transformed issue urban warming
87,Policy integration: Do laws or actors integrate issues relevant to flood risk management in Switzerland?,WOS:000527300300001,existing emphasizes interdependency social ecological system ecological system often complex span several issue integrated social governance system in order increase fit social ecological system understanding factor promote integration interdependent issue crucial in consider 11 issue related flood risk management e g technical flood protection habitat loss typically addressed different policy sector exhibit ecological functional geographical interdependency analyze two base issue integration political actor connecting issue b legal framework cross referencing issue propose network method systematic comparison issue integration based actor integration based law for case swiss flood risk management find actor law based issue integration co vary might self reinforcing find issue integration mostly rest law although case exist actor main basis integration result promote understanding potential base integration policy issue thereby contributing knowledge adaptive governance capacity social ecological system buffer effect
88,Understanding climate-human interactions in Small Island Developing States (SIDS): Implications for future livelihood sustainability,WOS:000426783600007,purpose pose diverse often fundamental challenge livelihood island people purpose demonstrate challenge must better understood effective sustainable possible design methodology approach understanding past livelihood impact help design operationalize future intervention in addition globalization uneven effect island country jurisdiction producing situation especially archipelago significant difference core peripheral community approach overcomes problem characterized many recent intervention island context resulted uneven best marginal livelihood improvement preparedness future finding island context range unique vulnerability resilience characteristic help explain recent proposed response these include sensitivity coastal fringe environmental change island society comparatively high degree social coherence closeness nature spirituality uncommon western context limitation implication enhanced understanding island environmental social context well insight past impact peripherality contribute effective sustainable future intervention originality value need effective sustainable island context becoming ever exigent pace twenty first century increase
89,Preparing Health Services for Climate Change in Australia,WOS:000288407600013,although implication public health continue elucidated still require much work guide development comprehensive strategy underpin health system evolving process impact emerge author aim focus response australian health system health risk particular best prepare health service predicted health risk heat wave bush fire infectious disease diminished air quality mental health impact in addition author aim provide general principle health system may applicable beyond australian setting they present guiding principle preparing health system also overview specific preparatory activity relation personnel infrastructure coordination increase extreme weather related event superimposed health effect arising gradually changing place additional burden health system challenge existing capacity key characteristic prepared health system flexible strategically allocated robust long term planning also require close collaboration nonhealth sector part nationwide adaptive response
90,Spatial Planning and Climate Adaptation: Challenges of Land Protection in a Peri-Urban Area of the Mediterranean City of Thessaloniki,WOS:000645372200001,growing interest related risk triggered effort address cause impact action mainstreamed various public policy spatial planning key role operates coordinating framework well one enables specific intervention at time land indispensable element spatial planning gaining attention natural resource closely related increasing need land protection raise need renewed role spatial planning type level examines issue land protection related peri urban area thessaloniki metropolitan area greece seek identify type spatial planning contribute land protection it argued viewing land protection perspective renewed relationship type level spatial planning demand emphasis placed cooperation enabling novel approach nature based solution becomes apparent
91,"Viability, efficiency, resilience and equity: Using very diverse indicators to deal with uncertainties of future events",WOS:000869722000006,dynamic model help adapt since inform impact decision future event sustainability they make possible follow evolution variable time model exogenous event adaptive policy compute sustainability indicator various model type based different worldviews exist give rise different indicator modeller generally choose one type model limiting variety indicator however decision maker creative face global need wider diversity indicator objective show diversity insight one get using alternative system indicator decision implication test diverse indicator approach illustrate result population risk flooding water basin manager help population implement protection measure test many variation including e g viability theory agent based modelling different indicator viability resilience efficiency equity based comparable data set show possible synergy obtained diversity insight example one indicator say urgent act another best policy use discus difficulty implementation benefit approach decision maker
92,Predictions of Climate Several Years Ahead Using an Improved Decadal Prediction System,WOS:000342883400002,decadal prediction established source information future alongside longer term projection information potential provide key evidence decision especially regional scale it importance implies following creation initial generation decadal prediction system process continual development needed produce successive version better predictive skill here new version met office hadley centre decadal prediction system depresys 2 introduced build upon success original depresys depresys 2 benefit inclusion newer realistic model hadley centre global environmental model version 3 hadgem3 share similar approach initialization predecessor by performing large suite reforecasts shown depresys 2 offer improved skill predicting several year ahead difference skill two system likely due multitude difference underlying model demonstrated herein improved simulation tropical pacific variability key source improved skill depresys 2 while depresys 2 clearly skilful depresys global sense shown decrease skill high latitude region related error representing long term trend detrending result focus prediction decadal time scale variability show improvement skill depresys 2 even marked
93,Business models for climate services: An analysis,WOS:000582023000003,service support mitigation encourage science based informed policy development a performing market vital supporting uptake service diffusion innovation depends business model meant firm strategic choice create capture share value within value network employed innovation business model rather product innovation proved useful overcoming bottleneck associated development diffusion technology but study analysed business model used within context service fill gap using sample 32 service provision different stage development use original revised version business model canvas framework facilitate data collection analysis process a quali quantitative approach employed tackle content administered semi structured interview map connected set node representing concept provided selected informant by combining content network analysis present business model aspect interact within across component find value network service operate crucial success subscription online based infrastructure widespread tool reaching target user creation partnership consortium organisation allows mutual learning opportunity happen boost innovation behind product focus graph giant component highlight role co creation approach generating direct indirect incremental innovation delivering seasonal forecast tailor made service finally call tighter link business related aspect enhance importance financial consideration around service provision
94,Audience segmentation and climate change communication: conceptual and methodological considerations,WOS:000340845800002,engaging public mitigating adapting threat pose significant challenge scientist policy maker others responsible developing communication strategy in response challenge interest growing audience segmentation possible strategy develop effective communication tailored targeted subgroup public share similar value belief behavior policy preference in provide brief historical overview audience segmentation application marketing health politics recently critically evaluate several conceptual argument whether segmentation appropriate strategy communication key methodological consideration associated conducting segmentation analysis make several recommendation best practice conclude principle audience segmentation targeted messaging potentially valuable tool enhancing communication but practice conceptual methodological complexity practitioner consumer aware conducting interpreting result segmentation study in addition required particularly related tailoring targeting message identified segment strategy considered sufficient evidence base warrant widespread adoption
95,"Politics, values, and reflexivity: The case of adaptation to climate change in Hampton Roads, Virginia",WOS:000415001600014,planning said necessary inevitable facet future society rapidly occurring across range geopolitical scale previous scholarship suggests democratic decentralized approach one foster inclusive participation representation central achieving equitable sustainable outcome however recent study frequently characterize process dominated techoscientific approach among expert elite actor tends obscure neglect perception desire marginalized member society employ value based approach better understand motivational factor closed non inclusive process through case early yet formidable stage planning urban coastal region hampton road virginia empirical data among epistemic community gathered interview participant observation de facto planning forum result document exclusionary process favoring participation representation technocratic elite exclusion elected official local citizen when linking case finding value theory inference made planning hampton road motivated dominant institutional actor value power security theorized opposition value fostering social environmental justice in light result call critically reflexive practice thereby challenging value assumption belief self well social structure power relation shape planning
96,Geodiversity and the ecosystem approach: the contribution of geoscience in delivering integrated environmental management,WOS:000320828100011,a reflected ecosystem approach conservation strategy natural environment responding society need changing ecosystem assessment particularly millennium ecosystem assessment uk national ecosystem assessment reviewed benefit society gain natural environment represent undervalue contribution geodiversity geodiversity underpins delivers many vital ecosystem service informs management important element natural capital includes application knowledge physical process evidence quaternary archive recent environmental help future proof ecosystem service key principle include working natural process based understanding spatial temporal dynamic adopting possible soft engineering practice enable multiple benefit nature society ecosystem approach need require integrated approach geodiversity biodiversity landscape conservation management enable sustainable future engaging issue also demonstrate wider relevance today geodiversity geoconservation contributing successfully critical area requires closer partnership working across geoscience geoconservation community sector nature conservation policy maker planner community well discipline geoscience essential contribution make addressing knowledge gap recognised ecosystem assessment implementing robust solution broader environmental economic social issue
97,"A Statistical Adjustment of Regional Climate Model Outputs to Local Scales: Application to Platja de Palma, Spain",WOS:000299800500008,projection effect system platja de palma spdp derived using novel statistical technique socioeconomic activity developed settlement closely linked any planning socioeconomic opportunity mid long term must take account possible effect to aim daily observed series minimum maximum temperature precipitation relative humidity cloud cover wind speed analyzed for projection daily data generated ensemble regional model rcms used to properly use rcm data local scale quantile quantile adjustment applied simulated regional projection method based detecting change cumulative distribution function recent past successive time slice simulated applying calibration recent past observed series result show overall improvement reproducing present baseline using calibrated series instead raw rcm output although correction result clear improvement dealing extreme rainfall next corrected series analyzed quantify signal an increase annual mean temperature together decrease remaining variable projected throughout twenty first century increase weak intense daily rainfall high extreme daily maximum temperature also expected with information hand expert planning future spdp respond effectively problem local
98,A framework for using autonomous adaptation as a leverage point in sustainable climate adaptation,WOS:000721097500006,planned adaptation commonly adopted government considering large scale socio economic political intervention local community innovate adaptive response using locally available resource also known autonomous congruence planned autonomous needed develop concerted effective effort minimize negative impact context specific vulnerability offer systematic framework building congruence planned autonomous using six step approach guide integration maintaining environment future autonomous innovation applied framework previously conducted case study spain bangladesh revealing key lesson using autonomous leverage point sustainable
99,Stakeholder involvement in strategic adaptation planning: Transdisciplinarity and co-production at stake?,WOS:000407869500016,to address increasing climatic variability extreme city gradually forced develop strategy ensure continuous transformative process there widespread consensus sustainable establishment strategy requires transdisciplinary approach involvement internal external stakeholder state civil society market actor become part find innovative way unite effort capacity however little hardly empirical evidence process stakeholder involvement co production development municipal strategy against background examines factor influence different stakeholder involved excluded process developing strategy get reflected process outcome based applied participatory analysis two pioneering municipality sweden identifies contrast existing pattern feed back theory practice synergy mismatch barrier driving force co production identified contrasted current discourse result highlight level internal external stakeholder involvement conditional change broader governance context associated power constellation stakeholder act e g standing department proximity decision making body change constellation political party contractual arrangement staff individual champion progress mainstreaming on basis conclusion drawn regarding foster sustainable transformative increased stakeholder involvement result conclusion crucial advance theory co production providing basis analysis action they inform existing theory policy guideline strategic planning need revisited support across current risk governance
100,Cycles of meaning-making crystallization in the WeValue InSitu process as clear contributions towards transformative learning,WOS:000655683900026,transformative learning highly sought practitioner academic sustainable development education sustainable development adult education involves shift perspective potentially underpin significant change worldviews way learning a practice based design process crystallizing local shared value called wevalue insitu already reported regularly produce transformative learning tl lack discipline theory based origin mean currently way formalise mechanism there thus need conceptualize sub process within order provide theoretical underpinning extract key contribution production transformative learning tl here polanyi fine toothed micro process used analyse discourse transcript wevalue insitu event reveal pattern meaning making meaning checking cycle also identified key facilitator action redirecting challenging refocusing reflecting back disentangling concept these finding allow self consistent conceptualization wevalue insitu sub process thus formal methodology furthermore lead widespread transferability scaling wevalue insitu field meet demand known us e g planning sustainability assessment education reconceptualized sub process also contribute wider tl since enable reliable tl production replace fortuitous case study with new tl agenda systematic study e g tl learning mechanism contextual influence tl
