,title,wos,clean_abstract
0,"Public participation, engagement, and climate change adaptation: A review of the research literature",WOS:000521615300001,there clear need state art public participation considered across academic community rio declaration developed 1992 un conference environment development unced included explicit goal citizen participation engagement action principle 10 nation state given special responsibility facilitate ensuring access information opportunity participate decision making process since need public participation featured prominently call action using text analysis produce corpus abstract drawn web science literature incorporating public participation citizen engagement since 1992 reveals lexical temporal spatial distribution dynamic topic an exponential rise effort since year 2000 demonstrated focus action three substantial theme risk flood risk risk assessment perception communication these critically reviewed three substantive issue considered paradox participation challenge governance transformation need incorporate psycho social behavioral policy process gap current include lack common understanding public participation across discipline incomplete articulation process involving public participation citizen engagement paucity empirical examining understanding usage influential concept risk vulnerability adaptive capacity varies among different discipline stakeholder finally provisional agenda attending gap described categorized vulnerability institution policy governance governing community city region
1,Participatory 3-dimension mapping: A tool for encouraging multi-caste collaboration to climate change adaptation and disaster risk reduction,WOS:000329882700016,reflects upon use participatory 3 dimensional mapping p3dm facilitating collaboration different caste disaster risk reduction drr cca unequal power relationship amongst upper lower caste indeed identified major driver people vulnerability natural hazard including negative effect nepal elsewhere south asia however prevent member caste including lowest untouchable display significant capacity facing natural hazard change pattern it therefore similarly important harness capacity address unequal power relationship underpinning vulnerability achieving goal requires fostering dialogue amongst upper lower caste well stakeholder drr cca e g scientist ngo government agency often tend work single caste easier p3dm provides platform dialogue make knowledge every caste tangible credible others prof essential assessing planning reducing risk disaster adapting particularly document activity conducted small village terai plain nepal frequently affected flooding
2,Developing a Conceptual Model for Identifying Determinants of Climate Change Adaptation,WOS:000618528600004,conceptual model seems integral part academic any conceptual model developed based theoretical reasoning practical relevance topic however instance study ground rationale relevance a relatively lower r 2 value study indicates lack care developing conceptual modelling thus current attempted propose conceptual model assessing determinant farmer bangladesh a three stage approach used constructing model first relevant literature collected analysed second list factor compiled first stage e analysis literature refined using delphi method finally result delphi method cross evaluated focus group discussion fgd based present proposes multi dimensional conceptual model includes personal economic institutional environmental determinant might influence farmer decision finding expected suitable particular bangladesh developing country general most importantly expected guide future assessing factor influencing farmer strategy effect similar event adopting agricultural technology
3,Planning adaptation based on local actors' knowledge and participation: a climate governance experiment,WOS:000356272300004,involving wide range stakeholder different moment planning urban help overcome different barrier lack common perception control option argues approach involves wide range actor throughout planning process order confront challenge urban it build result three year participatory action project identify catalyst local administration overcome lack data low level engagement around issue cause effect linkage impact urban environment significant factor include territorial rootedness leveraging actor experience interaction actor well valuing local actor expert territorial management rather novice regard in addition contributing towards engagement large number stakeholder around issue planning process involves representative various sector several stage contributes greater understanding issue linkage it follows process bring change urban practice better articulating local concern climatic issue policy relevance although participation commonly advocated policy response empirical study investigated way local actor knowledge integrated planning process build result action project carried quebec city address relevance involving progressively broader range actor process move various phase given multitude barrier play different time municipality collaboration local stakeholder emerge key factor these collaboration provide greater insight linkage impact urban environment bring question ordinary urban management design practice
4,Religious beliefs and climate change adaptation: A study of three rural South African communities,WOS:000451292200001,argues religious belief significantly influence community understanding experience indicating need inclusion information education data collected using q method whereby recurring statement identified semi structured interview participant three rural community north west province south africa lkageng ventersdorp jouberton found community member regard religious overall christian faith fall two group religious determinist fatalist see natural process governed god religious participant deny naturalness acknowledge human impact
5,"Assessing Policy Capacity for Climate Change Adaptation: Governance Arrangements, Resource Deployments, and Analytical Skills in Canadian Infrastructure Policy Making",WOS:000313490900003,examines infrastructure policy sector capacity respond analysis case it includes three level examination capacity macro level virtual policy network analysis meso level examination lead department evolving mandate resource micro level analysis survey data related departmental worker policy task attitude four hypothesis across three level set tested national subnational level together finding suggest policy capacity infrastructure sector unable meet demand placed upon sector respond increasing challenge
6,Coordination and health sector adaptation to climate change in the Vietnamese Mekong Delta,WOS:000412944300004,examines impact three coordination dimension health sector vietnamese mekong delta cross scale cross sectoral cross boundary while task divided government ministry department vietnam little collaboration issue span mandate similarly water flow vietnamese mekong delta take resource management health concern across provincial boundary formal mechanism interprovincial collaboration lacking while decentralization effort sought devolve authority decision making lower level continued state centered top policy making limit collaborative coordination across scale all three issue inhibit health sector vietnamese mekong delta though coordination issue recognized vietnamese government date little success addressing author hope stimulate debate discussion coordination problem conclude despite significant challenge south west steering committee could play facilitating role coordinating response health sector across vietnamese mekong delta a analysis governance applicable area sector vietnam well part south east asia
7,Materialising energy and water resources in everyday practices: Insights for securing supply systems,WOS:000309306400019,policy secure energy water supply impact currently developed place many developed nation little known policy security system resource provision prioritise affect householder capacity adapt to better understand connection resource provision consumption explores notion different energy water conceptualised material element social practice shape way practice performed draw australian migrant experience different resource provision system multiple country time period context across three generation discus differing characteristic energy water provision across three broad resource era way resource enable reduce resourcefulness adaptive capacity resilience find policy maker may inadvertently reduce householder capacity respond adapt impact prioritising resource characteristic immateriality abundance homogeneity conclude policy prioritises resource characteristic materiality diversity scarcity important underutilised currently unacknowledged source adaptive capacity
8,Theoretical frameworks in climate change adaptation planning: a comparative study in coastal cities of developing countries,WOS:000768711500001,shifted single dimension integrative approach aligns vulnerability resilience concept planning correspondingly guided three framework categorized hazard based vulnerability based urban resilience framework exploring way framework affect proposed initiative crucial planner justify well fit approach planning seek examine influence theoretical framework formulation initiative sample 45 coastal city developing country vulnerability framework found tackle issue sufficiently hazard based approach share resource matter urban resilience framework put effort issue rather from finding offer implication planning applying three framework
9,Expert views of climate change adaptation in the Maldives,WOS:000307256200008,essay ass integrating risk resilient island planning maldives program iccr four year 9 3 million project supported least developed country fund maldivian government united nation development program essay elaborates type challenge arise low income country try utilize international development assistance adapt based primarily series semi structured interview maldivian expert discussed benefit iccr include improving physical resilience deploying soft infrastructure institutional resilience training policymakers community resilience strengthening asset challenge include ensuring effort sufficient reduce vulnerability lack coordination value attitude business community leader
10,"Everybody should contribute, but not too much: Perceptions of local governments on citizen responsibilisation in climate change adaptation in the Netherlands",WOS:000779920400001,argument called citizen responsibilisation transfer responsibility public service citizen increasingly put forward several western european country an important domain citizen responsibilisation advocated urban however practice advocated shift taking place limited extent aim help explain researching dutch local government perception citizen capability well government preference regarding task want delegate citizen different stage planning finding three workshop policy practitioner local government show practitioner moderate trust citizen capability low willingness transfer responsibility concern local government include ensure equal division resource different citizen group neighbourhood ii address citizen pursuing benefit producing public good iii address potential externality citizen iv guarantee certain quality level public space show local government implicit awareness different dimension responsibility tension including least responsibility task legal duty something one held accountable recommend explicit discussion dimension practice systematic treatment conceptual empirical study
11,Three ways social identity shapes climate change adaptation,WOS:000722021700001,inescapably influenced process social identity people perceive others place world around yet sparse evidence specific way identity process shape planning response proposes three key way understand relationship identity formation process social identity response perceived risk threat b identity may objective
12,Integrating public health in European climate change adaptation policy and planning,WOS:000898227300001,ass extent public health integrated european national urban policy planning analyse national document 27 european union member state interview city level expert n 17 integration three category effort general effort minimize health impact related targeted effort enhance resilience health system supportive effort foster potential first two category at national level general effort address vector borne disease heat related illness covered comprehensively whereas effort addressing several related health risk neglected e g water borne disease injury extreme weather cardiopulmonary health overlooked e g malnutrition mental health targeted effort inform policy decision carrying risk monitoring assessment often described detail effort manage day day health care delivery emergency situation receive little attention at urban level health issue receive le attention policy planning if health topic included often described indirect benefit effort sector perceived priority involved authority effectively mean general targeted effort responsibility sectoral department supportive effort responsibility national government external organization a result urban level related health system policy aim right many potentially high health risk ignored in order health risk better integrated policy planning critical interconnect national urban level reduce sectoral thinking welcome external expertize facilitate large scale data collection sharing health indicator key policy insightswe recommend focussing cooperatively drafting strategy integrating health issue policy planning stakeholder national urban level different policy sector society policy planner build strength document country city take note weakness advocate foster co benefit health action various measure e g promoting active mobility urban greenery health impact related heat mental physical stress air pollution reduced large scale data collection sharing health indicator facilitated support learning pro active decision making
13,Preparedness of key coastal and marine sectors in Ireland to adapt to climate change,WOS:000292179600009,preparedness adapt impact assessed three important sector activity within irish coastal marine environment namely tourism fishery conservation biodiversity information current status sector valuable point reference term accessing contribution implementation future national effort a modified version national adaptive capacity nac framework developed world resource institute used ass three sector activity framework structured around five function assessment prioritisation coordination information management risk reduction result assessment suggest three sector nascent stage process currently dedicated national policy guidance legal support mechanism ireland hence national financial commitment support implementation action sector assessed subjecting three selected sector activity assessment enables identification existing action potentially support current well issue knowledge gap lack policy support hinder progress
14,Barriers to transformation towards participatory adaptation decision-making: Lessons from the Cork flood defences dispute,WOS:000503093800049,analysis cause consequence public participation failure flood hazard management important lesson offer despite potential participatory decision making scholarship remained largely separate literature participatory environmental governance brings literature conversation applying concept transformation outcome decision making through examination disputed flood relief scheme cork ireland develops three main argument 1 it demonstrates need analytical approach recognise constitutes transformative vary depending definition transformation used context definition applied perspective local stakeholder 2 it argues producing intractable conflict damaging reputation organisation responsible hazard management public participation failure create formidable new barrier transformative outcome 3 it concludes incremental change decision making process prove insufficient overcome barrier in order facilitate effective public participation hazard management much wider hazard management policy resourcing required
15,The dynamics of institutional arrangements for climate change adaptation in small island developing states in the Atlantic and Indian Oceans,WOS:000833487100001,successful design implementation management institutional arrangement critical component sustainable development especially true small island developing state sids group 58 country spread across three main geographic region acknowledged disproportionately vulnerable impact in many instance dynamic arrangement sids poorly understood documented help fill gap identifying analyzing network action situation semi structured interview 14 national international official practitioner four sids comoros maldives seychelles singapore atlantic indian ocean region find strategic actor involved multiple mutually reinforcing sometimes conflicting arrangement simultaneously shaped reshaped different scale also find varying pattern power politics participation act driver barrier country by deconstructing institutional interlinkages strategic feedback loop contributes broader understanding complexity environmental governance small jurisdiction
16,Evaluation of climate change impacts on energy demand,WOS:000313461800012,although previous documented effect linking mitigation energy sector still lack integrated assessment particularly national level may contribute fill gap identifying interaction energy demand macedonia analysis conducted using markal market allocation macedonia model focus energy demand commercial residential sector mainly heating cooling three different case developed 1 base case give optimal electricity production mix taking account country development plan without 2 damage case introduces change adjusting heating cooling degree day input consistent existing national scenario 3 case optimal electricity generation mix determined allowing endogenous capacity adjustment model modeling exercise identify change energy demand electricity generation mix case well damage benefit
17,Policy-induced innovations networks on climate change adaptation - An ex-post analysis of collaboration success and its influencing factors,WOS:000369195700008,16 policy induced innovation network e subsidised multi actor network initiated institute formed around particular real life problem aiming joint development test implement measure political administrative context institutional context joint framework network work independently particular topic remains bound principle practical solution oriented carried close partnership scientific extra scientific actor our objective provide empirical insight process outcome network systematically analyse network collaboration success influencing factor to end collaboration success operationalised three dimensional metric including 1 practitioner satisfaction cooperation 2 perceived learning effect 3 perceived implementation capacity result show decreasing level success throughout three dimension particularly gap knowledge acquisition learning one hand implementation e transforming knowledge action while positive relationship dimension confirmed result correlation analysis highlight importance repeated participation appropriate information management inclusive well responsive network practice discus result existing knowledge multi actor collaborative deduce methodological lesson learnt well future need
18,Soil and Water Bioengineering (SWB) is and has always been a nature-based solution (NBS): a reasoned comparison of terms and definitions,WOS:000807983600003,nature based solution nb collective term solution based natural process healthy restored ecosystem service address three pillar sustainability including related challenge soil water bioengineering swb swbe hazard mitigation restoration discipline formally established structured since aftermath world war ii finding root age old application many objective common nb however structured comparison swb nb terminology objective lacking much needed highlight swb amenable concept nb context disaster risk reduction drr work present comparison definition swb nb terminology fall nb concept a matrix created compare nb nb related terminology three main aspect swb practice main aim field application objective result comparison confirm nb unifying concept prioritise nature integrate mitigation disaster reduction effort embracing also many aspect swb criterion application thus swb recognized always nb
19,Public engagement and climate adaptation: insights from three local governments in Australia,WOS:000354108300004,public participation decision making central component planning process however implementing effective engagement initiative resolve complex planning policy problem challenging planner these challenge particularly acute coastal community throughout many settlement risk future perturbation using international association public participation framework public participation analyse three local government led public participation initiative new south wale victoria tasmania our analysis suggests three critical factor influence level public participation context technocratic approach decision making absent high order government support lack evaluation mechanism public participation
20,Organizational values and the implications for mainstreaming climate adaptation in Dutch municipalities: using Q methodology,WOS:000343165500013,mainstreaming requires inclusion policy various policy domain water management spatial planning investigates organizational value present several municipal policy department order explore willingness act upon implication mainstreaming q methodology supplemented interview focus group applied three major dutch municipality amsterdam hague rotterdam reveals three value pattern 1 start today 2 u lead 3 shared responsibility these different value pattern indicate general agreement problem impact solution disagreement time frame action allocation resource although three value pattern present within department municipality different value pattern prevail municipality additionally analysis show barrier well opportunity mainstreaming a lack political commitment leadership unsupportive organizational structure create barrier in spite willingness act strategic framing applied gain acceptance mainstreaming
21,"Variables shaping coastal adaptation decisions to armor, nourish, and retreat in North Carolina",WOS:000502881300018,understanding decision maker choose use different strategy remains important theoretical practical question coastal provides exploratory statistical analysis three measure shoreline armoring property acquisition beach nourishment deployment respect metric risk exposure socioeconomic marker critical infrastructure north carolina u s exploratory analysis evaluates two proposition first measure deployed relative specific metric risk second choice disproportionately correlate socioeconomic attribute finding support proposition reveal shoreline armoring correlate higher home value household income population density low racial diversity property acquisition found correlate low home value household income population density high racial diversity furthermore measure interconnected acquisition likely occur area low level armoring beach nourishment occurs exclusively area shoreline armoring result find correlation deployment critical infrastructure provides foundation future decision made trade offs among action considered whether decision adequately protect critical infrastructure deployment pattern affect social equity
22,On Track to Become a Low Carbon Future City? First Findings of the Integrated Status Quo and Trends Assessment of the Pilot City of Wuxi in China,WOS:000324050300001,low carbon future city lcfc project aim facing three dimensional challenge developing integrated city roadmap balancing low carbon development gain resource efficiency give overview first outcome analysis status quo assessment likely development regarding ghg emission impact resource use wuxi chinese pilot city lcfc project a first step detailed emission inventory following ipcc guideline wuxi carried in second step future development energy demand related co2 emission 2050 simulated current policy scenario cps in parallel selected aspect material water flow energy building sector analyzed modeled in addition recent future impact vulnerability investigated based finding nine key sector high relevance three dimension could identified although wuxi government started path implement low carbon plan first result show shift towards sustainable low carbon development ambitious step need taken order overcome challenge faced
23,Institutions for long-term problems: the influence of the Dutch Delta Programme on forward-looking climate adaptation responses at the local level,WOS:000899889500001,requires forward looking policy response developing response challenging government therefore specific long term institution proposed overcoming short termism however impact institution underexplored in analyze influence long term institution dutch delta programme local government decision result based analysis strategy investment plan project interview policymakers across seven dutch municipality result indicate local strategy largely forward looking project tend focus solving present day issue found delta programme enabled local government make forward looking decision policy 1 providing knowledge vulnerability 2 creating broader framing issue 3 providing guidance developing local policy
