,title,wos,clean_abstract
329,Paths of adaptation to climate change in major Italian agricultural areas: Effectiveness and limits in supporting the profitability of farms,WOS:000603305900009,requires mediterranean farm maintain adequate profitability adapting increase water need crop growth water demand non agricultural user reduction resource availability use discrete stochastic programming model three italian farming area simulate path farm type change yield irrigation need crop could generate 2030 done context progressive decrease water availability condense choice attributed optimization process farm type mean indicator value produced per water cubic meter per hectare use indicator quadratic regression analysis explain hourly wage family labour represents farm resource profitability examination resulting elasticity index outline path impact farm profitability integrated analysis optimization model econometric regression show core italian cow milk production based medium high intensity forage system adapts better instead available technology structural feature provide much narrower margin livestock farm based intensive forage production conversely extensive livestock system crop farm adapt reducing labour use le profitable activity boost family hourly wage increase unemployment furthermore surface crop expanded cycle take place month availability water decrease le irrigation requirement increase le however low productivity crop allow increase wage family labour result farm overall profitability derive integrated analysis change water resource productivity soil labor mathematical programming outline path maximize farming income econometric analysis indicates whether path support profitability favouring farm economic sustainability
330,Does agroecosystem management mitigate historic climate impacts on dryland winter wheat yields?,WOS:000888921100001,global study quantify effect crop yield using top spatial framework invaluable assessing generalized effect world food supply yet contain resolution necessary identify local mediating effect management our objective identify factor historically affected winter wheat triticum aestivum l yield eastern colorado b management may mitigate impact
331,Crop breeding for a changing climate: integrating phenomics and genomics with bioinformatics,WOS:000640157500001,key message safeguarding crop yield changing requires bioinformatics advance harnessing data vast phenomics genomics datasets translate finding smart crop field additional 3 billion mouth feed 2050 raise serious concern global food security crop breeding land management strategy need evolve maximize utilization finite resource coming year high throughput phenotyping genomics technology providing researcher information required guide inform breeding smart crop adapted environment bioinformatics fundamental role play integrating exploiting fast accumulating wealth data association study detect genomic target underlying key adaptive resilient trait these data provide tool breeder tailor crop environment introduced using advanced selection genome editing method to effectively translate field genomic phenomic information need integrated comprehensive clade specific database platform alongside accessible tool used breeder inform selection adaptive trait here discus role bioinformatics extracting analysing integrating managing genomic phenomic data improve resilience crop including current emerging potential approach application bottleneck breeding pipeline
332,"Updating beliefs and combining evidence in adaptive forest management under climate change: A case study of Norway spruce (Picea abies L. Karst) in the Black Forest, Germany",WOS:000319101900009,uncertainty manager belief develop influence decision develop approach updating knowledge belief based observation forest variable illustrate application adaptive management even aged norway spruce picea abies l karst forest black forest simulated forest development range scenario forest management alternative our analysis used bayesian updating dempster rule combination simulate observation forest variable may influence decision maker belief development thereby management decision while forest manager may inclined rely observed forest variable infer impact found observation state e g temperature precipitation superior updating belief supporting decision making however little conflict among information source strongest evidence would offered combination least two informative variable e g temperature precipitation success adaptive forest management depends manager switch forward looking management scheme thus robust policy may depend crucially better understanding factor influence manager belief
333,Water Productivity and Harvest Index Response of Paddy Rice with Alternate Wetting and Drying Practice for Adaptation to Climate Change,WOS:000881667400001,current water scarcity world population increase cause need food pushing demand water resource due crop production rice increasing agricultural water productivity reducing amount irrigation water without affecting yield especially paddy rice necessary possible alternate wetting drying awd irrigation conducted greenhouse condition tokyo university agriculture technology japan evaluate response yield water productivity harvest index different water regime experiment performed pot four water regime treatment three replication making 12 pot water regime continuous flooding irrigation control three awd condition awd5 awd10 awd15 pot irrigated water reached 5 10 15 cm soil depth respectively disappearance surface ponding water yield component harvest index water productivity showed significant difference p 0 05 irrigation treatment in 25 reduction water use 6 4 grain yield awd15 considered best irrigation practice among treatment provides data reference theoretical scientific knowledge understanding safe awd practice country facing water shortage
334,"Analysis of vernacular houses in southern Vietnam, and potential applications of the learned lessons to contemporary urban street houses",WOS:000828774000001,purpose examines spatial layout sustainable feature vernacular house southern vietnam apply lesson learned development contemporary housing design proposes hypothetical low rise street house model popular contemporary urban vietnam applying spatial ecological lesson learned analysis design methodology approach in total 23 well preserved vernacular house dong hoa hiep 18th century village tien giang province chosen 2 month site investigation during field survey house measured fabricate scale drawing detailed analysis photograph taken finding an depth evaluation highlighted unique characteristic spatial composition sustainable feature architectural component contribute adaptive strategy limitation implication although numerous potential arrangement model possible example illustrated validate assembly could help achieve dynamic streetscape street house social implication from perspective vernacular house vietnam rich architectural resource significant cultural heritage house adopted sustainable design strategy suitable local culture ensure comfort well long time perhaps sustainable lesson drawn vietnam indigenous house prerequisite developing contemporary housing country originality value employing lesson learned vernacular house developed three sustainable prototypical design development contemporary street house densely populated city vietnam
335,Conservation agriculture increases the soil resilience and cotton yield stability in climate extremes of the southeast US,WOS:000683824800002,extreme pose global threat crop security conservation agriculture expected offer substantial benefit however synergistic effect conservation practice yield normal versus extreme climate underlying regulatory mechanism remain elusive here analyze 29 year data cotton gossypium hirsutum l yield soil data 32 management practice tennessee usa find long term tillage enhanced agroecosystem resilience yield stability extreme maximized yield favorable demonstrate tillage benefit tied enhanced soil structural stability organic carbon no tillage enhanced effectiveness legume cover crop stabilizing cotton yield relatively dry wet dry year nitrogen fertilizer rate precipitation timing controlled yield stability wetter year our finding provide evidence based insight management strategy enhance agroecosystem resilience production stability extreme long term tillage system enhance cotton yield resilience extreme improved soil quality tennessee usa according 29 year rain fed plot scale cotton experiment
336,"Grassland dynamics in response to climate change and human activities in Inner Mongolia, China between 1985 and 2009",WOS:000322076300006,china grassland undergoing rapid change recent past owing increased variability shift grassland management strategy driven series ecological restoration project investigated spatio temporal dynamic inner mongolia grassland main grassland region china part eurasia steppe detect interactive nature ecosystem society land use landscape pattern period 1985 2009 analysed based tm modis derived land use data net primary productivity npp estimated using carnegie ames stanford approach model used ass growth status grassland furthermore factor related dynamic grassland analysed perspective two driving factor human activity result indicated higher temperature lower precipitation may generally contributed grassland desertification particularly arid region during period 1985 2000 higher human population increase livestock number major driving force responsible consistent decrease npp relatively fragmented landscape from 2000 2009 implementation effective ecological restoration project arrested grassland deterioration ecologically fragile region however rapid growth livestock number sparked new degradation onnon degraded lightly degraded grassland initially neglected project in spite achievement grassland restoration china take step develop sustainable management practice economic development bring lasting benefit
337,Soil water balance modelling using SWAP An application for irrigation water management and climate change adaptation in citrus,WOS:000333607900004,physically based agro hydrological soil water atmosphere plant swap model applied andalucia southern spain simulate water balance component irrigated citrus orchard direct measurement soil water status using frequency domain reflectometry fdr probe used calibrate soil hydraulic function using pest parameter estimation package crop coefficient k
338,ASSESSING AND ADDRESSING CLIMATE-INDUCED RISK IN SUB-SAHARAN RAINFED AGRICULTURE: LESSONS LEARNED,WOS:000289819300011,a defining characteristic many rainfed tropical agricultural system vulnerability weather variability there increased attention paid agriculture link world focused shown need understanding current future link agricultural investment decision particularly farmer decision integrated strategy coping need start managing current risk largely association strengthening agricultural eastern central africa asareca project demonstrate value increased understanding presented issue journal key lesson follows 1 statistical method analysis historical data relevant agriculture need complex critical point describe term event direct relevance farming date start rainy season rather simple standard measure annual total rainfall 2 analysis requires access relevant data tool expertise daily data current historical arc primarily responsibility national meteorological service nm accessing data particularly daily data always easy including stall nm partner data provider reduce problem 3 farmer perception variation risk complex they keenly aware variability evidence estimate risk negative impact thereby fill make use good condition occur there also evidence multiple cause change arc confounded farmer observe decreasing crop production may distinguishing rainfall declining soil fertility condition hence project working farmer coping must also access analysis observed data foal nearby recording station 4 mechanism reducing coping risk exemplified pastoral system exist variable environment new approach risk transfer index based insurance show potential positive impact 5 skilful seasonal forecast give better indication coming season simple average would help farmer take decision coming cropping season increasing meteorological knowledge show forecasting possible part africa there institutional barrier farmer accessing using forecast information furthermore skill forecast currently limited maybe still rational choice farmer make basis forecast with justified current interest agriculture stakeholder including researcher data provider policy developer extension worker need work together ensure intervention based correct interpretation valid analysis relevant data
339,Selected Good Practices in the Hungarian Agricultural Heritage,WOS:000666765100001,agriculture always played determining role hungarian landscape forested area also agricultural use however use changed starting least middle age need new arable field resulted tremendous decrease forested area protection forest started many reason saving fuelwood construction material reason period forest carpathian basin suffered considerable pressure even today pressure continues however source changed animal husbandry tourism forestry wildlife management rather hunting created need search analyse former sustainable use forest furthermore consideration use tree treelines scope helping arable field wooded grassland also mapped various analysis done related survival wish introduce ancestral form agricultural use hungarian farming tree play important role origin distribution threatening factor future sustainable arable farming system tree including wood pasture orchard grassland conventional organic permaculture horticultural farm various proportion tree cover described
340,Opportunities and limits of controlled-environment plant phenotyping for climate response traits,WOS:000677242200001,rising temperature changing precipitation pattern affect agricultural production substantially exposing crop extended intense period stress therefore breeding variety adapted constantly changing condition pivotal enable quantitatively qualitatively adequate crop production despite negative effect a yet possible select future scenario field simulation future condition controlled environment ce phenotyping facility contribute understanding plant response special stress condition help breeder select ideal genotype cope future condition ce phenotyping facility enable collection trait easy measure field condition assessment plant phenotype repeatable clearly defined environmental condition using automated non invasive high throughput method however extrapolation translation result obtained controlled environment field environment ambiguous outline opportunity challenge phenotyping approach controlled environment complementary conventional field trial it give overview general principle introduces existing phenotyping facility take challenge obtaining reliable robust phenotypic data response trait support breeding adapted crop
341,Spectral Estimation of In Vivo Wheat Chlorophyll a/b Ratio under Contrasting Water Availabilities,WOS:000808744500001,to meet ever growing global population necessity integrating relevant plant trait breeding program required developing new tool fast accurate estimation chlorophyll parameter chlorophyll chl content chlorophyll b chl b content ratio chl b promote breeding program wheat enhanced adaptability spectral reflectance leaf affected change pigment concentration used estimate chlorophyll parameter current identified validated top known spectral index developed new vegetation index vi chl chl b content estimation used non destructively estimate chl b value compare hyperspectral estimation three wild emmer introgression line contrasting drought stress responsiveness dynamic selected well watered water limited irrigation regime applied wheat leaf spectrally measured handheld spectrometer acquire reflectance 330 790 nm range regression model based calculated vi well hyperspectral curve calibrated validated chlorophyll extracted value developed normalized difference spectral index ndsis resulted high accuracy chl ndsi415 614 chl b ndsi406 525 estimation allowing indirect non destructive estimation chl b root mean square error rmse value could fit 6 10 time range measured value they also performed similarly hyperspectral model altogether present new tool non destructive estimation chl b serve basis future breeding effort resilient wheat well crop
342,Research on the Spatial Pattern Characteristics of the Taihu Lake Dock Village Based on Microclimate: A Case Study of Tangli Village,WOS:000457129900072,dock village terrain name implies region contains settlement reminiscent dock term elongated shape outward upward tilt location center low wide valley dock village terrain feature deep fertile soil suitable farming taihu lake contains number classic example dock village dock village relatively independent hidden characteristic play role security defense also importantly associated enhanced adaptability relative lack cold weather equable level heat humidity dock village reflects wisdom distillation traditional chinese ecological practice highly valued topic based microclimate theory envi met software four microclimate index namely air temperature wind speed wind direction relative humidity simulated analyzed correlation spatial characteristic microclimate studied four perspective plane space cross section space vertical section space linear development space summarizes historical context evolution dock village spatial form construction contemporary human settlement it also provides scientific suggestion protection sustainable development ancient village
343,Extreme precipitation enhances phenolic concentrations of spinach (Spinacia oleracea),WOS:000562519300001,understanding environmental impact crop growth quality essential developing sustainable agricultural practice shift expected precipitation essential component agriculture including increased intensity rainfall examined effect extreme precipitation intensity spinach spinacia oleraceal growth quality manipulative greenhouse water treatment produced rainfall simulator modeled precipitation intensity predicted storm spinach growing area northeastern usa compared flooding treatment crop growth quality measured using biomass total phenolic concentration tpc general indicator quality impact appearance flavor health attribute crop leaf plant receiving high intensity precipitation smaller biomass leaf flooding treatment root biomass exhibited negative relationship tpc excess water increased tpc leaf treatment higher tpc occurred root low intensity precipitation treatment finding highlight water treatment extreme precipitation may enhance crop quality spinach leaf context though much water could negative impact yield require strategy
344,Four ways blue foods can help achieve food system ambitions across nations,WOS:000940612400003,blue food sourced aquatic environment important economy livelihood nutritional security culture people many nation they often nutrient rich 1 generate lower emission impact land water many terrestrial meat 2 contribute health 3 wellbeing livelihood many rural community 4 blue food assessment recently evaluated nutritional environmental economic justice dimension blue food globally here integrate finding translate four policy objective help realize contribution blue food make national food system around world ensuring supply critical nutrient providing healthy alternative terrestrial meat reducing dietary environmental footprint safeguarding blue food contribution nutrition economy livelihood changing to account context specific environmental socio economic cultural aspect affect contribution ass relevance policy objective individual country examine associated co benefit trade offs national international scale find many african south american nation facilitating consumption culturally relevant blue food especially among nutritionally vulnerable population segment could address vitamin b 12 omega 3 deficiency meanwhile many global north nation cardiovascular disease rate large greenhouse gas footprint ruminant meat intake could lowered moderate consumption seafood low environmental impact analytical framework provide also identifies country high future risk blue food system particularly important overall framework help decision maker ass blue food policy objective relevant geography compare contrast benefit trade offs associated pursuing objective
345,Shifting cultivation induced burn area dynamics using ensemble approach in Northeast India,WOS:000762155200002,identifying shifting cultivation area assessing spatio temporal dynamic essential framing adaptive policy efficient forest management agriculture practice benefit people current attempt develop alternative approach classify shifting cultivation area using ensemble technique integrating multiple spectral index three state northeast india nei assam manipur meghalaya adopted approach integrates green cover leaf water content change shifting cultivation land preparation landsat imagery deforested burned area patch identified based threshold value using landsat data derived index vegetation burned area leaf water digital elevation model dem ensemble approach provided shifting cultivation map good overall accuracy 83 maximum shifting cultivation area observed assam 126 87 km 2 followed meghalaya 51 53 km 2 manipur 46 04 km 2 2016 normalized difference vegetation index ndvi ndvi difference performed better vegetation index ensemble approach applied region minor modification threshold value thus potential accounting shifting cultivation dynamic operational basis future may include blending local traditional knowledge modern scientific solution improved forest land resource planning benefit inhabitant mountain environment scenario
346,SOIL FUNCTIONS - TODAY'S SITUATION AND FURTHER DEVELOPMENT UNDER CLIMATE CHANGE,WOS:000310494800003,effect many ecosystem including top layer earth soil induced change soil property lead change soil function importance soil protection these possible change evaluated within german part eu interreg ivb project proof area two pilot region wesermarsch evaluation eight different soil sub function carried using evaluation method tusec b based soil information gained soil map present status quo adapted soil property four different scenario 2050 considered evaluation result individual soil function summarized overall evaluation result using maximum principle evaluation result status quo show large area pilot region important soil protection regarding individual soil function evaluation summarized evaluation influenced evaluation parameter result increase importance protection soil sub region decrease others depending scenario difference extent direction changing evaluation result mainly depend change soil organic matter content groundwater level they different individual soil function regarding overall evaluation result show influence soil function on basis result recommended consider induced change soil function within spatial planning process area wide coastal protection water management measure e g dike reservoir construction avoid loss soil valuable function worth protecting
347,Targeting Irrigation Expansion to Address Sustainable Development Objectives: A Regional Farm Typology Approach,WOS:000694574700001,sustainable water management core sustainable development goal sdg also contributes sdgs including food water security ecosystem health to achieve synergy policy must target effort region best correspond development objective design targeting strategy irrigation expansion southern mexico region long considered strong potential sustainable irrigation development use integrated farm typology decision tree approach identify priority municipality irrigation expansion use multivariate statistic examine relationship among farm characteristic 933 municipality classifying according four farm type lowland midland midland irrigated highland partition municipality 11 farm type subgroup ranked priority level receiving irrigation intervention following mexico national water program guideline result identify highest priority subgroup 73 municipality comprised mostly midland highland farm type these type characterized low irrigation use small farmland area high vulnerability high marginalization poverty strong representation indigenous community low maize yield high rate subsistence production finding provide crucial first approximation irrigation expansion would best address water policy priority sustainable development objective southern mexico also provides useful framework scaling organization tasked targeting development effort across large spatial scale
