,title,wos,clean_abstract
88,Empowering irrigation: A game-theoretic approach to electricity utilization in Indian agriculture,WOS:000390744000005,us game theoretic approach analyze electric power provision irrigation andhra pradesh based result interview survey data farmer face coordination problem collectively preserving electric power quality linked dilemma obtaining sufficient electric infrastructure capacity utility low equilibrium prevail due asymmetric payoff farmer knowing electric network property finding derived survey data empirical test model synthesis indicate capacity dilemma overcome enable coordinated technology adoption via farmer utility investment energy efficient economically viable technology coordinated demand side measure could effectively reduce energy use support
89,"Understanding the nested, multi-scale, spatial and hierarchical nature of future climate change adaptation decision making in agricultural regions: A narrative literature review",WOS:000349724000005,historically innovation industrialised agricultural landscape slow likewise future cca also slow complex interaction highlighted innovation adoption literature ignored aim collate conceptualise multidisciplinary literature nested multi scale spatial hierarchy understand complexity cca decision making process highlighting influential factor across nested scale seven nested hierarchical scale identified overarching level governance outer boundary hazardscape spatially defined climatic region potential impact cc suitable cca strategy defined differing socio economic demographic profile community typology scale mean strategy need tailored enhance community adoption bolster resilience cc strength type social interaction within community also influence cca central hierarchy variation individual belief risk perception greater cc risk perception within household enhance constrain cca farm scale in turn farm scale attribute influence cca differing farm farmer characteristic provide layer complexity considering cca capability greater knowledge evaluation circumstance factor involved cca decision making highlighted use hierarchy create evidence base allow targeted approach cca adoption increased targeted range cca strategy tailored plan communication dissemination cc cca information across nested scale approach build much needed momentum cca rural setting while interaction scale discussed future required understand cross scale interaction feedback loop temporal dynamic within hierarchy
90,"Economic effects of climate change in the Murray-Darling Basin, Australia",WOS:000306630900002,us hydro economic model examine role water trading economic impact reduced surface water availability murray darling basin result show loss irrigated agriculture median scenario modest modified 2030 dry extreme scenario would substantial reduction water use irrigated land use profit nevertheless basin wide proportional economic impact would le percentage decline water use a comparison model result without inter regional water trade show inter regional water trade period much reduced water availability mitigates farm impact given agricultural production basin likely affected development drought tolerant crop cultivar along learning extension best farming practice reduced water use could also assist irrigated agriculture adapt within basin
91,Climate Change and Nature-Based Tourism: How Do Different Types of Visitors Respond?,WOS:000600463200001,impact nature based tourism community altering weather pattern influencing supply outdoor recreation resource visitor destination respond recreation substitution altering participate outdoor pursuit understanding predictor recreation substitution important destination considering best adapt using visitor intercept data n 1 398 explored different visitor segment intent utilize recreation substitution response changing environmental condition visitor segment characterized low trip anticipation long travel distance likely cancel trip travel elsewhere pursuit ideal recreation condition spatial substitution lower among visitor higher degree destination loyalty highlighting value communication strategy foster connection place targeted marketing retain visitor segment likely cancel trip may minimize negative impact travel behavior
92,Estimation of the drought sensitivity of Hungarian soils based on corn yield responses,WOS:000508887400001,during soil specific drought sensitivity aim ascertain drought stress factor caused lack precipitation affect soil fertility used five year long 1985 1989 soil corn yield data national pedological crop production database npcpd assigned annual palfai drought index padi annual corn yield data npcpd order identify drought free corn yield production area determined drought sensitivity soil comparing drought free annual yield based result statistical analysis created seven point drought sensitivity scale soil type based produced national soil specific drought sensitivity index map our result may provide good starting point constructing large scale 1 10 000 sensitivity soil map agricultural land assist soil specific crop production also adapts
93,"Playing the climate game: climate change impacts, resilience and adaptation in the climate-dependent sport sector",WOS:000470296400006,aim understand issue pose major australian sport stadium organization manage organizational response issue like dependent agriculture tourism sport sector potentially vulnerable impact yet largely overlooked empirical result reveal four primary issue organizational uncertainty greater management complexity cost risk associated water energy resource waste output no revenue opportunity evident result demonstrate physical impact manageable primacy commercial operational imperative determine organizational response ahead government policy direct signal adapt ten factor shape three organizational response typed using berkhout 2012 organization wiley interdisciplinary review 3 1 91 106 framework result challenge assumption impact response limited non sport leisure industry
94,Economics of a low-carbon future,WOS:000325719700004,set economic factor underpinning scotland move low carbon economy economics matter since address cost reducing greenhouse gas emission cost impact economic factor motivate individual behaviour behaviour business all important understanding barrier meeting target successful thinking barrier lifted discus relative merit market mechanism carbon tax cap trade cost including additional target issue counting carbon embedded imported good an efficient way achieving carbon reduction widen scope carbon trading include forestry transport agriculture energy efficiency business household priority benefit felt short term local level
95,"Water supply management in a semi-arid region: analysis of potable water consumption in Campo de Cartagena - Mar Menor, Southeastern Spain (2010-2019)",WOS:000613008000003,campo de cartagena mar menor region area semi arid characteristic structural drought water shortage constant history supplied water transfer unconventional resource analyzes potable water consumption establishing difference high primary consumption low secondary consumption find performance network strategy priority line action formulated improve water security region data taken commonwealth canales del taibilla mct municipal supply company municipality region result show evolution source supply extracted among others company performance improved key factor diversifying supply resource implementing new technology well improving distribution advance social awareness create resilient territory work serf model characterize improve situation water supply semi arid environment similar problem
96,"Influence of Repeated Prescribed Fire on Tree Growth and Morialily in Pinus resinosa Forests, Northern Minnesota",WOS:000393351000010,prescribed fire widely used ecological restoration fuel reduction fire dependent ecosystem also prone drought despite importance drought fire adapted forest little known cumulative effect repeated prescribed burning tree growth related response drought using dendrochronological data red pine pinus resinosa ait dominated forest northern minnesota usa examined growth response understory prescribed fire 1960 1970 ass whether repeated burning influence growth response overstory tree vulnerability overstory tree growth drought found difference tree level growth vulnerability drought expressed growth resistance resilience recovery area receiving prescribed fire treatment untreated forest annual mortality rate period active burning also low le 2 treatment these finding indicate prescribed fire effectively integrated management plan strategy red pine forest ecosystem without significant short long term negative consequence growth mortality rate overstory tree
97,The potential benefits of agricultural adaptation to warming in China in the long run,WOS:000426876000002,understanding extent agriculture adapt determinant farmer adaptive capacity paramount importance policy perspective based household survey data large sample rural china present adopts panel approach estimate potential benefit long run identify determinant farmer adaptive capacity empirical result suggest various model setting scenario long run adaptation mitigate one third one half damage warming crop profit end century these finding support basic argument hedonic approach omitting long run adaptation dramatically overestimate potential damage also find household level capital intensity farmland size significant effect farmer adaptive capacity
98,Human dimensions of climate change: the vulnerability of small farmers in the Amazon,WOS:000254577500012,argues twofold perspective human amazon first need understand process mediate perception environmental behavioural response level individual local population second take account process production dissemination global national information model regional local population especially small farmer discus sociocultural environmental diversity small farmer amazon susceptibility associated drought flooding accidental fire using survey ethnographic archival data area state para discus farmer source knowledge long term memory climatic event drought accidental fire source information response drought fire event impact changing rainfall pattern land use highlight challenge created influence migration family turnover collective action memory mismatch scale used monitor disseminate data lack extension service translate large scale forecast local need found farmer memory extended drought tend decrease significantly 3 year over 50 farmer interviewed 2002 remember significant el nino southern oscillation enso drought 1997 1998 help explain approximately 40 farmer changed land use behaviour face strongest enso event twentieth century
99,Institutional responses to climate change: opportunities and barriers for adaptation in the Pantanal and the Upper Paraguay River Basin,WOS:000344093500011,climatic expected serious impact pantanal large tropical wetland located upper paraguay river basin centre south america range institutional response developed mitigate adapt in order examine institutional achievement challenge managing region specific typology initially introduced comprises schematic gradient institutional response an empirical analysis conducted brazil bolivia paraguay three country share pantanal identified hybrid basis policy framework construction sense actually combine element various institutional response included proposed typology important factor seem undermine efficacy institutional response addressing region strong influence agribusiness sector still relatively low importance pantanal national environmental policy making essay make claim principle justice guiding policy intervention constitute appropriate strategy address inequality unfairness related
100,"Adapting the Congo Basin forests management to climate change: Linkages among biodiversity, forest loss, and human well-being",WOS:000347763100001,tropical forest center global debate sustainable forest management twin role mitigation resilient development however country congo basin forest receive little attention national planning policy currently considered decision long term forest management plan country demonstrates 1 congo basin forest needed help decrease human vulnerability 2 congo basin forest management practice need adapted accommodate forest vulnerable a framework facilitating forestry discussed adaptive action presented recommends adoption sustainable forest management approach includes focus such management avoid adverse effect forest resource conservation biodiversity also provides opportunity greater sustainable rural development poverty alleviation income generation employment opportunity
101,Greenhouse Gas Emissions Drive Global Dryland Expansion but Not Spatial Patterns of Change in Aridification,WOS:000888269400001,drylands play essential role earth environment human system although dryland expansion widely investigated previous study lack quantitative evidence supporting human induced change dryland extent here using multiple observational datasets model simulation phase 6 coupled model intercomparison project employ correlation based optimal fingerprinting approach conduct quantitative detection attribution dryland expansion our result show spatial change atmospheric aridity e aridity index defined ratio precipitation potential evapotranspiration recent period 1990 2014 past period 1950 74 unlikely caused greenhouse gas ghg emission however likely least 95 confidence level dryland expansion global scale driven principally ghg emission over period 1950 2014 global drylands expanded 3 67 according observation dryland expansion attributed ghg emission estimated similar 4 5 drylands projected continue expanding population increase global warming reach similar 3 5 degree
102,Detached islands: Artificial islands as adaptation challenges in the making,WOS:000495656700005,there surprisingly little information concern within academic literature field coastal marine planning management related issue artificial island particularly noteworthy considering phenomenon vi vi sea level rise urgent need effort aiming sustainable use coastal area recent focus academic circle marine spatial planning most literature including grey literature artificial island appears engineering geology discipline focused energy extraction e oil gas yet coastal nation intent solving problem lack space resource shortage construction near shore artificial island myriad us including commercial residential transportation infrastructure present limited policy literature planning construction artificial island it reflects repercussion artificial island portend marine conservation sustainability importantly highlighted neglected spatial solution addressed building nearshore artificial island israeli situation tender recently published calling planning building island mediterranean sea serf example
103,Associations between metabolic traits and growth rate in brown trout (Salmo trutta) depend on thermal regime,WOS:000695812400001,metabolism defines energetic cost life yet still know relatively little intraspecific variation metabolic rate arises persists spatio temporal variation selection potentially maintains difference relationship metabolic trait standard metabolic rate smr maximum metabolic rate mmr aerobic scope fitness across context unresolved show association smr mmr growth rate key fitness related trait vary depending thermal regime potential selective agent offspring wild sampled brown trout two population reared approximately 15 month either cool warm 1 8 degree
104,Measuring Adaptive Capacity of Farmers to Climate Change and Variability: Application of a Composite Index to an Agricultural Community in the Philippines,WOS:000346756800005,farming household philippine vulnerable variability due weather sensitive livelihood lack resource finance measure in order formulate appropriate program policy addressing vulnerability essential understand adaptive capacity analyzed adaptive capacity vulnerability 520 farming household dumangas town central philippine confronting weather induced risk objective determine level adaptive capacity farming household analyze factor cause difference adaptive capacity find whether adaptive capacity translates level adaptive capacity farming house hold determined using composite index based previous study index included five indicator namely human resource physical resource financial resource information diversity result showed variation adaptive capacity caused difference information resource physical financial resource farming household scored low three indicator lower adaptive capacity it also found despite level adaptive capacity household employed measure adapt variability household higher adaptive capacity however employed strategy
105,Multiobjective Optimization of Agricultural Planning Considering Climate Change Impacts: Minab Reservoir Upstream Watershed in Iran,WOS:000755318800004,affect water resource quality quantity water consumption crop yield change amount precipitation pattern temperature evapotranspiration erosion pollution wash watershed in simulation optimization model developed coupling soil water assessment tool swat nondominated sorting differential evolution nsde algorithm develop strategy mitigation multiobjective model applied maximize agricultural revenue minimize nutrient discharge minab reservoir calibrated verified model utilized estimate future 2021 2099 variable annual precipitation reservoir inflow decrease 14 46 respectively analysis indicated precipitation temporal pattern early fall late spring result optimization showed agricultural revenue increased 37 total nitrogen tn load decreased 70 compared current condition also applying optimum strategy could reduce total revenue tn load 57 41 respectively
106,Declining human activity intensity on alpine grasslands of the Tibetan Plateau,WOS:000685353600004,human activity profoundly changed structure functioning alpine grassland ecosystem tibetan plateau critical ecological safety shelter asia however remains unclear degree human activity intensity impacted alpine grassland tibetan plateau here quantify human activity intensity alpine grassland tibetan plateau based relationship actual potential net primary production found human activity intensity decreased 16 1 2000 2017 across alpine grassland might driven recent ecological conservation policy especially reduction livestock number critical threshold show marked grassland response different level human disturbance identified ecozone net primary production dry grassland western ecozones resistant human disturbance lower resilience alpine grassland plateau our finding beneficial design practical countermeasure adapt recover damaged grassland tibetan plateau
107,Analysis of the impacts of well yield and groundwater depth on irrigated agriculture,WOS:000351971700008,previous found irrigation water demand relatively insensitive water price suggesting increased pumping cost due declining groundwater level limited effect agricultural water management practice however non linear change well yield aquifer saturated thickness reduced may large impact irrigated production currently neglected projection long term sustainability groundwater fed irrigation conduct empirical analysis observation data numerical simulation case study nebraska usa compare impact change well yield groundwater depth agricultural production our finding suggest declining well pumping capacity reduce irrigated production area profit significantly whereas increased pumping cost reduce profit minimal impact intensity groundwater fed irrigation suggest therefore management dynamic relationship well yield saturated thickness core component policy designed enhance long term food security support
108,"The Holistic Effects of Climate Change on the Culture, Well-Being, and Health of the Saami, the Only Indigenous People in the European Union",WOS:000544901500002,purpose 1 to develop framework understanding holistic effect saami people 2 summarize scientific evidence primary secondary tertiary effect saami culture sapmi region 3 identify gap knowledge effect health well saami recent finding saami health average similar slightly better compared health population area warming already influenced saami reindeer culture mental health suicide risk partly linked changing physical social environment major concern summary lifestyle diet morbidity saami changing resemble majority population posing threat health saami making vulnerable adverse effect threat cultural way life saami possibility saami adapt limited
109,"Policy implications of climate variability on agriculture: Water management in the Po river basin, Italy",WOS:000342268500004,discus policy implication changing hydro climatic condition water management po river valley area characterized heterogeneous topographical feature intensive water use agriculture first fundamental level agriculture occurs level local farmer farmer undertake strategy adapt form able foresee observation recent trend indicator average temperature average precipitation however little respond greater uncertainty inherent role policy address residual uncertainty investing institution infrastructure notably variability implies water storage problem discus different role private public sector play managing water stock across space time prevent agricultural yield fluctuation causing welfare loss
110,Institutional adaptation of water resource infrastructures to climate change in Eastern Ontario,WOS:000240484900005,institutional barrier bridge local impact affecting small rural municipality conservation authority ca watershed agency eastern ontario examined element community based strategy related water infrastructure proposed case community no general water scarcity expected region even unusually dry weather scenario localized quantity quality problem likely occur especially groundwater recharge area some existing institution relied municipality build effective strategy based watershed region perspective credibility expertise window opportunity framing issue offered provincial level relevant one federal state municipal emergency plan requirement pending watershed source water protection legislation voluntary soon mandated mitigation program federal level one
111,"Pollen and sediment evidence for late-Holocene human impact at the Seonam-dong archeological site, Gwangju, Korea",WOS:000320089700008,present pollen sediment evidence late holocene human impact seonam dong archeological site gwangju southwest korea due lack undisturbed profile high sedimentation rate relationship environment agricultural activity properly investigated korea using paleoenvironmental approach show possible induced change chestnut production contemporaneously recognized chinese important unique local food source southwestern korea our result also show human may resulted degradation recovery local forest ecosystem area data seonam dong archeological site provided evidence supporting following hypothesis 1 chestnut cultivation declined 400 bc ad 200 2350 1750 cal bp herbaceous crop production may sufficiently expanded sustain population possibly due agricultural improvement climatic amelioration 2 chestnut cultivation enhanced ad 200 ad 800 1750 1150 cal bp probably compensate decreased herbaceous crop yield due climatic deterioration 3 increase chestnut cultivation led forest disturbance increased flooding intermittent forest recovery period decreased cultivation
112,People and nature in the Fuerteventura Biosphere Reserve (Canary Islands): socio-ecological relationships under climate change,WOS:000426664800003,analysis interdependence environment society term socio ecological web human biophysical system linked a quantitative model based canonical correlation analysis applied fuerteventura island canary archipelago detected indicator human landscape relationship predicted potential shift based simulated environmental change in last decade landscape fuerteventura island changed natural component cultural agrarian us decreased population increased due immigration mainly mainland spain european country island show transition coupled local socio ecosystem one based interaction environment coastal tourism decouples native inhabitant landscape traditional land use practice a vulnerability represent critical set potential interaction canary island model map socio ecological system four intergovernmental panel scenario show rural decoupling deagrarianization deruralization well stronger link tourism system
113,"Community perceptions of climate change and ecosystem-based adaptation in the mangrove ecosystem of the Rufiji Delta, Tanzania",WOS:000744709900001,mangrove increasingly recognized role supporting variability however knowledge variability affect mangrove ecosystem service me role supporting coastal community adaption limited tanzania used participatory rural appraisal method field observation explore local community perception variability ecosystem based eba strategy mangrove rufiji delta tanzania decrease rainfall increased temperature coastal flooding incidence sea level rise identified key variable associated changing delta perceived climatic stress included damaged fish breeding site altered regulation decrease coastal protection flood control decline crop fish honey production perceived main impact community livelihood although significant difference across occupational group dependence me time shock agriculture production fails switching occupation crop diversification fishing deep water migration area provided potential option although reported perception related variability explicit negative consequence mangrove dependent community livelihood
