,title,wos,clean_abstract
20,Open Standards for conservation as a tool for linking research and conservation agendas in complex socio-ecological systems,WOS:000600980900003,disparity knowledge produced knowledge required address complex environmental challenge biodiversity conservation continues grow system thinking open standard conservation framework help close gap facilitating interdisciplinary engagement advancing conversation environmental system work identifying action could implemented achieve defined conservation goal here present modelling exercise one endangered forested system world gran chaco focus unsustainable hunting pressing threat system highlight knowledge gap underpin part adaptive management process understanding key relationship social ecological system design implementation strategy gran chaco conservation well evaluation outcome
21,Indigenous Peoples and Multiscalar Environmental Governance: The Opening and Closure of Participatory Spaces,WOS:000786601400005,there unprecedented inclusion indigenous people environmental governance instrument like free prior informed consent reducing emission deforestation forest degradation redd project initiative environmental impact assessment draw theory participatory governance show locally implemented process shaped interaction invited closed indigenous led space multiple scale empirically based field latin america semistructured interview systematic literature find four main barrier produced environmental injustice environmental governance first lack influence institutional design governance instrument second exclusion indigenous people domestication global instrument third policy incoherency constraining scope decision making fourth weak cross scale linkage indigenous led space help elucidate constraint participatory space identify leeway transformation toward environmental justice
22,Co-evolving dynamics in the social-ecological system of community forestry-prospects for ecosystem-based adaptation in the Middle Hills of Nepal,WOS:000457941000015,analysis prospect ecosystem based examining diverse forest people interaction nepal community forestry social ecological system s examine linkage social ecological resilience societal middle hill nepal based discus prospect system in also discus prospect community forestry ecosystem based rural agrarian context focussing attribute resilience diversity modularity flexibility find community forestry provides multiple pathway reactive anticipatory often reinforcing community resilience our finding also show ecological process community forestry cf managed local institution explicit goal enhance overall resilience s underlying social political dynamic cf tend neglected policy planning prevents local organization harnessing benefit ecological resilience enhance adaptive capacity contribution ecological resilience societal constrained large scale social political driver especially bureaucratic structure underpinning governance forest nepal based finding recommend ecosystem based fully informed take account local power dynamic for instance aligning governance decision making need marginalized group increase resilience adaptive capacity social ecological system
23,Once there was a lake: vulnerability to environmental changes in northern Mali,WOS:000319774800003,vulnerability assessment increasingly recognised starting point identify need improve adaptive capacity however vulnerability assessment challenging complexity multifaceted biophysical human institutional factor interacting different scale level within socio ecological system using participatory approach across level gender explores vulnerability livestock forest based livelihood variability lake faguibine northern mali drastic ecological political social change occurred our result show distribution vulnerability within livelihood group shifted ecosystem evolved lake forest new vulnerability driver emerged related resource availability access power relation in addition political interest psychological barrier hinder local transition equitable sustainable use forest ecosystem service divergent perception social identity interest power explained different actor governmental non governmental men woman local sub national national differed vulnerability assessment exemplified way actor different level different gender analysed effect herder mobility way woman analysed men migration case confirms need participatory gender sensitive vulnerability assessment across different scale level consider interaction socio ecological system dynamic distribution vulnerability across different social sub system
24,"Management Foundations for Navigating Ecological Transformation by Resisting, Accepting, or Directing Social-Ecological Change",WOS:000743475000005,despite striking global management ensure healthy landscape sustained natural resource tended set objective basis historical range variability stationary ecosystem many social ecological system moving novel condition result ecological transformation present four foundation enable transition future oriented conservation management increase capacity manage foundation identify plausible social ecological trajectory apply upstream deliberate engagement decision making stakeholder formulate management pathway desired future consider portfolio approach manage risk account multiple preference across space time use kenai national wildlife refuge alaska case illustrate four foundation address common land management challenge navigating transformation deciding resist accept direct social ecological
