,title,wos,clean_abstract
22,Environmental integrity of forest offsets in a changing climate: embedding future climate in Australia's sinks policy regime,WOS:000917545500001,forest carbon sink important policy recent government business net zero commitment likely increase demand forest carbon offset at time forest part country suffered prolonged drought bushfires growing body suggests future could significant implication forest carbon sink permanence draw expert view explore incorporating knowledge physical risk strengthen environmental integrity forest sink policy it find challenge opportunity strengthening science policy practice interface forest carbon changing proposes reform strengthen capacity forest long term contributor emission target policy these reform may relevance country vulnerable forest interest forest carbon offset
23,Forest management for mitigation and adaptation to climate change: Insights from long-term silviculture experiments,WOS:000292672800010,developing management strategy addressing global become increasingly important issue influencing forest management around globe currently management approach proposed intend 1 mitigate enhancing forest carbon store 2 foster maintaining compositionally structurally complex forest however little known compatibility two objective long term efficacy given management regime simultaneously achieving mitigation to address need examined stand level carbon complexity response using five long term 50 yr silviculture experiment within upper great lake region usa in particular live tree carbon store sequestration rate compositional structural complexity analyzed three thinning experiment pinus resinosa two selection method experiment northern hardwood system elucidate long term effect management ecosystem attribute general compatibility mitigation objective a expected observed general increase large tree density stand age positive relationship stand stocking level live tree carbon store more importantly result clearly identify tradeoff achievement mitigation objective across for example maintaining higher stocking level e enhanced mitigation increasing carbon store resulted decrease stand level structural compositional complexity e reduced potential in addition rate live tree carbon increment also lowest within highest stocking level despite benefit stand condition maximizing carbon store collectively finding underscore importance avoiding rigid adherence single objective maximum site carbon store without recognizing potential consequence ecosystem component crucial ensuring long term ecosystem functioning within context environmental one potential stand level strategy balancing goal may employ multi aged management system irregular shelterwood selection system maintain large proportion carbon store retained mature tree using thinning create spatial heterogeneity promotes higher sequestration rate smaller younger tree simultaneously enhances structural compositional complexity
24,Increased drought reduces acorn production in Quercus ilex coppices: thinning mitigates this effect but only in the short term,WOS:000287252200008,in order explore effect mediterranean regenerating forest experimentally assessed effect increased drought reproductive attribute quercus ilex 4 year period 2005 2008 also investigated whether traditional thinning selection one stem per stump could mitigate consequence increased drought oak coppice increased drought reduced number reproductive tree mean number female flower produced acorn crop size although effect appeared last 2 year experiment in different way thinning enhanced reproductive attribute main effect transient covered 1 2 year application treatment our result indicate moderate reduction rainfall 15 per cent reduces reproductive ability q ilex may long term negative consequence recruitment well fauna feeding acorn although traditional thinning may mitigate consequence increased drought remarkably short term effect highlight need examine traditional forestry practice potential adaptive strategy coping mediterranean regenerating forest
25,Global carbon dioxide removal rates from forest landscape restoration activities,WOS:000450812500001,background forest landscape restoration flr adopted government practitioner across globe mitigate adapt restore ecological function across degraded landscape however extent activity capture co2 associated mitigation impact poorly known especially geography data biomass growth restored forest limited exist to fill gap developed biomass accumulation rate set flr activity natural regeneration planted forest woodlots agroforestry mangrove restoration across globe global co2 removal rate corresponding confidence interval grouped flr activity region result planted forest woodlots found highest co2 removal rate ranging 4 5 40 7 co2 h 1 year 1 first 20 year growth mangrove tree restoration second efficient flr removing co2 growth rate 23 1 co2 ha 1 year 1 first 20 year post restoration natural regeneration removal rate 9 1 18 8 co2 ha 1 year 1 first 20 year forest regeneration followed agroforestry flr category lowest regionally broad removal rate 10 8 15 6 co2 ha 1 year 1 biomass growth data abundant widely distributed across world planted forest natural regeneration representing 45 32 data point assessed respectively agroforestry study found africa asia latin america caribbean region conclusion represents comprehensive published literature tree growth co2 removal date operationalized constructing removal rate specific flr activity across globe these rate easily applied practitioner decision maker seeking better understand positive mitigation impact existing planned flr action country making restoration pledge bonn challenge commitment fulfil ling nationally determined contribution unfccc thereby helping boost flr effort world wide
26,Spatial-temporal variations of carbon storage of the global forest ecosystem under future climate change,WOS:000555490500006,forest play important role sequestrating atmospheric carbon dioxide co2 therefore order understand spatial temporal variation controlling mechanism global forest carbon
27,Aboveground biomass in secondary montane forests in Peru: Slow carbon recovery in agroforestry legacies,WOS:000684802500009,andean tropical montane forest tmf hotspot biodiversity provide fundamental hydrological service well carbon sequestration storage agroforestry system occupy large area andes climatic pressure market volatility disease may result inagroforest abandonment promoting secondary succession secondary forest well adapted efficient carbon sink whose conservation vital mitigate adapt support biodiversity little known however secondary tmf recover aboveground biomass agb composition abandonment established 1 5 ha plot 1780 masl 30 year old abandoned agroforest compared two control forest plot similar elevation agroforestry legacy influenced agb leading far lower stock 42 3 5 4 59 6 7 9 mg ha 1 using allometric equation expected 30 year 106 33 mg ha 1 based ipcc standard growth rate secondary montane forest suggests regional overestimation mitigation potential using ipcc standard satellite derived agb largely overestimated plot value 179 27 3 mg ha 1 secondary growth rate 1 41 2 0 mg ha 1 yr 1 dbh 10 cm indicate recovery time ca 69 97 year reach average control agb value 137 12 3 mg ha 1 26 year average residence time montane forest elevation 71 1 91 year suggesting non recovery far slower recovery control agb value three variable appear define outcome compared control plot lower dbh 15 8 5 9 cm v 19 8 11 0 cm lower basal area 12 67 0 7 v 28 03 1 5 2 ha 1 higher abundance lighter wood tree genus 0 46 0 10 v 0 57 0 11 gr cm 3 inga common shade tree andean agroforests with 3 2 million hectare committed restoration peru need target currently neglected tmf recovery scheme support biodiversity water carbon storage fulfill international commitment
28,"Post-fire landscape evaluations in Eastern Washington, USA: Assessing the work of contemporary wildfires",WOS:000721496700002,in western u wildfire modifying structure composition pattern forested landscape rate far exceed mechanical thinning prescribed fire treatment there conflicting narrative whether wildfire restoring landscape resilience future wildfire to evaluate landscape level work wildfire assessed four subwatersheds eastern washington usa experienced large wildfire 2014 2015 2017 century fire exclusion extensive timber harvest compared preand post fire landscape condition ecoregion specific historical hrv future range variation frv based empirically established reference condition derived large dataset historical aerial photo imagery these four wildfire proved blunt restoration tool moving attribute towards adapted condition setting others back fire reduced canopy cover decreased overall tree size canopy complexity moved slightly outside frv range moderate low severity fire generally shifted closed canopy forest structure open canopy class patch high severity fire shifted pattern forest woodland grassland shrubland towards beyond hrv range within frv range increasing total area size non forest patch however large patch high severity fire dry moist mixed conifer forest homogenized landscape pattern beyond frv range towards simplified condition dominated non forest vegetation type fire realigned reconnected landscape pattern topo edaphic template case pre existing fragmentation spatial mismatch compounded many others patch large tree closed canopy forest reduced high severity fire potential restore adapted large tree open canopy forest lost re establishing landscape pattern desired patch size forest particular patch large tree take many decade century may occur drier location seed tree longer present while large wildfire burning extreme fire weather condition move attribute towards hrv frv range intentionally planned mechanical prescribed fire treatment integrated strategic wildfire response better prepare adapt landscape future wildfire
29,Predicting Vegetation Carbon Density Distribution in different Terrains in Subtropical Forests in China,WOS:000573701000001,through large scale afforestation reforestation china increased forest area improved forest quality making considerable contribution carbon stock world forest a one important indicator forest quality carbon potential vegetation carbon density vcd affected different factor different scale little known effect topographic factor vcd subtropical forest southeast china especially large regional scale based national forest continuous inventory protocol 2000 permanent sample 2061 sample 2009 2115 sample 2014 2132 sample 2016 major forest type bamboo forest bb broad leaved forest bf mixed forest mf coniferous forest cf grouped topographic factor compare distribution vcd zhejiang province china four topographic factor altitude slope gradient aspect slope position explained 16 2 similar 28 4 variance different forest type random forest model importance order four terrain variable basically corresponding significance radar chart vcd forest type varies significantly different altitude p 05 except bb sample 2009 in general vcd tends higher high altitude vcd bb bf varies significantly slope gradient p 05 largest steep slope smallest gentle slope however vcd cf mf showed almost difference different slope gradient found significant difference vcd eight aspect mixed forest p 05 largest s sw aspect three forest type a different slope position vcd ridge relatively large vcd upslope generally larger downslope pronounced bb bf p 05 made detailed analysis greening distribution different topographic factor conclusion could provide scientific basis selection afforestation location forest scientific management contribute improvement capability coping subtropical forest
30,Vulnerability of mires under climate change: implications for nature conservation and climate change adaptation,WOS:000300248500004,wetland general mire particular belong important terrestrial carbon stock globally mire e bog transition bog fen assumed especially vulnerable depend specific namely cool humid climatic condition in use distribution data nine mire type found austria habitat distribution model four ipcc scenario evaluate induced risk mire ecosystem within 21st century found climatic factor substantially contribute explain current distribution nine austrian mire ecosystem type summer temperature proved important predictor majority mire ecosystem precipitation mostly spring summer precipitation sum influential mire ecosystem type depend partly entirely ground water supply e g fen found severe induced risk mire ecosystem rain fed bog ecosystem threatened difference scenario moderate mid 21st century become pronounced towards end 21st century near total loss space projected ecosystem type bog quagmire severe our result imply even minimum expected e inevitable climatic risk mire austria considerable nevertheless pronounced difference projected habitat loss moderate severe scenario indicate limiting future warming likely contribute enhance long term survival mire ecosystem reduce future greenhouse gas emission decomposing peat effectively stopping reversing deterioration mire ecosystem caused conventional threat regarded contribution mitigation because hydrologically intact mire resilient climatic change would also maintain nature conservation value mire help reduce severe climatic risk austrian mire ecosystem may exposed 2nd half 21st century according ipcc scenario
31,Forest policies and programs affecting vulnerability and adaptation to climate change,WOS:000286675500005,due large scale afforestation program forest conservation legislation india total forest area seems stabilized even increased in spite effort forest fragmentation degradation continues forest subject increased pressure due anthropogenic factor such fragmentation degradation leading forest cover dense moderately dense open forest 253 km 2 dense forest converted moderately dense forest open forest scrub non forest 2005 2007 similarly degradation 4 120 km 2 moderately dense forest open forest scrub non forest resulting net loss 936 km 2 moderately dense forest additionally 4 335 km 2 open forest degraded scrub non forest coupled pressure due anthropogenic factor likely added stress forest forest sector program policy major factor determine status forest potentially resilience projected impact an attempt made forest policy program implication status forest vulnerability forest projected concludes forest conservation development policy program need oriented incorporate impact vulnerability
32,Managing climate change adaptation in forests: a case study from the US Southwest,WOS:000327027200004,forest mortality related increasingly common global phenomenon provide case u s southwest investigate interaction among forest restoration treatment alter stand density tree growth drought resistance tree different size class using core taken five position large tree coarse root breast height base live crown midcrown branch treetop breast height small tree investigated radial growth response thinning precipitation availability varied 72 ponderosa pine pinus ponderosa dougl northern arizona ten year thinning growth small tree respond significantly thinning whereas growth large tree increased following moderate heaving thinning response similar across within tree core sample position intensity thinning treatment significantly affect dry year growth small tree in large tree dry year growth thinning maintained pre thinning level moderate heavy thinning treatment decreased light thinning control treatment synthesis application our finding indicate aggressive thinning treatment used forest restoration stimulate growth throughout large residual tree coarse root branch also improve drought resistance providing greater resilience future related stress these response treatment pronounced large tree small tree forest thinning therefore recommended system likely experience increased temperature decreased precipitation result
33,"Fostering real-time climate adaptation: Analyzing past, current, and forecast temperature to understand the dynamic risk to Hawaiian honeycreepers from avian malaria",WOS:000568729900014,various vector control option increasingly considered safeguard forest bird natural habitat avian malaria transmission however vector control option require localized deployment logistically ethically ecologically economically viable everywhere time based thermal tolerance sporogonic stage avian malaria plasmodium relictum parasite vector southern house mosquito culex quinquefasciatus examined long term weather trend three high value forest bird refuge alakai wilderness preserve kaua hanawi natural area reserve maui hakalau forest national wildlife refuge hawai island understand temporal site specific difference temperature driven suitability localized avian malaria transmission on average alakai mean ambient temperature suitable vector immature stage development parasite sporogonic development time 85 3 indicating observed variability vector abundance disease transmission may driven factor at higher elevation site like hakalau hanawi current mean ambient temperature suitable vector development prevail 91 7 96 6 respectively mean ambient temperature vector parasite sporogonic development seldom occur 4 4 0 respectively our result show difference temperature suitability transmission across elevation also different level vulnerability avian malaria transmission additional projected increase temperature for instance conservative warming scenario 1 0 degree
34,Forest regeneration management and policy in the Nordic-Baltic region since 1900,WOS:000714788300001,since beginning twentieth century forest regeneration management policy nordic baltic region denmark sweden norway finland estonia latvia lithuania gone significant change for decade forest key natural resource managed main focus timber production however several factor influenced shifting forest management including forest regeneration meet wide range society need aim reveal historical development forest regeneration identifying knowledge gap supporting decision promote sustainable regeneration future forest development forest regeneration management policy nordic baltic country analyzed reforestation afforestation practice well legislation aspect using narrative approach trend forest regeneration practice within region identified explored timeframe spanning 1900 today despite diverse forestry management structure differing political social situation show forest regeneration development followed similar pattern time nordic baltic region country extensive forestry clear cut forestry retention forestry currently evolving adaptive forestry nevertheless regional difference among nordic baltic country especially forest regeneration related legislation identified due mixture international local driving force
35,Beyond the black box: Forest sector vulnerability assessments and adaptation to climate change in North America,WOS:000329476700012,in wake failure date well publicized multilateral multi sectoral mitigation effort control greenhouse gas attention increasingly focused effectiveness capacity national sub national level sectoral plan including forestry usher new era effort in government british columbia spent several year developing future forest ecosystem initiative part larger response strategy forest sector similarly united state wildfire related event led inspired effort individual state e g alaska california u forest service recently undertaken plan incorporate consideration national forest planning beginning national road map responding highlight number shortcoming national sub national strategy respect relationship existing governance forestry it proposes incorporating consideration governance mechanism directly forest sector planning need ass natural system level change also extent new problem dealt old new governance arrangement
36,Illegal use of natural resources in federal protected areas of the Brazilian Amazon,WOS:000412980400001,background brazilian amazon world largest rainforest region play key role biodiversity conservation well mitigation government created network protected area pa ensure long term conservation region however despite importance positive advance establishment pa natural resource depletion brazilian amazon pervasive method evaluated total 4 243 official law enforcement record generated 2010 2015 understand geographical distribution illegal use resource federal pa brazilian amazon classified illegal activity ten category used generalized additive model gam evaluate relationship illegal use natural resource inside pa management type age pa population density accessibility result found 27 type illegal use natural resource grouped 10 category illegal activity most infraction related suppression degradation vegetation 37 40 followed illegal fishing 27 30 hunting activity 18 20 explanatory power gam low category illegal activity maximum explained variation 41 2 illegal activity whole minimum 14 6 hunting activity discussion these finding demonstrate even though pa fundamental nature conservation brazilian amazon pressure threat posed human activity include broad range illegal us natural resource population density 50 km pa key variable influencing illegal activity these threat endanger long term conservation many effort still needed maintain pa large enough sufficiently intact maintain ecosystem function protect biodiversity
37,Adapting western North American forests to climate change and wildfires: 10 common questions,WOS:000706883300001,science based strategy western north american wna forest include restoring active fire regime fostering resilient structure composition forested landscape a part address common question associated realignment treatment run counter broad consensus literature these include following 1 are effect fire exclusion overstated if treatment unwarranted even counterproductive 2 is forest thinning alone sufficient mitigate wildfire hazard 3 can forest thinning prescribed burning solve problem 4 should active forest management including forest thinning concentrated wildland urban interface wui 5 can wildfire work fuel treatment 6 is primary objective fuel reduction treatment assist future firefighting response containment 7 do fuel treatment work extreme fire weather 8 is scale problem great can ever catch 9 will planting tree mitigate wna forest and 10 post fire management needed even ecologically justified based scientific evidence range proactive management action justified necessary keep pace changing climatic wildfire regime declining forest heterogeneity severe wildfire science based option include use managed wildfire prescribed burning coupled mechanical thinning prescribed burning consistent land management allocation forest condition although current model fire management wna averse short term risk uncertainty long term environmental social cultural consequence wildfire management primarily grounded fire suppression well documented highlighting urgency invest intentional forest management restoration active fire regime
38,A new climatic classification of afforestation in Three-North regions of China with multi-source remote sensing data,WOS:000392066200033,afforestation reforestation activity achieve high attention policy agenda measure carbon sequestration order mitigate three north shelter forest program largest ecological afforestation program worldwide launched 1978 last 2050 three north region accounting 42 4 china territory shelter forest three north shelter forest program exhibited severe decline planting 1978 due lack detailed climatic classification besides comprehensive assessment current shelter forest lacking in aridity index determined precipitation reference evapotranspiration employed classify climatic zone afforestation program precipitation reference evapotranspiration 1 km resolution estimated based data tropical rainfall measuring mission moderate resolution imaging spectroradiometer respectively then detailed climatic classification afforestation program obtained based relationship different vegetation type aridity index shelter forest 2008 derived landsat tm three north region in addition climatic zone shelter forest corrected comparing natural vegetation map field survey by overlaying shelter forest climatic zone found 16 30 coniferous forest 8 21 broadleaved forest 2 03 mixed conifer broadleaved forest 10 86 shrub strict accordance condition these result open new perspective potential use remote sensing technique afforestation management
