,title,wos,clean_abstract
52,Sustainable construction practice and contractors' competitiveness: A preliminary study,WOS:000287428600007,with increasing requirement resource efficiency construction industry need contractor implement sustainable practice such action also source competitive advantage future however study investigating contribution sustainable construction practice contractor competitiveness sustainable practice construction industry relationship sustainability performance business competitiveness a framework implementing sustainable construction practice improve contractor competitiveness introduced help contractor develop sustainable strategy meeting changing competition environment
53,Coordinating Plans for Climate Adaptation,WOS:000797019100009,planning emphasizes need coordination across sector scale to ass coordinated multiple planning effort community i analyze plan city chester pennsylvania usa multiple environmental plan strategy align effort policy plan mapped clear conflict redevelopment priority emerges land use plan promote redevelopment hazardous location increasing vulnerability these conflict raise question ability mainstreaming win win strategy produce transformation
54,Transdisciplinary Research: Can Citizen Science Support Effective Decision-Making for Coastal Infrastructure Management?,WOS:000810522700001,stakeholder engagement increasingly recognised imperative developing effective policy within eu particularly delivering sustainable coastal infrastructure perspective discus current transdisciplinary tdr approach concerning ecoengineering solution artificial coastal structure insufficient ensuring adequate stakeholder engagement facilitate coherent enduring decision making policy development process socio cultural analysis focussing people view feel artificial coastal infrastructure within coastal infrastructure recognised large knowledge gap suggest citizen science c methodology part cultural ecosystem service ce approach adequately inform support implementation ecoengineering solution hard artificial coastal structure whilst addressing existing barrier associated stakeholder engagement current tdr approach
55,"Cities and Climate Change Challenges: Institutions, Policy Style and Adaptation Capacity in Bogota",WOS:000326033000003,while growing awareness marked institutional agenda national level colombia capital city bogota undertaken action include within policy far conceptualizing central role city level institution successful realization policy straightforward matter case action condition may foster capacity according varying institutional social geography using secondary data selection interview key stakeholder occupying leading planning role important department local administration explores framework based incentive obstacle complemented recent development analysis policy implementation based differentiation political programmatic success failure basis existing local policy style
56,Understanding adaptation: What can social capital offer assessments of adaptive capacity?,WOS:000233623200004,burgeoning interest social capital within community represents welcome move towards concern behavioural element adaptive action capacity in case put forward critical engagement social capital there need open debate conceptual analytical trap opportunity social capital present contrast three school thought social capital us social capital lens map current future area it identifies opportunity using social capital adaptive capacity action within community place community practice
57,"Industrial ecology, climate adaptation, and financial risk",WOS:000526142200004,become important topic risk management company investigates usefulness industrial ecology tool concept context conclusion established tool concept designed purpose assisting manager related financial risk context nevertheless tool concept offer plenty aspect feature helpful assessment management risk tool primarily provide guidance managerial decision making process notably term data handling concept used starting point developing new risk management framework
58,Emerging responses to global climate change: ecosystem-based adaptation,WOS:000454070300002,ecosystem based eba recently emerged important way address impact eba suggests harnessing ecosystem service help community adapt thereby limiting threat social system human security what argument eba who favour eba what eba mean practice what limit eba global average temperature rise reviewing document non governmental organisation government intergovernmental organisation scholar help answer related question a result increasing challenge society important form including eba become yet useful appropriate certain context eba might sufficient disruption becomes severe would require consideration transformational global institution practice
59,Analyzing community resilience as an emergent property of dynamic social-ecological systems,WOS:000432464800006,community resilience widely promoted community respond positively range risk including shock extreme event change although much identified characteristic capacity confer resilience resilience simply sum resilience emergent property capacity linked act together present empirical analysis five different capacity ass interaction confer resilience two coastal community cornwall uk these capacity place attachment leadership community cohesion efficacy community network knowledge learning based survey focus group discussion result show resident draw capacity different combination enabling resilience diverse way provides dynamic socially nuanced perspective community resilience process potentially informing theory practice conservation disaster risk reduction community development
60,A reflection on collaborative adaptation research in Africa and Asia,WOS:000402137900026,reality global demand novel approach science reflective scale change likely occur new form knowledge required positively influence policy support vulnerable population examine opportunity challenge presented collaborative transdisciplinary project africa asia utilized hotspot approach a large scale effort develop appropriate baseline key challenge outset program need develop innovative methodology enable researcher work appropriate spatial scale effort match biophysical scale occurs need aware mismatch develop regional scale governance scale decision made
61,A DESIGN FOR A SUSTAINED ASSESSMENT OF CLIMATE FORCING AND FEEDBACKS RELATED TO LAND USE AND LAND COVER CHANGE,WOS:000346335400005,land use land cover lulcc significantly influence system hence prepare nation future variability sustained assessment lulcc climatic impact need undertaken to address objective need determine contemporary trend land use land cover affect affected weather also identify sector region affected weather variability moreover critical recognize land cover region vulnerable end use practice adapting identifies series step need undertaken address key item in addition national scale institutional capability identified discussed included discussion challenge opportunity collaboration among institution sustained assessment
62,Policy-adaptation for a smarter and more sustainable EU electricity distribution industry: a foresight analysis,WOS:000449886800014,european union eu transition smarter sustainable electricity sector driven technological development for electricity distribution industry contributed growing need understand network monopoly adapt role activity responsibility redesigned electricity market given growth distributed generation increased control monitoring capability considering foresight business model innovation technological market design policy alternative presented a policy delphi method applied involving two iterative survey round 207 european expert assessed 57 policy alternative result highlight challenge implementing new technology business practice expert support innovation transition new role innovative service warranting core electricity distribution activity secured shift role expected achieved development r d support policy innovation friendly regulatory framework concerted action eu member state level result provide policy guideline electricity distribution industry stakeholder
63,"Aerosols, Clusters, Greenhouse Gases, Trace Gases and Boundary-Layer Dynamics: on Feedbacks and Interactions",WOS:000920521000002,turbulence key process transporting material energy atmosphere furthermore turbulence cause concentration fluctuation influencing different atmospheric process deposition chemical reaction formation low volatile vapour formation new aerosol particle growth atmosphere effect aerosol particle boundary layer meteorology in order analyse connection interaction feedback relating different process require deep understanding atmospheric turbulence mechanism atmospheric chemistry aerosol dynamic all process influence air pollution better understand process interaction associated feedback effectively mitigate air pollution well mitigate forcers adapt present several aspect importance turbulence including turbulence crucial atmospheric phenomenon feedback different environment furthermore discus boundary layer dynamic link aerosol air pollution here present also roadmap deep understanding practical solution
64,Climate adaptation planning in practice: an evaluation of adaptation plans from three developed nations,WOS:000288256300002,formal planning emerging rapidly range geo political scale first generation plan provides useful information regarding institution framing issue range process recognized part response to better understand planning among developed nation set 57 plan united kingdom united state evaluated suite 19 planning process identified existing guidance instrument planning total score among evaluated plan ranged 16 maximum possible score 61 average 37 these result suggest plan largely developed critical weakness planning related limited consideration non climatic factor well neglect issue adaptive capacity including entitlement various form capital needed effective such gap planning suggest opportunity institution make better use existing guidance planning need consider broader governance context occur in addition option prescribed plan reflect preferential bias toward low risk capacity building 72 identified option delivery specific action reduce vulnerability to extent finding representative state developed nation planning appear significant deficiency preparedness even among nation often assumed greatest adaptive capacity
65,Promoting Renewable Energy to Cope with Climate Change-Policy Discourse in Israel,WOS:000645828000001,evidence show global increasing time requires adoption variety coping method a alternative conventional electricity system renewable energy considered important policy tool reducing greenhouse gas emission therefore play important role mitigation strategy renewable energy however may also play crucial role strategy reduce vulnerability energy system extreme event examines whether policy maker israel tend focus mitigation strategy strategy renewable energy policy discourse result indicate despite israel minor impact global greenhouse gas emission policy maker focus promoting renewable energy mitigation strategy rather strategy these finding shed light important role international influence tends emphasize mitigation motivating domestic policy discourse renewable energy coping method
66,Mainstreaming the nexus approach in climate services will enable coherent local and regional climate policies,WOS:000704501200014,current challenge society face call action fostering long term sustainability grounded effective policy consequently raise environmental resilience sustain human wellbeing need overhaul policy making process towards holistic approach nexus approach proven valuable tool identifying gap incoherency current policy understanding major interlinkages across sector scale promoting sustainable development goal sdgs nevertheless silo approach decision making currently prevails thus achieving cross sectoral cross scale harmonization still remains challenge policy making in response challenge next step science policy practice interface integrate nexus approach service arena order support integrated policy service embody bridge researcher stakeholder supporting integrated policy ensure synergy sector scale reduce potential trade offs enable co benefit
67,"3 KEY NOTIONS FOR ROAD TRANSPORT SUSTAINABILITY: RESILIENCE, CLIMATE ACTION AND ENERGY TRANSITION",WOS:000843699500001,in relationship resilience sustainable development order determine place road resilience sustainable development goal sdgs action energy transition show road resilience inseparable mitigation energy transition therefore address issue adapting road infrastructure decarbonization transport it also emphasizes resilience road infrastructure necessary condition strategy reminds u contribution road transport mitigation overlap practice decarbonization goal resulting energy transition
68,The use of indicators for monitoring and evaluation of adaptation: lessons from development cooperation agencies,WOS:000324365900006,in context scaled funding important ever guarantee value money intervention robust monitoring evaluation m e ensures prospective benefit intervention realized help improve design future project programme first empirical assessment m e framework used development cooperation agency project programme specific related component it analysis document 106 project across 6 bilateral development agency analysis find result based management logical framework approach accompanying logframe common m e approach used in applying approach long term perspective initiative mean particularly important clearly differentiate outcome output activity in addition m e framework combine qualitative quantitative binary indicator baseline indicator specified improve understanding progress significant challenge remain relation dealing shifting baseline attribution time lag intervention outcome
69,"Governance for Sustainability of Estuarine AreasAssessing Alternative Models Using the Case of Ria de Aveiro, Portugal",WOS:000473105700216,estuary one productive complex type ecosystem supporting wide range economic activity departing set governance problem emergent goal sustainability faced estuarine case area ria de aveiro portugal ass adequacy alternative governance model existing water resource legal framework traditional political culture it show apart centrally based compliance model alternative require high degree institutional reform moreover although model based dedicated new agency long preferred many user ria de aveiro understandable focused assure pursuance adaptability collaboration considered essential estuary governance a relies collective action multi level multi agent context estuarine governance may require new institutional design where one begin process institutional however simple issue address demand deeper analysis particularly type required institutional change well impact policy decision making outcome estuarine environment associated socio ecological network
70,Migration as a contribution to resilience and innovation in climate adaptation: Social networks and co-development in Northwest Africa,WOS:000298778000014,human migration described one conflict constellation region affected also contribute migrant social network help build social capital increase social resilience community origin trigger innovation across region transfer knowledge technology remittance resource these could increase flexibility diversity creativity community addressing stress open new pathway co development connecting home host community based conceptual framework connecting migration explores possible opportunity innovative approach institutional mechanism migration contribution western sahel used case region focus mali mauritania senegal using qualitative quantitative analysis remittance national level micro level analysis role migrant network country specific co development project water food energy
71,Mind the gap! Lessons from science-based stakeholder dialogue in climate-adapted management of wetlands,WOS:000390503400010,effective stakeholder involvement crucial management protected area especially new challenge like need addressed under circumstance science based stakeholder involvement required however often gap information produced science need information stakeholder along design implementation adaptive management strategy policy effort must taken adjust message conservation issue make easier understand relevant acceptable stakeholder in experience closing gap scientific information user need stakeholder biebrza valley documented requirement efficient stakeholder dialogue raising awareness indicated conclude many attempt raise awareness environmental conservation require improvement message often need adjusted different stakeholder various perception level efficiently anticipate potential impact changing ecosystem management also revealed autonomous measure implemented stakeholder mitigate impact climatic often contradict adaptive management planned implemented environmental authority conclude demand boundary spanner build bridge complex scientific output stakeholder need
72,An empirical study on the relationship between sustainability performance and business competitiveness of international construction contractors,WOS:000353095100029,with expectation resource efficiency construction industry increasing need contractor implement sustainable practice such action burden contractor additional cost lower economic performance there study sustainability relates firm competitiveness represents empirical relationship sustainability performance business competitiveness international construction contractor an inverse u shape relationship contractor sustainability performance international revenue u shape relationship contractor sustainability performance international revenue growth discovered finding help international contractor better understanding relationship sustainability performance business competitiveness evaluate current position relationship optimize resource allocation sustainable development integrate sustainability strategic planning therefore contractor high sustainability performance expect higher international revenue growth sustainability performance likely become opportunity competitive advantage international construction market
73,Can adaptation and mitigation be complements?,WOS:000323276900005,it often claimed mitigation greenhouse gas complementary strategy if mean usually optimal use mitigation deal perceived increase damage caused require increase mitigation simple economic analysis would support interpretation however complementarity technical meaning economics implies cost mitigation fell optimal response would increase level mitigation develop range economic model explore relationship mitigation show general mitigation substitute also find possible complementarity occur special case cost depend amount mitigation
74,Stakeholder engagement with environmental decision support systems: The perspective of end users,WOS:000477450000001,environmental decision support system eds designed assist natural resource manager stakeholder ass problem select option eds combine community engagement developing future scenario computer based land use planning modelling tool widely used internationally however eds often used development phase to best understand eds used long term end user eds consulted perspective lacking literature reported present perspective stakeholder involved community project western evidence community suggests project successful instigating however eds used project end our finding indicate end user perspective project could much greater sustained success ongoing engagement communication particularly form continued support use eds development project
75,Engendering disaster risk management and resilience-building: The significance of the everyday in evaluations of the exceptional,WOS:000599649000008,argues greater consideration everyday within evaluation exceptional present practical mean engendering disaster risk reduction management drrm resilience building building scholarship feminist geography gender development feminist political ecology chart new way theorising disaster risk resilience gendered perspective analytic everyday substantiates finding ethnographic conducted 2016 2017 disaster prone informal settlement philippine a case reveals focus everyday help uncover multiple subjective embodiment risk insecurity structural system underpin related inequality exclusion crucially lens everyday also expose social reproductive labour power hierarchy embedded community based drrm resilience building programme insight vital advancing inclusive sustainable socially approach disaster risk governance
76,A systemic approach for climate risk assessment applied to thermoelectric power plants in northeastern coast of Brazil,WOS:000792767400005,imposes risk asset system operation enterprise electricity sector whose management risk becoming increasingly important pro pose methodological structu r e support identification analysis assessment climatic risk thermoelectric power plant integrating concept ipcc ar5 methodological structure iso 31000 risk management principle change proposed iso 14090 five plant coastal zone northeast region brazi l studied indication strategic climatic non climatic stressor criterion significance determining hazard exposure vulnerability risk aspect design operation main tenance performance investigated based assumption sensitive plant component it stressed need combining observed data numerical model data correct assessing future projection however risk must reassessed reg ular basi decadal interval order abso r b ongoing change n make de cisions favor resilient option
77,An approach to assess the world's potential for disaster risk reduction through nature-based solutions,WOS:000860763400001,nature based solution nb increasingly advocated mean achieving greener sustainable future although discussion definition scale applicability nb country city level agenda ongoing nb received le attention term supporting country level approach disaster risk reduction drr us series indicator reflecting national capability national necessity nb mean support drr activity using principal component analysis cluster analysis result show total 178 country two group emerge country one group showing high level national capability necessity nb such country also found around 23 likely currently implementing disaster risk reduction action country lower capability necessity score showing nb actively supporting drr activity around world such country mixture global south north country showing statistical significant difference respect socio economic characteristic indicating nb equitable mean achieving potential synergy drr reducing nb grey infrastructure project measure
78,Climate-Adaptive Facades with an Air Chamber,WOS:000775948500001,development energy efficient technology stage building life cycle essential achieving sustainable development goal object adaptive facade structure air gap form trombe wall double skin facade case using phase material pcm photovoltaic module pv adaptive structure analyzed separately method aimed analyze energy saving potential integrating trombe wall double skin facade building work systematizes full scale physical mathematical experiment article scopus web science system 2001 2022 inclusive subject consideration present statistical analysis given scientific community current topic dynamic significance characterized lack knowledge behavior mentioned facade system various zone different building type result shown comprehensive study investigated system significant serve design energy efficiency improvement for first time scientometric analysis article topic adaptive facade compiled
79,A framework for assessing the vulnerability of communities in the Canadian arctic to risks associated with climate change,WOS:000225795300007,recognized important policy issue international body united nation various national government initiative identify need improve adaptive capacity increasingly start assessment vulnerability system interest term vulnerable stress way capacity exists adapt changing risk notwithstanding scholarship study nature arctic community vulnerability risk existing literature implication arctic community develop conceptual model vulnerability present analytical approach assessing hazard coping strategy arctic community vulnerability conceptualized function exposure climatic stress adaptive capacity cope stress analytical framework employ place specific case study involving community resident integrates information multiple source document current exposure adaptation characterize future exposure adaptive capacity
