,title,wos,clean_abstract
212,"Enhanced release, export, and transport of diffuse nutrients from litter in forested watersheds with climate warming",WOS:000806053900008,variation litter decomposition nutrient migration constraint accurately estimate watershed diffuse forest pollution combined effect topographic heterogeneity in remote sensing data decomposition leaching experiment soil water assessment tool swat used quantify release export transport characteristic diffuse nutrient forest litter two scenario current condition s1 future warming drying condition s2 impact aquatic environment identified annual litter decomposition 27 80 x 10 6 s2 1 39 time s1 additionally annual litter nutrient release s2
213,"Effects of enclosure management on carbon sequestration, soil properties and vegetation attributes in East African rangelands",WOS:000412254700002,use enclosure globally gained popularity effective strategy enhance soil carbon sequestration empirical evidence lacking particularly arid semi arid rangeland africa addressed effectiveness long term 15 37 year old enclosure enhancing soil carbon sequestration semi arid rangeland southern ethiopia tested difference soil property vegetation characteristic enclosure adjacent open grazed area accounting effect age enclosure soil depth three enclosure age category 20 20 30 30 year paired adjacent open grazed area selected collected soil sample three soil depth 0 5 cm 5 15 cm 15 30 cm vegetation attribute 90 plot within 9 enclosure adjacent open grazing site result showed soil property differ significantly p 0 05 two management system across three soil depth however relatively higher soil organic carbon content stock recorded enclosure open grazed land recorded overall mean soil organic carbon stock 39 6 3 5 mg ha 1 enclosure 20 year old 40 8 3 4 mg ha 2 enclosure 20 30 year old 51 0 4 4 mg ha 1 enclosure 30 year old soil organic carbon stock adjacent open grazed area ranged 34 4 2 5 47 9 5 1 mg ha 1 age enclosure show significant effect soil organic carbon stock however enclosure management significant p 0 05 effect vegetation attribute concluded enclosure significant role term soil carbon sequestration
214,Changes in soil carbon stocks across the Forest-Agroforest-Agriculture/Pasture continuum in various agroecological regions: A meta-analysis,WOS:000444928700007,contribution agroforestry system afs enhance soil organic carbon soc storage soil layer due presence deep tree root interest context promoting carbon sink greenhouse gas mitigation to quantify relative soil
215,Rural people's intention to adopt sustainable water management by rainwater harvesting practices: application of TPB and HBM models,WOS:000617137800022,water prerequisite human key link among climatic condition human environment human behavior mitigate impact present aimed evaluate rural people readiness sustainable management water resource to achieve goal theory planned behavior tpb health belief model hbm used framework instrument closed end questionnaire developed basis tpb hbm face content validity questionnaire confirmed panel expert sustainable agriculture it reliability also checked pilot calculating cronbach alpha average variance extracted ave r 2 composite reliability cr sample composed 480 villager hamadan province iran familiar sustainable water resource management context rooftop rainwater harvesting project result showed tpb variable moral norm attitude self identity could account 61 percent variance rural people intention adopt practice sustainable water resource management based hbm variable perceived benefit perceived susceptibility perceived severity could capture 49 percent variance result revealed theory potential predict rural people intention engage sustainable management water resource tpb proved provide robust prediction hbm
216,"CABI's innovative use of technology, data, and knowledge transfer to reduce crop losses in the developing world",WOS:000409902600002,cabi profit knowledge based organization mission improve livelihood solving problem agriculture environment it aim achieve impact scale combining modern icts knowledge management skill ability bridge gap practical application scientific knowledge global plantwise program led cabi aim reduce crop loss focusing improving plant health information service throughout developing world 80 world food produced it aim lose le feed providing appropriate authoritative practical information farmer network face face plant clinic backed vast knowledge bank factsheets distribution map image pest management toolkits introducing simple android tablet plantwise plant clinic backed mobile phone advisory service built capacity farmer community increased speed new pest disease identified improved quality diagnosis advice provided plant doctor a plantwise network grows data collected held knowledge bank analyzed combined source provide new insight tool address challenge increasing productivity adapting a partner godan initiative cabi also collaborating data provider seek solution world agricultural challenge build digital skill needed drive data revolution
217,Barriers to implementing climate resilient agricultural strategies: The case of crop diversification in the US Corn Belt,WOS:000429399000019,cropping system diversity help build greater agroecosystem resilience suppressing insect weed disease pressure also mitigating effect extreme variable weather despite potential benefit cropping system diversity farmer u corn belt use diverse rotation examines factor may influence farmer decision use diversified crop rotation u corn belt parallel convergent mixed method approach using multi level analysis corn belt farmer survey data n 4 778 depth interview n 159 analysis conducted answer question regarding factor influence farmer use extended crop rotation intensive corn based cropping system explore whether farmer corn belt might use extended crop rotation response climatic change finding suggest path dependency associated intensive corn based cropping system region limit farmer ability integrate diverse crop rotation however farmer diversified watershed farm marginal land livestock likely use extended rotation additionally farmer currently use diverse rotation also likely plan use crop rotation strategy if diverse cropping system desired reduce risk addition reducing negative impact associated industrial agricultural production effort must made facilitate diverse crop rotation u s corn belt may achieved adjusting policy economic incentive presently discourage cropping system diversity region
218,Future water security in the major basins of China under the 1.5 degrees C and 2.0 degrees C global warming scenarios,WOS:000857121700016,freshwater essential resource human life agriculture industry ecology future water supply water withdrawal water security impact human intervention key concern numerous study projected future change river runoff surface water resource however change major water withdrawal component including agricultural irrigation water industrial domestic ecological water withdrawal well balance water supply withdrawal joint impact socio economic development seldom investigated especially basin national scale in change surface water resource agricultural irrigation water industrial domestic ecological water withdrawal well balance water supply withdrawal baseline 2006 2015 1 5 degree
219,"Mapping irrigated croplands in China using a synergetic training sample generating method, machine learning classifier, and Google Earth Engine",WOS:000844311700002,agricultural irrigation important vehicle increasing crop yield large scale irrigation posed great challenge global regional water availability via altering land atmosphere interaction knowledge irrigation distribution essential understand regional water cycle guide agricultural management decision making information scarce china developed remote sensing dominated framework map irrigated croplands china 500 resolution using synergetic training sample generating method machine learning classifier cloud computing platform google earth engine gee to overcome challenge lacking nationwide training sample first produced two provisional irrigation map fusing statistic modis derived annual peak greenness index two provisional irrigation map spatially filtered existing irrigation product gripc construct initial training sample pool next enhance robustness cover irrigated candidate screened introduced irrigated croplands three land use cover map cci lc glc_fcs nlcd supplement training data pool afterward utilized locally adaptive random forest classifier data cube modis derived spectral index climatic topographic variable generate irrigation map province china gee resulting map outperformed current irrigation map overall accuracy 79 2 map also showed reasonable consistency statistical data province prefecture level determination coefficient r2 0 89 0 77 respectively in total identified 87 04 million hectare irrigated croplands mainland china 2015 using resulting map water use statistic found high correlation irrigation area agricultural water use northwest northeast south china low correlation north china plain map expected serve national water resource management assist decision making improving agricultural adaption
220,"Spatiotemporal dynamics of habitat suitability for the Ethiopian staple crop, Eragrostis tef (teff), under changing climate",WOS:000631247300002,teff eragrostis tef zucc trotter staple ancient food crop ethiopia it growth affected essential understand climatic effect habitat suitability order design countermeasure ensure food security based four representative concentration pathway emission scenario e rcp2 6 rcp4 5 rcp6 0 rcp8 5 set intergovernmental panel ipcc predicted potential distribution teff current future scenario using maximum entropy model maxent eleven variable selected 19 according correlation analysis combined contribution rate distribution simulated accuracy result validated area curve auc strong predictability value 0 83 0 85 current rcp scenario our result demonstrated mean temperature coldest season precipitation seasonality precipitation cold season slope dominant factor driving potential teff distribution proportion suitable teff area relative total area 58 current condition 58 8 rcp2 6 57 6 rcp4 5 59 2 rcp6 0 57 4 rcp8 5 respectively found warmer condition correlated decreased land suitability a expected bioclimatic variable related temperature precipitation best predictor teff suitability additionally geographic shift land suitability need accounted assessing overall susceptibility ability adapt critical ethiopia agricultural strategy food security a robust model necessary developing primary adaptive strategy policy minimize harmful impact teff
221,Smallholder farms' adaptation to the impacts of climate change: Evidence from China's Loess Plateau,WOS:000510958200061,impact agriculture developing country depend extent agricultural production region adapts influence us whole farm land use optimisation approach explore impact including farm profitability production associated greenhouse gas ghg emission loess plateau northern china result show activity loss smallholder farm profitability caused could moderate declining rainfall result land use change generate higher farm ghg emission economically beneficial adaptation with 5 10 decline annual rainfall introduction agricultural carbon tax would generate substantial reduction farm ghg emission with 30 rainfall reduction agricultural carbon tax likely bring considerable emission reduction economically optimised land us generally sensitive potential change when rainfall reduction appear clear trend toward reducing cropping area transiting pasture with 5 10 rainfall reduction increasing agricultural carbon tax rainfall reduction lead expansion cropping enterprise however 30 rainfall reduction land allocation sensitive agricultural carbon tax when declining annual rainfall optimal enterprise oat pasture rotation employed reduce wheat dominated rotation besides land use pattern adaptation altering farm management practice also necessary economically optimised sheep flock would increased considerably declining rainfall overall policymakers suggested initial educational scheme tell smallholder farmer make best use available strategy consider change design implement agricultural policy
222,"Spatiotemporal modelling of soil organic matter changes in Jiangsu, China between 1980 and 2006 using INLA-SPDE",WOS:000594244300013,growing human population demand food significantly impacted soil resource understanding spatiotemporal soil condition important support food production environmental sustainability nevertheless spatiotemporal prediction soil property could seriously influenced uncertainty data model integrated nested laplace approximation inla stochastic partial differential equation spde proposed general model account uncertainty spatiotemporal soil modelling prediction inla spde significant advantage computation efficiency commonly used geostatistical method markov chain monte carlo however pedometrics study used soil spatial modelling demonstrates application inla spde within hierarchical spatiotemporal model soil organic matter based soil survey data collected jiangsu china three period e 1979 1982 2000 2006 2007 compared updating digital soil map using bayesian maximum entropy approach prediction generated using inla spde accurate for example root mean square error using inla spde e 6 57 g kg 1 reduced 20 compared updating approach e 8 39 g kg 1 moreover accounting source uncertainty made prediction using inla spde certain nevertheless uncertainty temporal prediction soil still large due scarcity data across sampling period inla spde model predicts much detailed spatiotemporal change along sampling period therefore recommends use inla spde within hierarchical model effective method studying spatiotemporal soil
223,Technologically achievable soil organic carbon sequestration in world croplands and grasslands,WOS:000454406600003,reported potential sequestration carbon soil agricultural land overly optimistic assume degraded cropland grassland subjected best management practice two approach estimating potential presented method 1 m1 considers literature derived best estimate annual soil organic carbon soc gain mg
224,Data synthesis of carbon distribution in particle size fractions of tropical soils: Implications for soil carbon storage potential in croplands,WOS:000424179800005,organic carbon saturation soil refers theoretical maximum soil organic carbon soc associated stabilized fine silt plus clay particle f 20 mu reviewed literature dealing soc distribution soil fraction evaluate carbon saturation tropical soil estimate
225,STATUS ASSESSMENT OF AGRICULTURAL DRAINAGE DITCHES,WOS:000426051100022,poor maintenance environmental concern land use change creating growing need better agricultural drainage objective identify ditch property evaluated visually site related soil erosion process define parameter requiring intensive estimate using simplified method included survey ditch various soil using madras minnesota agricultural ditch assessment stability classify ditch status to explain ditch segment poor condition additional field laboratory study carried soil sample taken analysis particle size distribution unsaturated direct shear strength critical stress erosion hec ra data model used simulation hydraulic force acting different flow rate digital map land use catchment area different year used estimate change runoff condition time madras proved suitable tool rapid assessment stability problem ditch hec ra simulation good complement madras assessing change land use affected hydraulic load highlighting bottleneck system however hydraulic load adequately explain degree degradation ditch segment measurement soil shear strength good aid understanding existing degradation thus assessment soil erodibility bank stability essential anticipating risk future erosion process ditch
226,Functional Design of Pocket Fertigation under Specific Microclimate and Irrigation Rates: A Preliminary Study,WOS:000816114800001,irrigation fertilization technology need adapted provided effectively efficiently possible current proposed pocket fertigation innovative new idea providing irrigation water fertilization using porous material form ring disc inserted surrounding plant root irrigation emitter equipped pocket bag storing fertilizer objective evaluate functional design pocket fertigation specific micro inside screenhouse combination emitter design irrigation rate technology implemented experimental field lab scale melon cucumis melo l cultivation 23 august 25 october 2021 one planting season technology tested six treatment combination three emitter design two irrigation rate emitter design consisted emitter textile coating pt without coating pw without emitter control pc irrigation rate supplied one time evaporation rate e 1 2 time evaporation rate 1 2e pocket fertigation well implemented combination emitter design irrigation rate pt e pw e pt 1 2e pw 1 2e proposed technology increased average fruit weight water productivity 6 20 7 88 respectively compared control pc e pc 1 2e meanwhile optimum emitter design pocket fertigation without coating pw it increased 13 36 fruit weight 14 71 water productivity thus pocket fertigation good prospect future for planning proposed technology implemented field scale
227,Can conservation agriculture mitigate climate change and reduce environmental impacts for intensive cropping systems in North China Plain?,WOS:000740225300017,determining appropriate farming management practice adapt lower environmental cost important sustainable agricultural production in long term experiment 1985 2019 conducted different management practice combining fertilization rate low high n fertilizer n0 n1 n2 straw addition low high addition s0 s1 s2 conservation tillage tillage nt north china plain ncp denitrification decomposition dndc model firstly evaluated using experimental data applied simulate change crop yield soil organic carbon soc n2o emission different management practice combined scenario low high emission scenario societal development pathway ssp245 ssp585 respectively projection 2031 2100 under low emission scenario ssp245 wheat yield highest nt n1 s2 treatment 23 increase relative baseline 1981 2010 for maize yield nt n1 s1 treatment increased 46 relative baseline ssp585 whereas yield increased le treatment ssp245 2040s soc predicted increase 6 60 2100 ssp245 straw addition tillage main factor influencing soc n fertilizer important driver wheat maize yield however n2o emission soil increased increased application n fertilizer therefore tillage method low n fertilizer high straw addition nt n1 s2 recommended promote crop yield substantially increase soc ssp245 ssp585 conservation agriculture practice potentially offset crop yield reduction increase soil quality reduce greenhouse gas emission ncp ensure crop production meet growing demand food future
228,Impact of the numerical solution approach of a plant hydrodynamic model (v0.1) on vegetation dynamics,WOS:000846862100001,numerous plant hydrodynamic model started implemented vegetation dynamic model reflecting central role plant hydraulic trait driving water energy carbon cycle well plant different numerical approximation governing equation hydrodynamic model documented numerical accuracy model subsequent effect simulated vegetation function dynamic rarely evaluated using different numerical solution method including implicit explicit approach vertical discrete grid resolution evaluated numerical performance plant hydrodynamic module functionally assembled terrestrial ecosystem simulator fate hydro version 0 1 based single point global simulation our simulation result showed near surface vertical grid spacing coarsened grid size 10 cm model significantly overestimate aboveground biomass agb temperate forest location underestimate agb boreal forest location compared simulation finer vertical grid spacing grid coarsening small effect agb tropical zone asia south america in particular coarse surface grid resolution used large prolonged water content difference among soil layer depth due long dry season duration well drained soil soil evaporation dominant fraction evapotranspiration similarly coarse surface grid resolution used lithologic discontinuity along soil depth information useful uncertainty quantification sensitivity analysis training surrogate model design simulation computational cost limit use ensemble simulation
229,Climate-mediated dynamics of the northern limit of paddy rice in China,WOS:000655291100001,paddy rice agriculture play important role food security considerable influence natural system in context understanding nature driver shift northern limit paddy rice nlpr crucial strategy food security however quantitative study effect paddy rice distribution shift well performed here mapped nlpr china using landsat imagery 1984 2013 analyzed latitudinal elevational dynamic nlpr using fishnet analysis explored factor driving change rice area across nlpr region using linear regression model our result show 1984 2013 nlpr shifted 24 93 km northward greatest movement 88 01 km occurring approximately 133 degree e elevational limit increased 39 15 greatest movement 117 08 occurring approximately 129 degree e while socioeconomic factor e g benefit policy irrigation mulch played significant role rice area change change rice area across nlpr region strongest positive association increase previous temperature indicating rice cultivation nlpr region moved higher latitude 30 year period adapt our highlighted quantifying interaction crop production system facilitate better understanding human response change growing condition face ensuring regional global food security
230,From global agreements to local interpretations of sustainable agriculture: translation and implementation of the ABC Plan and Program,WOS:000600282500015,aim discus international agreement translated brazilian agribusiness actor construction sectorial plan mitigation consolidation low carbon economy agriculture abc plan implemented state mina gerais rio grande sul abc program for 70 actor linked construction implementation action interviewed utilized policy translation implementation approach demonstrates abc plan construction involved certain advance translation idea international national context interpreted opportunity signify brazilian agriculture agribusiness actor defined strategy advance attended cop15 structured policy proposal low carbon agriculture diverging unidirectional policy transfer plan abc program resulted process two way translation international national level strategically guided brazil after translated national context abc plan program translated implementation reaching local space if idea reducing greenhouse gas ghg emission present abc plan program formulation find correspondence interpretation action street level bureaucrat they interpret program another credit line pointing formal administrative issue discourage policy access it observed therefore interpretive distance idea global scale translation national local scale
231,Long-term trend and interannual variability of precipitation-use efficiency in Eurasian grasslands,WOS:000692570600004,precipitation use efficiency pue important ecosystem indicator efficiency carbon water conversion trend interannual variation precipitation use efficiency pue response climatic factor provide theoretical foundation understanding eurasian grassland adapt however long term trend regulating factor pue eurasian grassland continental scale still unclear here integrated long term global inventory monitoring modeling system gimms normalized difference vegetation index ndvi field survey aboveground net primary production anpp meteorological datasets 1982 2015 reveal temporal variation control pue eurasian grassland found overall uptrend pue 3 x 10 3 g
232,Drought impacts on ecosystem functions of the US National Forests and Grasslands: Part I evaluation of a water and carbon balance model,WOS:000362058700026,understanding quantitatively evaluating regional impact variability e g drought forest ecosystem function e water yield evapotranspiration productivity service e g fresh water supply carbon sequestration great importance developing strategy national forest grassland nfs united state however reliable continental scale modeling tool available account water carbon dynamic objective test monthly water carbon balance model water supply stress index wassi model potential application addressing influence drought nfs ecosystem service across conterminous united state conus performance wassi model comprehensively assessed measured streamflow q 72 u s geological survey usgs gauging station satellite based estimate watershed evapotranspiration et gross primary productivity gpp 170 national forest grassland nfs across 72 usgs watershed wassi model generally captured spatial variability multi year mean annual monthly q annual et evaluated correlation coefficient r 0 71 1 0 nash sutcliffe efficiency n 0 31 1 00 normalized root mean squared error 0 06 0 48 modeled et gpp wassi agreed well remote sensing based estimate multi year annual monthly mean nfs however systemic discrepancy gpp simulation satellite based estimate yearly monthly scale suggesting uncertainty gpp estimate method e remote sensing modeling overall assessment suggested wassi model capability reconstruct long term forest watershed water carbon balance broad scale model evaluation provides foundation model application understanding impact variability e g drought nfs ecosystem service function published elsevier b v
