,title,wos,clean_abstract
0,"Mainstreaming Ecosystem Services Based Climate Change Adaptation (EbA) in Bangladesh: Status, Challenges and Opportunities",WOS:000404133200057,aim analyze extent ecosystem service es based eba policy making process bangladesh based three stage hybrid policy making cycle agenda setting ii policy formulation iii policy implementation stage contribution eba horizontally ground vertically strategic stage mainstreamed integrated a total nine national sectoral development policy 329 project examined belonging different policy making stage major finding include role es marginally considered component reviewed policy especially top strategic level vertical mainstreaming however policy formulation implementation stage horizontal mainstreaming largely ignored priority given structural policy project e g large scale concrete dam embankment for example es role adapt sector urban planning biodiversity management disaster risk reduction left unchecked implementation stage receives overwhelming priority investment undertake hard measure 38 project related eba argues dominant structural ideology ii expert bureaucracy dependent policy making process iii lack adaptive integration capacity institutional level considerably offsetting eba mainstreaming process need adequately addressed
1,Sharing the burden of financing adaptation to climate change,WOS:000271613100004,may cause harm country historically contributed least greenhouse gas emission land use identifies consequentialist non consequentialist ethical principle guide fair international burden sharing scheme cost use ethical principle derive political principle historical responsibility capacity pay applied assigning share financial burden individual country propose hybrid common differentiated responsibility respective capability approach promising starting point international negotiation design burden sharing scheme a numerical assessment seven scenario show country annex i united nation framework convention would bear bulk cost contribution differ substantially subject choice capacity pay indicator contribution le sensitive choice related responsibility calculation apart associated land use related emission assuming cost usd 100 billion per year total financial contribution annex i country would range usd 65 70 billion per year expressed per caput basis give range usd 43 82 per caput per year
2,Barriers to climate change adaptation: Qualitative evidence from southwestern Iran,WOS:000647761400005,to minimize negative impact key there however range factor unless recognized dealt effectively prevent disrupt effort farmer barrier iran characteristic researched they need identified investigated inform policymaking provide assistance farmer us qualitative approach identify explore barrier susa county historic region khuzestan province southwestern iran data required obtained series focus group discussion n 50 semi structured interview key informant n 50 our result explored categorized numerous response barrier social cultural economic technological informational market based it important note reality margin classification much subtler many typology indicate based finding appropriate policy response recommended
3,Climate change adaptation: Linking indigenous knowledge with western science for effective adaptation,WOS:000441648200011,implementation response programme resilience anchored western scientific knowledge however led tendency marginalise indigenous knowledge considered unimportant process belfer et al 2017 lesperance 2017 whitfield et al 2015 yet knowledge system rarely develop isolation normally tend cross fertilize benefit in regard think indigenous knowledge important scientific knowledge two must integrated multiple evidence base approach mitigation in focussing african traditional society combine oral history available literature examine traditional knowledge awareness related environmental risk interesting theme emerge knowledge holder analysis uncovers wide range adaptive coping strategy applied mixed success from spotting reading position shape new moon interpretative correctness symbolism applied traditional climatology rainmaking ritual conservation wetland forest generally finding seem suggest traditional african knowledge environmental may old society local knowledge transmitted one generation next based perceived vulnerability indigenous community many scholar tend argue generically integration indigenous knowledge policy implementation ross 2009 maldonado et al 2016 etchart 2017 in however attempt supplement argument providing specific context ualised evidence indigenous knowledge linked it demonstrated indigenous knowledge neither singular universal rather voluminous diverse highly localised source wisdom conclude integration unique specific indigenous knowledge system evidence base knowledge could one best way effective sustainable implementation strategy among target indigenous community
4,"Adaptation to Climate Change: Definition, Subjects and Disputes",WOS:000649238600001,unlike mitigation core united nation framework convention since 1995 slowly incorporated international agenda poor result mitigation policy destructive impact nowadays give privileged place political discourse academic literature desirable necessary goal discus idea based author contributed genesis thinking origin concept first us evolutionary biology subsequent incorporation literature policy intergovernmental panel traced order recover critique latin american anglophones author use biological category explain social process well multiplicity project interest legitimized adopted name finally suggested rethink usefulness transdisciplinary perspective replaces biological reductionism commits socio environmental justice
5,The Role of Transdisciplinary Research for Agricultural Climate Change Adaptation Strategies,WOS:000451301100003,while science widely acknowledges necessity cca concrete strategy cca major land use actor group local level largely missing immediate economic challenge often prevent establishment long term collective strategy however collective decision communal level regarding land use crucial cca strategy given interdependency farming forestry tourism economic sector especially mountain area present inter trans disciplinary learning process evolved project modelling hydrological effect combined future land use change based combined scenario socio economic alpine valley brixental tyrol austria locally adapted scenario illustrate future land use change result different socio economic development hydrological result show increase forested area reduces streamflow measure water availability long term for local stakeholder process demonstrated clearly interdependence different economic sector necessity collective action regional level influence socio economic development moreover made aware local decision future land use may influence effect consistent storyline helped stakeholder visualize desired future see scope influence transdisciplinary process allowed local stakeholder translate hydrological modelling result concrete local cca strategy
6,Supporting Adaptation to Climate Change: What Role for Official Development Assistance ?,WOS:000270647200002,formal financial mechanism managing un framework convention unfccc falling significantly short meeting need vulnerable country given close relationship development tempting use existing channel development assistance fill gap however imperative development assistance seen substitute specific finance therefore attempt distinguish two role considers development assistance might support complement funding action convention rather competing substituting
7,Costs and effectiveness of climate change adaptation in agriculture: a systematic review from the NENA region,WOS:000745874500001,need define implement solution emerged since early 1990s ipcc started assessing change cause potential impact response yet limited information exists context specific effectiveness local agronomic practice near east north africa nena region one world region lowest per caput natural resource availability one vulnerable for reason urgent need improve development implementation plan action cope implement systematic sr methodology ass scientific literature adopting practice agriculture farm level nena region result highlight significant knowledge gap region recommend intensifying targeted funding cope urgent regional risk rural agricultural livelihood key policy insight a limited number study ass cost benefit option agricultural sector nena region majority published last ten year adapting crop management technique risk generates net improvement near east north africa yield however response aiming increase agrosystems resilience show context specific effectiveness water management option benefit crop water use efficiency different extent present relatively high implementation cost integrated management option show potential achieve additional multidimensional benefit still well designed long term experiment required evaluate practice different farming system present projected condition an urgent need promote various farming system nena region estimate cost measure guarantee farmer income food security face
8,Prioritizing farm management interventions to improve climate change adaptation and mitigation outcomes-a case study for banana plantations,WOS:000836222800001,intervening agricultural system necessarily includes risk uncertainty ultimately unknown outcome decision analysis embrace uncertainty interdisciplinary approach involves relevant stakeholder evaluating complex decision applied decision analysis approach prioritize 21 farm management intervention could considered certification scheme banana production estimated contribution mitigation well ecological outcome used general model estimated impact intervention benefit minus cost mitigation global warming potential ecological parameter e g biodiversity water soil quality farming aspect e g yield implementation cost production risk used expert documented knowledge presented uncertainty form 90 confidence interval feed model forecast change system outcome caused intervention compared baseline scenario without measure by iterating model function 10 000 time obtained probability distribution outcome farm management intervention our result suggest intervention associated nutrient management e g composting nutrient management plan positively affect mitigation ecological aspect measure direct yield benefit e g plastic reduction correlate negatively positive impact ecology creating buffer zone converting low productivity farmland incl unused land also positive ecological outcome decision analysis help prioritizing farm management intervention may vary considerably relationship expected outcome additional work may required elaborate comprehensive assessment underlying aspect modulating impact given measure evaluated outcome our analysis provides insight promising intervention banana plantation may help practitioner researcher focusing study
9,"Too weak to lead: motivation, agenda setting and constraints of local government to implement decentralized climate change adaptation policy in Ghana",WOS:000462598700003,local government developing country christened proadaptation agent however global effort virtually ignored inherent policy implementation nuance developing country ostensibly assuming narrative existing policy implementation literature could fill void drawing qualitative data six lgs ghana examines motivation agenda setting process teething challenge constricting implementation decentralized governance ghana though adherent decentralization argue local government likely conceive implement proadaptation related intervention evidence ghana provides fascinating lesson show local government ability mainstream related action local governance constricted taxonomy local political economy issue science heaviness it concludes local government unlikely fulcrum governance touted reasonable effort made strengthening broadening resource basket
10,A basis for climate change adaptation in Africa: burdens ahead and policy options,WOS:000305664700003,purpose purpose document impact may burden african continent suggest policy option design methodology approach present comprehensive published paper impact finding it documented 2050 world limit emission greenhouse gas equivalent 400 gt carbon order stand 75 per cent chance avoiding 2 degree
11,Climate risk perception and media framing,WOS:000534534700009,purpose aim analyze medium coverage impact extreme weather event ewe related risk management activity brazil design methodology approach using documentary analysis author examined medium coverage drought flood 2003 2013 concomitant official report finding result indicate although medium coverage conveys direct impact flood drought society underemphasizes importance risk management activity moreover private sector rarely engages risk management mitigation activity despite documented supply chain disruption limitation implication focus solely medium coverage provided wide circulation newspaper brazil would benefit extended medium platform practical implication result highlight need private sector involvement risk management activity facilitate social implication reveals deficiency existing report lack awareness regarding ewe originality value contributes focusing awareness society adapt well business improve supply chain operation facilitate smoother risk management
12,The Ordeal of Adaptation: Recognition and Relationality in a Climate Changed World,WOS:000815329500001,biophysical carrying capacity earth subject natural limit peril well governed tune limit offer promise possibility better future greater justice equality recognition diversity ordeal involve nothing le bending humanity arc history order respect natural limit largely ignored past two century political economic carbon addiction mission achieve future political economy promote rather diminish human flourishing respecting ecological limit managing without unsustainable economic growth still offering social plenitude form fine detail direction cannot foreseen but initial guiding conception developed resource ongoing discussion debate focus first notion practice recognition second deliberative civic learning planning mean realizing norm right recognition inherent human social ecological
13,Insurance and financial sector support for adaptation,WOS:000223148700009,adapting require financial resource for vulnerable part resource likely met government convention financial provision lack public funding led exploration insurance scheme public privately funded experience insurance market including response industry increased frequency extreme weather event useful guiding policy development area suggests limit availability commercial weather related insurance developed developing country micro finance scheme may useful additionally financial service sector may end playing role prompting mitigation response order prevent impact occurring thus limit amount insurance funding needed future
14,"Understanding the nested, multi-scale, spatial and hierarchical nature of future climate change adaptation decision making in agricultural regions: A narrative literature review",WOS:000349724000005,historically innovation industrialised agricultural landscape slow likewise future cca also slow complex interaction highlighted innovation adoption literature ignored aim collate conceptualise multidisciplinary literature nested multi scale spatial hierarchy understand complexity cca decision making process highlighting influential factor across nested scale seven nested hierarchical scale identified overarching level governance outer boundary hazardscape spatially defined climatic region potential impact cc suitable cca strategy defined differing socio economic demographic profile community typology scale mean strategy need tailored enhance community adoption bolster resilience cc strength type social interaction within community also influence cca central hierarchy variation individual belief risk perception greater cc risk perception within household enhance constrain cca farm scale in turn farm scale attribute influence cca differing farm farmer characteristic provide layer complexity considering cca capability greater knowledge evaluation circumstance factor involved cca decision making highlighted use hierarchy create evidence base allow targeted approach cca adoption increased targeted range cca strategy tailored plan communication dissemination cc cca information across nested scale approach build much needed momentum cca rural setting while interaction scale discussed future required understand cross scale interaction feedback loop temporal dynamic within hierarchy
15,"Playing the climate game: climate change impacts, resilience and adaptation in the climate-dependent sport sector",WOS:000470296400006,aim understand issue pose major australian sport stadium organization manage organizational response issue like dependent agriculture tourism sport sector potentially vulnerable impact yet largely overlooked empirical result reveal four primary issue organizational uncertainty greater management complexity cost risk associated water energy resource waste output no revenue opportunity evident result demonstrate physical impact manageable primacy commercial operational imperative determine organizational response ahead government policy direct signal adapt ten factor shape three organizational response typed using berkhout 2012 organization wiley interdisciplinary review 3 1 91 106 framework result challenge assumption impact response limited non sport leisure industry
16,Institutional responses to climate change: opportunities and barriers for adaptation in the Pantanal and the Upper Paraguay River Basin,WOS:000344093500011,climatic expected serious impact pantanal large tropical wetland located upper paraguay river basin centre south america range institutional response developed mitigate adapt in order examine institutional achievement challenge managing region specific typology initially introduced comprises schematic gradient institutional response an empirical analysis conducted brazil bolivia paraguay three country share pantanal identified hybrid basis policy framework construction sense actually combine element various institutional response included proposed typology important factor seem undermine efficacy institutional response addressing region strong influence agribusiness sector still relatively low importance pantanal national environmental policy making essay make claim principle justice guiding policy intervention constitute appropriate strategy address inequality unfairness related
17,People and nature in the Fuerteventura Biosphere Reserve (Canary Islands): socio-ecological relationships under climate change,WOS:000426664800003,analysis interdependence environment society term socio ecological web human biophysical system linked a quantitative model based canonical correlation analysis applied fuerteventura island canary archipelago detected indicator human landscape relationship predicted potential shift based simulated environmental change in last decade landscape fuerteventura island changed natural component cultural agrarian us decreased population increased due immigration mainly mainland spain european country island show transition coupled local socio ecosystem one based interaction environment coastal tourism decouples native inhabitant landscape traditional land use practice a vulnerability represent critical set potential interaction canary island model map socio ecological system four intergovernmental panel scenario show rural decoupling deagrarianization deruralization well stronger link tourism system
18,Do we realize the full impact of pollinator loss on other ecosystem services and the challenges for any restoration in terrestrial areas?,WOS:000474808600003,pollinator key agent ecosystem humankind concerning biodiversity agriculture ecosystem service particularly industrialized country pollinator diversity decline bulk entomological plant pollinator network related topic broad range impact pollinator loss coupled human natural system yet studied a 87 flowering plant depend pollinator basic ecosystem service extent therefore pollinator loss might cause simultaneous degradation ecosystem service inducing counterproductive human response interlinked poverty spiral interaction main risk factor pollinator unadvised human response pollinator decline rarely studied tipping point pollinator loss yet identified can counterproductive human response pollinator deficiency upscale pollinator decline toward pollinator loss syndrome course argues impact pollinator loss ecosystem service useful counterproductive human strategy pollinator loss induced degradation integration pollinator protection terrestrial restoration effort
19,Transformational adaptation of agricultural systems to climate change,WOS:000435286300001,explores increasing use concept transformational ta context agriculture analyzing conceptualization application while ta appealing concept involves implementation action different way small adjustment current technological economic approach also raise question complexity transforming agricultural system although current scientific evidence find pattern impact agriculture future inform analysis transformation required evidence enough fully inform practical decision making different scale part problem may enough empirical focusing transformational agriculture for example 93 article literature 39 focus understanding concept ta 32 focus analytical applied aspect ta including study applying global model analyze ta regional global scale identify broad pattern ta agriculture 16 tried understand ta empirical perspective while number empirical study ta still increasing issue ta received limited attention including uncertainty impact policy implication transition process role technological innovation barrier ta categorized vulnerability value based approach vulnerability
20,Banks' climate commitments and credit to carbon-intensive industries: new evidence for France,WOS:000730094700001,i investigate whether bank align green word term commitment tackle deed term credit allocation across carbon intensive industry france i use data bank credit exposure large versus small firm across 49 industry main banking group operating france i merge information industry greenhouse gas emission intensity score bank self reported related commitment 2010 2017 i find evidence higher level self reported commitment bank associated slower growth lending large firm five carbon intensive industry however lending small medium sized enterprise across le carbon intensive industry remains unrelated bank commitment green business these finding suggest devising appropriate carbon reporting framework small firm likely enhance decarbonization bank lending key policy insight over 2010 2017 france banking group self report cdp committed mitigation tend cut lending relatively faster domestic firm five carbon intensive industry pattern entirely driven dynamic bank credit large corporation france legally bound regular carbon reporting in contrast bank commitment seem affect lending domestic small medium sized enterprise smes carbon intensive industry overall result support recent call extension mandatory carbon disclosure regulation smes
21,An ethnography of policy: water reuse policy in Kenya,WOS:000465567200014,water scarcity inadequate infrastructure sanitation two challenge emblematic kenya developing nation sub saharan africa under circumstance water reuse potential address challenge favourable policy environment in policy document considered ethnographic object understand people talk water reuse kenya policy plan regulation guideline using general inductive approach content analysis finding suggest kenya policy water reuse progressed especially recognition potential reused water addressing water scarcity pollution cleaner industrial production food production mitigation while many water reuse issue discussed water irrigation environment industrialization key sector food agriculture housing urban development health remain silent water reuse therefore need take water reuse conversation beyond water environment industrialisation sector address water supply wastewater management issue likewise reminds u importance foregrounding public perception harmonized institutional arrangement success water reuse country
22,Integrating climate change into peacebuilding,WOS:000332319700007,peacebuilding country concentrated area heightened vulnerability impact almost certainly lack capacity manage impact in spite overlap mitigation project typically excluded peacebuilding activity particularly alarming given many analyst believe trigger amplify perpetuate humanitarian crisis population displacement political extremism violent conflict region peacebuilding operation take place investigates opportunity integrating peacebuilding it identifies three obstacle integration lack tool policy easily introduced typical peacebuilding programming skepticism complacency donor community tension objective timeframes peacebuilding response examines opportunity integrate four principal programmatic area peacebuilding socio economic recovery politics governance security rule law human right concludes attention need given opportunity order build resilience reduce likelihood daunting costly challenge future
