,title,wos,clean_abstract
109,"The role of perceptions, goals and characteristics of wine growers on irrigation adoption in the context of climate change",WOS:000636268000007,among multiple adaptation exist face irrigation one straightforward option wine growing yet widespread development irrigation may strengthen water scarcity increase farmer vulnerability water stress in context understanding condition adoption irrigation outmost importance characterize process risk policy implication present empirical approach understanding factor driving current envisioned irrigation farm level combining internet survey data terroir data precipitation temperature soil water holding capacity characterizing wine grower farm southeastern france languedocroussillon survey data include current future practice perception past change wine grower main objective sample gather 28 grower already irrigating vine 39 considering option future result different econometric model show terroir socioeconomic factor perception objective play significant role adoption irrigation specifically perception water scarcity seem drive future irrigation project much real water scarcity these result carry important policy implication water demand forecasting water supply planning
110,"A transaction cost approach to climate adaptation: Insights from Coase, Ostrom and Williamson and evidence from the 400-year old zangjeras",WOS:000312914900014,i argue transaction cost central analytics local common i illustrate bringing together insight coase tradability property right ostrom institutional design principle long lived common williamson transaction cost governance mechanism i call cow model analytics i illustrate using grounded theory case 400 year old zangjera irrigation society northern philippine zangjeras highly vulnerable climatic risk successfully managed adapt steadily overtime i argue ability adapt function transaction cost associated ingenious principle institutional design 1 clear allocation tradability right obligation 2 fairness allocation risk cost benefit 3 reliance price incentive mechanism 4 adaptive efficiency e maximization welfare least cost 5 reliable enforcement mechanism 6 polycentric structure governance i conclude cow model provide useful foundation analytics
111,The Role of Climate Factors in Shaping China's Crop Mix: An Empirical Exploration,WOS:000448559400399,a prominent agricultural consists shifting crop mix toward pole upward elevation examines extent factor shifted regional crop mix china forecast future crop mix might selected scenario using data set provides planted area share crop mainland chinese province 2001 2013 employ fractional multinomial logit fmlogit model examine influence regional crop mix historical well future condition result show temperature increase projected raise incidence wheat tuber reducing rice maize conventional food security crop moreover cash crop vegetable orchard fiber producing crop increase whereas oil bearing crop specialty crop decrease first kind examine impact regional portfolio crop mix across mainland china finding important implication foreseeing needed effort maintain food production face future pointing case effort may desirable
112,Climate-smart agriculture: making agriculture climate-friendly,WOS:000414802800001,objective smart agriculture csa adapted mitigate sustainably contributing food security concept emerged 2010 fao become popular different csa practice found today integrate objective differently agroecological practice aiming permanent soil cover either tree crop among common csa practice csa also wider approach allowing taking account challenge innovative public policy financing because defined objective mean reach objective concept csa also questioned especially regarding possibility reach three objective simultaneously risk promote disguised productivism would respect environment farmer 4 initiative soil food security take objective csa emphasizes mitigation increasing carbon content soil while csa concept yet prove innovative friendly approach agriculture compatible challenge
113,Soil and crop management practices and the water regulation functions of soils: a qualitative synthesis of meta-analyses relevant to European agriculture,WOS:000907285500001,adopting soil crop management practice conserve enhance soil structure critical supporting sustainable agriculture help maintain agricultural production face increasing drought water excess without impairing environmental quality in evaluate evidence assertion synthesizing result 34 published meta analysis effect practice soil physical hydraulic property relevant european agriculture also additional 127 meta analysis investigated synergy trade offs help explain effect soil crop management term underlying process mechanism finally identify response alternative soil crop management system vary contrasting agro environmental condition across europe information may help practitioner policymakers draw context specific conclusion concerning efficacy management practice tool our synthesis demonstrates organic soil amendment adoption practice maintain continuous living cover result significant benefit water regulation function soil mostly arising additional carbon input soil stimulation biological process these effect clearly related improved soil aggregation enhanced bio porosity reduce surface runoff increase infiltration one potentially negative consequence system reduction soil water storage groundwater recharge may problematic dry climate some important synergy reduction nitrate leaching groundwater greenhouse gas emission nonleguminous cover crop system benefit reducing tillage intensity appear much le clear cut increase soil bulk density due traffic compaction commonly reported however biological activity enhanced reduced tillage intensity improve soil structure infiltration capacity reduce surface runoff loss agro chemical surface water however evidence beneficial effect inconclusive significant trade offs include yield penalty increase greenhouse gas emission risk leaching pesticide nitrate our synthesis also highlight important knowledge gap effect management practice root growth transpiration thus conclusion related impact management crop water supply water regulation function necessarily based inference derived proxy variable based knowledge gap outlined several key avenue future topic
114,Developing an adaptation strategy for sustainable agriculture,WOS:000267067600014,agriculture one important economic sector global society agricultural production continues expand forest land marginal crop area attempt keep pace ever increasing world population environmental damage increasing including erosion salinity desertification deforestation threat biodiversity water scarcity moreover variability profound influence agroecosystems posing serious threat food security human health protection environment thus comprehensive agrometeorological policy guideline focusing preparedness mitigation measure support sustainable agricultural development needed cope impact variability policy effective stand alone strategy incorporated broader policy objective for example part broader socio economic policy agricultural forest water resource natural resource coastal zone management policy poorer country require resource improve capacity order cope impact undertake specific measure
115,Devising spatio-temporal adaptation from land suitability inputs: Measures and options for sub-alpine agricultural systems,WOS:000793367200003,introduces decision making approach intention guide agricultural 21st century using two orographically dissimilar sub alpine system located australian alp chilean dry andes rational selection measure local option framed spatio temporal model decision making supported interpretation pathway analogue following key typology like flexibility deepness representative landscape functionality found specific rural space model based estimating multi scale land suitability gap feasible biophysical irrigation potential combination adjustment seen necessary propose specific strategy baseline mid century end century period decision making insight resulting exercise could improve evaluation corroborating generalising regional type pathway light opportunity limit
116,Investigating the potential of the slurry technology for sustainable pig farm heating,WOS:000692117200005,sustainable energy development farming sector essential strategy respond combined challenge achieving reliable affordable solution including mitigation intensive breeding farm require maintaining adequate indoor thermal environment result high energy demand usually covered fossil fuel electricity address application combined slurry technology particular pig farm currently us diesel boiler supply piglet heating energy need also considers different option based closed ground source heat pump system after design slurry alternative geothermal one notable advantage detected compared existing diesel system result show implementation slurry technology implies important reduction operational cost turn involves short amortization period system relation diesel one greenhouse gas emission also highly reduced slurry alternative based low electricity use heat pump environmental side reinforced reduction polluting substance methane ammonia derived descent temperature slurry
117,"Perceived Effect of Climate Change on Forest Dependent Livelihoods in Oyo State, Nigeria",WOS:000456502500015,investigated perceived effect forest dependent rural livelihood oyo state nigeria view identifying possible strategy a total 208 respondent randomly sampled olokemeji onigambari forest reserve oluyole lbarapa east local government area lga respectively data collected analyzed using frequency distribution percentage chi square ppmc result show major livelihood activity farming 100 0 trading forest product 92 8 respondent vulnerable effect respect undefined season 90 4 shortage food production 84 1 reduction crop yield 80 8 pest disease outbreak 77 9 affect livelihood activity major strategy utilized soil protection tree planting 88 5 planting different variety ntfps tfps 87 0 practicing shifting cultivation 81 8 use organic fertilizer 81 7 respondent use weather insurance sparing area significant relationship existed farm size r 0 257 p 0 01 monthly income r 0 319 p 0 01 perceived effect strategy r 0 309 p 0 05 used significantly related perceived effect afforestation encouraged among forest dependent farmer addition strategy utilised recommends need educate farmer importance benefit weather insurance financial loss due effect
118,Investigating the incidental benefits of Environmental Stewardship schemes in England,WOS:000313318000005,direct benefit environmental stewardship e scheme well documented academic policy literature include increase stock quality field boundary associated wildlife landscape enhancement improvement farm soil water quality protection historic natural environment it argued incidental benefit e scheme capture benefit wider economy society beyond scheme original remit yet poorly understood insufficiently recognised current policy evaluation criterion describes systematically addressed evidence gap application sub regional economic model capture direct indirect induced effect variety e scheme beyond farm gate finding reveal sub regional income employment effect scheme significant particular scheme rewarding higher standard environmental management implication finding e policy evaluation rural development discussed
119,Enhancing the Ecological Value of Sea Dikes,WOS:000484561500091,sea dike protect low lying hinterland along many coast around world commonly designed embankment grass cover grey revetment accounting prevailing hydraulic load so far incorporation ecological aspect dike design limited with regard increasing environmental awareness need present review method ecological enhancement sea dike discus limitation challenge related method in one key aspect maintain dike safety increasing ecological value potential ecological enhancement sea dike found regarding natural nature based solution foreshore dike surface protection measure vegetated dike cover hard revetment dike road dike geometry while natural nature based solution foreland investigated thoroughly far experience ecological enhancement dike structure gained resulting uncertainty knowledge gap concerning implementation efficiency additional technical uncertainty engineer ecologist meet challenge interdisciplinary collaboration consideration societal need expectation
120,Measuring the effect of improved irrigation technologies on irrigated agriculture. A study case in Central Chile,WOS:000703508100006,irrigated agriculture primary sector demanding water resource world given improved irrigation technology could play crucial role enhancing water use efficiency us causal inference estimator evaluate effect technology irrigators farm level two irrigated valley central chile doubly robust estimator employed address selection bias adoption improved irrigation technology result show first low level technology adoption 18 irrigators adopting irrigation access credit education play crucial role adoption despite low rate estimate show consistently positive significant impact adopter term annual margin land use a result call attention towards focusing program policy targeting reducing entry barrier broadening adoption irrigation technology allowing reduce gap term economic wellbeing long term sustainability irrigated area
121,Performance of rice paddy varieties under various organic soil fertility strategies,WOS:000569775500001,it widely known integrating adopting sustainable agricultural practice restore maintain health degraded agricultural land adapt azolla pinnata sesbania rostrata local potential plant paddy field used green manure two paddy variety planted experiment conducted factorial randomized block design consisting green manure type p1 goat manure 10 ha p2 goat manure 10 ha azolla 10 ha p3 goat manure 10 ha sesbania 2 h p4 goat manure 10 ha azolla 5 ha sesbania 1 ha rice variety v1 bangir v2 inpari 41 result indicated use green manure increased nitrogen organic carbon content soil 0 10 0 82 0 20 2 0 respectively inpari 41 variety produced higher grain yield 4 92 ha compared bangir variety 3 48 ha these finding indicate suitable green manure combined paddy variety improve resilience soil health paddy productivity
122,ADAPTING IN THE SHADOW OF ANNAPURNA: A CLIMATE TIPPING POINT,WOS:000376591300002,rapid himalaya threatens traditional livelihood remote mountain community challenge traditional system knowledge stress existing socio ecological system through semi structured interview participatory photography repeat photography focused impact traditional livelihood aim shed light socio cultural implication related manang remote village annapurna conservation area western nepal observed change temperature precipitation permanent snow cover glacial extent directly inform villager perception adaptation himalayan strategy include shift traditional agropastoral practice diversified blend agropastoralism tourism service cash crop production tipped scale favor production fruit vegetable cash crop previously unsuitable local diversification livelihood strategy signifies transformation within socio ecological system manang may enable greater resiliency long term climatic continued development relevant place based adaptation rapid himalayan depends local people ability understand potential impact adjust within complex traditional socio ecological system
123,Achieving environmental flows where buyback is constrained,WOS:000419113600006,theory suggests development common property increase national welfare consistent thinking murray darling basin mdb plan us common property approach recover environmental water right national interest two water recovery instrument used purchasing water right buyback farmer saving water subsidising irrigator adoption technically efficient technology a moratorium buyback focused environmental recovery subsidised technically efficient technology adoption economist argue national welfare maximised via buyback highlight limitation efficiency saving recover sufficient environmental water a risk water recovery target may reduced future limiting welfare gain water reform evaluates possible welfare trade offs surrounding environmental water recovery outcome arbitrary limit buyback imposed result suggest average strategy attempt obtain 1500gigalitres gl water farm efficiency investment provide sufficient resource meet environmental objective wet state nature conclude reliance technically efficient irrigation infrastructure le economically efficient relative water buyback importantly transformation mdb irrigation significantly constrain irrigators future capacity adapt
124,Convergence of agricultural intensification and climate change in the Midwestern United States: implications for soil and water conservation,WOS:000318364900006,society face substantial challenge expand food production adapting climatic change ensuring ecosystem service maintained a convergence issue occurring midwestern united state e cornbelt region provides substantial grain supply world market also well known contribution hypoxic condition gulf mexico due agricultural nutrient loss examines anticipated trend possible consequence grain production soil resource management region historic region ideal large scale agriculture soil among world productive yet current trend degradation soil resource threatens capacity ensure stable food supply clean environment face changing a set strategy practice implemented meet challenge maintaining improving hydrologic plant growth function soil improve outcome aquatic ecosystem agricultural sector soil management ensures long term capacity provide reliable food supply mitigates pressure expand agricultural practice marginal croplands would lead environmental degradation
125,Interactive Influences of Elevated Atmospheric CO2 and Temperature on Phosphorus Acquisition of Crops and its Availability in Soil: A Review,WOS:000641679600001,global escalates rise atmospheric co2 concentration temperature impact crop production agricultural ecosystem a second important macronutrient phosphorus p fundamentally mediates crop adaptability an overview previous work crop p acquisition soil p dynamic response elevated co2 temperature would critical advancing knowledge p cycling management maintain agroecosystem sustainability focus effect elevated co2 temperature root morphology root exudation associated biochemical property rhizosphere relevant crop p acquisition soil p availability study indicate elevated co2 temperature could increase p uptake crop rice soybean crop grown within range optimal growth temperature elevated co2 temperature alter root exudate change activity soil enzyme microbe rhizosphere environment also directly influence soil chemical biochemical process thus bioavailability p it worth focus p solubilizing microbial community composition microbial function soil p mobilization rhizosphere crop grown
126,Identifying and Comparing Easily Accessible Frameworks for Assessing Soil Organic Matter Functioning,WOS:000916704700001,soil organic matter som stock crucial soil fertility food provision also contribute mitigation however assessing som change cropping system difficult due varying quantity quality input data som process described several model complex require high amount input data in work identified selected framework simulate som pool stock well effect different management practice also required framework easily accessible farm related end user require limited accessible amount input data in six framework met inclusion criterion socrates soil organic carbon reserve transformation ecosystem ccb candy carbon balance amg century cqestr rothc rothamsted carbon model collected information framework compared term accessibility model time step used nutrient cycle included simulation number som pool agricultural management option included our result showed ccb robust framework considered amg cqestr rothc performed least well however framework strength may match specific requirement ability individual user
127,Ecosystem Services in the Context of Agroforestry-Results of a Survey among Agricultural Land Users in the Czech Republic,WOS:000915059400001,agroforestry use tree interface agricultural forestry system key component multifunctional european landscape provides whole range ecosystem service it main potential lie provision service including increasing economic yield agriculture providing anti erosion measure main objective ass perception providing ecosystem service woody plant growing agroforestry farmer key land user czech republic different aspect influencing farmer subjective perception identified especially depending conventional versus organic farming method respondent view mapped using structured questionnaire allowed independently assessing importance windbreak respondent considered regulatory ecosystem service important one particular reducing soil erosion flood risk increasing resilience landscape drought respondent perceived physical obstruction tree mechanical tillage tenancy relationship land significant problem introduction agroforestry system aim promote innovative approach national agricultural strategy agroforestry one tool towards sustainable agricultural production
128,"Observing climate impacts on tea yield in Assam, India",WOS:000389098900006,tea important cash crop economy northeast india it also support livelihood large proportion population at time tea growth sensitive climatic condition making vulnerable variability identifying tea yield response climatic variability operational plantation identifying important climatic variable impact tea yield critical assessing vulnerability industry informing here developed garden level panel dataset estimated statistical model identify causal effect monthly temperature monthly precipitation drought intensity precipitation variability tea yield found decreasing tea yield return warmer monthly average temperature monthly temperature 26 6 degree
129,Potentiality of Moringa oleifera as a Nutritive Ingredient in Different Food Matrices,WOS:000882245000001,given growing interest today society improving nutritional profile food consumes industrial food reformulation booming in sense due high yield good high nutritional potential moringa oleifera may alternative mean fortifying product order improve different food matrix different part plant leaf seed flower pod root horizontal ellipsis marketed nutritional medicinal attribute in analysis various scientific study compiled evaluate potential moringa oleifera term incorporation food matrix influence final sensory characteristic in general incorporation different part moringa product bread pastry snack beverage increase nutritional profile product protein essential amino acid mineral fiber dried leaf powder representing alternative milk egg helping vegan vegetarian consume protein content in case dairy meat product goal improve antioxidant antimicrobial capacity in every food product adding high concentration moringa lead greenish coloration herbal flavor change mechanical property texture hardness chewiness volume sponginess negatively impacting acceptance final product bibliographic highlight need continue researching technological property dual aim incorporating different part moringa food matrix increasing consumer familiarity product
130,"Disentangling Environmental, Economic, and Technological Factors Driving Scallop (Argopecten purpuratus) Aquaculture in Chile",WOS:000902750400001,boom bust trajectory argopecten purpuratus industry chile show progression resource extraction fishing production aquaculture analysis effect environmental economic scientific technological factor influence factor scallop production chile reviewed period 1980s 2020 evaluation effect allows visualisation industry productive evolution reveals current challenge occurrence abrupt environmental disturbance commercialisation imperfect market configuration public private effort scientific technological advance acted favourably scallop production however industry mainly focused price high production volume devote much effort develop low cost resilient technology today economic challenge must addressed helping reduce production cost add economic value product product our result show industry must focus low cost technology use renewable energy circularity process environment ensures capture natural seed these challenge must lose sight emerging effect covid 19 pandemic
131,Urease Inhibitors Effects on the Nitrogen Use Efficiency in a Maize-Wheat Rotation with or without Water Deficit,WOS:000676000700001,use urease inhibitor irrigated system decrease soil ammonium nh4 nitrate no3 availability thus could easy tool reduce n loss due ammonia volatilization no3 leaching main goal experiment ass effect urease inhibitor n use efficiency n loss economic impact maize wheat field experiment in 10 treatment compared combining urea fertilizer without urease inhibitor applied one two dressing optimal sub optimal irrigation a single application urease inhibitor in1d coupled conventional urea helped reduce nitrate leaching risk maize period even compared two dressing treatment harvest in addition improvement achieved together increase economic benefit even compared application amount regular urea split two dressing under low water availability system benefit applying urease inhibitor increased respect application regular urea making technique promising strategy arid semiarid region
