,title,wos,clean_abstract
126,Community-based responses to climate hazards: typology and global analysis,WOS:000462907000002,severity frequency hazard increasing around world because impact acutely felt local community critical improve understanding response option available chosen community conducted mixed method analysis case study reporting community based response hazard based content analysis published case study generated emergent evidence based typology response according nature goal using typology quantitatively analysed 1500 response example determined pattern community level disaster mitigation strategy vary across world region across economic governance condition specifically diversity response lower developing country implementation local level policy planning response le frequent country characterised low governance quality our result confirm although much local community respond challenge also need increased support local activity by synthesising data many local study provides first global evidence base local level policy
127,Past and future adaptation pathways,WOS:000372038100003,pathway increasingly used foresight tool help guide implementation deliberate transformation applies pathway lens hindsight tool provide new understanding past relevant improving future pathway approach four case study past adaptation examined solomon island community forest dependent community transylvanian village response policy result highlight response diverse case study involve complex transition gradually create new condition trajectory manifest multiple inter related pathway response different social spatial scale e g different path different household community legacy continuity across time affect future pathway affected power complex way create need analysis also highlight working prospective approach response need consider 1 underlying assumption value principle associated future 2 existence inter connected multiple pathway implication reinforcing existing social inequality 3 understanding past provides inspiration new transformative future overall concludes shift towards analysis rather simply pathway require careful consideration underlying ontological assumption relationship past present future
128,Building climate change resilience by using a versatile toolkit for local governments and communities in rural Himalaya,WOS:000564662200020,with impact disruption becoming evident increase uptake toolkits assist local government build community resilience adapt impact there increasing attention call practitioner adopt proactive participatory approach help adaptive response planning process one toolkit international council local environmental initiative iclei asian city resilience network accrn process iap simple rigorous toolkit developed help local government asian city build resilience impact outline application toolkit determine versatility rural context trialled himalayan rural enclave ramgad indian state uttarakhand given difference urban rural environment outcome highlighted need investigation analysis process ensure methodology truly reflects nature rural system level vulnerability adaptive capacity overall toolkit proved simple versatile toolkit ass vulnerability adaptive capacity community rural himalaya over 40 resilience intervention strategy developed ramgad enclave prioritized according technical political social economic feasibility
129,Using Government Resettlement Projects as a Sustainable Adaptation Strategy for Climate Change,WOS:000408861800088,given increasing migration addressed major consequence growing number scholar suggest planned relocation people government resettlement project grps included review status environmentally induced migration china present empirical case shangnan county northwest china specific grp called massive southern shaanxi migration program mssmp initiated response related impact result showed mssmp helped local resident adapt better reducing exposure risk enabling mobility providing financial incentive raising living standard improving emotional status furthermore mssmp added additional benefit migrant compared traditional grps respecting voluntary participation preparing future risk reducing social isolation via short relocation distance however grps could also seen maladaptation disproportionately increase burden vulnerable community member financially disadvantaged new migrant people left behind suggests grps designed involving multiple strategy supplement grps broadening political scheme consider special need vulnerable group contributes understanding role grps sustainable thereby facilitating design organization implication future similar program
130,The relationships between social capital and concerns for climate change with increasing wildfire risks in rural communities in Central Oregon,WOS:000538110600002,though global issue necessitates local action for many rural community challenge available capital infrastructure knowledge system need identified adequately address adaptability in social capital information network examined local strategy mitigate specific risk vulnerability wildfire examine survey data collected 683 owner occupied rural central oregon household localized manifestation present risk resident increased wildfire occurrence severity result indicate social network tie professional knowledgeable wildfire statistical impact perception associated local risk such social network tie however mediated social capital measure governmental trust result also indicate resident higher perception capacity mobilize collective action greater concern localized risk resident higher view community solidarity le concern clarifying relationship add understanding social network community level social capital concern generalized versus localized manifestation risk strategy forested rural community
131,A global assessment on adaptation of forests to climate change,WOS:000272479700002,an international expert panel established 2007 undertake assessment impact forest forest dependent people well management policy option effective summarizes main finding assessment also revealed severe limitation current knowledge much needed especially forest related social economic impact despite limitation current knowledge progressing quickly postpone action pending outcome future study assessment confirms practice associated sustainable forest management likely help reduce environmental social economic vulnerability wide range potential future climatic condition
132,Extreme weather events and pro-environmental behavior: evidence from a climate change vulnerable country,WOS:000878033800001,experiencing extreme weather event consequence might make risk associated tangible easier evaluate salient consequently experience might translate adoption pro environmental behaviour understanding relationship fundamental successful design policy aimed towards promoting adoption mitigation measure work contributes literature showing fact positive relation experiencing extreme weather event willingness take pro environmental action prevailing available evidence developed country our empirical analysis based nationally representative sample household mexico developing country highly vulnerable effect extreme weather event
133,Uncertainty Assessment of Climate Change Adaptation Options Using an Economic Pluvial Flood Risk Framework,WOS:000455314300172,identifying much needed account increased pluvial flood risk inherently uncertain present challenge decision maker trying identify robust measure present integrated uncertainty analysis quantify overall uncertainty individual scenario also net uncertainty alternative direct comparison efficiency further sensitivity analysis used ass relative contribution inherent uncertainty assessment a danish case show uncertainty relation assessing present hazard vulnerability e g input runoff volume threshold damage costing flood important overall uncertainty thus contributing substantially overall uncertainty relation decision action action once decision action taken uncertainty hazard current also magnitude future le important uncertainty discount rate cost implementing measure proposed methodology important tool achieving explicit uncertainty description strategy provides guide effort e g field data collection improve decision making relation
134,The role of markets and governments in helping society adapt to a changing climate,WOS:000240484900009,provides economic perspective specifically examines role market government efficient response for adaptation efficient benefit following adaptation must exceed cost for private market good market actor follow principle interest for public good government must take responsibility government must also careful design institution encourage efficiency could inadvertently increase damage finally although case actor must anticipate change far future generally best learn act respect
135,A new paradigm of quantifying ecosystem stress through chemical signatures,WOS:000392207600017,stress induced emission biogenic volatile organic compound vocs terrestrial ecosystem may one dominant source voc emission worldwide understanding ecosystem stress response could reveal ecosystem respond adapt turn quantify change atmospheric burden voc oxidant secondary organic aerosol here argue based preliminary evidence several opportunistic measurement source chemical signature stress identified quantified ecosystem scale also outline future endeavor see next step toward uncovering quantitative signature stress including new advance voc data collection analysis big data
136,Engaging with uncertainty and ambiguity through participatory 'Adaptive Pathways' approaches: scoping the literature,WOS:000487216100002,planning demand decision making condition uncertainty ambiguity adaptive pathway ap planning receiving increased attention method guide planning face uncertainty approach extensively developed applied large well funded context thames barrier dutch delta program however development ap planning focused much le parallel need engaging challenge ambiguity diverse sometimes contending knowledge value stake involved a nascent body work exploring way engaging uncertainty ambiguity various participatory approach ap planning sought synthesise insight emerging work examining peer reviewed grey literature identified eight case four country across five different policy issue provided detail approached diverse participation analysis small suite case provided key insight seeking use participatory approach ap planning engage inherent uncertainty arguably necessary ambiguity concludes call greater publication detail regarding participatory approach method ap planning undertaken undertaken
137,Improving the climate adaptability of building green retrofitting in different regions: A weight correction system for Chinese national standard,WOS:000647737900009,adaptability including daily readiness face natural calamity nurturing long term resource environment part goal building green retrofitting setting retrofitting evaluation standard consider regional diversification due varying local condition based entropy method fuzzy analytic hierarchy process fahp proposes weight correction system correct weight china assessment standard green retrofitting existing building by comparing corrected weight original weight recommendation building green retrofitting measure seven zone put forward result indicate priority given selection material building envelope site design basis building adaptability it imperative equipment transformation carried cold area severe cold area comprehensive energy non traditional water source used hot summer cold winter area hotsummer warm winter area mild area our finding improve adaptability building retrofit according regional characteristic circumventing low efficiency measure furthermore discussed possibility extending proposed weight correction system country standard
138,"How might adaptation to climate change by smallholder farming communities contribute to climate change mitigation outcomes? A case study from Timor-Leste, Southeast Asia",WOS:000374329900008,agriculture industry significantly exposed impact also responsible contributing extensive greenhouse gas emission a way responding mitigation challenge within industry examines community based initiative might provide mitigation outcome agriculture sector timor leste beginning exploration nation wide institutional response utilises interview field observation document analysis examine extensive community based program two district timor leste focused increasing resilience agriculture sector livelihood poor rural farmer analysis program reveals largely synergistic relationship measure focused land water management agriculture corresponding greenhouse gas mitigation potential including co benefit soil atmospheric carbon sequestration reduced emission soil nitrification reduced use inorganic fertiliser community based program agriculture sector significant influence mitigation outcome often overlooked community based program program timor leste provided useful insight inter relationship mitigation community level could supported scaled southeast asia country elsewhere
139,Determinants of successful delivery by non-state actors: an exploratory study,WOS:000532868800001,party united nation framework convention giving increasingly prominent role non state actor action reflecting development significant effort gone studying non state actor action however literature show paucity study determinant delivery non state actor asks following question full range determinant delivery non state actor focused disaster risk reduction drawing data collected interview survey core partner selection non state actor action put forward taxonomy help gauge likelihood non state actor action may able deliver intended objective finding presented reveal several determinant delivery non state actor outside sphere influence core partner action make case using kind taxonomy conducting ex ante assessment non state actor action view reflecting result assessment design action thus increasing quality non state actor action
140,The implications of group norms for adaptation in collectively managed agricultural systems: evidence from Sri Lankan paddy farmers,WOS:000446321000004,a growing literature seek explore factor shaping in collectively managed common pool resource system often tension behavior benefit individual action benefit larger group resource user sustainable system must therefore work together ensure outcome beneficial group whole however face changing social political environmental condition community norm may leading emerging new behavioral pattern understanding people decide act way benefit group whole help policy maker better target policy incentive promote desired outcome seek build common pool resource management multilevel selection understand collective pressure shape individual behavior using qualitative data depth interview farmer sri lanka confirms collective management practice sri lankan irrigation system significantly influence farmer potential adaption behavior based farmer explanation behavior hypothesize farmer belief ecological necessity cooperation explicit government support collective action important driver collective action given influence community rule norm conclude effort likely successful target farmer organization community whole rather individual farmer
141,"The adaptive capacity of institutions in the spatial planning, water, agriculture and nature sectors in the Netherlands",WOS:000379034400005,problem call continuously responding society raise question do institution allow encourage society continuously adapt us adaptive capacity wheel acw ass adaptive capacity formal informal institution four sector netherlands spatial planning water agriculture nature formal institution examined assessment 11 key policy document informal institution analysed four case study covering sector based acw analysis sector specific general strength weakness adaptive capacity institution netherlands identified concludes important challenge increasing institutional adaptive capacity lie combining decentralized participatory approach top method generate leadership vision goal standard instrument resource monitoring
142,The social organisation of adaptation to climate variability and global change: The case of a mountain farming community in Norway,WOS:000298778000019,local strategy manage variability key adapting long term investigate local adaptive strategy socially organised oystre slidre norwegian mountain farming community operating close climatic margin farmer actively use informal social relation accessing equipment labour order secure production quality life importance relation managing variability persists even dramatic shift towards larger scale production increasing formalisation economic diversification despite social innovation adaptation forming social relationship institution concurrent reduction number people involved farming may putting flexibility social network practice collaboration pressure potentially undermining adaptive capacity future policy need focus ensuring social innovation social organisation
143,Philosophy of Ethnobiology: Understanding Knowledge Integration and Its Limitations,WOS:000529380800001,ethnobiology become increasingly concerned applied normative issue forest management sustainable agriculture applied ethnobiology emphasizes practical importance local traditional knowledge tackling issue thereby also raise complex theoretical question integration heterogeneous knowledge system aim develop framework addressing question integration four core domain philosophy epistemology ontology value theory political theory in dimension argue model partial overlap acknowledges substantial similarity difference knowledge system while overlap ground successful collaboration partiality requires reflectivity limitation collaboration co creation by outlining general programmatic framework aim contribute developing philosophy ethnobiology field interdisciplinary exchange provides new resource addressing foundational issue ethnobiology also expands agenda philosophy biology
144,Contribution of Conservation Agriculture to Soil Security,WOS:000694528600001,soil securitization increasingly becoming quintessential currency attaining sustainable development given mounting global concern land degradation loss biological diversity associated ecosystem service food insecurity water stress a well functioning soil panacea address global concern describes contribution conservation agriculture ca biological diversity protection mitigation ecosystem service delivery food security water security potential entry point soil securitization using literature share insight contribution ca soil security discourse in also make key recommendation good practice soil security pillar thus conclude empirical required deepen understanding benefit ca soil security especially developing country
145,Climate Adaptation as Organizational Learning: A Grounded Theory Study on Manufacturing Companies in a Bavarian Region,WOS:000758892900001,support organization dealing current projected effect recognizing challenge opportunity increasing economic efficiency based regional model remo 13 expert interview representative mainly manufacturing company analyzed grounded theory methodology contribution aim outline actual future challenge investigated region analyze manufacturing company respond ass main promoter barrier organizational learning context expert interview confirm importance company concrete business case strategy increasingly making process manufacturing transparent supply chain assessment in accordance focus strategic management level crucial organizational learning process responsible development mobilization resource realization concept
146,Sustainable construction practice and contractors' competitiveness: A preliminary study,WOS:000287428600007,with increasing requirement resource efficiency construction industry need contractor implement sustainable practice such action also source competitive advantage future however study investigating contribution sustainable construction practice contractor competitiveness sustainable practice construction industry relationship sustainability performance business competitiveness a framework implementing sustainable construction practice improve contractor competitiveness introduced help contractor develop sustainable strategy meeting changing competition environment
147,Coordinating Plans for Climate Adaptation,WOS:000797019100009,planning emphasizes need coordination across sector scale to ass coordinated multiple planning effort community i analyze plan city chester pennsylvania usa multiple environmental plan strategy align effort policy plan mapped clear conflict redevelopment priority emerges land use plan promote redevelopment hazardous location increasing vulnerability these conflict raise question ability mainstreaming win win strategy produce transformation
148,Climate resilience in sustainability assessment of constructions,WOS:000755563900006,against background globally noticeable effect resilient construction steadily gaining importance show resilience already incorporated various sustainability rating system german sustainable building certificate dgnb federal sustainable building rating system bnb followed filtering hazard mentioned sustainability goal eu taxonomy regard induced construction specific environmental site risk finally rough assessment resilience standard residential construction method made risk
149,Vietnamese Folk Architecture: Regional Architecture based on Climatic Adaptation,WOS:000462065400006,overview facing challenge ever globalized world architectural convergence study regional architecture serve refreshing counterpoint brings essential insight earth perspective regionalism architecture reflected many aspect including aspect climatic recent architecture implementation take vietnamese folk architecture object proceeds depth local influence architectural characteristic understand mean climatic provide effective guideline development vietnamese contemporary architectural design
150,Transdisciplinary Research: Can Citizen Science Support Effective Decision-Making for Coastal Infrastructure Management?,WOS:000810522700001,stakeholder engagement increasingly recognised imperative developing effective policy within eu particularly delivering sustainable coastal infrastructure perspective discus current transdisciplinary tdr approach concerning ecoengineering solution artificial coastal structure insufficient ensuring adequate stakeholder engagement facilitate coherent enduring decision making policy development process socio cultural analysis focussing people view feel artificial coastal infrastructure within coastal infrastructure recognised large knowledge gap suggest citizen science c methodology part cultural ecosystem service ce approach adequately inform support implementation ecoengineering solution hard artificial coastal structure whilst addressing existing barrier associated stakeholder engagement current tdr approach
151,Agroforestry solutions to address food change challenges in Africa,WOS:000334005600011,tree inside outside forest contribute food security africa face variability they also provide environmental social benefit part farming livelihood varied ecological socio economic condition given rise specific form agroforestry different part africa policy institutionally segregate forest agriculture miss opportunity synergy landscape scale more explicit inclusion agroforestry integration agriculture forestry agenda global initiative mitigation increase effectiveness identify gap overarching question contribution special issue may help shape current opinion environmental sustainability
152,"Covid-19 and outdoor recreation management: Increased participation, connection to nature, and a look to climate adaptation",WOS:000720149100003,outdoor recreation management perspective investigated based general perception increased public outdoor recreation participation covid 19 pandemic supported survey local regional national level sweden there interest outdoor recreation professional perceived outdoor recreation public pandemic whether professional could identify specific implication covid 19 outdoor recreation experience literature support idea current global challenge coupled projection ongoing challenge requires pro active approach turn potential consideration guidance based characteristic covid 19 pandemic share outdoor recreational professional recent public survey subsequent semi structured interview group conducted obtain outdoor recreation professional detailed perception survey outcome result show professional confirm rapid significant increase outdoor recreation participation further professional identified critical trend increase new inexperienced outdoor recreation participant a positive proactive list implication emerged theme interview a synthesis theme support national goal outdoor recreation sweden further result indicate current opportunity outdoor recreation address concern diminishing nature experience support connectedness nature connectedness nature outcome strengthens comparison strategy given potential relationship connectedness nature pro environmental behavior
