,title,wos,clean_abstract
0,Optimal watershed management practices for the reduction of future non-point pollutants loads,WOS:000651077800045,from water quality perspective mean reducing pollutant total phosphorus increased current state in best management practice bmps presented maximize cost effective pollutant reduction effect adapting multi purpose optimization direct driving soil water assessment tool swat requires unrealistic simulation time therefore setting various bmps scenario based identification bmps applicable land use tp reduction efficiency cost required scenario databased using database multi purpose optimization performed without direct simulation swat method proposed significantly reduced number swat simulation upper reach namgang dam korea possible sufficient investigation 18 swat simulation result finally derived bmps plan displayed map exact location bmps facility could identified
1,"Climate change adaptation and cocoa farm rehabilitation behaviour in Ahafo Ano North District of Ashanti region, Ghana",WOS:000639124900001,sustainable cocoa production hub economic development growth ghana implicated dwindling productivity ghanaian cocoa sub sector although deforestation cocoa farmland expansion pose significant long term risk ecosystem stability environmental conservation assessed farmer perception method factor explaining involvement renovation rehabilitation old cocoa farm data collected 378 cocoa farmer ahafo ano north district ashanti region data analysed principal component analysis pca ordinary least square regression negative binomial regression two stage probit regression result showed majority farmer older 50 year attained primary education high temperature 64 29 stormy rainfall 64 29 much rainfall 61 90 largely perceived cocoa farmer 2015 farmer adapting diversification crop 70 63 planting hybrid variety 71 69 commitment spray cocoa pod regularly 74 87 initiation change planting harvesting time 71 96 significantly influenced p 0 05 cocoa farming experience number child age 5 year perception extremely high temperature perception low rainfall perception delay commencement rainfall cultivation cocoa primary crop perception delay rainfall stop delay regular farm clearing rented farm cocoa rehabilitation decision influenced indicator monthly income perception extreme temperature sharecropping implication result promotion perception would facilitate form cocoa farmland ownership well indicator influenced farmer involvement cocoa farm rehabilitation
2,Climate change adaptation behaviour of forest growers in New Zealand: an application of protection motivation theory,WOS:000913137500002,likely significant impact forestry sector new zealand however understanding forest grower reducing risk impact still infancy applies protection motivation theory identify socio psychological factor influencing forest grower present survey result 60 forest grower combined responsibility managing 70 new zealand plantation forest investigated whether perceived response efficacy self efficacy understanding response cost predictor protective adaptive measure based survey risk reduction risk spreading two type protective measure frequently reported respondent deal risk consistent protection motivation theory finding show respondent likely implement protective adaptive measure perceive threat severity high high self efficacy resource efficacy exhibit low maladaptive response evading postponing behaviour furthermore finding also suggest low self efficacy belief strong maladaptive behaviour among respondent negatively influence motivation implement measure result provides guidance policy maker researcher forest company make effort effective considering forest grower motivation adapt
3,A menu of climate change adaptation actions for terrestrial wildlife management,WOS:000828497700001,real world application practice terrestrial wildlife conservation slowed lack practical guidance wildlife manager although rapidly growing body literature topic wildlife management literature weighted towards narrow range action administrative policy recommendation typically beyond decision space influence wildlife professional developed menu tiered action terrestrial wildlife management translate broad concept actionable approach help manager respond risk meet desired management goal menu includes action related managing wildlife population well managing wildlife habitat designed resource used workbook structured decision support tool describe real world example manager used wildlife menu integrate consideration wildlife management conservation project our example illustrate comprehensive structured menu approach help manager brainstorm specific action easily clearly communicate intent effort
4,In the eye of the storm: adaptation logics of forest owners in management and planning in Swedish areas,WOS:000447199800009,with changing storm wind throw becoming increasing risk forest however swedish forest management practice far involved relatively little consideration examined resistance alternative business usual forest management drawing upon material obtained interview individual forest owner spontaneously identified discussed storm wind throw risk forest they thereby expressed logic differing forest industry sweden largely normalised storm risk rather considering work present analysis illustrates broad largely concerned position individual forest owner contrast established industry position storm accepted existing risk overall highlight diversity agency power relation within swedish forestry forested landscape aspect vital better understanding process relevant forest
5,Climate change and agriculture in South Asia: adaptation options in smallholder production systems,WOS:000545217400006,agriculture south asia vulnerable therefore measure required sustain agricultural productivity reduce vulnerability enhance resilience agricultural system there many practice production system proposed tested minimizing effect some socioeconomic political setup contributes others may inhibit present systematic impact crop production also major option agricultural sector available one key conclusion agricultural practice help agriculture available institutional setup implement disseminate technical solution yet strengthened thus important examine bring required institutional generate fund invest change design dynamic policy long term agriculture rather mere focus agricultural technology one area south asian policy require reconsidering avoid possible maladaptation long run
6,How can irrigated agriculture adapt to climate change? Insights from the Guadiana Basin in Spain,WOS:000368114700006,already affecting many natural system human environment worldwide like semiarid guadiana basin spain illustrates systematic analysis guadiana irrigation farming region applies solution oriented diagnostic framework structured along series sequential analytical step an initial stage integrates economic hydrologic modeling evaluate effect agriculture water sector next measure identified prioritized stakeholder based multi criterion analysis finally social network analysis identifies key actor relationship show severe scenario water availability could substantially decreased drought occurrence augment in consequence farmer adapt crop lesser amount water income gain diminish particularly smallholder farm among various measure considered related private farming new crop variety modern irrigation technology ranked highest whereas public funded hard measure reservoir lowest public soft measure insurance ranked middle in addition stakeholder highlighted relevant criterion selecting plan environmental protection financial feasibility employment creation nonetheless social network analysis evidenced need strengthen link among different stakeholder group facilitate implementation process in sum diagnostic framework applied considered valuable tool guiding supporting decision making communicating scientific result
7,Are farmers' adaptations enhancing food production? Evidence from China,WOS:000445234600024,a primary goal studying identify option used improve crop productivity reduce negative impact many adjustment farm management farmer adopt necessarily represent true adaptation issue often ignored existing literature resulting risk policy maker misled think easier actually thereby underestimate challenge present overall goal identify whether farmer adoption enhancing food production adapting identification us plot level panel survey 619 rural household three province china county level weather data with use plot county year fixed effect well instrumental variable approach estimate show autonomous adoption effective improving crop yield implies farmer adoption cannot always considered adaptation provides possible explanation result concludes policy implication
8,"Contribution of Dry Forests and Forest Products to Climate Change Adaptation in Tigray Region, Ethiopia",WOS:000902622300001,despite ecological importance dry forest contribution often neglected hence initiated ass socioeconomic contribution dry forest tigray region ethiopia a mixed quantitative qualitative design used examine role dry forest household questionnaire survey key informant focus group discussion used collect data result indicated 94 household visited dry forest least month access forest forest product while dry forest income level varied significantly p 0 05 overall dry forest income level contributed 16 8 total household income dry forest income enabled reduction area line equality lorenz curve 21 dry evergreen afromontane forest user 3 02 combretum terminalia woodland user 3 acacia commiphora woodland user gender occupation wealth status distance forest home factor significantly affected combretum terminalia woodland user income level among acacia commiphora woodland user respondent age influenced dry forest income level whereas among dry evergreen afromontane forest user family size household influenced dry forest income level finding could help policy maker understand crucial role dry forest income livelihood community policymakers could reduce pressure dry forest introducing policy recognize role dry forest income reducing poverty income inequality establishing farmer cooperation commercializing non timber forest product support long term coping strategy further needed understand increasing role dry forest product time contribution national economy large
9,Climate Change Adaptation in Non-Timber Forest Products: How Resilient are Small Shiitake Producers?,WOS:000854512600001,focused shiitake mushroom non timber forestry product adapting area examine practice sustainable forest management our relevant globally important agricultural heritage system site located kunisaki peninsula japan conventionally prone drought examined producer coping adopting low middle temperature variety shiitake lentinula edodes survey collected qualitative quantitative data field level qualitative data derived interview shiitake producer cooperative staff member government official wholesaler followed quantitative survey moreover workshop organized verify result interview result indicate producer higher average ratio low temperature shiitake production tend sell brand low temperature shiitake variety acquire production knowledge parent annual sale sloping terrain also affected ratio furthermore ongoing challenge presented alter information knowledge exchange thus increase interaction beyond family member
10,Pathways of socio-ecological resilience to climate change for fisheries through indigenous knowledge,WOS:000509880400008,aboriginal community northeast ne india remained isolation mainland lived distinct cultural milieu environment due high degree exposure better insight ground reality may rich traditional knowledge perception prediction accessed illustrated traditional knowledge fish fishery region participatory rural appraisal pra our revealed ecological climatic circumstance maintained traditional system governance local self government local skill tool technique wisdom belief costume aboriginal people act shock absorber disaster successfully build resilience climatic hazard most knowledge transmitted successive generation became part living cultural religion sustenance strategy community level fishery help reducing vulnerability extreme weather drought flood erratic rainfall pattern fishery decipher strategy available fine scale spatial grassroots level mainstreaming effort achieved extensive assessment recognition promotion local skill culture indigenous knowledge well community based fishery
11,"Climate change adaptation strategies, farm performance and poverty reduction among smallholder farming households in Ghana",WOS:000605673800001,many previous study evaluated impact poverty failed ass gain assessed multidimensional poverty perspective in survey data used examine effect adoption strategy comprising irrigation soil conservation enhanced cropping calendar management farm performance multi dimensional poverty index multinomial endogenous treatment effect mete model account selectivity bias due observed unobserved factor employed result showed higher crop output greater reduction downside risk exposure associated adoption strategy package result revealed using three strategy led significant reduction multi dimensional poverty among adapter suggests ex ante strategy risk exposure effective mean achieving sustainable development goal it therefore important policy maker consider promotion irrigation soil conservation cropping calendar management effective strategy could enhance farm performance reduce household poverty intensifying extension farmer education also enhance
12,Smallholder Adaptation to Drought in Costa Rica's Crony Capitalist Rice Economy,WOS:000450017500002,advance theoretical understanding exclusionary politics rural location institutional analysis costa rica rice economy it describes crony capitalism evolved state sponsored rural development national economy moved towards new neoliberal model crony reorganized rice production appropriated capital flow a smallholder farmer marginalized rice economy reliance state irrigation water made vulnerable drought a state adapted water allocation scheme drought condition determined would profit would lose livelihood author use analysis argue normative process may used justify coercion control specific class people to understand process current frame must broadened include organization production appropriation realization capital flow broadening facilitates understanding strategy produce stratified class structure class made vulnerable others profit breaking common refrain much critical literature neoliberal development author argue state response neoliberal neoliberal must increasingly incorporated critical development study rural transformation
13,"Mainstreaming Ecosystem Services Based Climate Change Adaptation (EbA) in Bangladesh: Status, Challenges and Opportunities",WOS:000404133200057,aim analyze extent ecosystem service es based eba policy making process bangladesh based three stage hybrid policy making cycle agenda setting ii policy formulation iii policy implementation stage contribution eba horizontally ground vertically strategic stage mainstreamed integrated a total nine national sectoral development policy 329 project examined belonging different policy making stage major finding include role es marginally considered component reviewed policy especially top strategic level vertical mainstreaming however policy formulation implementation stage horizontal mainstreaming largely ignored priority given structural policy project e g large scale concrete dam embankment for example es role adapt sector urban planning biodiversity management disaster risk reduction left unchecked implementation stage receives overwhelming priority investment undertake hard measure 38 project related eba argues dominant structural ideology ii expert bureaucracy dependent policy making process iii lack adaptive integration capacity institutional level considerably offsetting eba mainstreaming process need adequately addressed
14,Sharing the burden of financing adaptation to climate change,WOS:000271613100004,may cause harm country historically contributed least greenhouse gas emission land use identifies consequentialist non consequentialist ethical principle guide fair international burden sharing scheme cost use ethical principle derive political principle historical responsibility capacity pay applied assigning share financial burden individual country propose hybrid common differentiated responsibility respective capability approach promising starting point international negotiation design burden sharing scheme a numerical assessment seven scenario show country annex i united nation framework convention would bear bulk cost contribution differ substantially subject choice capacity pay indicator contribution le sensitive choice related responsibility calculation apart associated land use related emission assuming cost usd 100 billion per year total financial contribution annex i country would range usd 65 70 billion per year expressed per caput basis give range usd 43 82 per caput per year
15,Development projects for small rural communities in the Brazilian Amazon region as potential strategies and practices of climate change adaptation,WOS:000329791200002,scenario amazon region brazil indicate increase temperature precipitation decrease affecting society economic activity particularly small scale rural community aim identify describe evaluate factor present sustainable development project small rural community type a demonstration project pda alternative deforestation burnt project padeq already implemented recognizing potential use strategy small rural community amazon region research concerning fifteen project rondonia para mato grosso state developed document analysis technical visit interview stakeholder three project community perception vulnerability capacity analysis document regarding potential success project highlight short history important local context prospect continuity community participation decision making few activity developed project could associated practice two strategy practice important social organization process awareness training community diversification type form agricultural production interview indicate implemented project without considering pressure variability while project planned context greatest role project relates strengthening already existing capacity creating good condition incorporation new strategy measure clearly associated objective reduce vulnerability variability impact
16,Inconspicuous adaptations to climate change in everyday life: Sustainable household responses to drought and heat in Czech cities,WOS:000652320600001,often understood top decision making policy implementing process well application expert knowledge prevent reduce locally specific negative consequence in high income society household level frequently refers adopting technological fix distributed market sometimes considerable cost informed context central europe aim discus different practice household individual require increased consumption energy material still help adapting local expression heatwaves drought they described participant focus group six city czech republic i argue inconspicuous adaptation emerge without connection debate without deeper knowledge issue yet overlooked unimportant short term coping response underestimated debate they part parcel ongoing process societal
17,Reconfiguring vulnerability: climate change adaptation in the Cambodian highlands,WOS:000671975900001,drawing field across four year examines project cambodian highland it examines logic rationality making vulnerable group resilient context it show adaption project tend understand vulnerability result series external threat arise due global expressed primarily lost income using example knaing village mondolkiri province show come vulnerability often unhelpful separate capitalist relation state territorialization economic political cultural relation people village find imbedded co produced interaction climatic force expansion capitalist relation state territorialization thus try sketch conception vulnerability based villager changing agricultural practice livelihood trajectory context expansion economic land concession logging surrounding forest settlement adjacent land state conservation effort
18,Barriers to climate change adaptation: Qualitative evidence from southwestern Iran,WOS:000647761400005,to minimize negative impact key there however range factor unless recognized dealt effectively prevent disrupt effort farmer barrier iran characteristic researched they need identified investigated inform policymaking provide assistance farmer us qualitative approach identify explore barrier susa county historic region khuzestan province southwestern iran data required obtained series focus group discussion n 50 semi structured interview key informant n 50 our result explored categorized numerous response barrier social cultural economic technological informational market based it important note reality margin classification much subtler many typology indicate based finding appropriate policy response recommended
19,Climate change adaptation: Linking indigenous knowledge with western science for effective adaptation,WOS:000441648200011,implementation response programme resilience anchored western scientific knowledge however led tendency marginalise indigenous knowledge considered unimportant process belfer et al 2017 lesperance 2017 whitfield et al 2015 yet knowledge system rarely develop isolation normally tend cross fertilize benefit in regard think indigenous knowledge important scientific knowledge two must integrated multiple evidence base approach mitigation in focussing african traditional society combine oral history available literature examine traditional knowledge awareness related environmental risk interesting theme emerge knowledge holder analysis uncovers wide range adaptive coping strategy applied mixed success from spotting reading position shape new moon interpretative correctness symbolism applied traditional climatology rainmaking ritual conservation wetland forest generally finding seem suggest traditional african knowledge environmental may old society local knowledge transmitted one generation next based perceived vulnerability indigenous community many scholar tend argue generically integration indigenous knowledge policy implementation ross 2009 maldonado et al 2016 etchart 2017 in however attempt supplement argument providing specific context ualised evidence indigenous knowledge linked it demonstrated indigenous knowledge neither singular universal rather voluminous diverse highly localised source wisdom conclude integration unique specific indigenous knowledge system evidence base knowledge could one best way effective sustainable implementation strategy among target indigenous community
20,"Long-term trends and changes in rainfall magnitude and duration in a semi-arid catchment, South Africa",WOS:000799345800001,investigated long term trend change rainfall magnitude duration semi arid catchment it crucial determine change rainfall support effort adapt highly vulnerable semi arid area trend long term seasonal annual rainfall magnitude duration determined using mann kendall mk quantile regression qr method sen slope used determine magnitude rainfall correlation analysis conducted determine influence altitude land use rainfall trend there dominant non statistically significant decreasing trend annual seasonal rainfall magnitude rainfall duration trend qr low 0 1 0 2 high 0 7 0 9 quantiles mostly deviated mk there weak variable correlation long term rainfall trend altitude land use land use topography may therefore adequately explain variation trend further study essential understand interaction environmental various factor influence rainfall trend variation trend impact future water resource availability allocation it important consider deviation developing measure ensure improved decision making
21,Adaptation to climate change: The impacts of optimized planting dates on attainable maize yields under rainfed conditions in Burkina Faso,WOS:000352329700003,high intra seasonal rainfall variability lack adaptive capacity major limiting factor rainfed agricultural production smallholder farming system across sub saharan africa therefore crop planting date low cost agricultural management strategy aiming alleviate crop water stress contribute enhance agricultural decision making particularly strategy by considering crop water requirement throughout crop growing cycle using process based crop model conjunction fuzzy rule based planting date approach location specific planting rule derived maize cropping burkina faso bf then applied regional future projection derive optimized planting date opds 2020s 2011 2030 2040s 2031 2050 respectively based potential maize yield simulation driven projection planting date opd approach compared well established planting date method west africa evaluated potential strategy on average opd approach achieved approximately 15 higher potential maize yield regardless regional model rcm period however potential yield surplus strongly decreased north south regarding combined impact opd approach shown average mean maize yield deviation 23 34 comparison 1989 2008 baseline period yield deviation found depend strongly rcm location rcm ensemble mean yield period 2011 2050 revealed maximum decrease 8 compared baseline period on one hand finding highlight potential opds crop management strategy hand apparent farmer need combine opds others suited farming practice adequately respond
