,title,wos,clean_abstract
96,Assessing climate change risks to the natural environment to facilitate cross-sectoral adaptation policy,WOS:000431148800002,policy requires prioritization action across many diverse issue policy agenda natural environment includes biodiversity soil water also associated human benefit agriculture forestry water resource hazard alleviation regulation amenity value to address broad agenda use comparative risk assessment investigated reference statutory requirement uk risk assessment risk prioritization defined current progress relative risk magnitude implementation lead time use ecosystem approach provided insight risk interaction challenge remain quantifying ecosystem service for risk indirect effect potential systemic risk identified land use responding socio economic driver causing increased competition land water resource strategy enhancing natural ecosystem resilience buffer risk sustain ecosystem service require improved cross sectoral coordination recognition dynamic to facilitate risk assessment need reflexive explicitly ass decision outcome contingent riskiness adaptability including required level human intervention influence uncertainty ethical dimension more national scale information also required occurring practice efficacy moderating risk part theme issue advance risk assessment policy
97,The hydrological impacts of restoration: A modelling study of alien tree clearing in four mountain catchments in South Africa,WOS:000804599500004,ecological restoration effort scale shown play important role reducing human impact environment improving halting extinction globally upscaling restoration effort requires funding therefore evidence benefit restoration needed aim contribute towards addressing gap 1 bolstering evidence base water related impact investment ecological restoration improving method predicting streamflow impact alien tree clearing 2 exploring potential size variability catchment response fine scale 60x60 one particular region comparing four different neighbouring catchment model im pact streamflow four strategic water providing catchment using fully distributed mike she modelling tool find benefit clearing mature infestation alien tree pine naturally tree le ecosystem increase available surface water resource 15 1 29 5 clearing riparian invasion predicted 1 7 time greater impact compared terrestrial non riparian invasion largest modelled impact restoration streamflow mid low flow impact greater dry year relative wet year finding novel shed light type spatial uncertainty expected modelled gain implication generalisation these finding important leveraging investment upscale restoration effort water scarce region suggest improved water security dry season drought upscaling effort essential degradation ecosystem globally prevented halted reversed proposed united nation decade ecosystem restoration
98,Building Climate Change Adaptation and Resilience through Soil Organic Carbon Restoration in Sub-Saharan Rural Communities: Challenges and Opportunities,WOS:000707778000001,soil organic carbon soc widely recognised pivotal soil function exerting important control soil structure moisture retention nutrient cycling biodiversity turn underpins range provisioning supporting regulatory ecosystem service soc stock sub saharan africa ssa threatened change land practice climatic factor destabilises soil system resilience continued here provide role soc overall soil health challenge opportunity associated maintaining building soc stock ssa a exemplar national case focus tanzania provide context jali ardhi care land project detail role soc soil system ii sustainable land management slm technique maintaining building soc iii barrier environmental economic social slm implementation iv opportunity overcoming barrier slm adoption provide evidence importance site specific characterisation biophysicochemical socio economic context effective in particular highlight importance soc pool soil function need practitioner consider type biomass return soil achieve healthy balanced system in line need local scale site characterisation discus use established survey protocol alongside opportunity complement recent technology rapid situ scanning tool aerial survey discus tool used improve soil health assessment develop critical understanding landscape connectivity management shared resource co design strategy
99,Impact of elevated CO2 on C:N:P ratio among soybean cultivars,WOS:000496780900111,elevated atmospheric co2 concentration eco 2 exerts significant influence nutrient requirement plant investigation
100,"Coupled insights from the palaeoenvironmental, historical and archaeological archives to support social-ecological resilience and the sustainable development goals",WOS:000792469200001,many government organisation currently aligning many aspect policy practice sustainable development goal sdgs achieving sdgs increase social ecological resilience shock like impact here consider relationship amongst three element sdgs social ecological resilience positive feedback loop argue long term memory encoded historical archaeological related palaeo data central understanding element feedback loop especially long term fluctuation inherent social ecological system response abrupt yet scant reference valuable contribution made data past sdgs target indicator historical archaeological record emphasise importance key theme running sdgs including diversity inclusion learning innovation reduce vulnerability abrupt role connectivity using paleo data demonstrate change extent water related ecosystem measured indicator 6 6 1 may simply related natural hydroclimate variability rather reflecting actual progress towards target 6 6 highlight issue associated using sdg indicator baseline predicated short term recent data within context contribution long term data inform positive feedback loop ask whether current inability substantively combat anthropogenic threatens achieving sdgs enhanced resilience argue long term record central understanding improve resilience enhance ability mitigate adapt however uptake data occur improved understanding quality potential policymakers manager required
101,Canadian horticultural growers' perceptions of beneficial management practices for improved on-farm water management,WOS:000708562900008,challenge agricultural production eastern affecting water resource availability farmer adoption improved water management practice technology play important part region strategy to facilitate diffusion agricultural beneficial management practice bmps essential examine factor influence farmer decision making barrier facilitator adoption while determinant adoption studied extensively past suggests context dependent gap exists relation understanding bmp characteristic perceived shape adoption therefore identifies key factor adoption improved water management system ontario que bec focusing difference adopter non adopter us data survey 70 fruit vegetable grower result show grower find important good steward land interested minimizing farm impact environment making good use scarce resource farmer also believe society help support cost associated safeguarding environment grower interested adopting bmps likely le farming experience diverse farming goal higher educational attainment higher degree specialization production tomato cranberry onion while majority grower perceived bmps profitable better alternative capacity reduce water use improve yield grower interested adopting bmps identified several issue view act barrier initial cost investment market instability policy response aimed enhancing diffusion bmps better targeted priority region grower incorporating communication strategy message resonate grower need take note concern raise
102,US medical organizations and climate change advocacy: a review of public facing websites,WOS:000871053700002,background pose risk health catastrophe must expeditiously addressed across health care sector physician considered trustworthy well positioned discus patient a unified strategy u s medical society essential effectively mitigate carbon footprint address health concern method conducted public facing website member organization ama house delegate ama scored based inclusion content related position statement policy task force committee patient education material practice recommendation official society publication membership medical society consortium health participation organization my green doctor recorded indicator commitment providing educational resource mitigation availability virtual option annual meeting potential mean reduce carbon footprint attendee trended 2021 2022 result fifty 111 u s medical organization 45 least one metric reference sixty one organization 55 evidence website content out 111 website 20 n 22 position statement policy pertaining 11 n 12 committee task force dealing 8 n 9 provided patient education resource 21 n 23 included green practice recommendation 45 n 50 official society publication addressing only 14 n 15 listed member society medical consortium 2 n 2 participating organization my green doctor conclusion viewed lens medical society website wide variation effort address high performing organization serve guide society help mitigate adapt emergency
103,A multi-stage supervised learning optimisation approach on an aerogel glazing system with stochastic uncertainty,WOS:000848562800003,adaptive aerogel material resilient condition dependent thermophysical property stochastic uncertainty enhance reliability robustness aerogel glazings whereas multidimensional optimal design highly dependent stochastic uncertainty magnitude sampling size leading ineffectiveness inefficiency traditional physic based model furthermore given time variant meteorological parameter high level uncertainty adaptive design aerogel material building glazing system resist heat flux reduce heat gain reduce cooling energy consumption subtropical climate in uncertainty optimisation conducted subtropical region sensitivity analysis using two stage learning approach result indicate increase stochastic sampling size 18 72 training epoch required learn accurate optimisation function increase 5000 20 000 compared deterministic scenario gradual decrease total heat gain noticed uncertainty based optimal scenario furthermore dynamic thermal performance highly dependent uncertainty magnitude insensitive stochastic sampling size quantifies impact sample size uncertainty magnitude dynamic thermal performance frontier guideline providing adaptive aerogel glazings stochastic scenario uncertainty
104,Climate change education for universities: A conceptual framework from an international study,WOS:000469901200093,role university education cce great importance scientific social environmental political challenge world face met future leader must make decision informed position public need embed mitigation tool work private life it therefore essential understand range cce strategy taken globally higher education institution hel explore analyse way heis could better address challenge consistent need offer analysis extent heis 45 country approach cce provides conceptual framework exploring hel embedding cce curriculum in addition specialist approach student choose degree become expert mitigation tool cce framework developed identifies highlight three approach hel deploy embed cce piggybacking mainstreaming connecting transdisciplinary using data gathered explorative international survey involving participant working across academic senior management illustrates different approach taken analysis practical example current cce practice across world response 212 university staff 45 country indicated cce highly variable clear pattern identified country level cce approach varying significantly even within individual hel plurality highlight wide range idea example shared used institution different country context underline importance independence autonomy heis choose right cce approach to highlight breadth variety approach uncovered survey offer range example illustrating education may embedded higher education context could replicated hel across world conceptualisation cce example given valuable anyone thinking strategy embedding education higher education curriculum
105,Biocultural Diversity for Food System Transformation Under Global Environmental Change,WOS:000714946100001,biocultural diversity central nutrition resilience adaptive capacity indigenous traditional people collectively maintain longest ongoing human experience provision food environmental in form crop livestock associated knowledge cultivation use food related biocultural diversity likewise underpins global food security a food system transformation increasingly recognized urgent priority argue food security sustainability resilience adaptive capacity furthered greater emphasis conservation use celebration food related biocultural diversity provide example parque de la papa peru food biocultural diversity neighborhood advocacy partnership based around diversity enhanced local community contributed food security much larger scale outline collaborative action believe important scale food biocultural diversity neighborhood success further knowledge sharing critical better document understand track communicate value function state biocultural diversity food system expanded training capacity development opportunity important enable interchange experience vision food health sustainability resilience equity justice livelihood generation others facing similar challenge finally strengthened networking across food biocultural diversity neighborhood essential persistence growth increasingly engage local national international organization based shared interest term across five continent
106,A new look at roles of the cryosphere in sustainable development,WOS:000481679700008,while cryosphere may bring adverse impact natural built environment may also provide benefit resulting cryosphere service by looking effect cryosphere human develops unified approach analysis cryospheric risk service one focusing adverse impact cryospheric hazard another emphasizing benefit people obtain natural capital cryosphere meanwhile could alter complicate role cryosphere change risk cryospheric hazard also change service could potentially add risk proposed risk based approach development cryosphere approach essentially take option reduce exposure vulnerability society cryospheric hazard better manage natural capital demand together enhancing utility cryosphere maintain benefit cryosphere service sustainable way address role cryosphere service strengthening sustainable development term relation sustainable development goal sdgs provides preliminary result service contributes sdgs overall approach developed creates new way comprehensively ass effect cryosphere change society identify measure maximize benefit minimizing risk relation cryosphere
107,Efficient adaptation to climate change,WOS:000087646800014,firm individual likely engage substantial private respect sector farming energy timber recreation interest shared benefit nature joint however cause individual underprovide joint area water control sea wall ecological management government need start thinking joint careful design efficient response treat problem arise
108,Building Climate Resilience in Coastal City Living Labs Using Ecosystem-Based Adaptation: A Systematic Review,WOS:000851695800001,lead unequivocal rise intensity frequency natural disaster necessitates mainstreaming strategy global movement action ecosystem based eba become popular effective mean resilient flexible compared hard engineering based measure however ecosystem based approach disaster risk reduction still remain researched despite growing popularity delf utility eba context living lab using prisma preferred reporting item systematic review meta analysis based systematic literature a living lab ll participatory tool invented foster innovation real life testing environment individual city focus european coastal region highly populated vulnerable impact sea level rise storm flooding erosion identified multiple synergy eba concept living lab disaster risk reduction concludes eba scheme highly effective living lab set it also demonstrates increased stakeholder engagement consideration socio economic co benefit part eba ll model lead successful disaster risk reduction
109,Enhancing climate resilience of irrigated agriculture: A review,WOS:000719723800006,emerging evidence showing trend strong likelihood change continue elevates importance finding affordable adaptation irrigated agriculture successful measure needed affordably sustain irrigated agriculture face elevated carbon emission affecting reliability water supply numerous potential option available adjusting irrigated agricultural system implement risk work focus addressing gap literature defined scarcity review measure elevate capacity irrigated agriculture enhance resilience accordingly original contribution work literature describing measure enhancing resilience irrigated agriculture in addition describes role economic analysis discover affordable measure enhance resilience irrigated agriculture it achieves aim posing question what principle practice recent development available guide discovery measure improve resilience irrigated agriculture adapt ongoing evidence it address question reviewing several risk reduction measure control economic cost loss irrigators face growing water supply unreliability following role optimizing portfolio measure described followed discussion potential contribution made use hydroeconomic analysis result provide framework economic analysis discover economically attractive method elevate resilience irrigated agriculture
110,Incorporating climate change adaptation into local plans,WOS:000335847000002,local government encourage proactive action incorporating measure long term planning document author undertook action oriented case participating expert process create sustainability land use policy plan city prince george a range measure incorporated document factor enabling incorporation included high level local awareness existing strategy draw upon flexible process used create plan challenge lack priority limited policy direction perception solely environmental challenge persist barrier incorporating local plan particularly smaller centre
111,The Impact of Fair Trade on Smallholders' Capacity to Adapt to Climate Change,WOS:000440563800005,aim ass extent producer participation fair trade increase adaptive capacity make resilient based deficit framework fankhauser mcdermott 2014 expert interview 39 producer organization latin america asia africa first determine perception impact fair trade producer organization analyze fair trade helping producer increase adaptive capacity our result suggest fair trade affect adaptive capacity smallholder farmer developing country two way first work growth policy affect disposable income partly spent measure second increased knowledge exchange higher degree social capital better access international community make supply efficient
112,The effect of climate change across food systems: Implications for nutrition outcomes,WOS:000445936400002,a better understanding pathway linking nutrition critical developing effective intervention ensure world population access sufficient safe nutritious food us food system approach analyze bidirectional relationship food nutrition along entire food supply chain it identifies mitigation intervention step food supply chain move toward smart nutrition sensitive food system there many entry point double duty action address nutrition need implemented scaled government
113,Climate change and adaptation of the health sector: the case of infectious diseases,WOS:000364945600005,infectious disease form group health problem highly susceptible influence protect human population health change infectious disease epidemiology expected occur consequence involve action health system well non health sector in health sector strategy enhanced targeted epidemiological entomological surveillance development epidemic early warning system informed scenario needed measure sector meteorology civil defense environmental sanitation also contribute reduction risk infection
114,"Opportunities and challenges for mainstreaming ecosystem-based adaptation in local government: evidence from the Western Cape, South Africa",WOS:000361483600010,ecosystem based reduce social vulnerability hazard sustainable long term hard technical solution thus provide strong argument conservation natural ecosystem a entity directly responsible local level planning management municipality represent potentially key site implementing ecosystem based present result investigated extent eight local municipality knowledge mainstreaming ecosystem based issue western cape south africa most municipality little understanding ecosystem based issue limited implementation relevant action our finding suggest ecosystem based mainstreaming local government assisted increasing learning networking opportunity municipality increasing profile concept ecosystem based well conducting barrier enablers collaborative governance
115,It's not now or never: Implications of investment timing and risk aversion on climate adaptation to extreme events,WOS:000376544700024,public investment risk reduction infrastructure play important role facilitating impacted hazard natural disaster in provide economic framework incorporate investment timing insurance market risk preference evaluating project related reducing impacted risk model applied case bushfire risk management find optimal timing investment may increase net present value npv project various level risk aversion assuming risk neutrality market risk averse found result unnecessary delay investment risk reduction project optimal waiting time shorter insurance market risk averse serious scenario climatic assumed a higher investment cost higher discount rate increase optimal waiting time also find stochastic discount rate result higher npvs project discount rate assumed fixed long run average level
116,Role of community-based conservation and natural resource management in building climate resilience among vulnerable mountain societies,WOS:000879256300001,role community based conservation cbc natural resource management cbnrm protecting ecosystem improving socioeconomic well received considerable attention contribution le understood using mixed method case approach current compare two site khyber khudaabad northern pakistan comparable socioeconomic feature varying level effectiveness cbc cbnrm programme cbc khyber proactive khudaabad data collected household survey n 220 110 site key informant interview n 8 office bearer community based organization 4 site extensive document in comparison khudaabad finding revealed local community khyber demonstrated improved resilience proactive community based governance system improved practice access social service disaster preparedness improved knowledge concludes cbc cbnrm contributes building resilience among vulnerable mountain community strengthening social ecological system suggests building resilience vulnerable community instead investing stand alone measure government must focus ecosystem based adaption integrate specific mitigation action existing cbc cbnrm programme
117,Volatile organic compounds as mediators of plant communication and adaptation to climate change,WOS:000902119600001,plant volatile organic compound abundant structurally diverse plant secondary metabolite they play key role plant lifespan via direct indirect plant defense attracting pollinator mediating various interaction plant environment ecological diversity context dependence plant plant communication driven volatile crucial element influence plant performance different habitat plant volatile also valued multiple application food flavor pharmaceutical cosmetic industry in current summarize recent advance elucidated function plant volatile organic compound mediator plant interaction community individual level highlighting complexity plant receiver feedback various signal cue emphasizes volatile terpenoids abundant class plant volatile organic compound highlighting role plant adaptability global stress response pathway integral plant growth survival finally identify gap suggest future direction
118,Perspective Ensuring that nature-based solutions for climate mitigation address multiple global challenges,WOS:000808103500012,protection restoration management sustainable use natural modified ecosystem address mitigation received much global attention recent year those type action however often designed also address global challenge miss opportunity provide important non mitigation benefit compromise mitigation potential here highlight importance planning nature based solution mitigation considering suite global challenge society face propose set consideration ensure type solution also provide biodiversity human well benefit planning nature based solution mitigation also address global challenge timely every nature based effort grasp opportunity address variety pressing issue order allow continued delivery mitigation benefit critical decade
