,title,wos,clean_abstract
47,"Day Zero and The Infrastructures of Climate Change: Water Governance, Inequality, and Infrastructural Politics in Cape Town's Water Crisis",WOS:000522267700001,from 2015 2018 cape town south africa marked fear water crisis city tap threatened run dry argue cape town crisis water scarcity product convergence ongoing contradiction south african water governance came contact shifting infrastructural priority associated in response possibility financial crisis brought reduced water consumption city withdrew universal provision free basic water fbw reconfigured existing tariff structure both change meant city moved commercialization valuation practice context restricted monetary flow based understanding contemporary governance south africa reflective often contradictory need balance municipal budget also correcting apartheid inequity argue ongoing experience stretching existing municipal budget way threaten deepen existing inequality ultimately suggest cape town crisis critical understanding reconfiguring existing governance dynamic planetary scale thus offering insight form urban may take future
48,Caribbean Small-Scale Fishers' Strategies for Extreme Weather Events: Lessons for Adaptive Capacity from the Dominican Republic and Belize,WOS:000555206000001,understanding caribbean small scale fisher adapt critical sustaining coastal community livelihood region fisher continuously adapt practice variability recurring extreme weather event hurricane however remains unclear everyday response contribute building adaptive capacity future change unpredictable extreme event identifies analyzes strategy used fisher dominican republic belize deal extreme weather event variability draw two separate case study identify current autonomous adaptive strategy explore align broader dimension adaptive capacity find fisher country respond change variability relying three strategy 1 storing saving borrowing resource 2 using experiential knowledge flexibility mobility 3 diversifying livelihood intensifying fishing show fisher build adaptive capacity flexibility sustain livelihood local knowledge mitigate risk damage extreme weather event argues adaptive response used fisher dominican republic belize sustain livelihood cannot enable long term transformative ongoing cumulative change
49,Evaluating wider benefits of natural flood management strategies: an ecosystem-based adaptation perspective,WOS:000346820900004,projected alter river flow magnitude frequency characteristic flood drought ecosystem based highlight interdependence human natural system potential buffer impact maintaining functioning ecosystem continue provide multiple societal benefit natural flood management nfm emphasising restoration innate hydrological pathway provides important regulating service relation runoff rate water quality heralded potentially important strategy draw together 25 nfm scheme providing meta analysis hydrological performance along wider consideration net dis benefit increasing woodland coverage whilst positively linked peak flow reduction pronounced low magnitude event biodiversity carbon storage adversely impact provisioning service especially food production similarly reversing historical land drainage operation appears mixed impact flood alleviation carbon sequestration water quality depending landscape setting local catchment characteristic wetland floodplain restoration strategy typically fewer disbenefits provide improvement regulating supporting service it concluded future nfm proposal framed ecosystem based assessment trade offs considered case case basis
50,Monitoring Green Infrastructure for Natural Water Retention Using Copernicus Global Land Products,WOS:000477049000075,nature based solution increasingly relevant tool spatial environmental planning cca disaster risk reduction drr for reason wide range institution government financial body currently promoting use green infrastructure gi alternative complement traditional grey infrastructure a considerable amount already certifies benefit multi functionality gi natural water retention measure nwrms gi related specifically water sector also known instance key instrument prevention mitigation extreme phenomenon flood drought however persisting difficulty locating identifying gi one promising solution issue use satellite based data product hampered lack well grounded knowledge experience tool to bridge gap performed copernicus global land service cgls product consist freely available bio geophysical index covering globe mid low spatial resolution specifically focused vegetation energy index examining previous work made use evaluating current quality aiming define potential studying gi especially nwrms related agriculture forest hydro morphology nwrm benefit also considered analysis namely nwrm biophysical impact bps ii ecosystem service delivered nwrms es iii policy objective po expressed european directive nwrms help achieve result meant assist gi user employing cgls product ease decision making process based previous experience quality currently available version analysis provides useful tool identify index used several type nwrms ass benefit prioritize suitable one
51,Water transit time and active recharge in the Sahel inferred by bomb-produced Cl-36,WOS:000468026100007,lack data suitable method quantify regional hydrological process often hinders sustainable water management semiarid region particularly sahel known climatic variability here show cl 36 nuclear test promising method estimate water transit time groundwater recharge rate catchment scale distinguish water chloride cycle cl 36 measured 131 surface groundwater sample chari logone sub catchment emblematic lake chad basin located central sahel it found 12 8 catchment connected main river groundwater supporting river upper humid part catchment mean transit time 9 5 1 year recharge rate 240 170 mm yr 1 in lower sahelian part catchment stream focused recharge yield recharge rate 78 7 mm yr 1 riparian groundwater 16 27 mm yr 1 elsewhere our estimate suggest aquifer sahel host significant amount renewable water could therefore used strategic freshwater resource
52,Climate Change Adaptation Strategies and Approaches for Outdoor Recreation,WOS:000506899000139,alter opportunity demand outdoor recreation altered winter weather condition season length driven change user preference damage recreational infrastructure among factor to ensure outdoor recreation remains sustainable face challenge natural resource manager may need adapt recreation management one major challenge adapting recreation translating broad concept specific tangible action using combination depth interview recreational manager peer reviewed literature government report developed synthesis impact strategy approach tiered structure organizes information six broad strategy 25 specific approach identified organized recreation menu recreation menu tested two national forest u multi day workshop designed integrate concept real world project beginning stage planning process found recreation menu broad yet specific enough applied recreation focused project different objective impact these strategy approach serve stepping stone enable natural resource recreation manager translate broad concept targeted prescriptive action implementing
53,"Climate Change, Water Scarcity, and Health Adaptation in Southwestern Coastal Bangladesh",WOS:000455920000003,may affect human health multiple interactive pathway include safe water scarcity however impact induced water scarcity health well complex about 80 illness developing country attributed unsafe drinking water waterborne disease in southwestern bangladesh lack safe drinking water severe crisis due investigated impact water resource human health coastal area a questionnaire survey carried two village shymnagar upazila southwestern coast investigate present status safe water source health care facility impact local community result show local community belief substantial impact freshwater source health more 70 respondent identified diarrhea dysentery skin disease prime waterborne health risk occur related safe water scarcity by synthesizing ground data suggest pathway health effect safe water scarcity locally available adaptive practice use pond sand filter rainwater harvesting importing potable water active participation government nongovernmental organization community
54,Coastal adaptation to Sea Level Rise: An overview of Egypt's efforts,WOS:000782269600001,coastal zone recognized priority area without robust effective numerous coastal zone drastically affected there ongoing need coastal particularly low lying delta highly vulnerable coastal hazard based sea level rise slr worldwide national coastal strategy mainly focusing three coastal approach issued international panel retreat accommodation protection developed developing country made serious effort adapt slr investigates egyptian effort best practice experience dealing coastal erosion flooding inundation based slr egyptian national strategy coastal mainly adopted protection approach along nile delta coast egypt various national project contain coastal measure detected seawall revetment sand dune nourishment artificial sand dune based geotextile sand tube core using natural reed mat sand trapping in addition different action constructing modern fish farming regular dredging coastal lake lagoon enforcing coastal road observed all provide defense system most promising technology effort action show favorable response guarantee adequate protection slr hazard
55,Unavoidable solutions for coastal adaptation in Reunion Island (Indian Ocean),WOS:000447557600041,recent past trajectory vulnerability related hazard allows highlighting prevailing environmental anthropogenic driver operated last fifty sixty year given latency phenomenon social system therefore potential continue driving system vulnerability coming decade stop even reverse trend represents much unavoidable solution enhancing concrete long term whatever end century warming scenario using case reunion island indian ocean emphasize four major driver recent coastal trajectory vulnerability e change human built asset shoreline position natural buffer characteristic extent coastal protection structure together driver highlight need controlling urbanisation process reduce anthropogenic pressure exerted morphological ecological system restoring buffering function latter moving towards le hard structure dependent coastal defence strategy such shift coastal management however supposes radical change way coastal development strategy consider environmental issue hazard resource service here bring empirical material showing neither reunion island decision maker keen drive radical change population ready accept potentially constraining policy benefit future conclude need advancing design pathway build implementation context specific unavoidable solution thus seriously consider limiting risk maladaptation baseline strategy
56,"Energy, Backstop Endogeneity, and the Optimal Use of Groundwater",WOS:000343053800009,to meet growing demand freshwater many region increased groundwater pumping recent year resulting declining groundwater level worldwide a promising development address decline technical regarding groundwater substitute desalination wastewater recycling however technology energy intensive optimal implementation also depends future energy price trend provide operational model case reverse osmosis seawater desalination in application pearl harbor aquifer hawaii find allowing cost desalination increase average annual rate 2 4 next century result substantially steeper efficiency price path water higher price decrease optimal groundwater extraction induce slower head drawdown longer period time thereby delaying transition desalination 30 year because rise energy cost exacerbates efficiency loss pricing delay implementing efficiency pricing cause either greater future increase price need rationing reforming price sooner rather later may politically feasible given consumer may amenable gradual rise price today sudden doubling tripling price ten year using foundation outline agenda extending framework groundwater substitute adapting
57,"Identified vulnerability contexts for a paddy production assessment with climate change in Bali, Indonesia",WOS:000393873100002,indonesia one country vulnerable a small indonesian island bali likely also affected impact including rising sea level drought flooding also impact paddy production show focus area vulnerability assessment bali identified based multiple assessment including literature review statistical assessment stakeholder policy assessment interview farmer a project team applied six step process identify issue linked purpose system vulnerability assessment potential risk harm context potential variable assessment team identified paddy production significant issue purpose system presidential decree no 5 paddy production significant concern linked paddy production included drought land use potential variable vulnerability assessment water level price rice suggests adaptive measure implemented handle paddy production changing result used vulnerability assessment rice paddy takama t setyani p aldrian e 2014 vulnerability rice paddy production bali indonesia in w leal filho ed handbook pp 1 23 berlin springer
58,Evidence of Taxonomic and Functional Recovery of Macroinvertebrate Communities Following River Restoration,WOS:000690071500001,river ecosystem heavily degraded globally due channel hydromorphological modification alteration catchment wide process restoration action aimed addressing change restoring ecological integrity increasing evidence effectiveness action variable using rare 7 year control impact baci restoration lowland groundwater fed river england uk explore change macroinvertebrate community following removal impoundment channel narrowing aid restoration physical process restoration activity prompted significant taxonomic functional response benthic invertebrate community 4 year post restoration specifically significant gain taxonomic functional richness evident following restoration although corresponding evenness diversity measure mirror trend restoration activity prompted shift rheophilic taxon associated trait matching physical change channel habitat composition temporal change clearer taxonomic composition compared functional property macroinvertebrate community indicating functional redundancy effect new colonist inhabiting restored reach following restoration result highlight value long term baci study river restoration assessment well project appraisal incorporating taxonomic functional observation highlight urgent need study provide evidence inform effective river restoration strategy address future change adaption biodiversity crisis
59,Monitoring climate change and anthropogenic pressure at Lake Tanganyika,WOS:000454568800006,african great lake threat global local environmental challenge including climatic water pollution overfishing to address issue manager need observation based regularly monitored environmental indicator however environmental monitoring african great lake often lacking based harmonised method present manuscript case based lake tanganyika impacted anthropogenic pressure affecting water quality fishery biodiversity change implementation environmental monitoring often continuous standardised among bordering country prevents manager taking data based decision open risky field speculation may overcome rational approach long term monitoring observation essential guide management measure adapt change decrease whenever possible unfavourable human impact great lake environment a regionally standardised long term monitoring programme proposed sustainability monitoring requires remains inexpensive focus essential parameter it strength would uninterrupted implementation setting long term integrated monitoring programme also goal lake tanganyika authority lta mandated national authority stakeholder a lake tanganyika regional integrated monitoring programme ltriemp need widely encouraged supported ensure sustainability general principle lake tanganyika case could useful develop wider harmonised sustainable long term regional monitoring network african great lake multi lake collaborative approach
60,Critical infrastructure protection actualities with emphasis to public water supply,WOS:000834966000005,water unique irreplacable limited natural resource uneven global spatial temporal distribution fact life form human activity le related water clearly show importance relation protection water change recorded hydrological extreme flood drought becoming pronounced change ongoing task necessary develop maintain water management water utility facility system sustainable way in addition growing security threat water infrastructure asymmetric threat challenge cyber attack deliberate pollution terrorist attack sabotage etc economic development urbanization leading large increase water demand respect water becoming limiting factor development therefore utmost importance initiate protection water resource protection distribution water supply infrastructure republic croatia reduce security threat critical infrastructure applying approach primarily related legislative framework plan program activity need implemented level critical infrastructure management
61,Is ice in the Himalayas more resilient to climate change than we thought?,WOS:000623031000001,in himalaya threatens mountain water resource glacier melt change runoff water availability likely considerable negative impact ecological human system while much written effect glacier himalaya impact sustainability almost nothing published rock glacier region role maintaining water supply warms rock glacier important component himalayan hydrological system present almost region himalaya climatically resilient glacier type owing insulating layer debris cover mountain region show contain potentially important water store although himalaya almost information number spatial distribution response future extent contributes higher resilience himalayan cryosphere whole still open question argues himalayan rock glacier reveals hydrological significance critical underpinning strategy ensure highly populated region strong position meet sustainable development goal
62,"Toward hydro-social modeling: Merging human variables and the social sciences with climate-glacier runoff models (Santa River, Peru)",WOS:000342863600007,glacier shrinkage caused likely trigger diminished le consistent stream flow glacier fed watershed worldwide to understand model adapt glacier water change vital integrate analysis water availability domain hydrologist water use focus social scientist drawn case santa river watershed peru glaciated cordillera blanca mountain range provides holistic hydro social framework identifies five major human variable critical hydrological modeling force profoundly influenced water use last 60 year 1 political agenda economic development 2 governance law institution 3 technology engineering 4 land resource use 5 societal response notable shift santa river water use including major expansion hydroelectricity generation large scale irrigation project land resource use practice necessarily stem changing glacier runoff hydrologic shift rather human variable ultimately water usage predictable based water availability alone glacier runoff conforms certain expected trend predicted model progressively reduced glacier storage however societal force establish legal economic political cultural social driver actually shape water usage pattern via human modification watershed dynamic hydro social framework widespread implication hydrological modeling glaciated watershed andes alp himalaya tien shan well development plan
63,Climate adaptation and WASH behavior change in the Lake Victoria Basin,WOS:000936361700001,a disrupts global hydrological cycle bringing extreme flooding drought many community experience change water sanitation quality access requiring adaptive behavior change set map pattern namely strategy employed cope water sanitation hygiene wash related impact within mabinju community located along bank lake victoria western kenya qualitative method employed involving 17 semi structured individual interview seven focus group village member insight derived direct conversation village member deepened qualitative interview additional 13 wash sector stakeholder working wider lake victoria basin region through various wash specific community measure identified positive negative impact long term local resilience while many positive coping strategy found spurred creative faculty local resident capacity found restrained broader force poverty resource access resulting adoption certain maladaptive coping mechanism these finding highlight need intervention wash sector simultaneously build existing resilience enhancing measure addressing root cause maladaptation
64,Irrigation of green spaces and residential gardens in a Mediterranean metropolis: Gaps and opportunities for climate change adaptation,WOS:000453643000004,many city facing water shortage plan prioritized water saving prevent devastating consequence drought to develop plan critical understand water use pattern city present determines water consumption irrigation green space residential garden metropolitan area santiago chile ma compare consumption expected vegetation water requirement estimated using hydrological model monthly water consumption obtained database drinking water meter provided private water utility serving ma includes 110 large park 1882 small park ma show higher water consumption summer dry month november april water use irrigation higher modelled demand vegetation entail significant chance save water irrigation rate public space lower private space closer modelled demand in case landscaping based extensive lawn surface seems main driver irrigation further required trade offs urban green benefit cost irrigation semi arid mediterranean city
65,"How do natural climate variability, anthropogenic climate and basin underlying surface change affect streamflows? A three-source attribution framework and application",WOS:000513987500006,streamflows many river detected declining recently due environmental change dominating water management strategy affecting water security decline usually ended attribution underlying surface change without exploring effect natural anthropogenic component it might lead overestimation human induced impact inappropriate identification anthropogenic element streamflow crucial increasingly required water management planning mitigation action a novel framework proposed streamflow attribution term three source natural variability ncv anthropogenic acc underlying surface change basin result suggest role underlying surface change basin overwhelms recent historical period however natural variability could neglected since may play dominant role streamflow compared anthropogenic result also highlight need clarify effect human induced underlying surface change goal mitigation uncertainty attribution analyzed contrast attribution work case source presented explicitly conclusion could facilitate better understanding hydrological process result environmental change provide efficient reference administrator decision maker
66,Seasonal controls on nearshore dissolved oxygen variability and hypoxia in a coastal embayment,WOS:000889487800002,declining dissolved oxygen do emerging increasingly important stressor nearshore ecosystem growing need better understand do dynamic hypoxia risk highly variable environment in collected data monthly cruise inner shelf continuous nearshore mooring inside outside small coastal upwelling embayment san luis obispo bay central california weekly phytoplankton measurement inside bay upwelling season nearshore do generally domi nated low frequency synoptic variability increased do variance near surface relative bottom inside bay compared outside two nearshore hypoxic regime identified in first regime occurred period strong upwelling spring across nearshore site nearshore bottom water temperature do t do relationship aligned found offshore suggesting hypoxia driven direct advection cross shelf exchange low do subthermocline water shelf period also coincided minimal water column stratification small vertical do difference diatom dominated phytoplankton assemblage in second regime occurred summer month characterized weaker upwelling strong stratification dinoflagellate dominated phytoplankton assemblage near bottom t do relationship inside bay deviated significantly shelf offshore these hypoxic event inside bay likely driven localized respiration lack ventilation bottom water due strong stratification collectively observation reveal shift strength magnitude physical versus biological process driving nearshore do dynamic high spatiotemporal variability do dynamic upwelling bay mean likely forefront ecosystem impact adaption may act sentinel system canary coast
