,title,wos,clean_abstract
375,Migration and climate change: towards an integrated assessment of sensitivity,WOS:000289178200013,set new approach understanding relationship migration based understanding migration significant growing also complex phenomenon approach seek address sensitivity existing migration driver specific context in contrast existing approach sought generate global level estimate number migrant integrated assessment approach seek instead understand existing flow specific location may future provide practical tool planning example application approach provided ghana bangladesh
376,Methodological Proposal to Determinate Beneficiaries on Projects with Climate Change Adaptation Approach,WOS:000502987800004,work show importance determining benefit beneficiary project ecosystem based approach based rigorous analysis observance positive change well population improvement environment participatory cartography geographic information system used effective tool spatial analysis benefit beneficiary different knowledge articulated represent reality participatory manner a methodological proposal made identification beneficiary project ecosystem based approach based intervention community coastal ecosystem
377,"Understanding the Intersection of Climate/Environmental Change, Health, Agriculture, and Improved Nutrition: A Case Study on Micronutrient Nutrition and Animal Source Foods",WOS:000593009700001,with growing global population demand high quality food meet nutritional need continues increase our ability meet need challenged changing environment includes constraint land water resource growing concern impact human activity including agricultural practice changing adaptation meet food nutritional demand avoiding unintended consequence including negatively affecting environment needed cover specific case role animal source food asfs meeting micronutrient need changing environment cover understanding role asfs meeting micronutrient need evidence based approach development nutrition guidance current issue associated relation animal production practice greenhouse gas emission example might model myriad source relevant data better understand complex interrelation
378,Institutional and technological innovation: Understanding agricultural adaptation to climate change in Nepal,WOS:000298778000017,history show farmer supporting institution successful introducing technological innovation respond adapt environmental socioeconomic challenge innovation mechanism society adapt changing resource endowment turn driven social cultural value in future resource condition change role institution process technological innovation would crucial avoid deleterious consequence agriculture using nepal case illustrates farmer supporting institution evolving co producing sensitive technology demand drawing upon hypothesis induced innovation examine extent resource endowment influenced evolution technological institutional innovation nepal agricultural development reveals nepal developed novel multilevel institutional partnership including collaboration farmer non governmental organization recent year more importantly combining conventional technological innovation process tacit knowledge farmer new alliance instrumental innovation location specific technology thereby facilitating adoption technology efficient manner alliance improved knowledge network among institution scientist farmer enabled seek technology responsive likely change
379,Everyday Adaptation: Theorizing climate change adaptation in daily life,WOS:000827270100009,science date demonstrates natural human system must urgently adapt refers change society ecological system respond actual anticipated impact changing while limited level planning policy existing practice privilege institutional action argue definition broadened include small incremental change made daily life accommodate shifting ecology live drawing critical ethnographic fieldwork global south define everyday shifted way person work eats life think response reality rather hardening coastline relocation vulnerable structure integrate build existing scholarship everyday theorize logic everyday hyperlocal hyperlocal scale critical component definition useful lens studying way much global population adapts continue adapt life offer two theoretical component revealed everyday labor value lens see change everyday action through considering hyperlocal action identify explore four logic everyday action lifestyle stability socio ecological reactivity livelihood flexibility community capacity everyday adaptation limited individual capacity adapt thereby determine longevity livability quality life place frontlines argue understanding aggregate effect everyday order better align action living everyday life large scale project aiming protect
380,Cross-border organisations as an adaptive water management response to climate change: the case of the Guadiana river basin,WOS:000271815500009,in analyse role played cross border organisation guadiana river basin iberia extent new emerging institutional arrangement carry adaptive management practice response mounting risk river basin particular attention paid new transboundary agency promoted eu interreg programme potential mainstreaming consideration guadiana river basin development strategy result indicate penetration concern regional development policy requires better integration different policy improved connectivity coordination multiple actor operating across sector different spatial scale argue emergence new transboundary agency capable performing bridging function vital ingredient building adaptive capacity cross border region
381,Towards a climate change adaptation strategy for national parks: Adaptive management pathways under dynamic risk,WOS:000447557600023,government seek manage public protected area national park conserve high quality wildlife habitat provide essential ecosystem service risk permanent damage extinction complexity organizational structure required deliver breadth function coupled uncertainty surrounding onset severity impact local scale impedes planning describes development planning tool application pilot planning process national park wildlife service agency new south wale nsw government responsible management national park public conservation reserve process involved close engagement knowledge co production participatory workshop employed two complementary technique adaptive pathway risk assessment it successfully elicited tacit knowledge agency staff range intervention available need management practice evolve discontinuity management pathway dynamic risk environment finding suggest management effort across nsw reserve system increase risk rise consequently government need respond increased demand resource better targeting resource management innovation resource deployed support anticipatory transformative
382,"Life-cycle maintenance strategy of bridges considering reliability, environment, cost and failure probability CO2 emission reduction: A bridge study with climate scenarios",WOS:000925129300007,significantly affect existing infrastructure enhancing deterioration concrete structure a number repair strengthening increase service life bridge cost environmental impact gradually increase well aim propose framework adaptability considering reliability environment cost realize optimization life cycle maintenance strategy bridge in four preventive maintenance four essential maintenance bridge comprehensively considered reliability environmental impact cost bridge maintenance stage quantitatively analyzed by using decision tree method optimal strategy bridge life cycle maintenance reinforcement scenario proposed environmental impact environmental cost economic cost comprehensive cost optimization objective respectively finally failure probability calculation model emission reduction target bridge estimated based co2 emission reduction target china paris agreement to demonstrate applicability proposed framework typical highway bridge taken example it observed result maintenance strategy determined different optimization objective show great difference environmental economic cost with deepening scenario failure probability bridge emission reduction maintenance strategy diverse optimization objective increase 10 20 finding highlight adaptability assessment framework significant optimizing maintenance budget environmental impact aging bridge structure china expected support decision making bridge maintenance influence
383,Facilitating climate change adaptation through communication: Insights from the development of a visualization tool,WOS:000218708600007,communication anticipated impact adaptive response frequently presented effective mean facilitate implementation mitigate risk residential building however requires communication developed way resonates context target audience provides intelligible information address perceived barrier in reflect upon criterion useful communication gained three year development process web based tool visadapt tm aimed increasing adaptive capacity among nordic homeowner based result continuous user testing focus group interview outline lesson learned key aspect consider design tool communicating complex issue effect adaptive response measure
384,The effect of climate change across food systems: Implications for nutrition outcomes,WOS:000445936400002,a better understanding pathway linking nutrition critical developing effective intervention ensure world population access sufficient safe nutritious food us food system approach analyze bidirectional relationship food nutrition along entire food supply chain it identifies mitigation intervention step food supply chain move toward smart nutrition sensitive food system there many entry point double duty action address nutrition need implemented scaled government
385,"Everyday adaptation, interrupted agency and beyond: examining the interplay between formal and everyday climate change adaptations",WOS:000905094800004,increasingly widespread intense in response formal effort gaining momentum financing globally affected address felt change variety everyday adaptation aggregate daily practice articulated response ongoing social ecological our examined interplay formal everyday adaptation practice specifically sought shed light tendency emerging literature term interrupted agency formal intervention interrupt everyday strategy agency local actor potentially leading maladaptation north central vietnam disrupting life livelihood numerous formal everyday measure implemented response examined three key affected sector agriculture water management coastal management drawing existing literature well interview document policy found difference formal everyday adaptation indeed lead interrupted agency yet instance also support complementarity even transformative such outcome required dialogue pluralistic input related policy practice decision making underlining importance attention participation representation influence decision making effort our exploration concept everyday interrupted agency illustrates valuably contribute literature particularly politics
386,Restoring forest resilience: From reference spatial patterns to silvicultural prescriptions and monitoring,WOS:000316827500046,stand level spatial pattern influence key aspect resilience ecosystem function disturbance behavior regeneration snow retention habitat quality frequent fire pine mixed conifer forest reference site pre settlement era reconstruction contemporary forest active fire regime indicate frequent fire forest complex mosaic individual tree tree clump opening there broad scientific consensus restoration treatment seek restore mosaic pattern order restore resilience maintain ecosystem function yet method explicitly incorporate spatial reference information restoration treatment widely used in addition target reference condition must critically evaluated light used spatial clump identification algorithm quantify reference pattern based specified inter tree distance defines tree form clump used climatic water balance parameter scaled projection plant association ass historical reference site context projected future identify analog reference condition spatial reference information incorporated novel approach prescription development tree marking monitoring based viewing stand structure pattern term individual clump opening ico mixed conifer forest restoration case compared result ico approach simulation traditional basal area spacing based thinning prescription term agreement reference condition functional aspect resilience ico method resulted distribution tree clump opening within range reference pattern basal area spacing approach resulted uniform pattern inconsistent known reference condition susceptibility insect mortality lower basal area spacing prescription opening corresponding opportunity regeneration situ fewer operationally method struck balance providing clear target spatial pattern directly linked reference condition sufficient flexibility achieve restoration objective implementation efficiency need track pattern target implementation provide immediate feedback marking crew key lesson ico method especially used combination analog reference target offer practical approach restoring spatial pattern likely enhance resilience
387,Weathering climate change: some simple rules to guide adaptation decisions,WOS:000081740200007,discus element may characterise efficient strategy adapt changing such strategy reflect long time horizon prevailing uncertainty an intuitively appealing approach therefore seems enhance flexibility resilience system react cope shock extreme well improve information in addition case quasi irreversible investment long lifetime e g infrastructure investment development coastal zone precautionary adjustment may called increase robustness structure increase rate depreciation allow earlier replacement many measure may already considered could worthwhile right independent consideration
388,Climate change and adaptation of the health sector: the case of infectious diseases,WOS:000364945600005,infectious disease form group health problem highly susceptible influence protect human population health change infectious disease epidemiology expected occur consequence involve action health system well non health sector in health sector strategy enhanced targeted epidemiological entomological surveillance development epidemic early warning system informed scenario needed measure sector meteorology civil defense environmental sanitation also contribute reduction risk infection
389,A social and ecological imperative for ecosystem-based adaptation to climate change in the Pacific Islands,WOS:000321066000011,predicted range impact pacific island ecosystem service provide current future development there number characteristic make approach utilise benefit ecosystem compelling viable alternative approach objective determine level relative influence technical planning consideration currently guiding recognition application ecosystem based eba approach pacific island context technical feasibility eba relation expected impact compatibility planning process pacific island eba requirement considered main barrier fully implementing eba pacific island likely financial capital combination stable technical capacity within government department advise community eba opportunity compatibility planning framework
390,"Opportunities and challenges for mainstreaming ecosystem-based adaptation in local government: evidence from the Western Cape, South Africa",WOS:000361483600010,ecosystem based reduce social vulnerability hazard sustainable long term hard technical solution thus provide strong argument conservation natural ecosystem a entity directly responsible local level planning management municipality represent potentially key site implementing ecosystem based present result investigated extent eight local municipality knowledge mainstreaming ecosystem based issue western cape south africa most municipality little understanding ecosystem based issue limited implementation relevant action our finding suggest ecosystem based mainstreaming local government assisted increasing learning networking opportunity municipality increasing profile concept ecosystem based well conducting barrier enablers collaborative governance
391,Improving the use of crop models for risk assessment and climate change adaptation,WOS:000419415700027,crop model used increasingly broad range application commensurate proliferation method careful framing question development targeted appropriate method therefore increasingly important in conjunction author special issue developed set criterion use crop model assessment impact risk our analysis drew paper special issue experience uk risk assessment 2017 macsur agmip isimip project criterion used ass improvement could made framing risk outline good practice new development needed improve risk assessment key area good practice include development running documentation crop model attention given issue spatial scale complexity ii method used form crop ensemble based model skill spread iii method used ass need broadening account technological development reflect full range option available analysis highlight limitation focussing projection future impact option using pre determined time slice whilst long standing approach may remain essential component risk assessment identify three key component 1 working stakeholder identify timing risk what key vulnerability food system crop modelling tell u system risk 2 use multiple method critically ass use model output avoid presumption analysis begin end gridded output 3 increasing transparency inter comparability risk assessment whilst study frequently produce range quantify uncertainty assumption underlying range always clear suggest contingency result upon assumption made explicit via common uncertainty reporting format study assessed set criterion presented
392,Adaptation to climate change to enhance food security and preserve environmental quality: example for southern Sri Lanka,WOS:000220165800002,strategy explored using linked field scale basin scale modeling framework walawe basin sri lanka an integrated approach followed concentrating enhancement food security preservation environmental quality projection extracted hadley center hadcm3 coupled global circulation model gcm impact strategy evaluated coupled modeling framework based soil water atmosphere plant swap field scale model water salinity basin model wsbm basin scale model three time period considered 1961 1990 period used adjust projection local condition provide reference compare expected change near future 2010 2039 distant future 2070 2099 overall impact food security environmental quality appears positive result enhanced crop growth due higher co2 level small increase precipitation however extreme profound future making strategy necessary result modeling framework presented format accessible water resource manager policy maker enable make sound decision required strategy
393,Promoting Women's Capacity Building to Adapt to Climate Change in Uzbekistan,WOS:000342788700007,in developing economy uzbekistan state adequate finance environment health protection situation improved year there need mobilizing population make effort protect local ecosystem people health goal local woman group therefore ensure reduction disease family negative impact environment increasing level awareness providing appropriate training woman youth for need make effective use available resource rather demanding major investment using pedagogical psychological method influence ordinary inhabitant
394,Mapping the landscape of climate services,WOS:000487216100001,service technology intensive science based user tailored tool providing timely information wide set user they accelerate innovation contributing societal explored advancement service multiple field producing wealth interdisciplinary knowledge ranging climatology social science aim map global landscape service identify pattern individual affiliation country level structural property community use sample 358 record published 1974 2018 quantitatively analyze provide insight main characteristic community service bibliometrics complement finding network science computed centrality actor derived principal component analysis 42 different measure by exploring structural property network individual institution country derive implication central agent furthermore detect broker network capable facilitating information flow increasing cohesion community finally analyze abstract sample via content analysis find progressive shift towards user centric vision agriculture energy top mentioned sector anglophone country institution quantitatively dominant also important connecting different discipline network scholar building established partnership finding node facilitating diffusion information flow broker necessarily central high degree interdisciplinarity facilitating interaction different community
395,It's not now or never: Implications of investment timing and risk aversion on climate adaptation to extreme events,WOS:000376544700024,public investment risk reduction infrastructure play important role facilitating impacted hazard natural disaster in provide economic framework incorporate investment timing insurance market risk preference evaluating project related reducing impacted risk model applied case bushfire risk management find optimal timing investment may increase net present value npv project various level risk aversion assuming risk neutrality market risk averse found result unnecessary delay investment risk reduction project optimal waiting time shorter insurance market risk averse serious scenario climatic assumed a higher investment cost higher discount rate increase optimal waiting time also find stochastic discount rate result higher npvs project discount rate assumed fixed long run average level
396,Role of community-based conservation and natural resource management in building climate resilience among vulnerable mountain societies,WOS:000879256300001,role community based conservation cbc natural resource management cbnrm protecting ecosystem improving socioeconomic well received considerable attention contribution le understood using mixed method case approach current compare two site khyber khudaabad northern pakistan comparable socioeconomic feature varying level effectiveness cbc cbnrm programme cbc khyber proactive khudaabad data collected household survey n 220 110 site key informant interview n 8 office bearer community based organization 4 site extensive document in comparison khudaabad finding revealed local community khyber demonstrated improved resilience proactive community based governance system improved practice access social service disaster preparedness improved knowledge concludes cbc cbnrm contributes building resilience among vulnerable mountain community strengthening social ecological system suggests building resilience vulnerable community instead investing stand alone measure government must focus ecosystem based adaption integrate specific mitigation action existing cbc cbnrm programme
397,Climate adaptation of interconnected infrastructures: a framework for supporting governance,WOS:000336035100006,infrastructure critical human society vulnerable current body infrastructure adequately account interconnectedness infrastructure internally one another take step toward addressing gap introduction framework infrastructure conceptualizes infrastructure complex socio technical system system embedded changing natural environment demonstrate use framework structuring potential impact identifying option preliminary set case road electricity drinking water infrastructure by helping clarify relationship impact different level find framework facilitates identification key node web possible impact help identification particularly nocuous weather condition also explore framework may applied comprehensively facilitate governance suggest may help ensure mental model stakeholder quantitative model researcher incorporate essential aspect interacting infrastructure system further necessary test framework context determine application may beneficial
398,An overview of climate change impacts on the society in China,WOS:000654345800006,society could sustain impact adapting mitigating risk adverse effect increasing change continue maintaining prospect improving wellbeing nevertheless le affecting society function different scale including individual community in discus relationship society china aspect need different socioeconomic developing stage relationship well current spatial pattern future risk impact society summarized complexity social climatic system lead spatial heterogeneity impact risk china to effectively leverage increasing knowledge past advocate greater cross disciplinary collaboration adaption poverty alleviation nature based solution nb that could provide decision maker comprehensive train thought policy making
