,title,wos,clean_abstract
24,The role of inclusion in climate vulnerability assessment and equitable adaptation goals in small American municipalities,WOS:000934090500001,equity inclusion consideration important prerequisite effective planning especially local scale examines plan small american city county consider equity vulnerability assessment planning goal consideration equity existing plan relates inclusion diverse category stakeholder data analysis based content 23 local plan small urban rural municipality across united state population le 300 thousand people correlation conceptualization vulnerability dimension inclusion 9 category stakeholder consideration equity 12 different domain planning examined concludes municipality engage diverse group stakeholder examine sensitivity adaptive capacity population appear attentive social equity likely offer specific measure focusing vulnerable group
25,Factors Leading Municipal Authorities to Implement Preventive Interventions for Lyme Disease,WOS:000469517300072,aim document intervention targeting lyme disease municipal level province quebec exploratory relies theory planned behavior certain construct health belief model identify factor leading municipal authority implement preventive intervention lyme disease pild data obtained online survey sent summer 2018 municipal officer 820 municipality quebec health region population risk contracting lyme disease response rate 36 questionnaire used measure implementation pild intention implement intervention attitude perceived social pressure perceived control lever barrier intervention perceived effectiveness preventive measure risk perceived vulnerability result structural equation analysis showed attitude significantly associated municipal authority intention implement pild intention implement pild significant predictor implementation pild additional analysis showed perceived barrier added moderating effect intention implementation relationship prediction behavior practice municipal authority could implement prevent lyme disease enable evaluation time evolution quebec municipality lyme disease moreover examination association specific psychosocial factor revealed important implication design effective behavior intervention would allow health official awareness work create personalized intervention better suited municipal officer specific context
26,The future of environmental networks-Governance and civil society in a global context,WOS:000311462100004,knowledge network recent innovation global environmental governance they provide mean local regional initiative aimed averting mitigating adapting trans boundary problem join together system permit sharing experience diffuses policy innovation across national border span divergent disciplinary boundary better communicate science local decision maker consider role currently played network possibility time soft power characteristic reliance value policy emulation may eventually place position globally coordinate local regional environmental policy innovation if successful effort might supplant need national action address even replace nation state system whose environmental management effort continue rely hard power use primarily economic incentive induce policy iclei provides technical consulting training information service build capacity share knowledge support local government implementation sustainable development local level our basic premise locally designed initiative provide effective cost efficient way achieve local national global sustainability objective international council local environmental initiative website 2010 when california passed global warming law two year ago island started forming partnership everywhere could teamed great britain province western northeastern state state like co host illinois florida kansa wisconsin and right first time official china india mexico brazil indonesia across world summit working toward goal reducing greenhouse gas emission growing green economy backyard governor arnold schwarzenegger global summit los angeles california november 18 2008
27,Making Climate Change Policy Work at the Local Level: Capacity-Building for Decentralized Policy Making in Japan,WOS:000311765200004,examine state local capacity building local japan mitigation need led global strategy national mandate integrated way impact manifested locally adaptive capacity determined local condition first lay basic component local capacity decentralized policy making ass current local capacity view japan policy bulk data employed derived existing date government database it found largest municipality well prefecture governing capacity develop comprehensive approach medium sized municipality potential take participatory approach policy it argues pioneering locality realize potential take initiative political leadership locality act piecemeal fashion according clear national level guidance
28,Integrating regional perceptions into climate change adaptation: a transdisciplinary case study from Germany's North Sea Coast,WOS:000344396700006,coastal protection strategy increasingly take account effect at present engineering natural science model ass impact global climatic transformation regional coastal zone protection structure remain rather detached knowledge insight regional practitioner main thesis contribution using case north sea coast innovative coastal protection requires interdisciplinary transdisciplinary collaboration order develop viable strategy investigation social dimension coastal protection strategy using qualitative interview organized regional stakeholder researcher coastal engineer well representative public survey contributes comprehensive understanding regional perception respect coastal protection
29,A conceptual framework for linking urban green lands ecosystem services with planning and design tools for amelioration of micro-climate,WOS:000386605700003,urban planning design process land management important factor significantly influence distribution urban green land ugls thus provision ecosystem service es thereby providing opportunity managing process local level however planning ugls often secondary planning category often remain underutilized through analysis master plan major urban centre serbia bulgaria discus conceptualization ugls integration es planning design process based finding obtained analytical hierarchy process develops conceptual framework linking es different ugl type course urban planning order achieve better application ugls strategy amelioration micro climatic condition urban area proposes framework ecosystem sensitive conceptualization ugls planning design process ugl typology replace functional category spatial indicator defined relation ugl type such approach improve understanding e sensitive application ugls planning process local strategy
30,"Application of Copernicus Data for Climate-Relevant Urban Planning Using the Example of Water, Heat, and Vegetation",WOS:000701977400001,specific resilience measure efficiently designed implemented regional local level environmental database critical achieving sustainable development goal sdgs efficiently planning implementing appropriate measure available federated distributed database serve necessary starting point municipality identify need prioritize resource allocate investment taking account often tight budget constraint high quality geospatial environmental data broadly available remote sensing data e g copernicus service critical there forward looking approach use datasets derive forecast optimizing urban planning process local government on municipal level however existing data used limited extent there adequate tool urban planning remote sensing data merged meaningfully combined local data processed applied municipal planning decision making therefore project coklimax aim development new digital product advanced urban service procedure development practical technical tool capture different remote sensing situ data set validation processing coklimax used develop scalable toolbox urban planning increase resilience focus area project water e g soil sealing stormwater drainage retention flood protection urban micro e g heat island air flow vegetation e g greening strategy vegetation monitoring vitality to end new digital process structure embedded local government enable better policy decision future
31,Looking under the hood of local adaptation plans: shedding light on the actions prioritized to build local resilience to climate change,WOS:000413272600007,in face changing many united state u local government creating plan prepare these plan layout community vulnerable existing future change well action propose taking prepare action included plan provide insight local government feel ability undertake well action believe important building resilience to date little analysis conducted content plan leaving researcher practitioner supporting community limited understanding gap need filled best support locally prioritized action analyzes content 43 stand alone plan u local community identify type action proposed action compare researcher indicate community prioritizing based regional projection result indicate local community include numerous varied action plan majority community selecting action theoretically appropriate given projected change regional yet type action building code advocacy widely used these result contrast previous study found local community focus primarily capacity building approach finding also demonstrate plan rarely contain significant detail action implemented raising question whether plan translate real world project
32,"Analysing the challenges in implementing Vietnam's Nationally-Determined Contribution (NDC) in the agriculture sector under the current legal, regulatory and policy environment",WOS:000553918400001,analysis current supporting law regulation strategy national action plan ndcs scientific literature document policy vietnam identify barrier effective implementation mitigation agriculture activity committed vietnam ndc it also identifies redundancy synergy action green growth plan country a result found strong supporting legal framework implementing ndc action vietnam however challenge gap identified awareness technical capacity coordination resource allocation downscaling province engagement private sector ngo regulatory framework critical ndc implementation a set key recommendation proposed address challenge raised identified barrier developed
33,Nature-Based Solutions to Hydro-Climatic Risks: Barriers and Triggers for Their Implementation in Seville (Spain),WOS:000816123000001,nature based solution nb currently priority international institution un eu improve urban resilience hydro climatic risk however responsible institution river basin authority local government still prioritizing gray infrastructure often present resistance strategy analyzes issue case seville spain identify historical recent institutional practice related development gray infrastructure experience citizen movement demand implementation green infrastructure naturalization urban space based theoretical framework sustainability transition contributes identification factor hinder trigger process drawing result case long tradition hydro climatic disaster management included depth risk planning city seville semi structured interview 24 social institutional actor participant observation urban planning process practice citizen movement our result show generation shared vision clash first conflicting perception city strength weakness regarding risk second contradiction institutional discourse practice finally operational limitation public participation process
