,title,wos,clean_abstract
252,Role clarification for local institutions: a missing link in multi-level adaptation planning? Insights from a multiple case study in Botswana,WOS:000658207600001,meaningful engagement community based actor planning crucial effective plan achieving ongoing challenge even participatory method in explore different approach using shared value crystallization pre process standard vulnerability risk assessment vras recently reported significant impact plan produced posit could due learning via changed local perception role use multiple case work five village development committee vdcs north east district botswana examine vra output pre post vra interview transcript evidence finding indicate vdc member took part shared value pre process significantly clarified prioritized general role subsequently engaged deeply planning process taking responsibility ownership final plan they related risk local lived reality better producing quality action plan funding innovation mainstreaming wider local plan alongside eagerness present idea higher governance level these finding suggest shared value pre process could immediately valuable multilevel planning practice concept role clarification deserves specific consideration academic study participation
253,Toward reflexive climate adaptation research,WOS:000366330500016,expanding rapidly within increasingly reflexive society relationship academia social institution state flux tension exist two dominant orientation in particular community challenged develop process successfully executing transdisciplinary academic institution researcher largely structured around traditional disciplinary expertise funding model one tool helping manage tension third reflexive orientation toward emerging literature new promise help enhance understanding enterprise become adaptive
254,Local initiatives and adaptation to climate change,WOS:000235693900010,expected lead increase number strength natural hazard produced climatic event present example experience community based organisation cbos non governmental organisation ngo variation look incorporated finding design implementation local strategy local organisation integrate climatic hazard design development project mean adapting new climatic situation project designed boost resilience local livelihood good example local strategy to upscale initiative need improve information exchange cbos ngo academia moreover need bridge gap scientific local knowledge order create project capable withstanding stronger natural hazard
255,Settling with forests in Thua Thien Hue (Vietnam),WOS:000762214300003,in ever fast paced urbanization globalization impact manifested there urgent need new type occupation balance built environment nature especially forest for reason concept vernacular landscape gotten attention many discipline regarded stand alone tool subject aim investigate co presence vernacular political landscape termed j b jackson hypothesis understanding interaction vernacular political way settling forest throughout history pull problem statement future development by analysis archival document combined fieldwork interpretive mapping thua thien hue province key historical period result reveals co presence two landscape become increasingly profound time simultaneously trend decentralization territory problem statement drawn result set basis future study alternative environmental design settling model linked forest adapt
256,Toward a standardized framework for thermal resilience modelling and its practical application to futureproofing,WOS:000764960000001,recent extreme weather event expert forecast sharp increase frequency severity future extreme weather event due signaled need futureproof building make resilient thermal resilience among many aspect overall building resilience co benefit reducing energy demand carbon emission thermal resilience building commonly assessed using two indicator thermal autonomy ta passive habitability ph an emerging body identified two indicator significantly correlated energy efficient building performance however remains need achieve consensus coherently consistently model ta ph early stage design better inform decision making proposes framework establish common set building energy modeling convention comfort habitability threshold selection criterion weather data promote useful ta ph indicator it concludes proposing practical application thermal resilience modeling help address futureproofing code standard
257,Understanding the transformation of climate futures. A conceptual framework illustrated with urban adaptation policy,WOS:000372388300004,project science based future produced indicating relevant impact climatic change proliferating tandem increasing attention constructionist science study put forward concept co production understand knowledge claim become stable authoritative get institutionalised reorder science society moreover knowledge structure power co evolutionary exercise constructing future interesting practice ought enmeshed knowledge claim may turn performative societal reordering present conceptual framework understand transformation knowledge claim future analytical detail five concept suggested aid analysis transformation reduction extension rhetorical packaging modification redefinition conceptual framework used present qualitative depth transformation volatile issue urban warming face netherlands related knowledge claim future issue a case make clear constant erosion legitimacy urban warming matter collective concern important understand transformation knowledge claim also context organisational embedding project originated direct consequence construction relevant knowledge future urban warming moreover pre existing methodology science brings production knowledge functioned important template transformed issue urban warming
258,Achieving the climate goal with intergovernmental transfers to the forestry sector: insights from the Indian experience,WOS:000620366300003,forest play important role mitigation india amongst select group country experimented intergovernmental fiscal transfer support forest conservation well designed transfer important implication achievement national international commitment forest conservation well community mitigation a substantial amount usd 51 billion allocated devolution union government india subnational state government forest cover criterion period 2015 2019 evidence indicates substantial devolution guarantee fund flow forestry sector result appreciable increase conservation outcome state benefited transfer conduct depth empirical analysis demonstrates design transfer crucial determining outcome finding indicate conservation afforestation outcome likely better ecological value bulk carbon value incorporated upfront financial allocation decision indirectly incentivizing subnational entity compensating maintaining land forest much weaker approach may lead desired outcome our finding relevant since next phase allocation fiscal transfer active consideration ensuring design compatibility financial transfer complement link well international goal achieve mitigation redd well domestic priority achieving sdgs
259,Policy integration: Do laws or actors integrate issues relevant to flood risk management in Switzerland?,WOS:000527300300001,existing emphasizes interdependency social ecological system ecological system often complex span several issue integrated social governance system in order increase fit social ecological system understanding factor promote integration interdependent issue crucial in consider 11 issue related flood risk management e g technical flood protection habitat loss typically addressed different policy sector exhibit ecological functional geographical interdependency analyze two base issue integration political actor connecting issue b legal framework cross referencing issue propose network method systematic comparison issue integration based actor integration based law for case swiss flood risk management find actor law based issue integration co vary might self reinforcing find issue integration mostly rest law although case exist actor main basis integration result promote understanding potential base integration policy issue thereby contributing knowledge adaptive governance capacity social ecological system buffer effect
260,Green Technological Development and Deployment in the Association of Southeast Asian Economies (ASEAN)-At Crossroads or Roundabout?,WOS:000611735400001,southeast asia face one fastest growth electricity demand world driven increasing income urbanization industrialization development deployment green energy technology offer natural conduit meet growing electricity need association southeast asian economy asean region also serving viable strategy adapt aim formulate policy lesson asean economy government facilitating development deployment green technology alternative energy option based specific case asean asean economic region prioritizing sustainable economic growth minimizing regional impact decarbonization undertakes case specific analysis reviewing green energy deployment context green growth energy transition using secondary data source discus current status future option renewable energy development asean find carbon capture storage cc technology allow asean continue use fossil fuel achieving sustainable economic growth coal demand increase region deployment cc technology also act enabler hydrogen energy green energy solution region longer term boosting public acceptance nuclear energy implementing energy efficiency improvement policy eliminating fossil fuel consumption subsidy feasible short term medium term policy increasing public private sector energy investment development cc technology longer term necessary complementary policy maximize benefit greater deployment renewable energy source region combat
261,Balancing the dual mandate of conservation and visitor use at a Canadian world heritage site in an era of rapid climate change,WOS:000482255900002,national park operate dual mandate conservation visitor use involves balancing ecological integrity nature based tourism activity induced environmental may increase existing tension conservation visitor use major tourism resource located protected area pa projected undergo large scale change draw upon behavioural approach scenario planning landscape visualization examine relationship impact visitor perception visitor experience management athabasca glacier jasper national park four tourism development scenario defined two management driver ecological integrity visitor demand corresponding storyline visualization developed 2050 visualized scenario presented visitor n 304 survey understand potential implication visitor satisfaction result suggest park manager need find balance ecological integrity visitor use way ensures commercialized tourism development limited educational material prioritized ecological integrity maintained while understanding behaviour future tourist complex critical component planning decision making process need prioritized policymakers pa manager
262,Following the ice: adaptation processes of glacier tour operators in Southeast Iceland,WOS:000495940200002,growing recognition global climatic pressing reality impact human ecological system inevitable make core topic policymaking glacier tourism sector highly sensitive towards changing climatic condition among relevant respect aim examine empirically impact practiced small middle scale glacier tour operator data collected mean set semi structured interview manager owner nine small middle scale tour company operating vatnajokull national park southeast iceland observation glacier site respondent company operating result indicate entrepreneur consider real phenomenon affect present daily operation perceive implication significant threat business interaction operator attribute agency firsthand experience risk perception ability self organize structural element glacier destination system economic rationale hazard reduction institution shaped consolidated operator process form wait see strategy combined ad hoc reactive measure postponed prevented proactive long term strategy
263,Understanding climate-human interactions in Small Island Developing States (SIDS): Implications for future livelihood sustainability,WOS:000426783600007,purpose pose diverse often fundamental challenge livelihood island people purpose demonstrate challenge must better understood effective sustainable possible design methodology approach understanding past livelihood impact help design operationalize future intervention in addition globalization uneven effect island country jurisdiction producing situation especially archipelago significant difference core peripheral community approach overcomes problem characterized many recent intervention island context resulted uneven best marginal livelihood improvement preparedness future finding island context range unique vulnerability resilience characteristic help explain recent proposed response these include sensitivity coastal fringe environmental change island society comparatively high degree social coherence closeness nature spirituality uncommon western context limitation implication enhanced understanding island environmental social context well insight past impact peripherality contribute effective sustainable future intervention originality value need effective sustainable island context becoming ever exigent pace twenty first century increase
264,Tradeoffs and Synergies Across Global Climate Change Adaptations in the Food-Energy-Water Nexus,WOS:000782429400001,food energy water few system increasingly vulnerable natural hazard risk yet human depend system daily need wellbeing survival investigated adaptation related few vulnerability occurring global community learn interaction across adaptation conducted global analysis data set derived scientific literature present first large scale assessment n 1 204 evidence based few related adaptation found frequently reported adaptation few vulnerability continent occurred africa n 495 asia n 492 adaptation targeting food security robustly documented relevant water energy security suggesting greater global demand address food security determining statistically significant association found network connection variable characterizing few related adaptation showed interconnectedness variety natural hazard exposure sector actor cross cutting topic geographic location connectivity found vulnerability food security water community sustainability response sea level rise across city settlement key infrastructure sector additionally generalized linear regression model revealed potential synergy tradeoff among few adaptation necessity synergistically adapt system protect food water security tradeoff simultaneously addressing exposure consumption production v poverty result qualitative thematic coding showcased adaptation documented targeting multiple exposure still limited considering interconnectivity system applying nexus approach response these result suggest adopting nexus approach future few related adaptation profound benefit management scarce resource financial constraint
265,Measuring knowledge and action changes in the light of urban climate resilience,WOS:000658367700004,resilience gained essential role well international policy an increasing number city adapting enhance resilience given complexity urban system combination acceleration social challenging measure success resilience rising activity to manage accelerate learning process transformation process monitoring evaluation implemented measure crucial most currently used indicator set dealing system focused change however actor focused change le addressed holistic indicator set even individual agency assumes important role transformation process intended design framework individual resilience agency operationalise composite indicator set indicator set implemented survey 14 project finally indicator set verified using statistical empirical validation present applicable indicator set reveals depth insight individual resilience agency change within measurement further set applied one time assessment repetitive measurement therefore tool implemented monitoring tool well formative evaluation tool resilience context
266,PRIORITIZING LAND AND WATER INTERVENTIONS FOR CLIMATE-SMART VILLAGES,WOS:000479946400001,smart village mean implementing portfolio best locally suited smart agricultural practice integrated manner build resilience local community land water intervention form crucial part smart agricultural practice portfolio water availability key limiting factor crop growth to aid decision making process prioritizing land water intervention simple robust spreadsheet tool based water balance developed tool integrates simulates impact land water intervention water balance determine impact across smart agricultural objective agricultural productivity mitigation tool implemented two village state madhya pradesh india tool performs well simulating village water balance impact yield rainfed irrigated crop area result show considerable difference exist within portfolio land water intervention combination supply demand moisture conservation practice able help achieve smart agricultural objective in best case scenario yield increased 10 greenhouse gas emission intensity reduced 17 comparison stakeholder perception analysis highlight utility tool providing additional quantitative information decision making process
267,An Assessment of the Ecological Landscape Quality (ELQ) of Nature-Based Solutions (NBS) Based on Existing Elements of Green and Blue Infrastructure (GBI),WOS:000718477800001,nature based solution nb positively impact ecological landscape quality elq providing multiple benefit including enhancing natural capital promoting biodiversity mitigating water runoff increasing water retention contributing adaptation carbon sequestration to analyze specific contribution different nb type assessed 14 elq indicator based application spatial data five nb based existing element green blue infrastructure gbi analyzed city level lublin poland including park ups forest ufs water body uws allotment garden ag wood w analysis revealed different nb contribute contrasting way improvement various dimension elq ufs made biggest contribution maintenance ecological process stability well aesthetic value w together ag crucial maintaining high level diversity landscape scale also contributed preserving ecological structure uws ups outstanding impact elq mainly due high level anthropogenic transformation application spatial indicator proved useful providing approximate information ecological value different type nb data type either unavailable available high cost considerable time effort
268,"Quantitative Analysis of the Contributions of Climatic and Anthropogenic Factors to the Variation in Net Primary Productivity, China",WOS:000930396600001,accurate quantification contribution climatic anthropogenic factor variation npp critical elucidating relevant driving mechanism in spatiotemporal variation net primary productivity npp china 2000 2020 interactive effect climatic anthropogenic factor npp optimal characteristic driving force explored our result indicate npp obvious spatial differentiation overall increasing trend identified trend continue future half pixel land use land cover precipitation main factor regulating npp variation national scale sub region scale except southwest china dominated altitude temperature moreover interactive effect pair factor observed effect pair driving factor greater single factor manifested either bivariate enhancement nonlinear enhancement furthermore response optimal characteristic npp concerning driving force diverse finding provide critical understanding impact driving force npp could help create optimal condition vegetation growth mitigate adapt change
269,Preparing Health Services for Climate Change in Australia,WOS:000288407600013,although implication public health continue elucidated still require much work guide development comprehensive strategy underpin health system evolving process impact emerge author aim focus response australian health system health risk particular best prepare health service predicted health risk heat wave bush fire infectious disease diminished air quality mental health impact in addition author aim provide general principle health system may applicable beyond australian setting they present guiding principle preparing health system also overview specific preparatory activity relation personnel infrastructure coordination increase extreme weather related event superimposed health effect arising gradually changing place additional burden health system challenge existing capacity key characteristic prepared health system flexible strategically allocated robust long term planning also require close collaboration nonhealth sector part nationwide adaptive response
270,Developing China's National Emission Trading Scheme: Experiences from Existing Global Schemes and China's Pilot Programs,WOS:000427501300008,market based emission trading scheme etss widely used developed world reduce greenhouse gas ghg emission perceived source global china largest ghg emitter world committed introducing ets reduce emission here reviewed existing etss sustainable energy policy worldwide well china pilot program these study conducted order propose recommendation national initiative strategy implemented china relation mitigation it shown setting emission cap context national emission intensity target difficult however implementing reliable system measurement reporting verification emission essential a two level management system central provincial government carbon trading beneficial ensure uniform standard compliance maintaining flexibility persistent political support effective coordination policy government crucial in addition strengthening institutional innovation establishment national ghg emission information system equal importance vital information could provide great opportunity china define economic growth take global leadership combatting
271,The Concept of Regulating Forest Management in a Region Subject to High Environmental Pressure,WOS:000448398100035,in modern forestry complexity planning process increasing specifically context sustainable use forest resource change present concept forest use regulation promoting sustainable forestry development forest management planning a method defining synthetic criterion assessing important feature stand structure proposed would enable classification stand term need urgency transformation reconstruction suitability longer standing a result concept may ensure preservation relative uniformity logging use improvement age structure well increase natural value forest regardless stand age concept tested large forest complex 0 5 million hectare subjected intense environmental pressure silesian region poland prepared long term individualistic development forecast separately area volume based followed cutting uniformity principle analysed time period calculating long term average cutting allowance it determined averaging projected usage size moving window eventually adopted cutting upper limit whole analysed period proposed size cut period resulted relation average value forecast three set stand differentiated urgency intervention distinguished i well stocked stable stand need intervention 55 stand area ii acceptable stand urgent intervention needed 35 iii poor stand urgent intervention needed 10 concept join top bottom approach cutting uniformity focus stand status instead age dimension
272,The 'Pacific Adaptive Capacity Analysis Framework': guiding the assessment of adaptive capacity in Pacific island communities,WOS:000399699500008,community based cba becoming increasingly popular approach pacific island region building adaptive capacity important component project supporting cba literature establishes adaptive capacity highly context culture specific however date little factor process enable adaptive capacity pacific island community discus pacific adaptive capacity analysis framework theoretical framework developed guide assessment adaptive capacity purpose supporting cba project framework identifies seven broad factor several sub factor pacific specific adaptive capacity 1 human capital 2 social capital 3 belief system worldviews value 4 resource distribution 5 option livelihood food supply 6 information awareness 7 history dealing stress present case adaptive capacity community solomon island concludes unlike many adaptive capacity determinant identified broader international literature function based factor shaping ability access use resource cognitive example value belief system determinant particular relevance pacific community social cultural context key building upon cognitive function based aspect adaptive capacity increasing ability people liaise external support organisation plan acquire resource term
