,title,wos,clean_abstract
0,Can community-based governance strengthen citizenship in support of climate change adaptation? Testing insights from Self-Determination Theory,WOS:000401679700001,motivation play powerful role guiding human decision making behaviour including aimed determine whether community based governance would increase behavioural support form donation behaviour trust fund a sample 548 australian randomly assigned view one two governance scenario 1 community based scenario community member afforded high level autonomy designing allocating funding within trust fund help community adapt 2 government centred scenario decision making regarding trust fund remained government official path analysis revealed community based scenario produced significantly higher level perceived autonomy support within participant high level perceived autonomy support predicted higher level autonomous motivation indicating stronger citizenship lower level amotivation motivational pattern turn predicted greater willingness donate trust result interpreted term self determination theory motivational crowding theory crown
1,The role of government interventions in household climate adaptation on the Tibetan Plateau,WOS:000876988900005,a impact intensify role government process received widespread attention effective depends whether household community adopt appropriate strategy also whether government intervene effectively to improve understanding role government intervention household pro ce propose framework take government intervention consideration household level based household survey pumqu river basin tibetan plateau discus impact government intervention household result show govern ment intervention 1 buffered risk shock household livelihood 2 shaped household cognition 3 mediated impact household livelihood cognition strategy 4 directly influenced household livelihood choice strategy our finding emphasize interface government intervention household help government clarify principle planning terventions also important implication better guide household adapt
2,Three roles for education in climate change adaptation,WOS:000503527300001,education appropriately conceived powerful tool enabling effective in identify three distinct overlapping policy us first protecting deploying education infrastructure social material resource education depends reduce vulnerability build resilience second improving general education measured term literacy school attendance overall academic attainment enhance adaptive capacity third based learning support accelerate social policy maximizing learning adaptive decision making although three important unique transformative contribution education lie learning support curricular pedagogical technological resource prepare people complex adaptive decision making help solidify learning work a human society seek balance old social mechanism ensure stability new one facilitate capacity systematically support learning undergirds may limiting factor key policy insight value education policy limited vague definition poor cross field communication education support three distinct overlapping pathway offering concrete policy option education infrastructure general education learning support greatest value education lie transformative potential learning support curricular pedagogical technological resource prepare people complex adaptive decision making help solidify learning work
3,"Data, concepts and methods for large-n comparative climate change adaptation policy research: A systematic literature review",WOS:000447165600005,dominated depth qualitative single small n case study resulted rich depth understanding process decision making specific location recently number comparative policy case increased focusing examining describing explaining country region vulnerable group adapting across larger sample context time there however critical empirical conceptual methodological choice challenge comparative systematically capture ass current state larger n n 20 case comparative policy literature systematically analyze 72 peer reviewed article identify key choice challenge author face conducting find among others almost study use nonprobability sampling method existing comparative datasets exist study use easy accessible data might appropriate question many struggle disentangle rhetoric reality study engage critical reflection conceptual data methodological choice implication finding conclude effort increase data availability use rigorous methodology necessary advance comparative categorized vulnerability learning case analogy
4,Moving beyond description to explore the empirics of adaptation constraints,WOS:000456907400089,concept constraint become well known literature it describes impediment process could principle overcome often many constraint identified described literature across wide range context importance influence clear however study focussed describing constraint rather exploring origin process possible impact a consequence difficult operationalise concept provide information meaningful decision maker demonstrates approach estimating empirically process impact constraint based case farmer new zealand it combine established social scientific method explore process underlying range constraint estimate impact constraint may approach used explore social economic impact constraint information used consider sub optimal fully pave way policy response conscious human element
5,Ready-made oTree applications for the study of climate change adaptation behavior,WOS:000577820800006,intricate decision making process requires balancing cost uncertain benefit setting high stake low probability risk preference shape way individual group adapt setting dependent independent public policy with aim shedding light preference aid policy efficiency develop set application based otree cat set consists eight discrete apps correspond different risk perception bias corrective treatment from scientific perspective cat used better understand decision constraint individual community level policy perspective help policy maker plan improve existing strategy a pilot experiment 75 subject conducted evaluate cat functionality decision making process experiment examined decision different risk level home flood context it successfully explored impact unknown risk various time horizon framing condition group dynamic result show decision strongly correlated risk level rate increase uncertainty introduced collective increase group dynamic although polarization observed uncertainty reinforces collective inaction in addition typical subject characteristic including age gender home ownership significant impact
6,The interplay between social learning and adaptive capacity in climate change adaptation: A systematic review,WOS:000409293300001,successful implementation depends large extent capability individual organization community create mobilize adaptive capacity ac socioecological system creating mobilizing ac continuous process requires social learning sl although rich empirical case literature theorizing empirically investigating relationship ac sl highly fragmented aim critically examine peer reviewed literature focus sl ac context cca special attention paid interplay two understanding interplay help improve understanding cca take place practice advance theoretical debate cca systematic method used analyse 43 paper 1997 2016 our finding reveal three perspective play important role different context ac focused perspective sl focused perspective hybrid perspective these difference conceptualization relationship sl ac may seem trivial first consequence design learning based intervention aimed helping community respond it appears intervention need preceded analysis context order decide whether emphasize ac sl simultaneously
7,Artificial intelligence for climate change adaptation,WOS:000781616900001,although artificial intelligence ai inclusive machine learning gaining traction supporting projection impact limited work used ai address identify gap highlight value ai especially supporting complex choice implementation illustrate ai effectively leverage precise real time information data scarce setting focus supervised learning transfer learning reinforcement learning multimodal learning illustrate innovative ai method enable better informed choice tailor measure heterogenous group generate effective synergy trade offs categorized application area government public sector
8,Place identity and climate change adaptation: a synthesis and framework for understanding,WOS:000304158000003,most emphasizes material objective asset build capacity adapt nonmaterial subjective attribute e g identity belief value difficult quantify area le developed further effort required develop test framework facilitate systematic examination subjective attribute outline contribution place identity theory lens systematically examine personplace bond influence provide working typology three interconnected place identity approach help elucidate relationship each strength weakness depending theoretical practical context within used cognitive behavioral approach important utility addressing place identity shape perception behavior however limited due cognitive complexity lack richness quantitative methodology health well approach address often underemphasized health well impact place identity though subjective nature health must considered approach collective action approach offer important insight using place identity mechanism foster collective opportunity with approach however care must taken ensure inclusive representation subgroup identity conclude reflecting place identity theory foster improved understanding critically important emerging area wire clim 2012 doi 10 1002 wcc 164 for resource related please visit
9,Payments for Ecosystem Services in the Context of Adaptation to Climate Change,WOS:000302713700017,concept payment ecosystem service pe recently emerged promising tool enhancing safeguarding provision ecosystem service e although concept extensively scrutinized term potential positive negative impact poor developing country le attention paid examining role pe context pe potential contribute also risk could undermine effort in order maximize synergy minimize trade offs pe important conceptual link made explicit present present main conceptual link pe suggests way making pe pro poor pro drawing upon concept vulnerability adaptive capacity socioecological system suggested pe potentially contribute three main way enhancement provision ecosystem service enhancing adaptive capacity way pe designed implemented providing incentive mechanism adopt specific measure reflecting lesson pe poverty literature suggests way make pe pro poor pro concludes need area
10,Real options analysis of climate-change adaptation: investment flexibility and extreme weather events,WOS:000491987900013,investment made extent uncertain however important source uncertainty fall time data become available investigates effect optimal investment decision making learning reduces uncertainty it develops simple real option method value option found many context method modifies binomial tree model frequently applied problem incorporating gradual learning using bayesian updating process driven new observation extreme event it used investigate timing scale upgradable design project recognition might different information future make flexibility valuable amount value added flexibility way flexibility exploited depend fast learn when learning occur quickly value option delay investment high when learning occur slowly value option build small low risk project instead large high risk one high for intermediate case option build small project expanded future high approach support efficient decision making project anticipating gradually learn recurrence extreme event
11,Objectives of public economic policy and the adaptation to climate change,WOS:000280771500006,much learned applying structure methodology already used field employ public economic policy approach investigate supported public sector three different field activity identified especially relevant government intervention proposes way government intervention could conducted analysis take account developing region particularly vulnerable insufficient fund adequately adapt
12,Does climate adaptation policy need probabilities?,WOS:000226672900002,estimating likelihood future become priority objective within community case advancement science user demand central role played prediction guiding policy but probability policy really need review three key question 1 why might need probability 2 what problem estimating probability 3 how researcher estimating probability these question analysed within context overall conclude jury still whether probability useful policy answer highly context dependent thus function goal motivation policy analysis unit analysis timescale training analyst probability assessment context always subjective conditional provisional there various problem estimating probability future reflexive human behaviour e action explicitly influenced information largely intractable context prediction nonetheless considerable scope develop novel methodology combine conditional probability scenario relevant decision making
13,A values-based approach to vulnerability and adaptation to climate change,WOS:000291734800008,value play significant role debate to date however use term value narrowly focused monetary worth relative worth fair return exchange argues another broader interpretation value one concentrating intrinsically desirable principle quality needed understand respond how respond impact depends importantly effect mean affected similarly considered effective legitimate depends people perceive worth preserving achieving how adapt therefore hinge value underlying people perspective goal examines value based approach needed benefit understanding implication policy discussed
14,The governance of climate change adaptation: are networks to blame for the implementation deficit?,WOS:000491051200001,although governance often cited challenge implementing policy existing scholarship adequately explored relationship mode governance implementation objective analyzes governance two province focus three key element actor role actor relation policy instrument drawing comprehensive document analysis 81 interview argue network governance fruitful coordinating policy idea motivating actor across sector scale also served barrier effective implementation policy conclude incorporating feature governance mode including direct steering state required resolve implementation deficit
15,The Continuing Case for a Polycentric Approach for Coping with Climate Change,WOS:000941353100001,elinor ostrom argued effectively coping manmade requires polycentric approach although agree ostrom assessment argument regarding advantage polycentricity could taken in supplement ostrom work fleshing reason polycentric approach conducive coping national government attempt centrally direct policy argue least six advantage polycentric system coping competition among decision maker cooperation among decision maker perception legitimacy lead coproduction mutual learning experimentation institutional resilience robustness emergent outcome socially desirable centrally planned combination six factor give polycentric governance system distinct advantage top one especially term epistemics incentive compatibility scholar policymakers concerned implication appreciate many diverse nuanced advantage polycentric approach coping
16,How does climate change adaptation affect public budgets? Development of an assessment framework and a demonstration for Austria,WOS:000496022700008,public affect government budget directly expenditure side also indirectly via change tax base government consumption pattern while indirect effect analyzed intensively mitigation policy similarly detailed model based framework study policy still missing objective present fill gap proposing general modeling framework allows comprehensive analysis effect federal budget expenditure revenue side well macroeconomic effect ii demonstrate usefulness applying framework case austria find public lead substantial positive macroeconomic effect gross domestic product gdp welfare employment result robust respect assumption effectiveness also demonstrate essential analysis cover expenditure revenue side overall government revenue increase due offsetting additional direct public expense thus increasing budget balance le severe impact corresponding lower payment post disaster relief unemployment benefit well higher tax revenue thus strongly recommend making use economy wide modeling framework planning shed light true cost benefit
17,Development of a survey instrument to assess individual and organizational use of climate adaptation science,WOS:000860677400006,improve resilience social natural system become common many science organization agency focus actionable science model aim greater impact policy practice traditionally produced distributed science however evaluation project needed examine verify impact science society better understanding type mechanism impact allow organization design fund facilitate useful science many existing actionable science evaluation approach qualitative nature take considerable time effort funders administrator implement quantitative method could provide valuable option evaluation specifically making com parisons across many project thus designed quantitative survey instrument measuring use science designed survey using best practice iterative input social scientist well scientist practitioner distributed survey sample user science analyzed response refine survey quantitative quali tative result show use science may described either individual use organi zational use contrast popular model use existing evaluation literature survey made available future effort evaluate improve science advance effort measure different kind use
18,Evaluating the robustness of project performance under deep uncertainty of climate change: A case study of irrigation development in Kenya,WOS:000792767400004,infrastructure project developing country conventional development objective economic growth while project serve type purpose conventional benefit often clearly appreciated latter but clear identification implication project also important such distinction would help associate finance benefit directly however present established evaluation method benefit exist necessitates representation uncertainty effect specific project context often difficult against background case ex ante evaluation benefit uncertainty evaluate robustness project performance kenyan irrigation development project based simulation analysis carried using robust decision making rdm approach ass robustness positive expected outcome project quantitatively identify development irrigation facility especially combined soft measure farming practice could bring increase household income future large variety condition these beneficial effect partly reflection reduced damage achieved project also discus factor could become relevant application rdm based project evaluation field finance
19,What can climate services learn from theory and practice of co-production?,WOS:000582012500005,co produced service increasingly recognised mean improving effective generation utilisation information inform decision making support particularly developing country there rich literature outlining theoretical conceptual evolution co production experience variety decision context different sector different scale however extent producer service engaged literature varies reflecting emerging interest application particularly developing country review co production literature distil key principle inform service whilst aim neither comprehensive prescriptive principle inform normative pragmatic approach co produced service a co produced service product decision driven process based time managed process co producing service inclusive collaborative flexible illustration also provided principle may engaged practice evaluation emerging example help inform co production service
20,Climate prediction for adaptation: Who needs what?,WOS:000297910300009,role short long term prediction determining success investigated a simple theoretical model capture relationship adaptive performance decision structure prediction accuracy different temporal scale developed implication deduced it shown user face high adjustment cost e inflexible depend heavily accurate long term prediction able adjust strategy low cost however constraint accuracy long term prediction order accurate enough recommended unreservedly strongest precisely user desire there thus intrinsic structural limitation utility long term prediction adaptive decision making in addition heterogeneous dependence adaptive performance prediction different temporal scale give rise resource allocation problem investment aimed improving prediction maximize social benefit it suggested explicit distributional framework match user need scientific feasibility needed order guide investment key issue framework need address discussed
21,The Importance of Place in Communicating Climate Change to Different Facets of the American Public,WOS:000434202600008,while need action urgent individual level behavior mitigate adapt problem tracked increasing urgency action place based communication may catalyze action making personally relevant however one general public communication effort unintentionally polarize belief aim fill gap knowledge different audience respond place based communication could aid communication effort scientist result experimental survey 655 californian follow interview indicate prior belief influence effectiveness place based communication in particular already concerned classified six america group show significant response intervention also find difference willingness adapt local global framing however exposed local framing likely take personal scale action exposed global framing likely take policy scale action these result theory place attachment psychological distance suggest place based communication may applicable certain audience e g concerned scale intervention match scale action
22,Catalyzing Innovation: Governance Enablers of Nature-Based Solutions,WOS:000624824200001,there growing recognition using property nature nature based solution nb help provide viable cost effective solution wide range societal challenge including disaster risk reduction drr however nb realization depends critically governance framework enables nb policy process drawing three case study nocera inferiore italy munich wolong china identify key governance enablers contextual precondition policy process institution proved essential nb initiation planning design implementation in three case interview confirm success nb measure benefit term drr multiple ecological social economic co benefit result highlight critical governance enablers nb including polycentric governance novel arrangement public administration involved multiple institutional scale sector co design innovative stakeholder participatory process influenced final nb pro nb interest coalition group organized pressure group advocated nb financial incentive financing community based implementation monitoring nb finding show transition nb contribute multiple global agenda including drr sustainable development
23,"Successful climate services for adaptation: What we know, don't know and need to know",WOS:000865720100002,success service increasingly studied exists varying understanding service make successful systematically mapped breadth depth peer reviewed literature subject synthesized evidence know know need know successful service focus service based long term information aim inform decision making longer time scale includes paper inform success including evaluation study empirical investigation factor practice influence success conceptual discussion constitutes success result show insight service success scattered often originate western developed country conceptualization success literature diverse focus process production use product characteristic process element service contextual factor study ass result service tend focus evaluating perceived usability though uptake impact outcome service rarely assessed systematically frequently reported success factor include brokering function user producer interaction iterative flexible development process to successful service contextualized tailored user decision making context conclude whilst context emerges critical determinant success configuration factor process leading success demand investigation
