,title,wos,clean_abstract
0,Vulnerability reduction and adaptation to climate change through watershed management in St. Vincent and the Grenadines,WOS:000476495300018,st vincent grenadine archipelagic state caribbean regularly suffers natural disaster increasing frequency intense hurricane storm southernmost watershed st vincent rugged topography favour flash flooding rainy event great damage area concentrate country population infrastructure to deal problem government developed study engineering work watershed management plan land use management effective way controlling hydrological impact plan divide watershed three us nature conservation 46 agriculture agroforestry 24 urban 30 category establishing permitted prohibited restricted activity area close limit urban development expansion essential done increasing density lower flatter area many house usually low income settlement flooding landslide risk area decolonized changing land use it also necessary avoid hillside arable crop land use management essential although unfortunately le socially politically appreciated engineering work
1,Review on Seaport and Airport Adaptation to Climate Change: A Case on Sea Level Rise and Flooding,WOS:000432231800005,seaport airport critical node international supply chain thus stand edge social economic disaster they often affected extreme rough weather comparing threat sea level rise slr storming flooding currently present according relevant literature severe impact port airport aim provide comprehensive seaport airport focus slr flooding summarized related paper divided different type described trend study atter involves comparison analyze synergy previous study seaport airport provides insight study emphasize need opportunity collaborative work complement planning ensure resilience seaport airport
2,Pathways for building urban resilience to climate change in Oman,WOS:000466076400001,sultanate oman highly vulnerable recent experience cyclone gonu 2007 phet 2010 mekunu 2018 show potential impact extreme climatic event urban area high loss life destruction infrastructure economic damage despite oman facing multiple hazard risk policy strategy specifically designed build resilience urban city aim raise awareness among policymakers develop national policy framework towards addressing urban resilience it suggests several pathway country based previous study interview key stakeholder identified pathway include generation knowledge capacity building improved governance planning
3,"Human ecological effects of tropical storms in the coastal area of Ky Anh (Ha Tinh, Vietnam)",WOS:000396109400020,vietnam prone tropical storm effect contribute sea level rise flood progression low water line coastal erosion inventory perception local people ass value main aspect livelihood damage caused tropical storm period 2008 2013 three coastal commune ky anh district ha tinh province central vietnam commune selected location coastal line perpendicular storm made prone damage effect increasingly extreme weather condition three community area affected storm flood local resident response changing environmental condition analyzed assessed result questionnaire completed randomly selected local inhabitant commune show storm related hazard flood sea level rise heavy rain perceived impacting intensified phenomenon agriculture aquaculture livestock household property income opinion measured data provided commune district authority allow estimating total direct cost tropical storm 1 56 million u used conversion rate vnd u 21 730 conducted 2014 period 2008 2013 long term cost social impact measure significantly higher detail monetary figure allow identifying physical natural capital area affected storm trend cost analysis show total financial support hazard prevention management 2014 2019 estimated 1 19 1 32 million u local stakeholder indicate limited technical measure strengthening dike also target planting protection forest mangrove land use planning financial support relocation policy stakeholder involvement integrating socioeconomic development master plan local land use planning also importance
4,"Climate change, related hazards and human settlements",WOS:000282613300009,assessment intergovernmental panel ipcc 2007 demonstrated changing future see higher sea level heat wave intense storm heavy precipitation event extension drought area these hazard impact human settlement causing major loss life social disruption economic hardship recent literature demonstrated problem rather le critical linking disaster risk reduction important starting happen although significant barrier le developed country poorest people country risk usually least capacity adapt reduce risk a new international initiative integrated disaster risk addressing challenge natural human induced environmental hazard including established meet need providing enhanced base develop implement public policy
5,A framework to analyze vulnerability of critical infrastructure to climate change: the case of a coastal community in Florida,WOS:000384568300032,critical infrastructure essential society economy in recent year identified urgent growing threat critical infrastructure many study conducted ass vulnerability critical infrastructure however despite effort vulnerability critical infrastructure often vaguely defined inconsistently studied literature proposes framework analyze critical infrastructure vulnerability based traditional vulnerability sustainability framework hazard place model vulnerability vulnerability assessment emergency service sea level rise storm surge collier county florida taken example validate proposed framework flood simulation comparison storm surge model spatial analysis network based service area analysis conducted ass vulnerability fire station case area vulnerability assessment identifies predominant hazard risk exposed infrastructure analyzes sensitivity serviceability evaluates effectiveness potential adaptive capacity result show fire station case area vulnerable potential landfall change hurricane tropical cyclone pattern compared flooding caused directly sea level rise it indicates lack consideration potential landfall change storm could greatly underestimate vulnerability especially coastal area limited historical tidal data analysis also illustrates current floodplain management focus primarily 100 year flood may sufficient standard region given potential change frequency magnitude related hazard finally confirms disaster risk management strategy could also contribute weak linkage existing disaster risk management need strengthened proposed concept framework could generalized expanded critical infrastructure region related hazard
6,"Creating the Conditions for Climate Resilience: A Community-Based Approach in Canumay East, Philippines",WOS:000743361500010,people reside informal settlement global south vulnerable extreme weather event consequence flooding landslide fire those located coastal area face severe challenge seasonal typhoon induced flooding show uncertain land right exacerbate community vulnerability resident constant threat eviction private sector actor state individual community upgrading rarely possible situation focus effort secure tenure upgrade community resident sitio libis located canumay east city valenzuela philippine demonstrates community based approach require skill capacity community member enabling condition created government ngo required transformational outcome while people sitio libis conceptualize effort term success suggests possibility smart partnership among state civil society private sector actor emerge support small scale action
7,Co-learning during the co-creation of a dengue early warning system for the health sector in Barbados,WOS:000740754000004,over past decade caribbean region challenged compound health hazard including tropical storm extreme heat drought overlapping epidemic mosquito borne disease including dengue chikungunya zika early warning system ew key strategy health sector an ew integrate information forecasting model predict risk disease outbreak several week month advance in share experience co learning process co creating dengue ew health sector barbados discus barrier implementation well key opportunity process involved bringing together health practitioner transdisciplinary researcher jointly identify need priority ass available data co create early warning tool gather feedback via national regional consultation conduct training implementation ongoing team continues committed long term process collaboration developing strong partnership particularly health sector barbados critical part development in many country national health sector worked together sustained formal manner collaborative process purposefully pushed u comfort zone challenging u venture beyond institutional disciplinary silo through co creation ew anticipate barbados health system better able mainstream information decision making process using tailored tool epidemic forecast report risk map health bulletin ultimately increasing resilience health system
8,"Resilient remediation: Addressing extreme weather and climate change, creating community value",WOS:000453482600002,recent devastating hurricane demonstrated extreme weather jeopardize contaminated land remediation harm public health environment since early 2016 sustainable remediation forum surf led organized knowledge exchange examine 1 impact extreme weather event hazardous waste site 2 mitigate impact create value community surf team found extreme weather event undermine effectiveness approved site remediation also affect contaminant toxicity exposure organism sensitivity fate transport long term operation management stewardship remediation site further failure consider social vulnerability could compromise remediation strategy surf recommendation resilient remediation build resource driver state national international source marry practice sustainable remediation they outline general principle site specific protocol provide global example mitigation strategy opportunity synergy include vulnerability assessment benefit build established hazardous waste management law policy practice surf recommendation guide owner project manager developing site resiliency strategy resilient remediation help expedite cleanup redevelopment decrease public health risk create job park wetland resilient energy source resilient remediation redevelopment also positively contribute achieving international goal sustainable land management action clean energy sustainable city
9,"A Comparative Study of the Effects of the 1872 Storm and Coastal Flood Risk Management in Denmark, Germany, and Sweden",WOS:000666353800001,from november 12th 13th 1872 extreme coastal flood event occurred south baltic sea an unusual combination wind created storm surge reaching 3 5 mean sea level meter higher observation past 200 year on danish german swedish coast 300 people lost life consequence storm denmark severe sweden significantly larger destruction higher number casualty in denmark 1872 storm extensively documented remembered still influence local regional risk awareness a comparative indicates collective memory 1872 storm related background knowledge flood damage extent response storm flood mark dike help remember event in general coastal flood defence largest degree implemented affected area followed denmark almost absent sweden corresponding extent collective memory 1872 storm within affected country local variability flood risk awareness associated collective memory storm also economic dependency flood prone area conflicting interest tourism industry influence flood protection decision process implementation eu flood directive slowly removing difference flood risk management approach
10,Climate change and temporal-spatial variation of tropical storm-related Natechs in the United States from 1990 to 2017: Is there a link?,WOS:000678136400003,natural hazard triggered hazardous material hazmat release accident known natechs cause extensive damage loss several study found tropical storm becoming important cause natechs understanding whether affect incidence tropical storm related natechs becomes crucial issue industrial risk management analyzed temporal spatial variation tropical storm related natech incidence eastern side united state u 1990 2017 based analysis hazmat release accident reported u national response center result show frequency density tropical storm related natechs rise in order explore cause change investigates relationship temporal spatial variation incidence tropical storm related natechs accumulated cyclone energy north atlantic oscillation nao index oceanic nin tilde index oni variable result suggest indirect link temporal spatial variation incidence related natechs due effect tropical storm activity presented evidence suggests developing natech risk management plan potential effect considered not facility owner operator government first responder stakeholder consider affect natech risk landscape implement effective regulation manage natech risk wider area
11,Extreme weather impacts on tropical mangrove forests in the Eastern Brazil Marine Ecoregion,WOS:000432462000026,extreme weather event likely become frequent 21st century bringing significant impact coastal ecosystem however capacity detect measure impact still limited effect largely unstudied in june 2016 hailstorm wind gust 100 km h 1 caused unprecedented mangrove dieback eastern brazil to quantify scale impact short term recovery mangrove 15 mo used satellite imagery field sampling evaluate change forest structure control impacted area hailstorm satellite imagery revealed mangrove dieback 500 ha corresponding 293 total forest area suddenly impacted hailstorm fifteen month hailstorm impacted area show initial recovery others continued degrade el nino year 2014 2016 created mild drought condition eastern brazil a observed wetland semi arid region period mangrove recovery may impaired continued physiological stress effect economic loss site typical mangrove ecosystem service including food provision regulation raw material nursery estimated least us 792 624 yr 1 first evidence extreme weather impact mangrove brazil typically provide unique ecological economic subsistence coastal population our result reveal pressing need long term monitoring action coastal wetland brazil provide broad estimate ecosystem value associated ecosystem given many area already experiencing chronic stress local impact drought high temperature
12,HEALTH IMPACT ASSESSMENTS A Tool for Designing Climate Change Resilience into Green Building and Planning Projects,WOS:000297056200006,historical record documented considerable change global significant health economic environmental consequence projection predict intense hurricane increased sea level rise frequent intense natural disaster heat wave heavy rainfall drought future 1 2 coast along gulf mexico particularly vulnerable many environmental hazard particular risk several strike simultaneously hurricane disrupting electricity transmission heat wave due significant contribution global greenhouse gas ghg emission building sector already play important role mitigation effort e g reducing emission for example voluntary program leed leadership energy environmental design rating system 3 architecture 2030 challenge 4 american college university president commitment 5 clinton initiative 6 focus almost exclusively reducing energy consumption increasing renewable energy generation mandatory regulation international energy conservation code 7 international green building code 8 calgreen 9 also emphasize ghg emission reduction target leadership role necessary after united state epa estimate building sector account 62 7 total annual ghg emission u s construction sector facility operation transportation factored in fact construction sector alone third largest industrial emitter ghgs oil gas chemical industry contributing 1 7 total annual emission 10 11 a significant contribution appear built environment true contribution much larger ghg emission attributed building construction operation it also major determinant population vulnerable related hazard heat wave flooding 12 13 architecture land use planning therefore used tool building community resilience related environmental change underway 13 regulation voluntary program begun incorporate requirement targeting built environment ability work tandem natural environment reduce greenhouse gas emission protect occupant health consequence changing for example 11 state incorporated goal action plan 14 in 2010 profit organization iclei local government sustainability launched program 15 complement existing mitigation program support municipality signed u s conference mayor protection agreement 16 new tool introduced measure community vulnerability impact one tool health impact assessment hias emerged past decade powerful methodology provide evidence based recommendation decision maker community planning official likely health co benefit co harm associated proposed policy land use development proposal 17 while hias becoming common feature community planning effort introduces approach designing resilience specific building project hias used europe part world decade provide science based balanced assessment risk benefit health associated proposed policy program 18 in u s used past decade evaluate transit oriented development urban infill project california cap trade legislation among topic 17 19 to date hias used mainly inform large scale community planning land use industrial policy decision however recommendation generated hia process often bring light previously unforeseen vulnerability whether due existing infrastructure building technology socio economic condition designer make use hia process resulting recommendation prioritize design retrofit intervention result largest co benefit building owner surrounding community environment an hia focused health impact likely generate recommendation could enhance longevity building project useful life protect property value contributing resilience surrounding community result design decision prioritize strategy maximize short term efficiency long term environmental economic social value
13,Adaptive capacity in light of Hurricane Sandy: The need for policy engagement,WOS:000336111500002,aftermath hurricane sandy brings light tenuous u s model natural disaster management climatic extreme like sandy projected increase magnitude frequency calling upon society adapt appropriately imminent threat in describe knowledge policy disconnect exposed sandy submit four key element adaptive capacity resource institution knowledge innovation technology our synthesis multi disciplinary expert knowledge admonition civil engineer climatologist urban planner demonstrates significance mobilizing knowledge design robust socio ecological system contrast u s model dutch system emphasize feasibility value effectiveness adopting robust adaptive capacity rather policy steeped reactionary response such strategy integrate coordination imagination member across society imperative translating scientific foresight institutional action solution offer material action based discussion also provides illustration crafting policy enhances adaptive capacity socio ecological system
14,"Caribbean futures in the offshore Anthropocene: Debt, disaster, and duration",WOS:000452269500001,devastating impact hurricane irma maria across caribbean especially barbuda dominica puerto rico st martin st maarten part british u virgin island haunting harbinger world disaster halting recovery impossible future being leading edge global capitalist exploitation people living non living being world spanning system vast inequity severe injustice caribbean thinker writer poet philosopher activist artist long lived dwelt upon offered answer problem human man sylvia wynter put reflection island futuring defuturing offer critical analysis caribbean disaster recovery based understanding disjuncture three uneven spatio temporal reality 1 decelerating islanding effect debt foreign aid austerity 2 accelerating mobility offshore extended operational landscape planetary urbanization 3 durational im mobility amerindian survival maroon escape black indigenous cultural endurance alternative ontology
15,Evaluating climate change adaptation through evacuation decisions: a case study of cyclone management in India,WOS:000457710400007,adaptation extreme climatic event like tropical storm built disaster management empowering vulnerable community activity like disaster awareness training rescue measure provision better infrastructure strengthening societal institution disaster risk reduction disaster risk management program with increasing threat essential effectiveness measure evaluated limitation addressed state odisha eastern india witnessed nearly 10years capacity building cyclone management hit severe cyclone phailin 2013 public response evacuation order overwhelming in area many 95 resident evacuated aware precaution taken storm strike whereas area showed low 33 evacuation least interest training capacity building program maintenance critical infrastructure like cyclone shelter analyzing evacuation response logistic regression social economic issue like unemployment prevalence theft provision evacuation livestock safety explained evacuation failure significantly in future extreme event predicted hit coastal area intensity due necessitates government address socio economic problem along cyclone program make disaster management effective
16,Achieving sustainability goals for urban coasts in the US Northeast: research needs and challenges,WOS:000396622500008,in wake hurricane sandy recent extreme event urban coastal community northeast region united state beginning stepping effort integrate resilience long term coastal planning natural nature based shoreline strategy emerged essential component coastal resilience frequently cited practitioner scientist public wide range ecosystem service provide however limited quantitative information associating particular urban shoreline design strategy specific level ecosystem service provision issue always aligned decision context decision maker need engagement community local government official sustainability practitioner non profit private sector help bridge gap a workshop bring together group discussed gap challenge integrating ecosystem service urban sustainability planning urban northeast corridor many theme surfaced repeatedly throughout workshop deliberation including challenge associated ecosystem service valuation transferability case study within outside region opportunity urban coastal area focal point education outreach effort related ecosystem service
17,Regional wave model climate projections for coastal impact assessments under a high greenhouse gas emission scenario,WOS:000878551600001,in future shift wind storm across north baltic sea highly unpredictable challenging projection wave condition managing coastal hazard moreover regional sea level rise slr large uncertainty complicates situation stakeholder seeking recommendation plan purpose examine storm surge wind wave component water level due low tidal range koge bay near entrance baltic sea under high greenhouse gas emission scenario rcp8 5 employed regional model hirham forced wave model wam focused wave model result storm surge condition exceeding 20 year storm surge event stormy condition exceeding 90th percentile wave height find wave height period future negligible stormy condition nevertheless storm surge condition considering slr simulated wave height projected double near future mid century rcp 8 5 wave period may also increase 1 5 second high significant wave height event future associated storm surge event considering slr finding suggest combined effect mean sea level rise storm surge wave likely increase risk bay geography exposure comparable koge bay a result future plan engineering protection place premium additional wave energy protection associated storm surge
18,Coastal Defense Strategies in the Wadden Sea Region: Coping with Climate Change,WOS:000208051500001,recent flood one new orleans 2005 un intergovernmental panel report extreme weather event influence way people perceive problem necessity action analyzed coastal defense policy three wadden sea country netherlands denmark looked policy development relationship anticipated combined literature legislation management interview 11 decision maker area coastal defense land use planning policy found coastal defense policy relies mainly dike sand nourishment current defense strategy in anticipation effort made develop alternative solution land use planning involved flood defense limited extent a long budget technical solution keep wadden sea region safe major flood disaster found unlikely fundamental policy shift occur there however initiative improved management solution
