,title,wos,clean_abstract
0,Building regional priorities in forests for development and adaptation to climate change in the Congo Basin,WOS:000303355500007,indentifying common priority shared natural resource system constitutes important platform implementing major step sharing common responsibility addressing predominated discourse redd reduced emission deforestation forest degradation conservation sustainable management forest enhancement forest carbon stock developing country little emphasis risk lack policy measure addressing congo basin forest product ecosystem service provide security portfolio predominantly rural community play major role national development programme revenue employment opportunity thus raising profile forest policy arena especially twin role addressing mitigation achieving resilient development crucial within framework congo basin forest project cofcca project science policy dialogue conducted identify prioritize forest based sector vulnerable important household livelihood national development goal prioritization process development intervention forest measure central africa participant constituted wide range stakeholder government non governmental organization institution university community leader private sector etc representative three country directly involved project cameroon central african republic democratic republic congo building national priority four forest related sector identified common priority regional level focus these sector included 1 energy emphasis fuel wood charcoal 2 water principally quality quantity accessibility etc 3 food emphasis non timber forest product 4 health linked healthcare product medicinal plant using prioritized sector project focused addressing impact local community development strategy three pilot country congo basin region four sector constitute key development region equally considered priority sector poverty reduction paper focused sector help inject role forest national local development potential contribution national public discourse mainstreaming forest national development planning key improve policy coherence effectiveness forest management region
1,Exploring Traditional Ecological Knowledge (TEK) as an Urgent Action to Combat Climate Change in Turkey,WOS:000860503800019,aim determine role traditional ecological knowledge tek coping adapting projected change case turkey in order accomplish objective set present tek example theme 1 local information 2 understanding 3 coping developing strategy 4 correct management protection natural resource us qualitative design ethnographic data collected using qualitative data collection method observation interview 2018 2021 data analysis using descriptive analysis technique purposeful sampling method convenience sampling used select place observed group reveals local community developed tek practice strategy problem arise result turkey integrating tek example scientific knowledge turkey believed able play important role mitigation
2,Adapting forest certification to climate change,WOS:000352721000004,in context forest sector must consider extent sustainable forest management enables constrains mitigation may existing value principle policy decision making process institution longer appropriate forest certification emerged important arena setting international regional standard forest management unclear extent support help develop adaptive capacity forest sector therefore combine literature forest systematic assessment forest stewardship council criterion indicator detail forest carbon certification scheme brief shed light role certification standard mediating forest strategy
3,Spatially Explicit Assessment of Ecosystem Resilience: An Approach to Adapt to Climate Changes,WOS:000332321100001,ecosystem resilience play key role maintaining steady flow ecosystem service enables quick flexible response change maintaining restoring ecosystem resilience forest necessary societal however great lack spatially explicit ecosystem resilience assessment drawing principle ecosystem resilience highlighted literature built theory dissipative structure develop conceptual model ecosystem resilience forest a hierarchical indicator system designed influencing factor forest ecosystem resilience including stand condition ecological memory disaggregated specific indicator furthermore indicator weight determined analytic hierarchy process ahp coefficient variation method based remote sensing data forest inventory data forth resilience index forest calculated result suggests significant spatial heterogeneity ecosystem resilience forest indicating feasible generate large scale ecosystem resilience map assessment model result provide scientific basis conservation forest great significance mitigation
4,Climate change vulnerability and adaptation in the managed Canadian boreal forest,WOS:000341516800006,affecting boreal zone includes country managed forest impact zone expected pervasive require forest management system review potential action strategy forest management system considering current projected impact related vulnerability these impact vulnerability include regional increase disturbance rate regional change forest productivity increased variability timber supply decreased socioeconomic resilience increased severity safety health issue forest community potential action forest management system categorized reduce nonclimatic stressor reduce sensitivity maintain enhance adaptive capacity biophysical human subsystem forest management system efficient forest management system revolve around inclusion risk management planning process selection robust diversified regret action adoption adaptive management framework monitoring highlighted regret action central implementation adaptive forest management
5,"Natura 2000 and climate change-Polarisation, uncertainty, and pragmatism in discourses on forest conservation and management in Europe",WOS:000336948800012,european forest resource targeted several eu environmental land use policy forest critical importance mitigate at time central eu biodiversity policy particular natura 2000 network protected area yet interlinkage biodiversity policy complex discursively contested in ass debate affect forest conservation management natura 2000 drawing concept argumentative discourse analysis present evidence 213 qualitative interview policy stakeholder practitioner conducted european policy level local country level 6 eu member state our result demonstrate nexus forest conservation policy conceptualised differently different stakeholder practioners different level three major discourse made pragmatic discourse dynamic discourse threat discourse characterised set partially overlapping story line these discourse employed four discourse coalition environmental forest user expert grass root coalition a general rule debate european level polarised politicised local debate natura 2000 remain rather vague le polarised seems indicate link forest conservation mostly issue abstract high level policy debate at level used influence well known policy legitimise distinct interest already present debate emerged
6,The Congo Basin forests in a changing climate: Policy discourses on adaptation and mitigation (REDD+),WOS:000300817500026,discus discourse mitigation currently forefront congo basin on mitigation forest enormous opportunity contribute reducing emission deforestation forest degradation redd mechanism but forest multiple dependent society sector need adapt potential risk hence actor debating design policy forest sector theoretically combine agency focus frame analysis discourse theory analyze different agent hold frame mitigation policy region draw upon interview 103 different actor government international organization non governmental organization institution private sector three country cameroon central african republic car democratic republic congo drc three discourse found policy response forest sector mitigation policy separated policy mitigation integrated policy mitigation various frame articulated around discourse coalition include element cost benefit scale operation effectiveness financial resource implementation mechanism overall mitigation discourse mix actor resource interest seems stronger discourse finally outline number implication discourse policy design
7,"Allocating Untreated Controls in the National Wilderness Preservation System as a Climate Adaptation Strategy: A Case Study From the Flathead National Forest, Montana",WOS:000367363600004,challenge traditional strategy conserve native biological diversity sustaining ecosystem service several key framework call adoption experimental management whereby different strategy viewed experimental treatment requiring untreated control compare alternative approach at time variety traditional conservation approach e g protecting land connected network reserve continue emphasized critical strategy assuming reserve sufficiently representative ecological diversity land within national wilderness preservation system could used untreated control landscape also serving core within protected area network value nwps land serve untreated control representative ecological reserve require maximizing ecological diversity within protected area here assessed ecological representation across wilderness potential wilderness land located flathead national forest fnf our aim quantify map ecological cover type currently underrepresented wilderness underrepresented land cover type included diverse low elevation mixed conifer forest these cover type well distributed within potential wilderness suggesting opportunity expand untreated control diversifying ecological reserve investigating proportion potential wilderness composed underrepresented ecosystem provides mean prioritize area future wilderness recommendation however fnf large potential wilderness area provide opportunity significantly increasing representation individual ecosystem minimal representation wilderness method demonstrated could used national forest planning effort prioritize recommended wilderness based increasing ecosystem representation national forest wide scale
8,Coconstruction of Ecosystem Services Management in Tribal Lands: Elicit Expert Opinion Approach,WOS:000628840600010,mescalero apache tribal land matl provide diverse range ecosystem service many fundamental importance mescalero apache tribe well managing forest matl especially involves prioritizing certain ecosystem service used iterative survey expert opinion identify ecosystem service 1 high utility service tribe us could use obtained directly indirectly matl 2 irreplaceable service cannot provided natural resource 3 high level threat service risk declining lost directly indirectly thus critical management both scientist practitioner identified water cultural service management priority management recommendation mitigate adapt effect include reintroduction fire landscape assisted migration creation age size mosaic across landscape incorporation green energy incorporating human perspective natural resource management critical component maintain adapt social ecological system especially indigenous community inherent right sovereignty deeply connected natural resource demonstrates knowledge system complementary diverse perspective related value threat ecosystem incorporated coconstruct ecosystem management decision
9,"Exploring wildlife disservices and conservation in the context of ecosystem-based adaptation: A case study in the Mt. Elgon region, Uganda",WOS:000848218600001,ecosystem based program seek use ecosystem service help vulnerable human community adapt impact proponent program cite biodiversity conservation critical cobenefit however date limited study examine outcome ecosystem based intervention particularly term implication wildlife case applies common international classification ecosystem service framework examine ecosystem based program mt elgon region uganda participant interview within community previously enrolled ecosystem based project used explore program local community member perceived relationship nature context environmental potential implication wildlife within outside nearby mt elgon national park result indicate ecosystem based program positively influenced participant reported conservation value perception behavior however wildlife disservice emerged significant factor influencing outcome biodiversity conservation co benefit underscore importance incorporating disservice ecosystem based address factor may undermine resilience gain particularly nature based solution implemented globally
10,Perceptions of and adaptation to environmental change in forest-adjacent communities in three African nations,WOS:000355737400004,semi structured interview used explore rural community near forest responding environmental three african nation cameroon equatorial guinea rwanda first recount people perception environmental issue greatest concern identified local community second explores people response identified environmental problem particular role forest process finally concludes discussion changing land management practice implementation may affect future strategy community result suggest people current potential response environmental influenced availability access forest forest resource degree livelihood strategy diversified away forest dependence thus conclude forest policy redd need responsive diverse forest based need rather assuming one size fit relationship forest conservation
11,Forest policy and management approaches for carbon dioxide removal,WOS:000562794000003,forest increasingly used carbon dioxide removal cdr natural solution implementation forest based cdr present complex public policy challenge in goal range policy tool place support use forest cdr demonstrate concept policy design literature inform understanding domain explore utilization different policy tool shape ability use forest mitigate adapt consider challenge policy mix integration taking close look three area international forest policy including kyoto protocol clean development mechanism reducing emission deforestation forest degradation redd voluntary carbon offset market a expertise examine detail case usa country lack aggressive implementation national policy potential increase cdr reforestation existing forest management public private land for forest based cdr succeed wide array policy tool implemented variety context eye towards overcoming challenge policy design regard uncertainty policy outcome policy coherence around managing forest carbon simultaneously goal integration across governance context level
12,"Climate change mitigation via afforestation, reforestation and deforestation avoidance: and what about adaptation to environmental change?",WOS:000266988500002,affecting world ecosystem threatening economic system livelihood availability natural resource forest ecosystem carbon source sink therefore integrated international policy forest related carbon mitigation project threatened altered environmental condition forest process well synergistic effect impact already existing socioeconomic environmental stressor data risk management strategy collected survey 28 current forest project targeting mitigation ten represent officially implemented afforestation a reforestation r activity unfccc kyoto protocol additionally official methodology ar activity cdm scope 14 examined potential requirement a result forest mitigation project found insufficient a systematic approach inclusion risk management developed guideline design proof afforestation reforestation deforestation avoidance project proposed a broader mainstreaming issue required clear policy regulation necessary especially post kyoto process
13,Risk and contributing factors of ecosystem shifts over naturally vegetated land under climate change in China,WOS:000369937400001,identifying area risk ecosystem transformation main contributing factor risk essential assist ecological assessed risk ecosystem shift china using projection four global gridded vegetation model ggvms aggregate metric result show half naturally vegetated land surface could moderate severe risk end 21 st century middle high emission scenario area high risk tibetan plateau region area extended northeastward tibetan plateau northeast china with three major factor considered carbon stock main contributing factor high risk ecosystem shift carbon flux another important contributing factor high emission scenario water flux le dominant factor except tibetan plateau region high emission scenario although considerable uncertainty risk assessment geographic pattern risk generally consistent across different scenario result could help develop regional strategy ecosystem conservation cope
14,Cross-Sectoral Resource Management: How Forest Management Alternatives Affect the Provision of Biomass and Other Ecosystem Services,WOS:000351863600001,integrated forest management faced challenge contribution forest economic ecological planning target must assessed socio ecological system context introduces way model spatio temporal dynamic biomass production regional scale order derive land use strategy enhance biomass provision avoid trade offs ecosystem service software platform giscame employed bridge gap local land management decision regional planning linking growth yield model integrative mesoscale modeling assessment approach model region located saxony five scenario simulated aimed testing different alternative adapted land use context increasing biomass demand result showed example forest conversion towards adapted forest type positive effect ecological integrity landscape aesthetic in contrast negative impact landscape aesthetic must expected agricultural site converted short rotation coppice uncertainty stem assumption regarding growth yield model discussed future developmental step consider example accessibility resource identified
15,Forests and trees for social adaptation to climate variability and change,WOS:000309911100006,ecosystem provide important service help people adapt variability recognizing role ecosystem several international nongovernmental organization promoted ecosystem based approach scientific literature related ecosystem based eba forest tree highlight five case forest tree support 1 forest tree providing good local community facing climatic threat 2 tree agricultural field regulating water soil microclimate resilient production 3 forested watershed regulating water protecting soil reduced impact 4 forest protecting coastal area related threat 5 urban forest tree regulating temperature water resilient city literature provides evidence eba forest tree reduce social vulnerability hazard however uncertainty knowledge gap remain particularly regulating service watershed coastal area few study undertaken eba specifically abundant literature ecosystem service used fill knowledge gap many study ass multiple benefit ecosystem human well also recognize trade offs ecosystem service better understanding needed efficiency cost benefit trade offs eba forest tree pilot project implementation could serve learning site existing information could systematized revisited lens wire clim 2012 3 581596 doi 10 1002 wcc 195 for resource related please visit wire website
16,The calm before the storm: How climate change drives forestry evolutions,WOS:000518874700032,adapting forest management key issue forest crucial mitigation policy provision many ecosystem service understanding magnitude progress made respect help shape development avoid putative maladaptive side effect forest management evolution here aim bridge knowledge gap implementation french forest to stay close possible concrete change conducted semi structured interview forester two area differed intensity forest management approach our finding highlight unprecedented aspect adaptation focus productive ecosystem service expense essential service water supply natural habitat ii adaptation rely technical change forest management deal impact organizational economic tool iii envisaging ecological process adaptation instrumental limited small spatial temporal scale our result also extend existing body knowledge framework forest management main driver forestry change ii extreme event window opportunity stimulate adaptive change iii proactive unexperienced hazard weak argue effective possible forestry implement complementary organizational economic change addition necessary technical evolution
17,"Assessing and adapting to climate change in the Blue Mountains, Oregon (USA): Overview, biogeography, and climate",WOS:000582009500001,blue mountain partnership bmap established increase awareness ass vulnerability develop science based strategy national forest land blue mountain region northeast oregon southeast washington usa bmap process included 1 development science management partnership 2 vulnerability assessment effect natural resource infrastructure 3 development option help reduce negative effect assist transition biological system management changing 4 ongoing dialogue activity related blue mountain region special issue service describes social context vulnerability assessment water use infrastructure vegetation riparian ecosystem blue mountain region well option natural resource management manuscript introduces special issue describing management biogeographic climatic context blue mountain region vulnerability assessment process used bmap potential application information described special issue although institutional focus information special issue u s forest service land malheur umatilla wallowa whitman national forest broader social context option applicable land throughout region pacific northwest
18,Difficult climate-adaptive decisions in forests as complex social-ecological systems,WOS:000758464700012,threatens social ecological economic benefit enjoyed forest dependent community worldwide climateadaptive forest management strategy genomics based assisted migration am may help protect many threatened benefit however novel technological intervention complex social ecological system generate new risk benefit uncertainty interact diverse forest value preexisting risk using data 16 focus group british columbia show different stakeholder forestry professional environmental nongovernmental organization local government official member local business community emphasize different kind risk uncertainty judging appropriateness am show difficulty adaptive decision complex social ecological system widespread cascading impact diverse nonclimate value overarching judgment am strategy may appear simple elicited survey questionnaire require participant make complex trade offs among multiple domain uncertain unknown risk overall highest priority forest management objective stakeholder health integrity forest ecosystem important forest value derive factor perceived riskiest lack knowledge forest ecosystem work hinders stakeholder assessment am acceptability these result evidence inherent risk privileging natural science form knowledge science policy interface when decision framed technical normative ethical consideration define fundamental goal made invisible
19,"Ecological meteorology: Origin, concept, and prospects",WOS:000628655500012,ecological meteorology emerging earth science subject response current environmental crisis become secondary subject atmospheric science it encompasses meteorological science technological support national ecological civilization construction especially national environmental protection sustainable development accelerating ecological meteorology monitoring establishing operational brand critical origin concept primary area ecological meteorology hereby reviewed ecological meteorology study relationship ecosystem meteorological condition core multiple earth system sphere interaction serf harmonious development human nature it includes six main aspect 1 pattern law meteorologically induced ecosystem type geographical distribution 2 measurement ecosystem temporal spatial change due variable meteorological condition 3 meteorological contribution attribution analysis ecological change 4 feedback ecosystem change earth system 5 numerical modeling ecological meteorology 6 interaction meteorological condition ecosystem principle promote harmonious development human nature compared ecology meteorology ecological meteorology following characteristic 1 time scale range second millennium 2 spatial scale range stomatal scale global scale 3 driving force include weather atmospheric composition ecological environmental change 4 content emphasizes multiple earth system sphere interaction disaster risk management 5 method technology focus satellite ground integration monitoring system data model fusion analysis 6 goal understand relationship human nature based sustainable development earth system ecological meteorology observation come typical ecosystem station regional scale field investigation operational service include assessing ecological carrying capacity resource monitoring evaluating warning ecological meteorology disaster explains relationship ecological meteorology ecological civilization construction disaster prevention mitigation address primary urgent ecological meteorology task extracting relevant information analysis using big data artificial intelligence investigating ecosystem adaptation attribution exploring ecosystem main meteorological disaster process critical meteorological condition analyzing eco physiological mechanism key terrestrial ecosystem phenological period developing simulation model based multiple environmental factor developing eco meteorological numerical model coupling biological physical chemical management process understanding terrestrial ecosystem change sustainable development countermeasure affect system ecological meteorology new promising field expected provide valuable information future
