,title,wos,clean_abstract
23,The art of adaptation: Living with climate change in the rural American Southwest,WOS:000329881300043,a come forefront discourse policy crucial consider effect interpret concept draw attention need interpretation foster policy institution breadth flexibility recognize support wide range locally relevant strategy social scientist argued practice standard definition tends prioritize economic value technical social response draw attention away underlying cause vulnerability broader context adaptive response take place exclude discussion inequality justice transformation in discus alternate understanding label living emerged ethnographic rural resident u s southwest understand respond plan weather daily life consider might inform effort develop comprehensive definition discussion brings focus several underlying feature lay conception crucial understanding actually unfolds ground ontology based nature society mutuality epistemology based situated knowledge practice based performatively adjusting human activity dynamic biophysical social environment placed based system value suggest feature help point way toward comprehensive understanding one fully informed understanding living anthropocene
24,Balancing stability and flexibility in adaptive governance: an analysis of tools available in US environmental law,WOS:000404997600004,adaptive governance must work ground must operate structure procedure people governs perceive legitimate fair well incorporating process substantive goal effective allowing social ecological system sess adapt impact to address continuing accelerating alteration bringing sess adaptive governance generally require flexibility prior governance institution often allowed however function good governance adaptive governance must pay real attention problem balance increased need flexibility continuing governance stability foster without perceived experienced perpetually destabilizing disruptive unfair flexibility stability serve different purpose governance variety tool exist strike different balance still preserving governance institution legitimacy among people governed after reviewing purpose implication environmental governance examine psychological insight structuring adaptive governance variety legal tool available incorporate insight adaptive governance regime because substantive goal governance system differ among specific system purport comment normative substantive goal law instead conclude attention process procedure including participation well increased use substantive standard instead rule may allow increased level substantive flexibility operate legitimacy fairness providing requisite level psychological social economic stability needed community adapt successfully anthropocene
25,Adaptive capacity and climate change: the role of community opinion leaders,WOS:000378168500003,contribution informal community sector development collective response strategy socioecological well researched in examine role community opinion leader developing mobilising stock adaptive capacity in reveal largely unexplored mechanism building latent social capital associated network potential transcend local scale effort enduring question cross scalar sustainability issue participant drawn diverse sphere community activity sunshine coast interviewed strategy influencing community objective degree engaged responding result show community opinion leader politically engaged rich bridging connection community organisation vertically policy maker local state national international level despite latent potential majority community opinion leader interviewed strategically engaged responding finding suggests work needed connect network knowledgeable projected impact local network community opinion leader attention type community based strategy considered effective appropriate community opinion leader organisation also suggests avenue policy maker facilitate community engagement responding across sector likely affected impact opportunity extend understanding adaptive capacity within community sector also suggested
26,Aligning Resilience and Wellbeing Outcomes for Locally-Led Adaptation in Tanzania,WOS:000690191100001,intervention address rise past decade intervention programme aim build resilience local community shock ultimately wellbeing helping better prepare adapt recover resilience similar human wellbeing multidimensional construct grounded local reality lived experience yet current evaluation framework used resilience programming rarely consider resilience mean local context prior implementation mean policy design risk failing improve resilience community creating unintended negative consequence community wellbeing better process indicator assessing resilience needed explores interplay local predictor resilience wellbeing ass validity self assessed indicator part framework measure resilience draw devolved finance dcf mechanism implemented 2014 2018 tanzania find different factor explain resilience compared wellbeing resilience primarily influenced relationship wellbeing correlated livelihood show incentive improve resilience differ wellbeing development practitioner must adopt locally grounded framing resilience wellbeing ensure intervention track appropriate indicator towards positive outcome
27,"The Role of Place in Adapting to Climate Change: A Case Study from Ladakh, Western Himalayas",WOS:000435188000002,explores nexus socio economic focus significance local condition physical cultural influencing vulnerability resilience in order better examine impact interact socio economic change experienced community scale integrates household survey data geospatial processing technique two comparative site one rural one urban selected region ladakh area experiencing severe impact alongside rapid socioeconomic political change archival data used supplement survey response provide additional historical context survey response combined hot spot kernel density analysis arcgis identify area high low spatial concentration correlation while widely perceived many western himalayan mountain community impact issue high importance moderated pressing socioeconomic cultural political concern role locality place based theme community attachment social cohesion sense place emerged influential factor enhancing social resilience thereby reducing dimension local vulnerability impact
28,Assessing climate change vulnerability in urban America: stakeholder-driven approaches,WOS:000383615200004,localized vulnerability assessment critical effective however difference local decision maker expert see vulnerability yet fully explored especially united state seeing possible distinction approach critical since necessary ensure comprehensive accountable approach explores distinct approach local stakeholder conceptualizing vulnerability six american city sixty five interview cross sectoral local stakeholder conducted boston ma los angeles ca portland or raleigh nc tampa fl finding demonstrate conceptualization vulnerability affected intellectual framework tend orient around infrastructure human health retrospective prospective thinking inter related affect one another institutionalized form bias critical these factor shape way vulnerability conceived differently traditional expert framework
29,Not a Security Issue: How Policy Experts De-Politicize the Climate Change-Migration Nexus,WOS:000683587700017,policy expert play important role coping human migration nexus they offer expert solution decision maker thus contribute de politicizing issue aim find different policy expert envision human migration nexus netherlands nominated seat global center excellence aim become global center excellence water safety security domain policy expert selected based structured nominee process conducted semistructured interview policy expert analyzed policy expert documentation interview transcript document examined via coding frame unlike policymakers link conflict policy expert stress economic political factor migration issue happen major difference view policymakers policy expert link human migration emerges frame refugee in context human migration nexus policy expert act countervailing power prevents political exploitation nexus security issue
30,Evaluating what matters: an evaluation tool for vulnerability risk assessments in local climate change adaptation planning,WOS:000621677700001,united nation framework convention set guidance move country forward via national plan many proven non implementable generic lack detail community need here vulnerability risk assessment vra characteristic considered desirable absent thence develop evaluation tool systematically analyzing vras used planning local level test experimentally innovative vra process claiming better outcome us preprocess crystallizing shared value participant considering issue evaluation result show tool successfully discriminate quality approach capture many distinct characteristic difference tool also practitioner checklist thus helpful identifying accelerating improvement vras hence planning affiliated local global benefit
31,What is the potential and demonstrated role of non-life insurers in fulfilling climate commitments? A case study of Nordic insurers,WOS:000333720300008,collective action stakeholder required fulfilling commitment kyoto protocol insurance sector global influence societal impact fairly well documented sector influence society based interaction stakeholder product business political stance a critical actor facilitating key action mitigation already recognized leading sector term aim explore role non life insurer fulfilling commitment kyoto protocol based case nordic non life insurance company document nordic insurer responding related threat opportunity strategic manner reducing impact core activity influencing others act although nordic insurer classify action mitigation classify according core activity demonstrate action role potential ally nation fulfilling kyoto protocol commitment also reveals commercial reality industry expected contribution commitment instance specified international convention treaty intergovernmental panel ipcc industry report
32,Nature unsettled: How knowledge and power shape 'nature-based' approaches to societal challenges,WOS:000602819700013,nature based solution nb gaining traction high level decision making arena response global policy challenge claiming transformative pluralistic nb aim resolve societal problem focus nature understood benign ally uncritical framing nature may unintended inequitable consequence undermine emancipatory potential nb in highlight need pay attention epistemic power dimension tend hidden nb assume nature neither passive external human society instead expressed frame reifying mode expression reflect knowledge power social encounter nb used drawing upon five case analyse particular way framing nature express reinforce power relation structure people interaction each five case relies nature based frame produce knowledge peacebuilding justice analysis reveals frame nature enacted particular context condition potential societal transformation towards sustainability pluralistic knowledge demonstrate frame nature constrain enable opportunity various group respond environmental discus nb paradigm might better incorporate diverse situated knowledge subjectivity conclude require critical evaluation nb practice
33,Perspectives on civic engagement in national strategies to combat climate change,WOS:000310312600010,only democratic political system ensure reliable continuous inclusion interest citizen commitment addressing need contribution focus citizen engage developing answer fighting adapting impact employing function model civil society developed merkel lauth draw practical experience revealed concrete example offer systematization role function civil society play combating example successful civic engagement community national level cover different perspective entry point human right environmental energy issue consumer protection transition stable democracy become object significant international democracy support account concludes democracy international supporter must understand complexity brings livelihood community level potential benefit pursuing greater interaction civic engagement local national level
