,title,wos,clean_abstract
177,Analysis of Swedish Forest Owners' Information and Knowledge-Sharing Networks for Decision-Making: Insights for Climate Change Communication and Adaptation,WOS:000400444100002,to understanding process attention need paid various contextual factor shape whether related knowledge information received acted upon actor involved set examine characteristic forest owner sweden information knowledge sharing network draw upon decision making perception risk forest resilience need perceived adaptive capacity by applying concept ego network analysis empirical data generated quantitative survey distributed 3000 private forest owner sweden 2014 response rate 31 result show positive correlation even though generally weak forest owner perception network feature e network size heterogeneity ii presence certain alter group e network member actor result indicate forest owner social network currently serve minimal function sharing knowledge moreover considering fairly infrequent contact respondent alter group timing knowledge sharing important in conclusion suggest actor forest owner frequently communicate especially forestry expert providing advisory service e g forest owner association company authority clear role communicate risk opportunity peer valuable connecting information risk actual forest property
178,"How does climate adaptation co-benefits help scale-up solar-powered irrigation? A case of the Barind Tract, Bangladesh",WOS:000766032500010,solar powered irrigation system low cost option ensures variety co benefit domain mitigation thus incorporated part project however co benefit sufficiently explored may result lack insight co benefit prevent wider roll scaling aim exploring co benefit solar powered irrigation measure taking project drought prone area northwest part bangladesh case using interview focused group discussion find besides generating co benefit mitigation substantial co benefit various form including vulnerability reduction enhancement resilience however many co benefit indirect le visible realizable long term informal social group formation improved financial strength employment opportunity making co benefit visible among various stakeholder launching feed option may help scale solar powered irrigation
179,Can prior knowledge increase task complexity? - Cases in which higher prior knowledge leads to higher intrinsic cognitive load,WOS:000890374400001,background aimscognitive load theory assumes higher learner prior knowledge e expert learner lower intrinsic cognitive load complexity experienced given problem while case many scenario case converse also true resulting expert learner reporting higher intrinsic cognitive load novice problem occur relation problem involving complex system e g ecological system novice problem representation may underestimate problem complexity therefore report lower intrinsic load expert finding borne current sample method resultsin 1 118 participant black forest area participant higher level forestry ecological expertise evaluated problem relating restructuring black forest adapt complex novice in 2 within subject design n 66 primary school student conceptually replicated finding domain typical cognitive load theory study mathematics found higher prior knowledge also reduced underestimation complexity tricky frequently used mathematics word problem conclusionour finding suggest cognitive load theory assumption intrinsic load prior knowledge refined seems exist sub set problem solving task traditional relationship prior knowledge reported icl reversed
180,Ecosystem carbon stocks in different aged tea agroforestry systems: implications for regional ecosystem management,WOS:000539842000001,tea camellia sinensis often grown canopy tree forming distinctive agroforestry system covering estimated area 3 94 million ha land globally although tea major commercial crop many country tropical sub tropical region including china india sri lanka tea agroforestry system tafs remained little studied role carbon management mitigation action therefore undertook detailed storage organic carbon ground vegetation soil age chronosequence tafs north east india specific aim quantify variation soil physical chemical property carbon storage shade tree tea bush ecosystem carbon stock chronosequence tafs established significant variation soil property carbon storage different aged tafs one salient finding decrease soil bulk density increase water holding capacity age tafs 0 50 cm depth total vegetation
181,Variation in the Soil Prokaryotic Community Under Simulated Warming and Rainfall Reduction in Different Water Table Peatlands of the Zoige Plateau,WOS:000525702200001,water table drawdown impact community structure diversity peatland soil prokaryote nonetheless soil prokaryote different water table respond remains largely unknown used 16 rrna gene sequencing evaluate variation soil prokaryote scenario warming rainfall reduction combination different water table peatlands zoige plateau china stimulated affected diversity index relative abundance soil prokaryote three water table peatlands additionally dry rewetting event peatland dominant phylum genus showed significant change relative abundance due simulated treatment regarding functional microbial group carbon nitrogen cycling simulated affect abundance euryarchaeota proteobacteria verrucomicrobia methanobacterium three water table peatlands except nc10 nitrospirae redundancy analysis showed prokaryotic community variation primary impacted site property different water table peatlands rather simulated treatment moreover water table total carbon total nitrogen soil ph primary factor overall variation soil prokaryotic structure provides theoretical guidance management strategy zoige peatland scenario more attention given interactive effect peatland water table drawdown simulated change better restorative effort water table drawdown rather simply adapting
182,Crop connectivity under climate change: future environmental and geographic risks of potato late blight in Scotland,WOS:000387811300016,impact dispersal process largely ignored risk assessment crop disease inoculum generally assumed ubiquitous nonlimiting suggest consideration impact connectivity crop inoculum transmission may provide additional explanatory predictive power disease risk assessment leading improved recommendation agricultural in crop growth model combined aerobiological model newly developed infection risk model provide framework quantifying impact future climate risk disease occurrence spread integrated model us standard meteorological variable easily adapted various crop pathosystems characterized airborne inoculum in case framework used data defining spatial distribution potato crop scotland spatially coherent probabilistic data project future connectivity crop distribution phytophthora infestans causal agent potato late blight inoculum subsequent risk infection projection control recommendation provided multiple combination potato cultivar co2 emission scenario temporal spatial averaging scheme overall found relative current climatic condition risk late blight increase scotland first half potato growing season decrease second half to guide strategy also investigated potential impact driven shift cropping season advancing start potato growing season 1 month proved effective strategy agronomic late blight management perspective
183,Microgrid design for disadvantaged people living in remote areas as tool in speeding up electricity access in Rwanda,WOS:000922147400001,across many developing nation rwanda absence electricity significantly reduced economic impact rural community a common practice location process farm product using locally fabricated machine diminishes quality quantity production simultaneously increasing danger illness recent study suggest hybrid power system based renewable energy source could support development adaption low emission economy post pandemic future according current electrification rate variable restrict electricity access speed investigated solution overcome issue proposed according finding connection rural area delayed presence remote low density village access utility transmission line expensive complex for reason proposes novel microgrid design suggests installed solar pv mobile mini grid provide group household energy enabling obtain economical environmentally friendly energy result proven proposed model adjustable expandable generation distributed storage to greater extent installation single device residence even result establishment expandable dc microgrid develop cost efficient manner additional neighbor joined grid eventually microgrid able alter way processing equipment utilized solution also expected contribute advancement clean technology pursuit universal electrification
184,"Climate change, mining development and residential water security in the uMkhanyakude District Muncipality, KwaZulu-Natal, South Africa: a double catastrophe for local communities",WOS:000898038600001,academic mining associated impact water resource particularly developing world limitedly explored expected make water insecurity rural area severe weather pattern become unfavourable extent mining sector able reduce impact water resource adapt implication host community explores relationship mining development water security place rural community position risk mining development water security focus fuleni somkhele rural community located within umkhanyakude district municipality northern kwazulu natal induced water scarce area despite drought mining operation continue semi structured interview used collect data key social actor fuleni community e resident opposing mining development somkhele resident already burdening mining operation additionally somkhele questionnaire used ascertain 424 household view impact variability mining impact livelihood water result indicated interplay mining impact water food security development must implemented integrated holistic manner contributes sustainable development impact water resource technological innovation related water energy inter sectoral collaboration must prioritised mining government civil society achieve water security
185,Quantifying opportunities for greenhouse gas emissions mitigation using big data from smallholder crop and livestock farmers across Bangladesh,WOS:000660250700011,continue significant implication agricultural system while priority smallholder production system adoption cost effective mitigation option agriculture contributes food security also reduces extent future need utilizing management data 16 413 12 548 crop livestock farmer associated soil climatic data estimated ghg emission generated crop livestock production using crop livestock model respectively mitigation measure crop livestock production mitigation potential cost benefit adoption obtained literature stakeholder consultation expert opinion applied identified mitigation measure realistic scale adoption scenario short 2030 long term 2050 our result validated stakeholder consultation here present identified mitigation option mitigation potential cost benefit adoption form marginal abatement cost curve macc based analysis total ghg emission agricultural sector bangladesh year 2014 15 76 79 million tonne mt carbon dioxide equivalent co 2 e business usual ghg emission agricultural sector bangladesh approximately 86 87 100 44 mt co 2 e year 1 2030 2050 respectively adoption smart crop livestock management option reduce emission considering realistic adoption scenario would offer ghg mitigation opportunity 9 51 14 21 mt co 2 e year 1 2030 2050 respectively of mitigation potential 70 75 achieved cost saving option could benefit smallholder farmer realization potential mitigation benefit however largely depends degree supportive policy measure encourage farmer adoption identified smart agricultural technique therefore government focus facilitating uptake option appropriate policy intervention incentive mechanism strengthening agricultural extension program
186,"Trees, forests and water: Cool insights for a hot world",WOS:000398868900005,forest driven water energy cycle poorly integrated regional national continental global decision making mitigation land use water management constrains humanity ability protect planet life sustaining function substantial body reveals forest water energy interaction provide foundation carbon storage cooling terrestrial surface distributing water resource forest tree must recognized prime regulator within water energy carbon cycle if function ignored planner unable ass adapt mitigate impact changing land cover our call action target reversal paradigm carbon centric model one treat hydrologic cooling effect tree forest first order priority for reason sustainability carbon storage must remain secondary though valuable product effect tree cover local regional continental scale offer benefit demand wider recognition forest tree centered insight analyze provide knowledge base improving plan policy action our understanding tree forest influence water energy carbon cycle important implication structure planning management governance institution well tree forest might used improve sustainability mitigation effort
187,Photosynthesis-dependent/independent control of stomatal responses to CO2 in mutant barley with surplus electron transport capacity and reduced SLAH3 anion channel transcript,WOS:000362306700003,mechanism stomatal sensitivity co2 yet fully understood role photosynthetic non photosynthetic factor stomatal response co2 investigated wild type barley hordeum vulgare var graphic mutant g132 decreased photochemical rubisco capacity co2 dcmu response stomatal conductance g gas exchange chlorophyll fluorescence level atp putative transcript stomatal opening analysed g132 greater g wild type despite lower photosynthesis rate higher intercellular co2 concentration
188,Facilitating landform migration by removing shore protection structures: Opportunities and constraints,WOS:000389089300023,recent study identified need adapt allowing landforms habitat migrate landward although implementation actual response limited removing barrier shore protection structure create coastal upland habitat reestablish exchange sediment ecological function natural ecotone potential removing structure evaluated 12 national park managed u s national park service criterion removal included condition structure influence natural process environmental benefit public safety visitor access use found 145 structure total 407 could removed allowed deteriorate highlight three project currently conducted two involve removing structure reason taking pro active approach removing protection structure include 1 conflicting policy directive 2 presence key access road critical archaeological historic site 3 lack data 4 lack fund human resource 5 reluctance replace known problem unknown set problem 6 consideration visitor desire 7 reluctance allow erosion occur demonstration project needed provide information strategy promote enhancement ecosystem function project remove protection structure likely viewed successful result specified positive product distinction concept loss erosion existing landforms habitat concept gain evolution new landforms habitat made clear
189,Major United States Land Use as Influenced by an Altering Climate: A Spatial Econometric Approach,WOS:000654198700001,socioeconomic policy factor found stimulate land use change along change greenhouse gas emission adaption behavior most study investigating land use change u s considered potential spatial effect explicitly used two step linearized multinomial logit examine impact various factor conterminous u s land use change including spatial lag coefficient estimation result show spatial dependence existed cropland pastureland grassland negative dependence forest weakened land us except croplands temperature precipitation found nonlinear impact land use share succeeding year exerting opposite effect crop versus pasture grass share also predicted land use change different scenario simulation result imply southern region u s would lose cropland share severity business usual scenario land use share pasture grass forest would increase region a land use play important role system vice versa result may help policymakers tackle driven land use change farmer adapt
190,High-temperature indicators for capturing the impacts of heat stress on yield: lessons learned from irrigated wheat in the hot and dry environment of Sudan,WOS:000946598000001,high temperature occurring flowering early grain filling substantially decrease cereal yield drawing accumulated evidence showing compared air temperature ta crop canopy temperature tc better explains observed yield reduction caused heat stress evaluated usefulness tc versus ta designing high temperature indicator agrometeorological service including crop monitoring forecasting hot dry environment sudan provides ideal testbed tc derived combined simulation crop model land surface model based regression linking high temperature indicator irrigated wheat yield variation 3 region sudan last half century found using phenological period rather month wheat season november february using tc rather ta effectively track adverse effect high temperature yield key period tc based indicator calculated key phenological period robust multi region applicability ta based indicator calculated month season although necessarily outperform region specific indicator term explanatory power determined key period vegetative growth period relatively cool region reproductive growth period relatively hot region these finding suggest agrometeorological service national global level adopt tc based indicator ultimately help player global food system adapt preparing wheat supply disruption due high temperature extreme
191,"Application of a land use change model to guide regional planning and development in the south basin of the Urmia Lake, Iran",WOS:000686707400016,farmer make decision adapt reduce environmental vulnerability if decision made incorrectly irreversible change take place threaten environmental social economic sustainability agriculture applies land use model guide regional agricultural land use planning focus case south basin urmia lake nw iran using data landsat image statistic questionnaire checklist finding indicate significant change five factor namely rainfall humidity minimum temperature average temperature maximum temperature for example rainfall decreased 10 mm average temperature increased 3 5 degree
192,Productivity limits and potentials of the principles of conservation agriculture,WOS:000347810300045,one primary challenge time feed growing demanding world population reduced external input minimal environmental impact variable extreme condition future 1 4 conservation agriculture represents set three crop management principle received strong international support help address challenge 5 6 recent conservation agriculture effort focusing smallholder farming system sub saharan africa south asia 7 however conservation agriculture highly debated respect effect crop yield 8 10 applicability different farming context 7 11 13 here conduct global meta analysis using 5 463 paired yield observation 610 study compare till original central concept conservation agriculture conventional tillage practice across 48 crop 63 country overall result show till reduces yield yet response variable certain condition till produce equivalent greater yield conventional tillage importantly till combined two conservation agriculture principle residue retention crop rotation negative impact minimized moreover till combination two principle significantly increase rainfed crop productivity dry climate suggesting may become important strategy ever drier region world however expansion conservation agriculture done caution area implementation two principle often challenging resource poor vulnerable smallholder farming system thereby increasing likelihood yield loss rather gain although farming system multifunctional environmental socio economic factor need considered 14 16 analysis indicates potential contribution till sustainable intensification agriculture limited often assumed
193,Nested externalities and polycentric institutions: must we wait for global solutions to climate change before taking actions at other scales?,WOS:000299172600008,literature global largely ignored small positive step many public private actor taking reduce greenhouse gas emission a global policy frequently posited strategy needed it important balance major attention global solution strategy coping positive action underway multiple smaller scale start process mitigation researcher need understand strength polycentric system enterprise multiple level may complement building global regime necessity encouraging emergence polycentric system start process reducing greenhouse gas emission act spur international regime part
194,Determinants of water use saving behaviour toward sustainable groundwater management,WOS:000915969700001,promoting gw saving behaviour one strategy support sustainable groundwater use management however study paid attention gw saving behaviour to address surveyed gw user n 338 investigate factor influencing current gw saving attitude gw saving behaviour shaped community theory planned behaviour tpb participant asked perception gw saving water saving intentional behaviour probit regression use deployed explore factor influencing water user perception gw saving structural equation model sem also used construct tpb variable investigate psychological factor influencing gw saving intention behaviour finding show water user agricultural sector 8 0 98 p 0 01 negative gw saving bahavior changing user agricultural sector self perception gw saving tends decrease z score 0 98 statistical significance level awareness gw extraction impact 8 0 89 p 0 002 gw adequate knowledge information 8 1 16 p 0 015 gw tariff 8 0 78 p 0 02 strongly influenced gw saving behaviour gw saving intentional behaviour influenced sub jective norm 8 0 52 p 0 001 perceived behavioral control 8 0 21 p 0 001 our finding suggest gw policy option pay attention gw tariff application awareness raising gw impact gw knowledge dissemination control gw abstraction community enhance gw water saving attitude behaviour community also appeal engagement local community water governance increase social pressure water saving changing behavior
195,Understanding the cascade of GCM and downscaling uncertainties in hydro-climatic projections over India,WOS:000431999600013,india major agrarian country strongly impacted spatio temporal variation indian monsoon impact assessment usually accomplished implementing projection general circulation model gcms unfortunately projection cannot capture dynamicity monsoon require either statistical sd dynamical dd downscaling gcm projection finer resolution both downscaling technique capture spatio temporal variation climatic variable marred uncertainty projection resulting choice gcm downscaling method affect adaptation here assessed uncertainty projection hydro climatic variable india considering multiple downscaling technique multiple gcms combined effect referred total uncertainty multiple hydrological variable simulated implementing variable infiltration capacity model considered output dd derived coordinated regional downscaling experiment cordex sd forced multiple gcm simulation our result showed sd projection captured observed spatio temporal variability hydro climatic variable efficiently dd projection importantly contribution downscaled projection total uncertainty significantly smaller compared inter gcm uncertainty believe uncertainty analysis important component good scientific practice however several researcher appear rather reluctant embrace concept uncertainty making projection prediction forecasting it remains common practice show exercise decision maker stakeholder without uncertainty bound here successful attempt made identify key source uncertainty adequately bracket uncertainty indicating requirement code practice provide formal guidance particularly impact assessment consequently emphasized importance follow understand inter gcm uncertainty significant impact sustainable agriculture water resource management india
196,Farmers' Perception and Adaptation Strategies to Climate Change in Central Mali,WOS:000798742900007,agricultural sector crucial avoid food insecurity sub saharan africa farmer perception crucial element process aim compare farmer perception actual weather data recorded central mali ii identify change agricultural practice implemented farmer adapt iii investigate link farmer perception implementation practice focus group discussion individual survey conducted identify related change perceived farmer agricultural strategy consider relevant cope change a majority 50 farmer perceived increase temperature decrease rainfall shortening growing season early cessation rainfall increase frequency dry spell beginning growing season in line farmer perception analysis data indicated increase mean annual temperature minimum growing season temperature ii decrease total rainfall farmer perception early cessation rainfall frequent drought period detected data analysis to cope decrease rainfall late start growing season farmer used drought tolerant cultivar implemented water saving technology despite perceived warming specific heat stress mentioned farmer found evidence link farmer perception implementation option our highlight need dialogue farmer researcher develop new strategy compensate expected negative impact heat stress agricultural productivity
