,title,wos,clean_abstract
0,Piloting a Climate-Change Adaptation Index on US National Forest Lands,WOS:000717541700002,present novel significant threat sustainability forest ecosystem worldwide united state forest service usfs conducted vulnerability assessment much 193 million acre national forest land manages yet little exists degree management unit adopted consideration planning project implementation in response knowledge gap piloted survey instrument usfs region 1 northern region region 6 pacific northwest region determine criterion assessing degree national forest integrate consideration management planning activity our resulting index provides efficient quantitative approach identifying potentially national forest making progress toward incorporating adaptation forest planning management implication used self assessment survey planner manager u national forest forest service region 1 6 design index measuring degree national forest unit integrated consideration planning management activity our resulting index potentially used help understand usfs decentralized strategy led national forest make comparatively significant progress towards adapting others lagged behind
1,Mountain freshwater ecosystems and protected areas in the tropical Andes: insights and gaps for climate change adaptation,WOS:000725305200001,although protected area pa play important role ecosystem conservation systematic information available pa protection high elevation freshwater ecosystem e g lake watershed glacier biodiversity ecosystem service tropical andes therefore combined literature map analysis pa international union conservation nature iucn national system pa freshwater ecosystem found seven national park created water resource protection designed freshwater conservation e larger watershed high value biodiversity site protected new local pa created due water resource need quantified 31 ramsar site observed pa cover 12 lake 31 glacial lake 12 total stream length tropical andes additionally 120 watershed average area 631 km 2 glacier 40 total glacier surface area covered pa future role pa ecosystem service provision detailed freshwater inventory within around pa especially dependent glacier runoff fill key knowledge gap freshwater conservation tropical andes
2,Adaptation to climate change? Why business-as-usual remains the logical choice in Swedish forestry,WOS:000429399000008,two latest ipcc assessment report concluded knowledge sufficient inducing action problematizes issue going beyond business usual forestry sector sweden large economic sector could expected early adapter given newly planted forest may stand 70 90 year future therefore resource economic motivation longer term environmental foundation early action could expected exist draw upon foucauldian conceptualization governmentality explain particular institutional logic nevertheless lead business usual argument dominating discussion case swedish forestry emphasizes must seen steered limited existing institutional social system logic rather externally defined rational motivation effort must thus considered relation seek existing institutionally based motivational incentive structure must thus conceived social rather environmental logic in fact social logic may even define type action may regarded adaptation
3,"Climate, Adaptation, and the Value of Forestland: A National Ricardian Analysis of the United States",WOS:000766779900012,estimate econometric ricardian model effect forestry using novel national data set county level net economic return forestland result show projection 2050 increase forest net return middle latitude eastern u s timberland quantify value extensive margin separately estimating effect 11 distinct forest type find approximately 69 positive effect eastern u s forestry arises value extensive margin impact western united state inconclusive
4,Contribution of spatially explicit models to climate change adaptation and mitigation plans for a priority forest habitat,WOS:000424030100003,impact forest ecosystem biodiversity livelihood sustain several mitigation strategy counteract impact proposed ecosystem however effective implementation strategy requires clear understanding influence future distribution forest ecosystem us maximum entropy modelling maxent predict environmentally suitable area cork oak quercus suber woodland socio economically important forest ecosystem protected european union habitat directive specifically use two scenario predict change environmental suitability across entire geographical range cork oak area stand recently established up 40 current environmentally suitable area cork oak may lost 2070 mainly northern africa southern iberian peninsula almost 90 new cork oak stand predicted lose suitability end century future plantation take advantage increasing suitability northern iberian peninsula france predicted impact cross country border showing multinational strategy required cork oak woodland such strategy must regionally adjusted featuring protection refugia site southern area stimulating sustainable forest management area keep long term suitability afforestation effort also promoted must consider environmental suitability land competition issue
5,Climate exposure of East Asian temperate forests suggests transboundary climate adaptation strategies are needed,WOS:000491987900004,impact traverse administrative border call new strategy forest ecosystem conservation adaptive management despite relatively high biodiversity temperate forest east asia lacked comprehensive regional evaluation potential impact here ass level exposure temperate broadleaf mixed forest biome east asia 2070 these temperate forest occupy 18 ecoregions five country 102 province categorize exposure classifying baseline 1960 1990 condition current geographic distribution five temperate forest type within ecoregion within biome measure level four future climate warmer hotter future reduced emission rcp4 5 emission continuing unabated rcp8 5 by 2070 using rcp8 5 emission scenario 24 5 65 7 forest enter non analog marginal 1 baseline condition these result reveal need extensive transboundary governmental coordination including forest preservation action among 51 54 province retain forest location climatically stable low risk condition furthermore among 96 province forest highly exposed 90 require transboundary strategy forest span border including border area china russian federation north korea analytical approach could serve template supporting transboundary institutional coordination address
6,Application of integrated Korean forest growth dynamics model to meet NDC target by considering forest management scenarios and budget,WOS:000799255000001,background forest atmospheric carbon sink whose natural growth contribute mitigation however also affected various phenomenon example low growth coniferous forest currently reported globally including republic korea in response implementation paris agreement korean government proposed 2030 greenhouse gas roadmap achieve nationally determined contribution ndc forest sector set sequestration target 26 million ton 2030 in korean forest growth model ko g dynamic model used analyze various forest management scenario capacity address ndc target a 2050 strategy suggested based forest growth co2 sequestration result forest growth predicted gradually decline co2 sequestration predicted reach 23 million ton per year 2050 current condition maintained according model sequestration 33 million tco 2 year 1 2030 27 million tco 2 year 1 2050 achieved ideal forest management implemented it also estimated current forest management budget 317 billion krw 264 million usd twice large 722 billion krw 602 million usd 2030s 618 billion krw 516 million usd 2050s achieve ndc target conclusion growth trend korea forest transition young matured stand mature forest presented model based forest management plan appropriate response increase capacity korea achieve ndc target such modeling help forestry sector develop plan policy
7,Assessments of the Forest Carbon Balance in the National Climate Policies of Russia and Canada,WOS:000736721800017,examines role forest national policy two country rich wood russia made effort reduce direct co2 emission national economy intensify forestry increase greenhouse gas sequestration forest russia focus verification recalculation carbon sequestration capacity forest analysis russian stationary model used ass carbon sequestration capacity forest robul cbm cf respectively show model russian one derived reflect stationary dynamic forest stand inevitably result downward co2 absorption trend even forest inventory updated regular basis predictive component model unable take account variability forest ecosystem model describe global carbon flux e g one using fluxnet remote sensing data provide significantly higher net carbon sequestration value indicate nondecreasing net carbon accumulation trend forest it concluded stationary remote sensing model used together ass net carbon sequestration formulate key principle national policy country rich forest
8,Contribution To Climate Change Of Forest Fires In Spain: Emissions And Loss Of Sequestration,WOS:000520510200007,forest fire contribute mainly due emission greenhouse gas biomass burning loss sequestration sink destruction average contribution spain 1998 2015 9 494 910 mg co2 eq per year 23 8 biomass burning 76 2 loss carbon sequestration latter three time higher former although emission combustion usually accounted regarding vegetation burned 43 6 emission come forest 17 7 conifer 4 8 hardwood 21 1 eucalyptus 53 7 scrubland 2 7 grassland loss sequestration 6 6 fire year 93 4 previous year scrubland burning produce greater amount emission forest forest regeneration slower greater influence loss sequestration it essential forest management focused increase fire resilience increase effectiveness extinction work reduce fire damage implement action recover burnt vegetation loss sink critical aspect
9,Responses of Tree Growth and Intrinsic Water Use Efficiency to Environmental Factors in Central and Northern China in the Context of Global Warming,WOS:000847030300001,loess plateau fragile ecological zone sensitive response feedback tree growth forest ecosystem global warming co2 enrichment urgent scientific issue intrinsic water use efficiency iwue important indicator understanding forest ecosystem adaptability co2 enrichment in tree ring width tree ring stable carbon isotope ratio delta
10,The North Cascadia Adaptation Partnership: A Science-Management Collaboration for Responding to Climate Change,WOS:000324044300007,u s forest service usfs national park service np highlighted agency priority issued direction administrative unit responding in response usfs np initiated north cascadia partnership ncap 2010 goal ncap build inclusive partnership increase awareness ass vulnerability develop science based strategy reduce vulnerability ncap expanded previous science management partnership federal land larger ecologically geographically complex region extended approach broader range stakeholder ncap focused two national forest two national park north cascade range washington usa total land area 2 4 million ha making largest science management partnership kind ncap assessed vulnerability four resource sector hydrology access vegetation ecological disturbance wildlife fish developed option sector ncap process proven successful approach implementing across region emulated land management agency north america beyond
11,Model-based analysis of the spatial variability and long-term trends of soil drought at Scots pine stands in northeastern Germany,WOS:000304102400010,soil water availability determines vitality tree forest stand large degree over last decade increasing number drought spell observed several part europe our aim estimate long term trend soil drought scot pine l stand along prevailing climatic gradient mecklenburg western pomerania northeastern to end soil water balance simulation carried 24 site period 1951 2009 physically based model lwf brook90 a threshold soil water stress used 40 relative extractable water rew result indicated increased number drought day east together declining total precipitation however specific site condition large influence occurrence soil drought partly overriding climatic difference across area soil drought distinctly increased recent past duration intensity affecting eastern site western site increased soil dryness could attributed higher atmospheric evaporative demand due higher temperature well slightly lower precipitation sum summer month to mitigate negative effect future measure preferably conducted eastern part northeastern
12,Pattern of NDVI-based vegetation greening along an altitudinal gradient in the eastern Himalayas and its response to global warming,WOS:000371067600038,eastern himalaya especially yarlung zangbo grand canyon nature reserve ynr global hotspot biodiversity wide variety climatic condition elevation ranging 500 7000m sea level l mountain ecosystem different elevation vulnerable however little pattern vegetation greening response global warming objective examine pattern vegetation greening different altitudinal zone ynr relationship vegetation type climatic factor specifically inter annual normalized difference vegetation index ndvi variation along altitudinal gradient 1999 2013 investigated using spot vgt ndvi data aster global digital elevation model gdem data found annual ndvi increased 17 58 ynr 1999 2013 especially region dominated broad leaved coniferous forest lower elevation vegetation greening rate decreased significantly elevation increased threshold elevation approximately 3000 rising temperature played dominant role driving increase ndvi precipitation statistical relationship change ndvi region provides useful information develop integrated management conservation plan promote biodiversity conservation ynr
13,"Adaptation of trees, forests and forestry to climate change",WOS:000284292500001,chmura d j howe g t anderson p d st clair j b 2010 przystosowanie drzew lasow lesnictwa zmian klimatycznych sylwan 154 9 587 602 ongoing likely expose tree forest new stress disturbance century tree naturally adapt change natural adaptive ability may compromised rapid change projected century in broad sense also includes purposeful human system includes forestry in briefly expected impact projected tree forest ecosystem poland provide framework designing adaptive strategy sustain enhance forest growth health ecosystem service new climate within framework distinguish two related objective 1 decision making process forest management 2 forest ecosystem each objective may achieved strategy option whose applicability discussed relation major forest function ecological societal commercial multiple use knowledge gap need also identified conclude recent emphasis sustainable multi functional forestry current ownership structure poland facilitate polish forest future climate however much remains learned impact especially ecosystem level cooperation researcher forest manager critical developing better management strategy adapting forest
14,Sustaining Forest Plantations for the United Nations' 2030 Agenda for Sustainable Development,WOS:000881460200001,located hearth africa congo basin world second largest rainforest ecosystem spanning nine country including republic congo nature based solution e afforestation reforestation agroforestry supplying wood energy halting food insecurity restoring land desertification fostering mitigation warming increasingly used past decade within framework congolese coastal plain afforested using fast growing tree since early 1950s due low forest productivity soil fertility sustainable management forest ecosystem tree soil environment performed improved germplasms increased stand wood biomass healthier soil potential enhance wood fuel wood energy supply mitigation food security restoration land ecosystem biodiversity meet ten seventeen sustainable development goal sdg specifically goal related alleviating poverty 1 hunger 2 improving health 3 education 4 sanitation access clean water 6 other goal include providing affordable clean energy 7 sustainable production consumption 12 action 13 life land 15 partnership goal 17 nature based solution help face important societal challenge meeting half sdgs united nation
15,Dynamics of plantation forest development and ecosystem carbon storage change in coastal Bangladesh,WOS:000692515900004,plantation forest immense potential significantly contributing global carbon cycle regulating assessing spatio temporal distribution plantation forest vegetation analyzing landsat land use land cover lulc data provide logical basis developing ecological environmental policy effectively manage ecosystem carbon storage future aimed assessing predicting dynamic plantation forest development ecosystem carbon storage coastal bangladesh 1988 2041 three future land management scenario business usual bau economic development ed ecological protection afforestation epa linking ca markov invest model finding lulc analysis revealed 1988 2018 plantation forest increased 984 9 km2 68 34 leading overall increase regional carbon storage 3 30 tg
16,Climate Change and Recreation in the Western United States: Effects and Opportunities for Adaptation,WOS:000756751900001,affecting natural resource globally altering ecosystem support outdoor recreation in western united state effect warming temperature increased drought reduced snowpack widespread wildfire outdoor recreation landscape in synthesize state science regarding effect outdoor recreation western u summarize option reduce consequence considering adaptive capacity recreationists manager draw series assessment researcher manager collaborated understand recreation vulnerability develop effective adaptation conclude building resilience requires shift planning resource allocation decision including 1 longer term planning timeframes 2 interdisciplinary team 3 collaboration among agency recreation provider community implication outdoor recreation western u changing due effect organized five recreational category describes vulnerability outdoor recreation synthesizes strategy adapt recreation management vulnerability multiple direct indirect factor influence individual recreationists land manager capacity adapt describe diagram resilient land management requires long term planning integration multiple resource area collaboration across agency recreation provider community
17,Varietal diversity of Sri Lankan traditional rice based on sensitivity to temperature and photoperiod at vegetative stage,WOS:000463001000005,photoperiod temperature two important environmental factor affecting vegetative growth yield rice varietal diversity based response temperature photoperiod vegetative growth determined core collection 40 sri lankan traditional rice accession sltra 2 improved 2 wild rice type term day fully expansion fifth leaf dfl plant height ph short day sd day neutral dn long day ld condition imposed 2 trial high temperature ht low temperature lt 36 9 0 43 degree
18,The Role of Hydropower in Climate Change Mitigation and Adaptation: A Review,WOS:000392917700012,hydropower clean renewable environmentally friendly source energy it produce 3930 tw h 1 yield 16 world generated electricity 78 renewable electricity generation 2015 hydropower show double relationship on one hand important renewable energy resource hydropower contributes significantly avoidance greenhouse gas ghg emission mitigation global warming on hand likely alter river discharge impacting water availability hydropower generation hydropower contributes significantly reduction ghg emission energy supply security compared conventional coal power plant hydropower prevents emission 3 gt co2 per year represents 9 global annual co2 emission hydropower project may also enabling role beyond electricity sector financing instrument multipurpose reservoir adaptive measure regarding impact water resource regulated basin large reservoir capacity resilient water resource change le vulnerable act storage buffer at global level overall impact existing hydropower generation may expected small even slightly positive however possibility substantial variation across region even within country in conclusion general verdict hydropower cheap mature technology contributes significantly mitigation could play important role water resource availability however careful attention necessary mitigate substantial environmental social cost roughly terawatt capacity could added upcoming decade
19,Evidence of non-stationary relationships between climate and forest responses: Increased sensitivity to climate change in Iberian forests,WOS:000545727300001,forest structure considered major driver forest demography productivity however recent evidence suggests relationship tree growth generally non stationary e non time stable remains uncertain whether relationship forest structure demography productivity stationary altered recent climatic structural change here analysed three survey spanish forest inventory coveringc 30 year information applied mixed structural equation model ass temporal trend forest structure stand density basal area tree size tree size inequality forest demography ingrowth growth mortality ground forest productivity also quantified whether interactive effect forest structure forest demography ground forest productivity stationary two consecutive time period since 1980s density basal area tree size increased iberian forest tree size inequality decreased in addition observed reduction ingrowth growth increase mortality initial forest structure water availability mainly modulated temporal trend forest structure demography magnitude direction interactive effect forest structure forest demography changed two time period analysed indicating non stationary relationship forest structure demography above ground forest productivity increased due positive balance ingrowth growth mortality despite increasing productivity time observed aggravation negative effect increased competition forest demography reducing ingrowth growth increasing mortality interestingly result suggest negative effect forest demography could ameliorated forest management profound implication forest
20,"The Evolution of Wilderness Social Science and Future Research to Protect Experiences, Resources, and Societal Benefits",WOS:000376221500011,historic wilderness act celebrated 50th anniversary 2014 wilderness social science shared similar legacy a paradoxical might seem human important part wilderness helping define concept representing important component wilderness use management much past five decade wilderness related social science focused recreational use documenting impact recreation wilderness resource quality wilderness experience exploring application concept recreational carrying capacity wilderness developing planning management framework balancing inherent tension wilderness use protecting quality wilderness resource experience visiting wilderness limit acceptable related planning framework including formulation recreation related indicator standard continues help guide wilderness management today other program social science developed protocol measuring monitoring wilderness recreation defined root cause conflict among wilderness user identified management approach minimize conflict explored appropriate acceptable use fee wilderness use identified growing suite wilderness value all program others could included helped guide wilderness management policy however social science evolved function change wilderness society evolution continues focus public attitude toward public attitude toward restoration wilderness correct past human intervention appropriate use technology wilderness issue related relevance wilderness light change society use public land tell story change issue relationship wilderness american people
21,"Climate and wildfire area burned in western U. S. ecoprovinces, 1916-2003",WOS:000266281400015,purpose quantify climatic control area burned different vegetation type western united state demonstrate wild area burned wfab american west controlled 20th century 1916 2003 persistent ecosystem specific correlation wfab grouped vegetation type ecoprovinces most mountainous ecoprovinces exhibit strong year fire relationship low precipitation low palmer drought severity index pdsi high temperature grass shrub dominated ecoprovinces positive relationship antecedent precipitation pdsi for 1977 2003 variable explain 33 87 mean 64 wfab indicating strong linkage area burned for 1916 2003 relationship weaker explained 25 57 mean 39 variability variance wfab proportional mean squared different data set different spatial scale importance antecedent summer drought forested ecosystem antecedent winter precipitation shrub grassland ecosystem indicates mechanism behind observed relationship climatic preconditioning large area low fuel moisture via drying existing fuel fuel production drying impact regime therefore vary relative energy water limitation ecosystem ecoprovinces proved useful compromise ecologically imprecise state level localized gridded fire data difference relationship among ecoprovinces underscore need consider ecological context vegetation fuel seasonal identify specific driver wfab despite possible influence suppression exclusion fuel treatment wfab still substantially controlled implication planning management future wfab likely depend ecosystem specific seasonal variation in fuel limited ecosystem fuel treatment probably mitigate vulnerability increase resilience readily limited ecosystem large severe re extreme weather condition continue account area burned
