,title,wos,clean_abstract
19,"Water, Water Everywhere, Communities on the Brink: Retreat as a Climate Change Adaptation Strategy in the Face of Floods, Hurricanes, and Rising Seas",WOS:000592193600002,in nearly fifteen year hurricane katrina hurricane victim effort recover army corp engineer construction maintenance new orleans faulty levee system slowly wended way court after federal circuit held st bernard parish government v united state army corp engineer construction maintenance constitute taking hurricane victim effort recover court hit dead end using hurricane katrina aftermath lens examine mechanism compensate victim deter future loss note ultimately concludes existing method recovery natural disaster primarily tort national flood insurance program fall short a increase threat catastrophic flooding caused hurricane rising sea new mechanism compensate victim deter future flood loss needed note us taking theory rejected federal circuit st bernard parish potential mechanism facilitate retreat vulnerable area buying back flood prone property however federal buyback program must grapple problematic history using eminent domain forcibly displace poor minority community note proposes program incorporate community input early stage order keep valuable community tie intact
20,Failure analysis of corrugated panel subjected to windborne debris impacts,WOS:000341352800020,with changing natural disaster cyclone hurricane typhoon take place around world cause tremendous loss damage damage building structure windborne debris impact reported almost previous major wind event windborne debris usually imposes localized impact loading creates opening building envelope might trigger serious damage building structure roof lift collapse strong wind pressure propagating structure to withstand impact extreme event engineering solution technique need provided improved building protection capacity requirement panel resist windborne debris impact given australian wind loading code a nzs 1170 2 2011 1 corrugated metal panel widely used building envelope roof wall cladding might subject windborne debris impact evaluates capacity corrugated panel resist wind borne debris impact laboratory test carried corrugated metal panel dimension 0 76 1 2 subjected 4 kg wooden projectile impact effect various impact location impact velocity boundary condition performance studied failure deformation mode various impact scenario observed compared dynamic response examined based deformation strain panel back face perforation resistance capacity panel subjected windborne debris impact assessed analyzed in addition numerical model developed l dyna simulate response failure corrugated panel windborne debris impact accuracy numerical model calibrated test data validated numerical model used obtain result impact force boundary reaction force energy absorption vulnerability curve corrugated panel windborne debris impact also derived
21,Opportunities and Challenges for Hurricane Resilience on Agricultural and Forest Land in the US Southeast and Caribbean,WOS:000522460200082,three storm 2017 hurricane season caused 265 billion damage u s southeast caribbean including billion loss agriculture forestry sector projection indicate disastrous hurricane season becoming normal working land management sector need prepare future however study evaluate hurricane resilience strategy challenge faced land manager surrounding hurricane event boundary organization critical hurricane preparedness recovery advising land manager hurricane often supporting recovery effort here rely public advisor experience understand land manager pursue hurricane resilience using focus group online survey three agency southeast u s u s caribbean n 607 identify challenge faced land manager hurricane strategy implement minimize damage learn land manager faced many diverse unique challenge related hurricane long term planning hurricane event uncommon compared shorter term preparedness recovery activity effort towards hurricane resilience incorporate local need align land management goal increase overall resilience related stressor result guide state territorial national level prioritizations regarding hurricane resilience well identify need hurricane resilience strategy
22,Assessment of the effectiveness of wood pole repair using FRP considering the impact of climate change on decay and hurricane risk,WOS:000615259900005,electric power distribution system vulnerable disruption due severe weather event especially hurricane such vulnerability expected increase time due impact hurricane decay wood pole support distribution line investigates effectiveness using fiber reinforced polymer frp sleeve reinforce wood pole subjected decay hurricane hazard restore lost strength extend effective service life potential impact pole decay rate intensity frequency hurricane also considered optimal frp repair time based structural reliability pole also determined three location varying climate chosen evaluate compare result miami charleston new york city result show three location application frp sleeve double service life pole depending time repair result also show significantly increase vulnerability pole probability failure pole end 21st century rcp8 5 emission scenario miami charleston new york city increase 30 70 73 respectively compared scenario if assumed affect decay pole e hurricane hazard intensity corresponding increase failure probability 5 22 20 miami charleston new york city respectively implies impact pole failure risk due increase hurricane intensity impact decay found comparatively small it increase time variation temperature precipitation becomes prominent towards end 21st century optimization result show optimal frp repair time depends frp affect pole decay rate if frp significantly slow wood decay rate optimal time repair beginning pole life cycle if frp impact wood decay rate better repair pole significant decay occurred
23,"Bloated bodies and broken bricks: Power, ecology, and inequality in the political economy of natural disaster recovery",WOS:000440118800017,disaster recovery effort form essential component coping unforeseen event earthquake hurricane flood typhoon become frequent severe face accelerated most time disaster recovery effort produce net benefit society however depending design governance project germinate adverse social political economic outcome drawing concept political economy political ecology justice theory critical development study first present conceptual typology revolving around four key process enclosure exclusion encroachment entrenchment enclosure refers disaster recovery transfer public asset private hand expands role private actor public sphere exclusion refers disaster recovery limit access resource marginalizes particular stakeholder decision making activity encroachment refers effort intrude biodiversity area contribute form environmental degradation entrenchment refers disaster recovery aggravates disempowerment woman minority worsens concentration wealth income inequality within community document presence four inequitable attribute across four empirical case study hurricane katrina reconstruction united state recovery effort 2004 tsunami thailand typhoon yolanda philippine canterbury earthquake new zealand it next offer three policy recommendation analyst program manager researcher large spreading risk via insurance adhering principle free prior informed consent preventing damage punitive environmental bond political economy disaster must taken account project maximize efficacy avoid marginalizing vulnerable disaster
24,Extreme weather event attribution science and climate change litigation: an essential step in the causal chain?,WOS:000436973100002,2017 north atlantic hurricane season caused highest disaster related loss ever seen united state many people asking question cause liability impact kind event a related loss damage mount growing interest role law dealing complex multi scalar problem build shorter piece entitled act god human influence litigation published author nature geoscience august 2017 it interdisciplinary cross jurisdictional analysis emerging science extreme weather event attribution analysis human impact extreme weather event implication new science may law litigation scope duty care range actor suggest science event attribution may become driver litigation shift understanding weather expected relevantly law foreseeable may impact duty government actor well private party explain discipline event attribution science lawyer discus technical issue related use evidence court make suggestion regarding type case may influence conclude first kind litigation emerge likely arise failure adapt prepare changing
25,Rebuild or Relocate? Resilience and Postdisaster Decision-Making After Hurricane Sandy,WOS:000358370200016,hurricane sandy struck east coast united state october 29 2012 devastating community path in aftermath new york implemented home buyout program designed facilitate permanent relocation resident area considered risk future hazard while home buyout program becoming popular policy tool disaster mitigation little known factor influence homeowner participate reject program used mixed method ass relationship community resilience relocation decision two heavily damaged community majority resident made different decision regarding whether pursue buyout sample composed resident oakwood beach rockaway park working class community new york city participated via community survey n 133 depth interview n 28 result suggested community resilience moderated relationship community residence buyout decision leading opposite response buyout decision contextual community factor including history natural disaster local cultural norm sense place instrumental explaining different response implication disaster policy discussed
