,title,wos,clean_abstract
20,"Modelling 2050 Water Retention Scenarios for Irrigated and Non-Irrigated Crops for Adaptation to Climate Change Using the SWAT Model: The Case of the Bystra Catchment, Poland",WOS:000937911100001,present estimated change soil water content total runoff sediment yield actual evapotranspiration small bystra catchment east poland finding based result three simulation covering year 2041 2050 simulation based calibrated validated swat model 2010 2017 first variant cover existing structure soil cultivation three regional model supported ec earth global model emission scenario rcp4 5 rcp8 5 variant two three based first variant term changing second variant however involves placing pond farm catchment third variant involves designing huge reservoir result land consolidation variant two three occur five scenario first scenario v2 1 v3 1 involves increasing number pond farm increasing number reservoir non irrigated arable land crop e wwht winter cereal barl spring cereal canp rapeseed crdy crop second scenario v2 2 v3 2 involves growing vegetable without irrigation instead cereal third scenario v2 3 v3 3 involves growing vegetable irrigation instead cereal fourth scenario v2 4 v3 4 involves partial cultivation vegetable cereal fifth scenario v2 5 v3 5 involves partial cultivation orchard cereal scenario irrigation vegetable deep water bearing layer second variant reservoir third variant contribute increase water content soil especially summer comparison scenario vegetable cultivation without irrigation what actual evapotranspiration higher scenario involving irrigation scenario without irrigation it known change water content soil intensification water erosion gravely affected modification crop soil cultivation a cereal cultivation irrigated vegetable cultivation orchard increased water content soil climatic projection however increase number pond second variant little impact soil water content actual evapotranspiration overall runoff erosion loss decreased with lower precipitation level year 2041 2050 relative 2010 2017 presented emissive scenario rcp 4 5 soil water content decrease 14 variant total runoff variant also lower 4 35 percentage sediment yield fluctuate 86 116 on hand actual evapotranspiration variant higher with higher precipitation level year 2041 2050 relative 2010 2017 presented emissive scenario rcp 8 5 soil water content change slightly 7 3 total runoff variant also higher much 43 sediment yield scenario may increase 226 actual evapotranspiration variant also higher irrigation variant tend increase soil available water increasing evapotranspiration total outflow catchment compared non irrigated lulc largest increase soil water content observed irrigation variant rcp 4 5 annual average 316 319 mm v2 3 v2 5 v3 2 v3 3 rcp 8 5 annual average 326 327 mm v2 3 v2 5 v3 3 compared v1 bau 315 mm rcp 4 5 324 mm rcp 8 5 year 2041 2050 on hand lowest increase soil water content observed v3 5 variant annual average 292 mm rcp 4 5 annual average 311 mm rcp 8 5 thus future scenario irrigation water reservoir pond storage reservoir considered prof rationale behind building pond small catchment order increase water resource landscape also counteract adverse effect change e sediment outflow surface water erosion
21,"Integrated evaluation of Ecosystem Services in Prawn-Rice rotational crops, Vietnam",WOS:000414208500008,hydrologic condition kien giang province west coast vietnam mekong delta unique sense extensive saline water intrusion dry season every year instead triple crop scheme like area delta prawn rice rotational cultivation scheme initiated facilitate agricultural production kien giang in ecosystem service e generated agriculture ecosystem prawn rice rotational crop prrc assessed using integrated approach specific e identified include water nutrition regulation soil together regulation favor cultivated crop a multi disciplinary approach including remote sensing gi social survey statistical analysis adopted comprehensively evaluate geographical biophysical economic social aspect e firstly landsat 8 image processed normalized difference vegetation index nvdi modified normalized difference water index mndwi identify area cultivating prrc accuracy image classification assessed ground truthing found 80 coincidence simulated result field observation then social survey conducted using face face interview 50 local household collect data related farming practice economic value ecosystem service obtained using revised market method annual crop yield per unit area mean estimated value e provided prrc 1300 usd ha year standard deviation 600 usd ha year accounted 38 1 59 4 averaged economic revenue net benefit respectively analysis social survey data revealed factor greatest effect ecosystem service value selling price prawn farming experience finally result synthesized gi describe e value vary across area facilitates effective communication importance e concept policy maker regarding land use planning natural resource management decision
22,An assessment of the impacts of climate change on Puerto Rico's Cultural Heritage with a case study on sea-level rise,WOS:000438085700021,in summarize current projected change expected impact material cultural heritage puerto rico a case also conducted spatial analysis vulnerability assessment coastal heritage site 20 meter elevation result analysis show 1185 known cultural heritage site 20 meter elevation puerto rico 27 site inundated today highest high tide 56 inundated mid century assuming 0 6 rise sea level 140 site inundated end century assuming 1 8 rise sea level spatial analysis site adjacent high tide line demonstrate value likely conservative many site located within 1 highest high tide line also considered vulnerable finally present introductory proposal address need vulnerability assessment aid cultural heritage manager developing adaptive strategy impact material heritage
23,A methodology for the assessment of compound sea level and rainfall impact on urban drainage networks in a coastal city under climate change,WOS:000752647700003,seek investigate stormwater drainage system coastal city respond term simultaneous sea level rise rainfall 7 5 year recorded rainfall sea level data city trelleborg sweden used generate projection future event based emission scenario rcp8 5 twelve scenario formulated represent rain sea level today reference future future rainfall computed using regional model data together delta method sea related data represented two variable namely average sea level storm surge average sea level calculated reflect seasonal variation using second order fourier analysis whilst raw gauge data used capture storm surge two sea variable scaled represent future projection sea level rise storm surge area performance drainage system simulated mike urban 1d model result expressed two indicator number flooded node flood frequency result reveal tipping point likely found year 2075 2100 storm surge become major driver overwhelmed drainage system it also found pluvial flood may become likely frequent winter time progress great implication deciding measure
24,Assessment of water presence and use at sand dams in Kenya,WOS:000632490200002,level water access provided sand dam assessed measuring water presence use repre sentative sample 97 dam kenya most dam filled sediment capable holding water 25 median reduction water capacity due siltation using high estimate sediment specific yield multiple sediment core taken dam indicated presence water half sediment core 57 dam although individual variation generally dam region therefore capable accumulating water analysis landsat satellite image indicated translate average increase vegetative greening moisture index dam site compared control site observational data activity dam indicated variable level water use 43 dam active water harvesting present 39 dam current agricultural activity adjacent sand dam site cross sectional comparison data indicate consistently higher level water harvesting agricultural use dam water result point towards high level community understanding sand dam benefit lower rate actually realizing benefit
