,title,wos,clean_abstract
50,Concern and confidence. Architects making sense of climate adaptation,WOS:000334345200003,drawing analytical concept sensemaking defined weick 1995 sensemaking organization sage thousand oak ca scholarship concerning discourse architect identity regulatory context architecture i examine architect make sense issue i found discourse architect identity context appeared shape way made sense rather way around also architect identity contextual factor important architect sensemaking feature issue most important among identity related element architect sensemaking conception architect expertise holistic encompassing aesthetic creative technical craft related dimension among contextual factor architect sensemaking national building regulation industry focus cost efficiency central
51,Designing Institutions to Support Local-Level Climate Change Adaptation: Insights from a Case Study of the US Cooperative Extension System,WOS:000348973400003,in light global necessary level social organization however literature emphasizes impact vulnerability locally specific inevitably local in order inform design institution encourage support effective local level author derive principle design theoretically use case explore principle could practically implemented ten design principle synthesized principle derived review literature local level usable science boundary organization bringing three literature together highlight characteristic boundary organization make particularly valuable addressing challenge local level case illustrates existing boundary organization university arizona cooperative extension u s cooperative extension system ce implement principle organizational structure daily practice extension professional it also highlight significance ce existing social network social capital facilitating implementation from case concluded ce uniquely positioned serve important role national strategy united state supporting local level urban rural community across country
52,Knowledge gaps and climate adaptation policy: a comparative analysis of six Latin American countries,WOS:000487478700001,identifies analyzes main knowledge gap affect development policy latin american context it based comparative analysis online survey result conducted among government official working six country region argentina brazil chile costa rica paraguay uruguay address four key issue first identifies critical knowledge deficit missing incomplete information affect policy making implementation second address obstacle difficulty facing collaborative process knowledge production co production scientist public policy actor third analyzes factor affecting knowledge uptake use policymakers finally identifies main knowledge deficit specifically affecting monitoring assessment policy measure overall provides diagnosis main knowledge gap facing policy latin american country studied result diagnosis serve input action agenda aiming strength interaction science policy latin american country key policy insight country covered suffer strong knowledge deficit related design implementation evaluation policy collaborative mode knowledge production field tend sustain time co production process tend project based linked specific initiative rather institutionalized long term policymaking planning process fragmentation lack integration knowledge available different aspect issue deeply affect usability policy process weak state capability co produce manage use knowledge policy process constitute main barrier affecting science policy interface issue
53,Climate Adaptation Planning for Resilient and Sustainable Cities: Perspectives from the City of Rotterdam (Netherlands) and the City of Antwerp (Belgium),WOS:000835992400001,planning pursuit resilient sustainable society become focal point urban policy planning generally regarded separate traditional urban planning practice globally europe however city increasingly integrating planning traditional urban planning instrument process recent indicates scope integration varying stage city rotterdam netherlands city antwerp belgium identified two european city face similar impact risk given proximity large river delta both city aim integrate respective urban planning policy scope integration differs critically analysis urban planning policy two city distil key lesson learnt city similar impact approach urban planning may potentially face integrating planning urban planning policy find identifying evaluating synergy co benefit trade offs measure key challenge integrating urban planning policy it potential stumbling block long term sustainable development resilience
54,On the development of a regional climate change adaptation plan: Integrating model-assisted projections and stakeholders' perceptions,WOS:000701762700012,expected strong social ecological implication global especially regional local challenge to ass climatic vulnerability given territory necessary evaluate exposure adaptive capacity describes development action plan adapting tamega sousa region mountainous inter municipal community north portugal goal identify main impact water resource agriculture forest biodiversity socioeconomic sector well develop plan merging local scientific knowledge transdisciplinary lens describes approach combine modelling method applied different sector participatory method based analysis perception local actor result indicate target region experience generalized increase temperature decrease precipita tion negatively impact studied social ecological dimension overall local business institu tional agent perceive primary tourism sector vulnerable region described framework demonstrates engagement process relevant scientific expert local practitioner well critical understand impact support co design plan turn guide political economic decision making towards effective implementation plan in addition difficulty challenge encountered process discussed support future plan strategy local
55,"Progress of Local Health Department Planning Actions for Climate Change: Perspectives from California, USA",WOS:000823891600001,public health department frontlines protecting vulnerable group working eliminate health disparity prevention intervention disease surveillance community education exploration role national state local health department lhds play advancing planning action protect public health developing arena present insight local public health department california usa addressed barrier planning support california department public health office health equity health equity section ohe administers california building resilience against effect project calbrace with support u s center disease control prevention cdc ready state city initiative crsci calbrace initiated project seed planning action county health department in compared barrier strategy twenty two urban rural lhds explored potential option public health framework using key informant interview document review result showed engagement calbrace local health department partnership influenced county department ability overcome barrier diversification funding source leveraging strategic collaboration extensive public education communication campaign development political capital champion lesson learned recommendation may provide pathway practice national state local level health department collaborate developing protocol integrating system respond health related impact implementation
56,Barriers and facilitators to state public health agency climate and health action: a qualitative assessment,WOS:000920653200002,backgroundas health implication become apparent agency institution across united state developing recommendation state territorial health agency s thas implement evidence informed health strategy cdc established building resilience against effect brace framework 2010 encourage local state public health engagement however even decade brace initiative element affect adoption implementation health programming s thas well understood methodsusing implementation science framework sought understand define barrier facilitator determine breadth success health activity undertaken state health agency shas conducted focus group representative shas without health program analyzed data using framework method qualitative resultsthis identified funding state agency level prioritization staff capability capacity political polarization factor influence readiness implementation implementation health activity conclusionsas impact intensify s thas need expand resource capacity seek advocacy assistance external organization order support level engagement required strengthen resilience finding implication public health policy highlight potential pathway expand support health activity s thas u s
57,Adaptation planning in France: Inputs from narratives of change in support of a community-led foresight process,WOS:000601384900009,in france integrating planning policy prerogative recently delegated municipality there also various injunction engage local population decision making process how municipality co construct adaptive future citizen critically describes community led foresight process based mapping analysis interpretation narrative based empirical result explore discus role past present future narrative may play process outlining incremental scenario might enable identification pathway hinge point role design supporting process proposing innovative foresight workshop also discussed highlight narrative stimulated reflection art design science foresight experiment
58,The political in the technical: understanding the influence of national political institutions on climate adaptation,WOS:000497877700001,a growing body show local international institution well party politics affect yet study considered role political institution national level comparative political institutional theory argues country party system executive legislative arrangement electoral rule affect elected official incentive behaviour utilizes theory explain chile national elected official responded country extreme drought 2010 2015 result indicate ideologically distinct alliance strong president legislator competing incentive cater different interest resulted adaptive policy solution partially addressed shortcoming drought exposed finding show politics underlie technical decision making help account continued inadequacy chilean water reform even face new extreme demonstrate utility comparative political institutional lens explaining national strategy applying lens country case climatic event advance knowledge difference electoral incentive policy process systematically shape adaption policy
59,Network political ecology: Method and theory in climate change vulnerability and adaptation research,WOS:000303885900001,argues development network political ecology drawing insight regional political ecology recent advancement network theory scale meet challenge investigating meso scale problem vulnerability network political ecology attentive scale socio ecologically produced grounded regional resource use system one approach fill gap middle range theory necessary understand complex process vulnerability manifest adaptive capacity produced method exemplified case groundwater dependent irrigating farmer rajasthan india
60,Determination of hydroclimatically homogeneous areas. A technical proposal,WOS:000681683300002,different hydroclimatology researcher apply eigenvectors based technique compress large volume information preserving invariant structure original data developed methodology applying one technique principal component analysis element variability hydroclimatic time series identify cluster k mean method result regionalized map variable finally map intersected obtaining area homogeneous hydroclimatic structure variable similarity variance structure in case 8 variable evaluated colombia 9268 time series obtaining result 26 hydroclimatic region obtaining hydroclimatically homogeneous region offer possibility generating among others project localized way provide quasi specific solution maximize result
61,Cost-benefit analysis: What limits its use in policy making and how to make it more usable? A case study on climate change adaptation in Germany,WOS:000863220700006,cost benefit analysis cba used many context compare monetary cost benefit taking different action it thus advocated suitable method analysing environmental policy making well decision project effect societal welfare despite valuable use principle actual use policy process seems limited present empirical case city bremen contributes literature use cba policy making related interviewed municipal actor involved participatory workshop series dedicated supporting use cba deciding whether implement specific measure municipal actor asked perception usefulness cba particularly formulating policy option success factor constraint connected integrating cost benefit result policy making finding suggest cba perceived useful raising awareness environmental good increasing transparency policy making process here cba confirmed useful spurring systematic discussion advantage disadvantage different measure however municipal actor adopted relatively critical stance towards using cba decision criterion prioritising measure conclude context participatory process conducting cba take municipal actor knowledge seriously account important perception usefulness result policy making
62,Using education and social learning in capacity building - the IntECR concept,WOS:000315059400003,purpose aim present concept social learning used education thematically concept suitable complex interdisciplinary societal challenge high degree uncertainty regarding future change it exemplified need link disaster risk reduction drr cca flood risk management frm concept answer variety adopted solution build knowledge exist consequence far reaching local liability initiative concept advocate building platform procedure manager stakeholder researcher policy maker regular student meet interact learn local example design methodology approach concept intecr integrated education collaboration tested two course 2009 2010 around swedish lake vanern malaren seminar field visit arranged ten different city participant replied anonymously course evaluation questioned group perceived benefit concept finding informal networking holistic perspective shared problem identification positive possibility several example local management arrangement high degree structural openness mentioned participant positive outcome concept originality value use educational concept aim increase adaptive capacity societal entity raised capacity individual member applied example timely relevant contribution drr cca
63,Action Research with Children: Lessons from Tackling Disasters and Climate Change,WOS:000303387200006,recent practice field disaster management created shift emphasis child vulnerability need protection towards potential agent disaster event examines lesson action child agency disaster prone community el salvador philippine describe participatory risk management method adapted use child centrality ethic approach importance working non governmental organisation ngo partner provides ongoing support community design led external agent order cross compare finding across location country however argue engaging child process knowledge generation analysis broke assumed hierarchy researcher researched common orthodox approach
64,From environmental to climate justice: climate change and the discourse of environmental justice,WOS:000334589500005,environmental justice major movement organizing discourse environmental politics arena movement idea large influence way justice conceptualized while discussion justice academic literature focus ideal conception normative argument justice theory pragmatic policy elite environmental nongovernmental organization ngo distinct discourse developed grassroots in movement articulation justice concern principle environmental justice clear consistent here justice focus local impact experience inequitable vulnerability importance community voice demand community sovereignty functioning trace discourse environmental justice development range principle demand grassroots justice movement recent articulation idea for resource related please visit conflict interest author declared conflict interest
65,"Leading with Local Knowledge: Climate Adaptation, Local Knowledge, and Participation in Austin, Texas' Network of Plans and the Co-Designed Climate Navigators' Tool and Process",WOS:000911148700001,planning theory scholar practitioner identified need include resident affected development planning reason justice effectiveness investigates whether austin texas network plan includes participation resident incorporation local knowledge find plan contain limited material participation engagement equity local knowledge in response gap present case dove spring navigator resident nongovernmental organization municipal university collaboration working co create online portal training system process incorporate local knowledge planning
66,Seven suppositions about energy security in the United States,WOS:000291130300001,changing pattern energy use requires investigating energy consumer expert conceive energy challenge explores varying belief attitude view energy security united state among expert resident based primarily academic literature distill expert view survey distributed hundred resident u s capture consumer view begin explaining methodology identifying seven supposition related energy security these supposition involve security fuel supply energy democracy energy development affordability energy service environmental pollution mitigation second section test supposition survey distributed 427 respondent united state three supposition supported two unsupported two neither supported unsupported final section offer implication u s energy policy scholarship
67,Framing climate change in Chile: discourse analysis in digital media,WOS:000403405600007,present discourse analysis four digital medium press chile regard mitigation unprecedented chilean case aimed acknowledging news framing mean communicated since medium main source information decision maker citizen result show primary definers topic governmental actor national level invisibilization individual civil organization process thus see high degree consensus visible actor regard framing economic opportunity absence framing critical ecology conclusion point imbalance might influence design public policy technocratic bias losing possibility building integral vision development country
68,"SCIENCE-POLICY INTERFACE AROUND CLIMATE CHANGE IN MENDOZA, ARGENTINA",WOS:000565226900006,science policy dialogue paramount strengthen mitigation political agenda considers dialogue term interface understood area tension discontinuity produced difference value interest knowledge power explores qualitative methodology standpoint academic politician involved main project mendoza province related water territorial ordering ass way operates interface scientific local policy community main finding indicate dialogue develops process mutual influence based relationship instance interaction built time trust bond capable influence decision making process in instance essential presence intermediary actor capability understanding logic community therefore make effective possible dialogue
69,"Indigenous peoples, local communities and climate change mitigation",WOS:000392425800001,special issue climatic collect recent finding relationship mitigation local community indigenous people single issue specifically issue seek address question policy measure proven effective context advancing goal indigenous sovereignty mitigation journal aim provide mean exchange among working different discipline problem related climatic variation provide platform reflect wide diverse range perspective experience concerning indigenous people local community mitigation response although many paper available regarding contribution impact indigenous people significantly le material available regarding relationship contribution mitigation paper special issue address pertinent cross disciplinary topic facing policy maker today including link mitigation initiative livelihood resilience impact local regional international level
70,Climate change and global justice,WOS:000301644400002,in i examine matter concerning justice light current work global justice i briefly discus important contemporary work political philosopher theorist global justice relate various consideration regarding justice after briefly surveying international treaty context i critically discus several issue including human right responsibility historical emission polluter pay principle ability pay principle grandfathering entitlement emit greenhouse gas equal per caput emission entitlement right sustainable development responsibility financing set issue exhaust list consideration global justice includes important consideration wire clim 2012 3 131143 doi 10 1002 wcc 158
71,A question of 'fit': local perspectives on top-down flood mitigation policies in Vermont,WOS:000417680400008,despite consensus need adapt adapt remain open question while local level action essential state federal government play substantial role in investigate local perspective state level flood mitigation policy vermont mean analysing lead top adaptation effective mobilizing local action drawing interview town official delineate local level perspective vermont top policy use perspective develop conceptual framework present fit top policy local level context comprised three component receptivity ease participation design explain component interaction influence local level action analysis point careful consideration component fit may lead greater local level uptake top policy
72,Citizen science and the right to research: building local knowledge of climate change impacts,WOS:000749519900002,present result project aiming develop theoretical empirical contribution participatory approach method citizen science risk mapping in first part present literature key concept perspective related participatory citizen science introducing concept right it highlight mutual fertilization participatory mapping method deal disaster situation associated in second part describes present result conclusion action developed coastline state sao paulo rio de janeiro brazil 2017 2018 it involved affected community protagonist mapping managing risk natural disaster caused extreme event combining citizen science approach method participatory geographic information system pgis social cartography concludes pointing contribution limit right relevant social science approach reframe citizen science democratic view
73,An interdisciplinary perspective on environmental justice: integrating subjective beliefs and perceptions,WOS:000564460800003,in environmental justice considered interdisciplinary integrative perspective combine theory study geography environmental policy planning justice psychology approach open integrated view take account societal individual aspect perception evaluation environmental justice in sense notion environmental justice seen result discursive process historical context social localization standardization shaped cognitive evaluation process emotion additionally environmental justice participation process considered context environmental sustainability policy implementation first summarising point criticism participation process discussing environmental justice aspect participation practice from key point justice sensitive design participation process context environmental sustainability policy programme e g urban planning energy system transformation derived interdisciplinary analysis show one environmental justice multitude idea evaluation based different concept perception
74,"Free prior and informed consent in the Green Climate Fund: the implementation of a project in the Datem del Maranon, Peru",WOS:000553245200007,in context implementation resilience project indigenous community right free prior informed consent fpic becoming mandatory requirement present giving overview requirement fpic international law address issue resilience project financed green fund gcf peru such project implemented indigenous territory datem del maranon region at time approval gcf board proposed project raised protest indigenous community claimed properly consulted disbursement funding episode evidenced gcf needed adopt ad hoc policy engage indigenous people respecting fpic requirement prescribed international law present demonstrates indigenous people policy adopted february 2018 gcf example harmonization international law requirement fpic prescribed united nation declaration indigenous people right finally aim evidencing challenge represented excessive state centred structure gcf need overcome facilitate true participatory dialogue indigenous people
