,title,wos,clean_abstract
103,Climate Change Adaptation in a Mediterranean Semi-Arid Catchment: Testing Managed Aquifer Recharge and Increased Surface Reservoir Capacity,WOS:000411567200062,among different us freshwater irrigation impacting groundwater resource leading water table depletion possible seawater intrusion unbalance availability water resource demand currently exacerbated could become worse near future accordance observation scenario provided intergovernmental panel ipcc in context increasing maximum capacity surface reservoir imc managed aquifer recharge mar measure potential enhance water supply system resiliency in multiple user multiple resource water supply system w model implemented evaluate effectiveness two strategy context overexploited groundwater rcp 4 5 rcp 8 5 ipcc scenario presented case located puglia semi arid region south italy characterized conspicuous water demand irrigation observed although significant long term trend affect proposed precipitation scenario expected temperature increase highly impact w resource due associated increase water demand irrigation purpose under rcp 4 5 mar scenario result effective imc long term wet period typically 5 year successfully compensates impact groundwater resource differently rcp 8 5 due persistent dry period scenario fail groundwater resource become exposed massive sea water intrusion second half century conclude mar scenario suitable strategy face expected future change although mitigation action reduce green house gas strongly required
104,"Adaptation Strategies for Flooding Risk from Rainfall Events in Southeast Spain: Case Studies from the Bajo Segura, Alicante",WOS:000747183200001,management runoff torrential rainfall event significant problem urban area southeast spain increase soil sealing occupation area prone flooding aggravated problem due situation municipal administration collaboration concession holder supply water sewage service hidraqua gestion integral de agua de levante sa committed efficient management non conventional water resource an example found municipality rojales daya nueva san fulgencio these town located bajo segura region province alicante various initiative implemented break away traditional paradigm rigid infrastructure these initiative include green space area sustainable urban drainage system suds nature based solution nb present various case study firstly town rojales several action undertaken improve management wastewater rainwater provide solution unauthorised dumping well encouraging use reclaimed water creation recreational green area el recorral park secondly case daya nueva europa park constitutes recreational green area europa park facilitates runoff drainage suds nb finally creation floodable pond municipality san fulgencio encourages use wastewater thus avoiding discharge non conventional water resource sea in addition pond facilitates appropriate management runoff water working method twofold firstly bibliographical reference consulted national international area secondly technical project case study analysed detail several field trip made selected municipality accompanied technical personnel charge execution project examine measure adopted result show implementation system contributes adapting creates resilient urban space
105,Why Land Planners and Water Managers Don't Talk to One Another and Why They Should!,WOS:000315676300008,increasing evidence demonstrates unsustainable land use practice result human induced drought condition inadequate water supply constrain land development growing city nonetheless organizational barrier impair coordinated land water management land planning strongly influenced political reality interest group water management focused single minded goal providing reliable water future development often set apart priority survey result portland or phoenix az show water manager land planner generally aware physical interconnection land water little cross sector involvement two city focusing shared concern outdoor water use variability water sensitive urban design fruitful first step integrating practice land planning water management sustainable resource use
106,High-resolution surface water dynamics in Earth's small and medium-sized reservoirs,WOS:000840132800016,small medium sized reservoir play important role water system need cope variability various man made natural challenge although reservoir dam criticized negative social environmental impact reducing natural flow variability obstructing river connection also recognized important social economic development multiple study map large dam analyze dynamic water stored reservoir behind dam study focus small medium sized reservoir global scale in use multi annual multi sensor satellite data combined cloud analytics monitor state small 10 100 ha medium sized 100 ha excluding 479 large one artificial water reservoir globally first time these reservoir crucial importance well many society regular monitoring record water dynamic mostly missing combine result multiple study identify 71 208 small medium sized reservoir followed reconstructing surface water area change satellite data using novel method introduced dataset validated using 768 daily situ water level storage measurement r2 0 7 67 reservoir used validation demonstrating surface water area dynamic used proxy water storage dynamic many case our analysis show small reservoir inter annual intra annual variability much higher medium sized reservoir worldwide implies community reliant small reservoir vulnerable extreme short term within season longer term across season our finding show long term inter annual intra annual change reservoir equally distributed geographically through several case demonstrate technology help monitor water scarcity condition emerging food insecurity facilitate transboundary cooperation it potential provide operational information condition ungauged upstream riparian country share data neighboring country may help create level playing field water resource information globally
107,Regulation of snow-fed rivers affects flow regimes more than climate change,WOS:000404778800006,river flow mainly controlled physiography regulation relative importance large landmass poorly understood here show computational modelling hydropower regulation key driver flow regime snow dominated region important future change implies need include regulation scheme natural river regime snowy region low flow snow stored pronounced peak flow snow melting global warming hydropower regulation temporal pattern similarly causing le difference river flow season conclude snow fed river globally future impact flow regime minor compared regulation downstream large reservoir similar magnitude large landmass our highlight impact hydropower production also river regulation could turned measure maintain biodiversity floodplain
108,Unlocking the Potential of Permeable Pavements in Practice: A Large-Scale Field Study of Performance Factors of Permeable Pavements in The Netherlands,WOS:000823886200001,infiltrating pavement potentially effective measure counteract arising challenge related flooding drought urban area however susceptible clogging causing premature degradation a part dutch delta plan dutch municipality encouraged put infiltrating pavement practice disappointing experience made significant number municipality decide however stop implementation a need existed better understand infiltrating pavement function practice through 81 full scale infiltration test investigated performance infiltrating pavement practice most pavement function well dutch international standard however variation found high infiltration rate decrease time age alone however sufficient explanatory factor other factor environmental system characteristic influence maintenance play major role preserving improving performance infiltrating pavement practice while result provide first indication functioning infiltrating pavement practice multi year measurement following strict monitoring protocol longer term effect environmental factor maintenance actually determined providing basis development optimal maintenance schedule associated cost benefit assessment added value type
109,"Water option contracts for climate change adaptation in Santiago, Chile",WOS:000428205600007,induced extreme event pose important challenge urban water manager in santiago chile total cost event reduced option contract set ex ante water price water volume traded certain triggering condition met discus two type option contract water leasing trade water agriculture urban us drought saving option contract reduce urban water consumption short term turbidity event find water option contract flexible instrument improve distribution hydrological risk
110,The science and politics of climate risk assessment in Australia's Murray Darling Basin,WOS:000571444200003,many disruptive consequence particularly large river basin experiencing drying trend declining water availability with pressure adaptive policy understanding institution governing water adapting risk broad international relevance examines challenge risk assessment murray darling basin economically culturally important basin national legislation mandate basin plan based best available science however despite repeated scientific warning drying current basin plan reduce estimate water resource available risk management relies bricolage policy mechanism appear insufficient magnitude predicted change outline finding original exploring occurred it draw interview 30 senior public policy professional researcher deep experience water policy interview data indicate minimising political risk principal reason abandoning proposed reduction entitlement relying historical average estimating water availability a reform process evolved decision water planning technique became increasingly politicised adoption explicit measure became problematic a result basin plan neither reflects broad scientific consensus make specific allowance declining water availability risk downplayed concern level scientific uncertainty appear overstated importantly lesson emerge examination could contribute revision plan scheduled 2026 more generally find proactive policy large river basin require sustained well designed institutional reform particularly adoption legally prescribed procedure utilising science accounting use controversial environmental reform
111,Strategy for adapting to climate change and conserving biodiversity in the Bangladesh Sundarbans,WOS:000400799100004,bangladesh sundarbans region difficult place live region become increasingly inhospitable time sea level rise cyclonic storm embankment failure constant hazard biodiversity mangrove forest reduced in addition increased waterlogging soil water salinization pose serious threat agriculture livelihood option majority resident undertaken answer following question strategy could government bangladesh consider order enhance security inhabitant bangladesh sundarbans impact zone siz conserve biodiversity sundarbans mangrove forest proposed strategy based data analysis team social natural scientist engineer includes two central element incentive encourage migration siz successfully measure reduce danger natural hazard inhabitant choose remain in addition strategy includes measure conserve biodiversity action strengthen government agency operating sundarbans element strategy implemented effectively
112,Assessing the effectiveness of Sustainable Land Management for large-scale climate change adaptation,WOS:000458630100010,strongly affect essential ecosystem service like provision freshwater food production soil erosion flood control sustainable land management slm practice increasingly promoted contribute mitigation lack evidence scale relevant policymaking evaluated effectiveness slm large mediterranean catchment projected significantly reduce water security show site site impact almost entirely reversed large scale implementation slm moderate condition characterized limited reduction annual precipitation significant increased precipitation intensity under extreme reduction annual precipitation slm implementation reduces impact water security cannot prevent significant increased plant water stress reduced water availability under condition additional measure required considering interaction trade offs regarding water security
113,Modeling water scarcity and droughts for policy adaptation to climate change in arid and semiarid regions,WOS:000350920200008,growing water extraction combined emerging demand environment protection increase competition scarce water resource worldwide especially arid semiarid region in region projected exacerbate water scarcity increase recurrence intensity drought these circumstance call methodology support design sustainable water management present hydro economic model link reduced form hydrological component economic environmental component model applied arid semiarid basin southeastern spain analyze effect drought ass alternative policy result indicate drought event large impact social welfare main adjustment sustained irrigation environment water market policy seems suitable option overcome negative economic effect drought although environmental effect may weaken advantage society environmental water market policy water acquired environment appealing policy reap private benefit market protecting ecosystem current water management approach spain based stakeholder cooperation achieves almost economic outcome better environmental outcome compared pure water market these finding call reconsideration current management arid semiarid basin around world illustrates potential hydro economic modeling integrating multiple dimension water resource becoming valuable tool advancement sustainable water management policy
114,"Adaptation to climate change and freshwater resources in Vusama village, Viti Levu, Fiji",WOS:000424643300017,changing precipitation pattern including intense prolonged dry period become growing concern people living pacific island region people region particularly sensitive change given resource based livelihood high dependence rainfall freshwater need despite little attention given understanding implication climatic change people capacity manage change ass human vulnerability relates fresh water resource vusama itaukei village southwest viti levu fiji context recent social ecological change an analysis data collected using vulnerability approach included semi structured interview participant observation analysis secondary source reveal together behavioural change negatively affecting availability access clean freshwater implication household economy food security human health in particular prolonged drought changing seasonal pattern together people increasing reliance village borehole lieu family well resulted freshwater crisis people coping using earnings wage employment harvesting selling seafood buy water vegetable rationing freshwater depending extended social network fresh produce current response reactive short term longer term strategy needed consider expected future broader human development goal
115,"Rapid Climate Adaption Assessment (RCAA) of water supply and sanitation services in two coastal urban poor communities in Accra, Ghana",WOS:000599948400052,assessed impact different hydrological scenario existing vulnerability water sanitation service chorkor shiabu two coastal urban poor community accra ghana hydrological scenario developed literature projection recommends adaptation community member service provider municipality based impact assessment chorkor shiabu vulnerable increase rainfall lack adequate solid waste management hydrological sound drain shiabu topography indiscriminate sand mining along beach make vulnerable increase sea level looking beyond chorkor shiabu community boundary urban water utility supply water vendor community may severely impacted decrease rainfall would lead water scarcity shortage hydroelectricity regardless scenario emerges many recommended adaptation good water management practice example increasing number household connection reducing non revenue water putting high agenda potential generate additional funding help address chorkor shiabu water sanitation problem proof service future however method address governance adaptation
116,The determinants of private flood mitigation measures in Germany - Evidence from a nationwide survey,WOS:000350524200005,public flood protection cannot eliminate totally risk flooding hence private mitigation measure proactively protect home flooded reduce flood damage essential part modern flood risk management analysis private flood mitigation measure among german household final data set cover 4200 household part country including flood plain well area typically high risk riverine flooding result suggest propensity mitigate flood damage increase past damage experience damage expectation future latter effect interpreted signal flood mitigation behaviour all factor remaining equal strong belief induced increase personal flood damage next decade correlate increase probability flood mitigation 10 percentage point moreover empirical evidence moral hazard flood mitigation behaviour cannot observed household expecting insurance coverage reduce mitigation effort likewise expectation government relief payment hinders mitigation group household
117,"Sustainable Hydroelectric Dam Management in the Context of Climate Change: Case of the Taabo Dam in Cote D'Ivoire, West Africa",WOS:000489104700032,management hydroelectric dam aspect sustainability come resolving problem locally use global indicator sustainable solution thus need local indicator besides current sustainability assessment tool lack integration making assessment context impossible in present management sustainability assessment context using sustainability indicator modeled using normal moderate extreme condition defined standardized precipitation index spi value out 36 year analyzed 24 year fall near normal regime remaining 12 year moderate extreme condition making near normal regime basis managing taabo dam impact techno economic socio environmental indicator sustainability investigated result analyzed according scenario show higher sustainability index techno economic socio environmental scenario probability matrix show high low value respectively environmental flooding indicator risk matrix hand show even small probability value risk still exist small probability taken absence risk reveals sustainability improved integrating existing assessment method
118,Unraveling the Water-Energy-Food-Environment Nexus for Climate Change Adaptation in Iran: Urmia Lake Basin Case-Study,WOS:000650848900001,a holistic approach management water energy food environment required meet socioeconomic demand future well sustainable development limited resource urmia lake basin faced environmental social economic challenge recent year situation likely worsen impact for adaptability analysis region proposed 2040 horizon year two model water evaluation planning weap stockholm environmental institute stockholm sweden low emission analysis platform leap stockholm environmental institute boston ma usa integrated simulate change water energy food environment 20 year two scenario nine policy scenario combined ass sustainable development using multi criterion decision analysis mcda approach result show pursuing challenging goal agricultural potable water energy industrial sector sustainable development achieved in scenario lake urmia water level reach ecological water level 2040 however social technical political challenge considered obstacle implementing goal scenario in addition industry growth industry structure adjustment impact sustainable development achievement
119,The importance of indirect effects of climate change adaptations on alpine and pre-alpine freshwater systems,WOS:000794141100018,freshwater vital much life earth essential resource human however dramatically change freshwater system reduces water quality pose risk drinking water availability severe impact aquatic ecosystem biodiversity direct effect increased temperature higher frequency extreme meteorological event interact human response refer indirect effect latter possibly even greater impact direct effect specifically change land use practice response adjusted cropping regime shift renewable hydroelectricity mitigate strongly affect freshwater ecosystem hitherto indirect effect possibility idiosyncratic outcome recognized here synthesize knowledge identify threat freshwater environment alpine pre alpine region particularly affected focus effect adapted agriculture hydropower production freshwater quality ecological status example strong indirect effect interact direct effect e g water temperature drought isolation population outline failure effectively account indirect effect associated human response may exacerbate direct impact aquatic ecosystem if managed properly however human response indirect effect offer potential rapid implementable leverage mitigate direct effect aquatic ecosystem to better address looming risk policy decisionmakers must account indirect effect incorporate restoration planning respective sectorial policy
120,Compensating Water Service Interruptions to Implement a Safe-to-Fail Approach to Climate Change Adaptation in Urban Water Supply,WOS:000553890300001,a city resilient characterized effectively responding recovering negative impact hazard in city santiago chile extreme weather associated nascent manifestation caused high turbidity event repeatedly forcing main water company interrupt supply drinking water affecting million people proposes transformative response reduce harm extreme event due traditional approach increasing resilience large infrastructure work complemented one reduction water use emergency exchange economic compensation alternative seek transfer individual responsibility water company collective one community active agent reduces damage face extreme event resulting in assessment response used choice experiment estimate minimum amount user willing accept compensation water service interruption result show willingness accept compensation significant close 0 6 usd hour decrease user experienced additional unplanned interruption aggregate cost compensation lower infrastructure investment required avoid service interruption various future hypothetical hydroclimatic scenario associated impact therefore compensation based instrument water service interruption could flexible cost effective alternative infrastructure based measure cope future hazard
121,Identification of Water Scarcity and Providing Solutions for Adapting to Climate Changes in the Heihe River Basin of China,WOS:000356708700001,in ecologically fragile area arid heihe river basin northwestern china sustainable social economic development depends largely availability sustainable us water resource however serious water resource shortage decrease water productivity heihe river basin influence human activity attempt identify severe water scarcity present possible solution sustainable development heihe river basin three problem intervened land use change water resource relevant policy institution heihe river basin identified including 1 water scarcity along serious contradiction water supply demand 2 irrational water consumption structure along low efficiency 3 deficient system institution water resource management along unreasonable water allocation scheme in sense focused reviewing state knowledge institution successful practice cope water scarcity regional extent possible solution dealing water scarcity explored presented three perspective 1 scientific research needed scientist 2 management institution formulation needed government 3 water resource optimal allocation manager administrative level
122,Effect of land use-land cover and projected rainfall on soil erosion intensities of a tropical catchment in Sri Lanka,WOS:000877407500003,soil erosion become severe environmental issue due detrimental effect land productivity agricultural production hydropower generation water quality land use land cover rainfall two factor affecting soil erosion estimated spatial variation soil erosion nalanda oya catchment sri lanka using revised universal soil loss equation rusle model supported gi ass change erosion time relation change land use land cover impacted rainfall finding would help land management minimize erosion potential changing mean annual soil loss value catchment 2 99 ha 1 yr 1 expected change land use land cover projected rainfall could increase mean annual soil loss 2030 3 43 ha 1 yr 1 3 66 ha 1 yr 1 representative concentration pathway rcp 4 5 rcp 8 5 scenario respectively result highlighted 18 78 catchment moderate high 5 ha 1 yr 1 erosion risk may increase 20 83 21 58 2030s rcp 4 5 rcp 8 5 respectively about 32 land area would show increase soil erosion mostly due impacted change rainfall improving land use mitigate increase potential erosion may require reforestation conservation practice measure protect sensitive ecosystem ensure continued ecosystem service
