,title,wos,clean_abstract
21,COMBINING ABILITY AND STABILITY STUDIES IN F(1 )POPULATIONS OF TRITICUM DURUM ACROSS ENVIRONMENTS,WOS:000547782400022,in developing world plant breeding seed improvement system must promoted reduce crop vulnerability development improved genotype different crop plant enlightened plant breeding earnestly needed deliver help food security five durum wheat cultivar syrian 4 dumes 1 sham 7 yousef 1 haurani crossed 2016 17 half diallel fashion create 10 f 1 hybrid duhok university iraq during 2017 18 seed genotype five parental genotype 10 f 1 hybrid grown early november 20 2017 late december 20 2017 sowing randomized complete block design rcbd three replication two different location e sumel duhok university amedi duhok city iraq combined analysis variance showed significant p 0 01 difference hybrid environment hybrid x environment interaction analysis variance combining ability showed mean square due gca sca significant p 0 01 indicating role additive non additive gene effect inheritance studied trait in general parental line e sham 7 haurani found good general combiners character sca effect significant three hybrid e syrian 4 x sham 7 sham 7 x haurani duma 1 x haurani majority character in order determine stability genotype four different environment stability parameter used identify stable genotype regression coefficient bi variance deviation regression s 2 result revealed genotype differed response across various environment variable some genotype reflected stability one character unstable trait showing wide range variation according stability parameter parental line sham 7 haurani f 1 hybrid e duma 1 x haurani sham 7 x haurani duma 1 x sham 7 best stability grain yield component thus indicating wide range across environment these investigation play important role managing strategy improvement durum wheat diallel cross future breeding program
22,Comprehensive Environmental Assessment of Potato as Staple Food Policy in China,WOS:000482128400069,chinese government projected 30 total consumed potato staple food psf 2020 comprehensively assessed potential impact psf rice flour consumption rice wheat planting energy nutrient supply irrigation water chemical nitrogen n phosphorus pentoxide p2o5 potassium oxide k2o fertilizer input total greenhouse gas ghg emission potato rice wheat assuming different proportion potato substitute rice flour result showed per caput 2 9 0 3 4 7 0 5 kg potato per year would enter chinese staple food diet government target psf consumed expected reach 5 2 0 7 tg yr 1 equivalent substituting potato 4 2 0 8 8 5 0 8 tg yr 1 wheat 5 1 0 9 10 1 1 8 tg yr 1 rice different scenario while substitution increase nutrient supply index 63 towards nutrient reference value may induce significant effect staple food energy supply lower chemical fertilizer except k2o irrigation water input ghg emission different substitution scenario business usual scenario reduction rice wheat demand lead wheat north china plain early rice decrease 6 1 11 4 12 1 24 1 respectively total ghg reduction equal 1 1 9 0 co2 equivalent associated ch4 n2o emitted chinese agroecosystem 2005 saved irrigation water three crop compared 2012 reach total water use 17 9 4 9 21 8 5 9 million people 2015 more n fertilizer irrigation water ghg reduced psf ratio increased 50 together potato yield improves optimal level our result implied psf policy worth healthier diet also mitigate resource input ghg emission also support agricultural structure adjustment area irrigated wheat north china plain early rice across china designed increase adaptability
23,Variation of nutritional and microbiological properties of milk in relation to climate adaptation strategies across dairy production systems in West Africa,WOS:000714435100007,conducted west africa ass performance strategy dairy production system microbiological physico chemical quality milk fifty four sample raw milk pasteurised milk local cheese collected three dairy production system extensive modern semi intensive traditional semi intensive analysed result physico chemical quality milk cheese three dairy production system line standard extensive dairy production system system 1 mainly dependent natural resource high value total protein carbohydrate modern semi intensive dairy production system 2 silage technology high value calcium traditional semi intensive system 3 fodder treatment high value fat energy potassium regarding microbiological quality milk cheese three system contaminated highest contaminant modern traditional semi intensive dairy production system
24,Effect of increasing the proportion of chicory in forage-based diets on intake and digestion by sheep,WOS:000461637300006,there lot evidence chicory could highly palatable nutritious source forage ruminant well adapted dry condition summer thanks resistance drought high water content aimed describe effect incorporating chicory ryegrass ryegrass white clover mixture feeding behaviour digestive parameter nitrogen n balance methane ch4 emission sheep in total three sward ryegrass white clover chicory established managed manner ensuring forage use constant vegetative stage throughout experiment in four dietary treatment pure ryegrass binary mixture 50 ryegrass 50 chicory ternary mixture 50 ryegrass 25 white clover 25 chicory pure chicory evaluated 4x4 replicated latin square design eight young castrated texel sheep each experimental period consisted 8 day diet phase followed 6 day measuring phase intake dynamic chewing activity digestibility rumen liquid passage rate fermentation end product n balance ch4 emission determined data analysed using mixed model orthogonal contrast used detect potential associative effect ryegrass chicory daily voluntary dry matter intake lower pure ryegrass diet containing chicory p 0 001 increased quadratically 1 39 1 74 kg day increasing proportion chicory huge positive quadratic effect p 0 001 ryegrass chicory detected eating time eating rate feeding indicating increase motivation eat mixture whereas rumination activity decreased linearly proportion chicory p 0 001 organic matter digestibility similar among treatment around 80 strong positive quadratic p 0 001 effect observed liquid passage rate suggesting chicory allowed fast particle breakdown rumen animal fed ryegrass white clover chicory mixture higher urinary n loss p 0 001 whereas retained n per day per g n intake greater proportion chicory least 50 p 0 001 similar 40 greater treatment ch4 yield lower pure chicory treatment p 0 001 emission similar in conclusion mixing ryegrass chicory equal proportion produce synergy voluntary intake improved n use efficiency likely due complementarity chemical composition increased motivation eat faster ruminal particle breakdown
25,"Adaptation to climate change impacts on crop water requirements in Kikafu catchment, Tanzania",WOS:000402284400006,agricultural activity main livelihood 70 tanzania population woman main player crop need water crop water requirement cwrs growth production either rain fed irrigation sourced however affected hydrological cycle particularly water available agricultural crop since impact consequently site specific assessment effect maize water requirement kikafu sub catchment conducted using crop simulation model cropwat accordingly scenario obtained a2 emission scenario using three general circulation model gcms these scenario downscaled two site location using long ashton station weather generator lars wg model baseline period analysis 1971 2000 cwrs projected increase 3 8 2020s 7 1 2050s moshi airport 19 9 22 4 lyamungu station respectively more impact projected 70 80 day development stage entire mid season 81 140 day whereby temperature high low precipitation with increasing cwrs better measure increase crop diversification restore soil organic matter cropping system established multi criterion analysis
26,Intra-varietal stability performance of popular rice landrace 'C14-8' in the Andaman Islands,WOS:000522609500001,multitude agronomic merit traditionally tall photosensitive japonica rice landrace c14 8 enabled popularity tropical andaman nicobar island india however noticed distinct variation grain husk colour culture field evaluation four grain husk color selection 4 year across three major rice growing island revealed significant variation agro morphological trait studied in overall population harvest index identified potent selectable trait indirect selection through ammi stability analysis environmental g x e interaction genotype effect recorded 24 4 12 5 12 3 respectively highest positive genotypic index recorded c14 8 11 108 0 39 followed c14 8 11 113 0 29 c14 8 11 91 0 20 also yielded original population 20 across year thus indicating consistency favorability selection marginal ecosystem finding useful breeding conservation perspective unique germplasm climatically adaptive trait marginal ecosystem
27,New potato cultivars with resistance to late blight [Phytophthora infestans (Mont.) De Bary] and adaptation to climate change,WOS:000457389900006,cultivation potato peru main source income food small producer high andean area for new potato cultivar adopted disseminated release necessary apply methodology participatory varietal selection pvs actor crop value chain participate during year 2016 2017 three potato clone evaluated cip393079 4 flor blanca cip387096 2 shulay cip396034 268 cultivar unica canchan eight location region huanuco junin huancavelica peru sowing experiment randomized complete block design dba three repetition carried month september november 2016 harvest month march june 2017 selection criterion flowering resistance late blight abundant foliage tolerance drought harvest high yield uniform size tuber health at flowering clone cip396034 268 cip393079 4 selected farmer men also selected clone cip387096 2 woman addition first two clone selected cultivar canchan to harvest producer selected clone cip396034 268 cip393079 4 cip387096 2 respectively three region clone cip387096 2 cip393079 4 cip386034 268 resistant late blight canchan unica cultivar region huancavelica huanuco junin
28,What does CGIAR do to address climate change? Perspectives from a decade of science on climate change adaptation and mitigation,WOS:000894749100006,cgiar consists network international publicly funded agricultural development institute over five decade worked increase food abundance reduce hunger poverty rate lower geographical footprint agriculture lower middle income country cgiar first formalised program set 2009 here report analysis 300 outcome generated lifetime program ran 2021 outcome characterised relation objective geography thematic scope contribution global goal more half outcome analysed related policy agriculture development twenty six percent outcome related information financial service 22 percent related organisational programming most outcome analysed early stage maturity focusing design planning stage policy strategy investment fewer five percent outcome evidence impact scale outcome facilitated wide network partner contributed ten sustainable development goal result analysis show value outcome oriented science able harness diversity balance strategy opportunism plan flexibly work across multiple vulnerability context allocate resource towards outcome these element played significant role fostering across context adjusting emerging need context change creating condition spillover ensuring global relevance to transform food system development agenda need bolder it require outcome various type achieved diverse partnership spanning diversity geography vulnerable context priority significant intentional investment strengthening monitoring evaluation reporting learning capacity required realize potential outcome oriented
29,Organic Vegetable Crops Managed with Agro-Ecological Practices: Environmental Sustainability Assessment by DEXi-met Decision Support System,WOS:000496258100206,in last decade increasing interest sustainable agricultural technique environmental evaluation effect agricultural practice in present evaluated production capacity organic horticultural system ex post sustainability new multi attribute decision model named dexi met qualitative model able estimate environmental sustainability cropping system managed different agro ecological approach in particular compared following three horticultural system eco organic system full implementation agro ecological strategy agro ecological service crop asc strip cultivation organic amendment ii gm organic system introduction asc iii no asc organic system without asc treatment asc presence eco gm showed similar total energy output substantially higher no asc indicating positive effect agro ecological practice finding pointed eco system followed principle natural ecosystem contribute building complex agro ecosystem increasing resilience biodiversity management strategy reached good compromise production vegetable cropping system environmental sustainability achievement then possible optimize use natural resource support reduce greenhouse gas emission
30,Predicting the water use-demand as a climate change adaptation strategy for rice planting crops in the Long Xuyen Quadrangle Delta,WOS:000487923100001,work evaluates impact water use demand three rice planting crop including winter spring w summer autumn sa autumn winter crop long xuyen quadrangle delta vietnam climatic variable scenario obtained updated report emission scenario issued vietnam ministry natural resource environment three future timescales 2016 2035 2046 2065 2080 2099 representative concentration pathway rcp 4 5 rcp8 5 scenario cropwat model selected evaluate irrigation water demand three rice planting crop based simulating actual evapotranspiration etc effective rainfall area result showed w sa planting crop need irrigation water demand growing developmental stage timescales rcp4 5 rcp8 5 scenario result also pointed compared current condition tendency decrease irrigation water demand initial developmental stage autumn winter planting crop arranging 2 9 12 9 10 0 18 2 respectively corresponding timescales rcp4 5 rcp8 5 scenario found significant downward trend late stage approximately 5 8 20 0 13 6 20 7 respectively rcp4 5 rcp8 5 scenario also recorded
31,"Agro-ecological urban agriculture and food resilience: The Case of Quito, Ecuador",WOS:000871494800001,rural urban divide promoted capitalism first global neoliberalism later characterized countryside synonymous backwardness established city model progress in recent year promoting agriculture city seemed counterintuitive nevertheless last decade agricultural practice urban realm encouraged great effort group city worldwide quito one participatory urban agriculture project agrupar promoted supported urban agriculture quito almost 20 year however aware food situation population requires stronger effort city decided go beyond urban agricultural production led agrupar together municipal actor metropolitan directorate resilience secretariat productive development municipality metropolitan district quito mdmq implementing public food policy outlined one central objective need strengthen city food security food resilience text present brief history urban agriculture quito review achievement agrupar based experience author hypothesize city gone promoting urban orchard establishing urban agricultural program better position implement food policy contribution resilience sustainable urban development display importance clearly understanding food value chain set strategic dimension currently shape agri food system aim better connect production processing transformation distribution sale storage commercialization consumption post consumption right food right city healthy environment achieve food security although result achieved thus far valuable benefit urban agriculture contribute improving quito food security resilience additional progress necessary therefore imperative proposal presented includes urban agriculture part city scale urban policy
32,Self-selection of dietary protein and energy by broilers grown under a tropical climate: Adaptation when exposed to choice feeding at different ages,WOS:000072940700002,three hundred broiler chick hubbard sex assigned five feeding treatment to received complete diet control ti choice feeding system simultaneous access energy rich feed ground corn protein concentrate 43 7 cp t2 t3 t4 introduced choice feeding 1 3 5 wk respectively consuming complete diet at 1 old ti chick showed marked preference corn 21 4 intake protein concentrate diet intake concentrate progressively increased 40 45 3 resulting diet 22 5 24 3 cp when broiler fed complete diet 1 5 wk t2 t3 t4 changed choice feeding ist feed choice intake similar t1 chick age visual observation tactile assessment feed particle initial period allowed chick quickly evaluate new feed adapt feeding behavior although total feed intake 6 wk age significantly affected feeding treatment broiler choice feeding selected diet lower percentage cp lower live body weight 6 wk fed complete diet to
