,title,wos,clean_abstract
52,Thermal Design Considerations for Raised Structures on Permafrost,WOS:000349982700001,with advance ability model complex geothermal condition aspect soil structure interaction relates long term change geothermal regime considered traditional geothermal modeling relied called n factor approach ground surface temperature represented air temperature multiplied factor account ground surface effect application surface energy balance formulation effect building including long wave radiation incorporated allows accurate representation geothermal regime structure in considering impact warming performance raised building permafrost terrain use surface energy balance geothermal model considered rigorous technically preferable approach addressing problem address use surface energy balance formulation geothermal analysis raised building construction permafrost terrain impact long term geothermal regime specifically impact building construction underlying geothermal regime direct implication ongoing discussion regarding need address potential foundation capacity degradation light warming both existing field data geothermal modeling result presented demonstrate ground temperature raised building cool time become colder ground remote building when long term warming considered ground temperature depth warm 20years warming ground temperature building still warmer initial ground temperature remote building
53,Ecohydrological processes and ecosystem services in the Anthropocene: a review,WOS:000514080300001,framework ecosystem service increasingly used integrated watershed ecosystem management practice involve scientist engineer manager policy maker objective explore intimate connection ecohydrological process water related ecosystem service human dominated ecosystem anthropocene synthesize current literature illustrate importance understanding ecohydrological process accurately quantifying ecosystem service different environmental socioeconomic setting scale our synthesis focus managed ecosystem dominated human explores ecological process affect tradeoff synergy multiple ecosystem service identify gap studying ecological process mainly including energy carbon water nutrient balance better ass quantify ecosystem service critical sustaining natural resource future generation to better ass ecosystem service future ecohydrological study need better account scaling effect natural anthropogenic stressor exerted evapotranspiration water supply demand process future study focus bidirectional interaction hydrological function service human action solve real world problem water shortage ecological degradation
54,EDUCATION IN SUSTAINABLE DEVELOPMENT AND NATURAL SCIENCES IN KINDERGARTEN,WOS:000514625700005,achieving consensus society role education characteristic competence sustainable development requires institutional plan adopt coherent picture individual characteristic one hand differentiate others set common behavioral attitude topic essential sustainable shared behavior people planet earth adapting protecting biodiversity human nature part important kindergarten realize education sustainable development understanding interpreting natural social world surrounding child interactive form attitude towards natural social object phenomenon process important standard no 13 geoi set criterion indicator meaningful organizational achievement additional form interaction on basis report interprets experimental design model sustainable pre school development
55,A trait-based typification of urban forests as nature-based solutions,WOS:000886053300002,urban forest nature based solution uf nb important tool sus tainable development however achieving effective sustainable uf nb solution requires diverse knowledge includes knowledge uf nb implementation assessment environmental impact diverse spatial context management long term safeguarding delivered ben efits a successful integration body knowledge demand systematic understanding uf nb to achieve understanding present conceptual uf nb model obtained semantic trait based modelling approach conceptual model subsequently implemented extendible usable interoperable ontology in formal trait based vocabulary uf nb created allows expressing spatial morphological physical functional institutional uf nb property typification subsequent integration knowledge data thereby way forward opened systematic uf nb impact assessment management decision making
56,Climate Change and Social Forestry: An Overview of CIFOR Research on Enhancing Resilience in Boreal and Tropical Forest Landscape,WOS:000748924500015,crisis highlight importance forest mitigating adapting well supporting un sustainable development goal sdgs to promote better understanding valuing critical role forest play develop holistic approach protecting maintaining center international forestry cifor adopted mission bring scientific knowledge bear major decision affecting world tropical forest people depend highlight important topic cifor portfolio forest diverse role mitigation forest governance ensures equitable sustainable wellbeing people locally globally a one founding donor country cifor government japan consistently supported cifor japanese scientist collaborating project serving member cifor board therefore specifically highlight project funded directly government japan particular
57,Influence of Fire on the Carbon Cycle and Climate,WOS:000468467800005,purpose understanding fire affect carbon cycle crucial mitigation strategy a often based earth system model simulation identify recent progress need improve model representation fire impact recent finding new constraint fire effect carbon cycle provided quantification carbon age effect vegetation type trait for global scale modelling low understanding human fire relationship limiting summary recent development allow improvement earth system model respect influence vegetation peatland burning pyrogenic carbon cycle better understanding human influence required given impact fire carbon storage thorough understanding effect fire earth system crucial support mitigation
58,"Traditional and modern ecosystem services thinking in nomadic Mongolia: Framing differences, common concerns, and ways forward",WOS:000703785400007,interest using ecosystem service approach environmental decision making natural resource management increased markedly however use approach local level particularly developing world challenging mongolian pastoral society provides opportunity investigate possible focus group interview key informant decision maker expert nomadic herder policy workshop used explore applicability these complemented policy document analysis assessed level sensitivity ecosystem service current land use planning practice demonstrates sensitivity provisioning ecosystem service integral traditional nomadic pastureland management consideration regulating supporting service le developed exploring option nomadic herder adapting brought challenge opportunity bringing traditional culture dialogue ecosystem service thinking ecosystem service thinking arrives local level governance hierarchy creates risk marginalization local interest understanding finding way leverage local knowledge use ecosystem service thinking empower local community essential
59,Governance criteria for effective transboundary biodiversity conservation,WOS:000387484300002,intact ecosystem across jurisdictional boundary growing importance world continues experience impact international boundary however drawn political rather ecological reason ecosystem component often occur one nation consequently subject conflicting management land use practice integrates legal institutional environmental management component transboundary biodiversity conservation propose comprehensive framework evaluating potential effectiveness transboundary conservation regime present twelve criterion effective transboundary conservation terrestrial biodiversity these criterion assist evaluation existing initiative design future one criterion increasing importance decision maker seek adapt conserve biodiversity scale political organization
60,Integrative Frontiers in Environmental Policy Theory and Research,WOS:000302614800004,environmental policy continues advance toward kuhnian normal science theory empirical tool brought bear real world policy system better understand social process determine context policy work best traditional environmental policy tool involve flexible market based instrument voluntary agreement information provision tool like ecolabels sustainability indicator policy process theory continue refined hypothesis testing evolving integrative multidisciplinary framework interdisciplinary method also employed better measure analyze environmental outcome always major challenge environmental policy these tool explored emerging policy approach like collaborative partnership novel environmental issue like pharmaceutical personal care product nanotechnology
61,The drivers of change for the contribution of small farms to regional food security in Europe,WOS:000602889100026,capacity food system respond economic demographic environmental challenge ahead become topic increasing interest particular attention role responsibility different actor ensure sustainable food system guarantee food nutrition security in approach need better understand factor condition potential contribution small farm regional food nutrition security europe acknowledging role small farm play europe present analysis based survey 94 expert 17 region nuts3 level 11 different european country identified driver according regional expert these driver categorized relative relevance assessed result indicate relevant driver european context linked capacity adopt technology practice allowing capacity connect food market emphasis need cooperation collective action weight european specific driver consumer value habit reveal future role small farm dependent societal equity becoming relevant component consumer choice
62,Determinants of perceptions of climate change and adaptation among Turkana pastoralists in northwestern Kenya,WOS:000372444500008,there growing concern variability combined environmental social political pressure may overwhelm resilience pastoral system local strategy strengthened understanding pastoralists perception response climatic necessary sustainable strategy systematic purposive sampling technique used select 302 household turkana county northwestern kenya descriptive statistic heckman probit model used analyse data obtained household interview result show majority household perceive rise temperature rainfall variability past three decade pastoralists perception significantly p 05 associated gender household head livestock ownership herd size access extension service heckman sample selectivity probit model revealed factor influencing pastoralist choice include gender education level household head household size wealth term livestock ownership distance market access credit extension service conclude prerequisite long term commitment household resilience policy programme aim improving factor
63,Environmental Education as a strategy to face climate change,WOS:000668777200011,global environmental crisis humanity facing involves creation effort contribute towards greater socio ecological resilience face consequence change affecting planet local regional global level these mechanism seek society acquire greater knowledge skill achieve ecological culture lead sustainable relationship nature in context aim determine effect environmental education strategy contributes mitigation investigation carried working high school student teacher authority three educational institution city cuenca applied two approach quantitative application survey student teacher qualitative depth interview headmaster coordinator high school result statistically examined case survey interview content properly analyzed obtained information used establish guideline help traditional way environmental education undertaken nowadays part defines strategy approach methodology worked transversal holistic way within curriculum program educational center
64,The WTO'S Contribution to the Challenges of Global Commons,WOS:000923545200001,global trade important part solution modern global challenge rule based multilateral trading system played instrumental role fostering peace prosperity since creation 1947 trade lifeline producing accessing critical medical supply face mask vaccine almost since beginning pandemic trade also important mean adapting well cutting emission trade helped net food importing country faced food crisis for trade part solution range modern challenge role world trade organization wto indispensable must updated remain fit purpose continuing reinvention wto easy outcome 12th ministerial conference mc12 good start in special contribution journal international economic law i reflect wto role twenty first century beyond mc12 outcome serve foundation platform member build reinvent wto
65,Can wildlife surveillance contribute to public health preparedness for climate change? A Canadian perspective,WOS:000396124400009,early warning system preparedness response need take consideration range factor drive risk vulnerability there data nominate effective efficient reliable wildlife health signal public health planning growing opinion wildlife health could signal public health vulnerability related objective commentary explore potential wildlife contribute early warning public health protection wildlife impact many determinant human health direct indirect mechanism several strongly interconnected there long history wildlife serving bio sentinel environmental pollutant pathogen wildlife health could support public health threat detection risk assessment risk communication detecting tracking infectious non infectious hazard bio sentinel effect new changed hazard providing biologically understandable information motivate change personal risk behaviour providing insight new unanticipated threat public health risk communication strategic planning priority could benefit wildlife health intelligence system collect data incident disease hazard discovery well information social environmental condition affect risk perception likelihood human exposure harm
66,Local and indigenous knowledge on climate-related hazards of coastal and small island communities in Southeast Asia,WOS:000346236800003,coastal small island community southeast asia face daily threat impact related hazard describes analysis local indigenous knowledge practice related related hazard identified documented indonesia philippine timor leste these include observation change environment celestial body predict related hazard community use local material method prevent mitigate hazard adapt prepare ritual ceremony based traditional religious belief together customary law govern behaviour ritual engender reinforce respect environment strengthen social cohesion thus help community better face respond impact related hazard after going process documentation analysis validation local indigenous knowledge grouped categorised help u better understand knowledge integrated science enable community develop strategy cope related hazard adapt scientist practitioner policy maker also harness knowledge education policy it important promote transmission local indigenous knowledge increase community resilience
67,THE CONSTRUCTION OF THE CHEMICAL CONTENT IN RELATION TO THE ENVIRONMENTAL DIMENSION AT THE PRE-UNIVERSITY LEVEL,WOS:000932075800059,pre university educational level aimed improving teaching learning process within objective aspiration student demonstrate positive creative responsible attitude towards environment understanding interdependence economic dimension political social ecological sustainable development knowledge essential cause affect local national global level fundamental condition maintenance preservation resource diversity life well planet in way program chemistry subject proposed objective explain cause effect relationship structure property application substance effect health environment encourages establish link chemical content environmental problem manifested different area social life student considered appropriate develop didactic model treatment chemical content relation environmental dimension theoretically based emphasis construction said content
68,Synergistic Interactions between Carotene Ring Hydroxylases Drive Lutein Formation in Plant Carotenoid Biosynthesis,WOS:000308675100020,plant carotenoid play essential role photosynthesis photoprotection precursor apocarotenoids plastidlocalized carotenoid biosynthetic pathway mediated well defined nucleus encoded enzyme however major gap understanding nature protein interaction pathway complex needed mediate carotenogenesis in focused carotene ring hydroxylation performed two structurally distinct class enzyme p450 cyp97a cyp97c hydroxylases nonheme diiron hyd enzyme cyp97a hyd enzyme function hydroxylation beta ring carotene show functionally interchangeable formation lutein involves hydroxylation beta epsilon ring shown require coexpression cyp97a cyp97c enzyme these enzyme also demonstrated interact vivo vitro determined using bimolecular fluorescence complementation pull assay respectively discus role specific hydroxylase enzyme interaction promoting pathway flux preventing formation pathway dead end these finding facilitate effort manipulate carotenoid content composition improving plant enhancing nutritionally important carotenoid food crop
69,Climate-Change Adaptation in Ethiopia: To What Extent Does Social Protection Influence Livelihood Diversification?,WOS:000325537300003,social protection programme like productive safety net programme psnp ethiopia play positive role promoting livelihood enhancing risk management us propensity score matching estimate effect income diversification result suggest receiving transfer psnp average increase farm non farm income significantly increase natural resource extraction one component farm income while result treated caution suggest psnp may helping smallholder diversify income source positive manner concludes arguing promotion positive form income diversification investigation psnp influence autonomous strategy
70,"Communicating about plant breeding and genome editing in plants: Assessment of European stakeholders, sources, channels and content",WOS:000840717300001,genome editing help develop plant variety address future agricultural challenge resource efficiency sustainable productivity nevertheless associated aspect relating besides others regulation genome editing intellectual property right potential environmental health aspect lead fierce discussion within european union in discussion value moral aspect play decisive role to support set stage open minded dialogue communication behaviour need specific stakeholder group analysed mean two online survey survey considered source channel used information sourcing dissemination conveyed content relevant target audience in addition degree trust stakeholder different information source assessed stakeholder included representative academia civil society organisation including environmental consumer organisation journalist farming community seed plant breeding sector policymakers across europe our analysis suggests general high level trust associated representative academia safety related aspect transparency sustainability considered important topic across different stakeholder group in addition social medium seem play subordinate role inter stakeholder communication higher relevance reaching public
71,Valuing Geodiversity and Geoconservation: Developing a More Strategic Ecosystem Approach,WOS:000311374000008,review value benefit geodiversity geoconservation context strategic objective national outcome scottish government national performance framework particularly relation economic development biodiversity science education recreation health cultural inspiration a key challenge improve integration geodiversity environmental policy implementation order deliver holistic sustainable environmental management wider public benefit requires greater awareness recognition key benefit ecosystem service geodiversity provides society with overall objective promoting integration geodiversity relevant policy decision framework advocate strategic ecosystem based approach address future proofing ecosystem service particularly context rising sea level conservation sustainable management geodiversity designated site wider countryside raising awareness value geodiversity contribution ecosystem service improving understanding geodiversity key knowledge gap such approach adopted scotland geodiversity charter
72,"STRATEGIES TO ENHANCE ADAPTABILITY - TECHNOLOGICAL-CHANGE, SUSTAINABLE GROWTH AND FREE-TRADE",WOS:A1995RQ31000003,proposes three broad interrelated strategy stimulating technological sustainable economic growth free unsubsidized trade enhance future adaptability global including principle developing social legal economic framework necessary effect strategy proposal based upon examination present potential contribution strategy sustainability adaptability mitigation limitation environmental change various synergy strategy strategy principle would meet criterion recognize inevitable occur context already occurring global due agent reducing vulnerability change increase future adaptability specifically strategy increase ability feed clothe shelter world expanding population regardless agent b reduce vulnerability forest habitat biological diversity demographic environmental stress
73,Exposure to climate change in Central Europe: What can be gained from regional climate projections for management decisions of protected areas?,WOS:000361830600022,expected become important driver influencing biodiversity to protect biological diversity long term nature conservationist must include potential impact management decision in order incorporate effective adaption strategy management protected area potential threat need identified in model projection evaluated derive information future exposure nature park indicator reflecting boundary condition selected cooperative process considering scientifically reliable scenario analysis requirement park manager evaluation exhibit large uncertainty depending indicator while temperature warming trend projected region future projection precipitation show largest inter model uncertainty climatic water balance reflects potential water availability aid clarification stakeholder incorporates temperature trend analysis robustly indicates prolongation climatic growing season main challenge related model information decision making uncertainty different scale ecosystem process finding common communication level knowledge transfer result useful influenced decision making provide one part evidence making decision
74,Palaeoecology to inform wetland conservation and management: some experiences and prospects,WOS:000376388100004,wetland important social ecological resource fundamentally important many natural process human wellbeing livelihood they also contain important store information sediment increasingly used improve conservation environmental management outcome describe palaeoecology inform understanding longer term process wetland environment example contributed directly site based conservation decision wetland uk palaeoecological science used partnership scientist wetland manager yet scope broadening use support integrated inclusive form ofmanagement discus potential palaeoecology informmore holistic approach conservation landscape scale conservation focus ecosystem service natural capital interdisciplinary approach social ecological system frame conservation people nature realising potential requires enhanced communication engagement scientist user palaeoecological data scope application limitation need use narrative past environmental change future management scenario need improved approach conservation provide opportunity bridging science policy practitioner gap advancing wetland conservation management
75,Identifying Climate-smart agriculture research needs,WOS:000428459600001,smart agriculture csa approach help agricultural system worldwide concurrently addressing three challenge area increased mitigation ensuring global food security innovative policy practice financing it involves set objective multiple transformative transition newly identified knowledge gap address question raised csawithin three area conceptualization implementation implication policy decision maker also draw scenario future csa concept relation 4 per 1000 initiative soil food security launched unfccc 21st conference party cop 21 our analysis show still need interdisciplinary theoretical foundation csa concept necessary transformation agriculture land use system contrasting view implementation indicate csa focus triple win mitigation food security need assessed term science based practice csa policy tool need incorporate integrated set measure supported reliable metric environmental social safeguard necessary make sure csa initiative conform principle sustainability agriculture food system level
