,title,wos,clean_abstract
244,Mapping the Life Cycle Co-Creation Process of Nature-Based Solutions for Urban Climate Change Adaptation,WOS:000533886300001,developing urban peri urban ecosystem service nature based solution nb participatory approach help achieve resilient sustainable environment city urban area face co creation process increasingly recognised way forward deal environmental issue city allowing development associated method tool described published specific stage it argued co creation process comprises various interlinked stage corresponding stakeholder subsequent method tool need mapped integrated across stage in life cycle co creation process lcccp nb developed building continuous improvement cycle design thinking methodology stage substages involved stakeholder engagement method tool mapped defined for stakeholder actor urban living lab ull adapted lcccp engagement method tool goal stakeholder engagement used guide select example co creation method tool developed lcccp comprises five stage e coexplore codesign coexperiment coimplement comanagement creating unique path followed practitioner nb co creation
245,Smart cities indicators: the emergence of a new cliche,WOS:000485808800008,objective present bibliographic aim perform critical analysis indicator sustainable city abnt sdg smart city web science related challenge faced city methodology approach methodological procedure literature web science database content analysis categorization indicator comparison originality relevance originality analyze set indicator smart sustainable city regarding sensitivity assessing modern innovative urban management focused current challenge migration natural disaster main result author observed recurring indicator health education housing sanitation poverty well innovation technology absence indicator related aforementioned challenge theoretical methodological contribution result indicate theoretical reference quality recognized scientific community conclusion production tool technology use scope urban issue present great gap construction sensitive indicator measurement unprecedented transformation climatic point view great impact city
246,Spatial Form of Greenery in Strategic Environmental Management in the Context of Urban Adaptation to Climate Change,WOS:000467051900031,our focus problem greenery management urban area term spatial form greenery well biologically active area due importance spatial form greenery shaping positive feature city local author proposed method assessing spatial form greenery masfog extension existing widely used method in addition inventory plant spatial model created 3d model rendered geographic information system gi novelty method method allows visualizing calculating spatial form greenery real biologically active size studied area well estimate real loss environment resulting introduction planned change e g cutting greenery construction new facility method may facilitate management city greenery especially planning spatial development 1 stage drawing planning document 2 stage specific investment taking final decision concerning location activity related natural compensation
247,"Planting Stormwater Solutions: A methodology for siting nature-based solutions for pollution capture, habitat enhancement, and multiple health benefits",WOS:000692536200004,urban area worldwide must manage stormwater prevent flooding reduce pollution infrastructure historically designed used single purpose managing stormwater gray infrastructure typically negative consequence fails address challenge faced urban area a alternative vegetated nature based solution nb bioretention facility constructed stormwater wetland outfall retrofit may used capture treat stormwater also contributing benefit reducing urban heat island effect increasing carbon sequestration improving air quality access open space enhancing mental physical health urban biodiversity to optimize benefit siting nb crucial developed spatially explicit analytical methodology planting stormwater solution prioritize siting vegetated nb benefit biological diversity social public health water quality using los angeles case demonstrate benefit spatially converge diverge found greatest opportunity benefit biodiversity occur along waterway greatest social public health benefit may realized nb installed around heavily developed area nb sited area high density commercial industrial land us may provide greatest water quality benefit use analytical methodology may allow decision maker limited resource multiple challenge make informed siting decision vegetated nb
248,Creating a National Urban Research and Development Platform for Advancing Urban Experimentation,WOS:000611736300001,transformative change required 21st century sustainable urban development transition involving multiple interconnected domain energy water transport waste housing necessitate step performance goal tangible solution regenerative urban development emerged major pathway together decarbonisation involving new blue green infrastructure transition new green circular economy these grand challenge unlikely realised current urban planning governance system within time frame mitigate environmental economic social disruption a new national platform urban innovation envisaged implemented capable enabling engagement multiple stakeholder across government industry community well real time synchronous collaboration visioning synthesis experimentation decision making it target large strategic metropolitan mission scale transition challenge well tactical neighbourhood scale project introduces ihub national urban development platform underlying concept multiple layer technical it av software analytical data engagement envisioned implemented four largest capital city five collaborating foundation university
249,"Make kin, not cities! Multispecies entanglements and 'becoming-world' in planning theory",WOS:000432110300003,much planning theory undergirded ontological exceptionalism human yet city planning sit outside eco social reality co producing anthropocene urban planner scholar therefore need think carefully critically speaks nonhuman place making in identify two fruitful direction planning theory better engage imbricated nature human nonhumans recognised characteristic anthropocene multispecies entanglement becoming world drawing human literature urban cultural geography environmental humanity consider term offer new possibility productively rethinking ontological exceptionalism human planning theory critically explore planning theory might develop inclusive ethical relationship nurture possibility multispecies flourishing diverse urban future future increasingly recognised co produced nonhuman agent context variability argue critical developing adaptive planning tool narrative creation socially environmentally multispecies city
250,A framework for urban climate resilience,WOS:000315208000006,unavoidable impact urban system population especially asia many large city exposed essential planning simplified operationalizing concept resilience vulnerability review concept theory range diverse field illustrate general notion urban resilience developed operational framework planning practitioner framework integrates theoretical empirical knowledge factor contributing resilience process translating concept practice framework includes characteristic urban system agent people organization depend manage system institution link system agent pattern exposure it operationalizes concept structured iterative shared learning approach allow local planner define factor context order develop practical strategy local action viability framework demonstrated example resilience planning activity undertaken 10 city across asia asian city resilience network funded rockefeller foundation
251,Contrasting changes in fine-scale land use structure and summertime thermal environment in downtown Shanghai,WOS:000822679700002,understanding association fine scale land use structure surface urban heat island effect within city synonymously defined intra suhi vital decision making sustainable land development uhi mitigation taking downtown shanghai case quantified association change land use structure indicated eleven metric urban morphology land use composition urban green infrastructure intensity intra suhi intra suhii land parcel level two model type including type 1 model merely consider main effect factor type 2 model consider main effect potential interaction employed analysis performance model type parallelly assessed using partial least square regression plsr random forest regression rfr method our result revealed type 2 model exhibited higher interpretation power plsr 55 604 55 887 rfr 53 841 55 739 type 1 model plsr 47 531 47 591 rfr 47 111 50 300 explaining variance parcel level intra suhiis finding indicated non negligible importance potential interaction factor determining model interpretation power our generalizable many large city similar climatological condition
252,Evidence-based decision-making in supporting integrated local-level urban and climate change adaptation planning simultaneously: A simulation-optimisation approach,WOS:000930834500003,sustainable development heart city planning urbanisation play central role achieving sustainable development goal urbanisation however interlaced existential challenge national government developed overabundance national plan foster sustainable economic development led plethora act place many statutory requirement municipality contains critical national plan statutory requirement resultant planning framework instrument main finding many national plan make adequate progress act planning instrument require policy intervention long term vision tested implemented might contribute fragmentation poor coordination neglecting impact case study based simulation model used locally decision support tool presented case made use integrated land use transport model test policy intervention include urban planning an enhanced simulation optimisation framework proposed allow planner determine best mean achieve specific target framework useful many government department know wish achieve often struggle determine achieve target let alone whether even achievable
253,Green infrastructure as life support: urban nature and climate change,WOS:000356326600008,green infrastructure network green space water system delivers multiple environmental social economic value service urban community living network strengthens resilience urban environment respond major current future challenge growth health biodiversity loss well water energy food security with rapid expansion town city around world far reaching value green infrastructure increasingly recognised scientific planning design community a key strategy area south australian green infrastructure project development sound credible evidence base demonstrate multiple benefit make case investment green infrastructure a local global literature emphasis recent peer reviewed carried 2012 2014 body evidence firmly establishes many diverse benefit green infrastructure these include modification temperature climatic condition improved human health well enhanced community liveability effective water management increased economic prosperity greater opportunity biodiversity conservation extensive urban food production primary focus contribution green infrastructure protection
254,Identifying enablers and barriers to the implementation of the Green Infrastructure for urban flood management: A comparative analysis of the UK and China,WOS:000569421500007,urbanization increasing urban flood risk cause adverse socio economic environmental impact green infrastructure gi reduce stormwater runoff offer multiple benefit initiated united kingdom uk china namely sustainable urban drainage system suds sponge city program scp respectively currently implementation gi restricted small spatial site specific scale facing several constraint financial investment governance limited fuller function potential aim identify barrier enablers adoption gi investigating suds scp uk china twelve depth semi structured interview stakeholder our result found multiple benefit suds scp identified main enablers country reducing stormwater runoff alleviating peak discharge drainage system also contributing social well adaptation some barrier found current practice facing challenge financial biophysical socio political circumstance case conclude beneficial learn comparative finding experience country contributes stakeholder improving current gi practice prior achieve sustainable long term deliverable
255,Applying the Knowledge Product Evaluation (KnoPE) Framework to two urban resilience cases in the United States,WOS:000525353800002,urban decision maker increasingly focused enhancing community resilience anticipation frequent intense impact variability these impact manifest complex nuanced way particularly coupled additional social economic environmental shift vary across context given challenge urban decision maker seeking new knowledge new way using existing knowledge support decision making process in response broad range knowledge product e decision support tool service developed urban area yet date little directly evaluated product knowledge product evaluation knope framework address gap providing conceptual clarity surrounding knowledge product structured generalizable methodology guide support improved knowledge product creation uptake knope framework combine data information knowledge product use decision making time evidence tangible action taken knope framework developed two urban resilience knowledge product urban tool maine flood resilience checklist initial testing indicates knope framework ass transferability scalability use knowledge product urban resilience decision making any evaluation using knope framework requires thorough understanding contextual detail case understanding factor may influence knowledge product development subsequent decision making process outcome yet analytical entry point evaluation knowledge product knope framework offer insight regarding extent knowledge product influence urban resilience decision making process
256,The role of institutions in sustainable urban governance,WOS:000393051100004,in effort support transition sustainability urban institution face new challenge municipal level institution design implement sustainability action plan action plan increasingly adaption project review debate surrounding role institution sustainable urban governance well tool available ass plurality actor working within across institutional boundary sustainability guiding principle urban planning requires fundamental reorientation rationality governed discrete aspect social economic political life city institution ordering administrative management activity urban government critical effort hasten adoption sustainability ideal implementation associated project urban political institution engage new form environmental leadership polycentric form environmental governance response contextually specific urban characteristic actor constellation extent sustainability ideal institutionalized depends sound analysis help form new understanding way human environment system coupled coupling inform governance action support sustainable urban development
257,The everyday politics of urban transformational adaptation: Struggles for authority and the Barcelona superblock project,WOS:000526037400025,a vulnerability city effect increase urgency interest urban transformational to date however looked empirically everyday urban politics shape multi scalar political constraint prevent municipality implementing transformational analyze poblenou superblock project barcelona spain effort enact transformational land use planning linked effort find key driver behind opposition everyday political struggle municipal authority materializes clashing vision future city political clout define show urban transformation least much competitive urbanism related short term political gain importance environmental quality life benefit ostensibly target intervention also highlight civic political contestation authority champion jeopardize transformational achievement also political survival champion conclude transformational obstructed fear material political effect transformation per se also message conveys concern authority decide common good
258,Piloting a city health adaptation typology with data from climate-engaged cities: Toward identification of an urban health adaptation gap,WOS:000649615200003,important population health impact city often frontlines however health reported le active sector to contribute better understanding urban health effort identifying gap developed city health typology tested action 106 large world city population 1 million reported major publiclyavailable database found two third action active adapter city healthassociated half health information activity e g hazard mapping early warning nearly onethird addressed relevant health determinant urban built environment e g green space forty percent city low middle income country our proposed typology provides systematic framework monitoring comparing city health action reported city action suggestive increasing depth breadth urban health associated however even among adaptationengaged city health gap apparent key health service e g mental health related public health governance capacity building covid 19 pandemic demonstrated pressing need strong public health institution recommend better integration public health agency local action planning enhanced mode collaboration health non health agency non governmental actor strengthening city public health adaptive capacity including networking
259,"Exploring relationship between social inequality and adaptations to climate change: evidence from urban household surveys in the Yangtze River delta, China",WOS:000354496800002,enhances understanding complex relationship social inequality adaption urban area it novel first area based conceptual econometric framework within multiple stage explicitly developed empirical evidence gathered use approach examine role material social status power inequality influencing spontaneous choice urban setting china yangtze river delta framework differentiates two vital stage decision making household level allows u examine first social inequality shape severity impact second social inequality interacts experience influence response impact pilot approach selected metropolitan area shanghai nanjing our result show dimension social inequality significantly associated experience choice application conceptual framework provides policymakers planner new useful tool used formulate better policy measure either enable disadvantaged adapt situ provide group real opportunity capacity migrate
260,From XS to XL Urban Nature: Examining Access to Different Types of Green Space Using a 'Just Sustainabilities' Framework,WOS:000570138200001,different type urban green space provide diverse benefit human health environmental sustainability study access green space focus neighborhood park le work smaller larger green space in examined sociodemographic difference access green space different size 14 385 census block group 12 u s city using sustainability framework classified green space street level greenery x neighborhood park s l walking cycling access large park xl walking cycling driving access ran spatial filtering model census block group level using different threshold based transportation mode uncovered complex picture inequality consistent injustice x green space fewer injustice s l xl green space based socioeconomic status age instance distribution s l xl green space based race ethnicity our finding present concerning picture sustainability green space type often part sustainability strategy street greenery unjustly distributed likely result structural racism u s institution by examining multimodal access green space different size help urban greening professional develop sustainable strategy
261,A social assessment of urban parkland: Analyzing park use and meaning to inform management and resilience planning,WOS:000378956300005,globally municipality tackling resilience planning urban green space crucial biophysical buffering capacity also affect social interaction human well considers social dimension urban green space assessment focused park use function meaning compare result category cultural ecosystem service develop mixed method approach assessment us social meaning parkland pilot method 2140 acre parkland waterfront neighborhood surrounding new york city jamaica bay area heavily affected hurricane sandy method combine observation human activity sign prior human use structured interview park user find urban parkland crucial form nearby nature provides space recreation activity socialization environmental engagement support place attachment social tie show park use interaction human producing vital cultural ecosystem service may help strengthen social resilience certain service easily detectable others via assessment technique including recreation social relation sense place assessment method designed spatially explicit scalable replicable natural resource manager engaged park management resilience planning could apply method across individual site particular district vulnerable waterfront area citywide demonstrates way cultural ecosystem service understanding social meaning could incorporated park management resilience planning published elsevier ltd
262,Land for housing: Quantitative targets and qualitative ambitions in Dutch housing development,WOS:000882918000009,struggle city achieve quantitative housing objective partly explained struggle cope increasing value conflict qualitative policy objective including realization affordable housing adaptive area inclusive neighborhood high quality public space in public debate netherlands high ambition piling policy objective often mentioned cause non conformance quantitative housing objective however despite non conformance plan policy may still function well informing decision making process invoking scrutiny conflicting objective aim understand municipality cope implementation housing development pluralistic policy objective therefore performance policy objective accelerate production housing studied exploring value conflict quantitative qualitative objective addressed a survey among dutch municipality two additional depth case study reveal non conformance acceleration housing production result exogenous process also result accumulating policy decision favouring qualitative ambition case study reveal municipality especially struggle trade offs qualitative quantitative objective result show relevance additional focus value conflict public policy implementation process
263,Innovative urban forestry governance in Melbourne?: Investigating green placemaking as a nature-based solution,WOS:000423654100018,a nature based approach resilience aim challenge frame conventional environmental management method refocusing solution technological strategy socio ecological principle human well community based governance model thereby improving legitimizing delivery ecosystem service e there however many challenge applying socio ecological agenda urban resilience thereby framing e delivery community people focused knowledge gap extensively outlined environmental governance literature in aim contribute assesment urban environmental governance examining city melbourne approach urban renaturing governance place based perspective here focus city internationally acclaimed urban forest strategy ufs investigating extent governance arrangement embedded within ufs draw strength diverse perspective allow institutional arrangement support situated reflexive decision making co creation find melbourne ufs governance process foster green placemaking focusing solution technological strategy situated socio ecological principle human well community based decision making in sense case provides valuable insight broader ugi governance field regarding opportunity challenge associated socio cultural approach urban naturing e delivery
