,title,wos,clean_abstract
96,Initial findings from the implementation of a community-based sentinel surveillance system to assess the health effects of climate change in Alaska,WOS:000325721900327,background report describes result determine whether community based sentinel surveillance system developed implemented ass health effect contribute local discussion mitigate health effect purpose report describe process outcome innovative approach identifying priority area investment report used assist local state federal government determining develop action policy promote objective to evaluate health effect rural alaska design conducted iterative participatory process develop metric instrument protocol collect sentinel surveillance data health effect 3 ecologically distinct region state result collected surveillance data 91 participant course 12 month these data analyzed categorized frequency association specific health outcome health related factor food security reported exposure environmental effect found significant association several health outcome health outcome mediator reported exposure presented data participant community setting moderated discussion likely causal factor measured association helped community resident identify specific adaption measure mitigate health effect conclusion conclude community based sentinel surveillance effective method assessing health outcome exposure environmental effect informing health planning alaskan community contend would effective region nation well
97,Challenges of performing socio-environmental interdisciplinary research: the experience of the Brazilian Research Network on Climate Change (Rede CLIMA),WOS:000486591900009,how move team scholar varied academic background multidisciplinary comfort zone towards genuine interdisciplinarity integration collaboration field challenge project faced concerning perception smallholder farmer four brazilian biome amazonia cerrado pantanal semiarid region coordinated brazilian network rede clima interdisciplinary clash among scientist went well beyond semantics reached core concept perception resilience vulnerability adaptive capacity even challenge included thinking collectively problem much ambiguous contradictory knowledge conflicting interest diverging epistemology case focused internal debate climatic apparent misperceptions family farmer confirmed blueprint interdisciplinary project well clear need project specific context sensitive strategy critical factor going successful interdisciplinary transdisciplinary integration included early involvement different group researcher decision maker local actor stakeholder essential finding common objective priority experience rede clima confirmed barrier successful mutual incomprehension distrust scientist scientist end user could overcome creating collaborative enterprise co creation science included switching role knowledge producer end user facilitated horizontal work identification related risk among family farmer
98,Factors Leading Municipal Authorities to Implement Preventive Interventions for Lyme Disease,WOS:000469517300072,aim document intervention targeting lyme disease municipal level province quebec exploratory relies theory planned behavior certain construct health belief model identify factor leading municipal authority implement preventive intervention lyme disease pild data obtained online survey sent summer 2018 municipal officer 820 municipality quebec health region population risk contracting lyme disease response rate 36 questionnaire used measure implementation pild intention implement intervention attitude perceived social pressure perceived control lever barrier intervention perceived effectiveness preventive measure risk perceived vulnerability result structural equation analysis showed attitude significantly associated municipal authority intention implement pild intention implement pild significant predictor implementation pild additional analysis showed perceived barrier added moderating effect intention implementation relationship prediction behavior practice municipal authority could implement prevent lyme disease enable evaluation time evolution quebec municipality lyme disease moreover examination association specific psychosocial factor revealed important implication design effective behavior intervention would allow health official awareness work create personalized intervention better suited municipal officer specific context
99,Climate change literature and information gaps in mountainous headwaters of the Columbia River Basin,WOS:000590245600001,altering mountainous headwater biophysical social system depend while scientific knowledge abounds literature synthesis needed understand multidisciplinary impact identify critical knowledge gap ass potential management policy response in systematically map analyze topical spatial distribution mountainous headwater major transboundary watershed columbia river basin crb find crb focus impact much frequently mitigation rarely focus most study ass trend large spatial extent use secondary data make projection impact rather observation spatial distribution thematic content vary across international border greater concentration usa a general scarcity social science limited interaction social biophysical content reinforce need increased collaboration disparate discipline future focus area include related mitigation increased integration social biophysical science collaboration bridge international border unified basin wide focus focusing new direction increase potential science management community co produce actionable science effective response
100,Is the participatory formulation of policy strategies worth the effort? The case of climate change adaptation in Austria,WOS:000419157400021,participation usually regarded good practice environmental policymaking effect policy strategy unclear based literature survey interview participant present ass whether decisional participation formulating austria national strategy na worth effort assessed goal participation process find raised awareness facilitated exchange among participant improved content na however regarding goal enhancing acceptance commitment na find achieved among participated among high level policymakers responsible implementing na conclude decisional participation benefit formulating comprehensive policy strategy likely able overhaul well documented weakness among weak political commitment implementation failure
101,Sustainability and climate adaptation: Using Google Earth to engage stakeholders,WOS:000306822900003,action project aimed test participatory mapping methodology using google earth develop shared understanding among participant sustainability process focused improving knowledge uptake enabling dialogue among participant order develop strategy rottnest island western australian coast project result indicate increased level knowledge commitment active involvement sustainability issue common thread came together coherent set recommendation contribute ongoing sustainability planning rottnest island authority major conclusion drawn include usefulness google earth participatory planning sustainability methodology enables social economic ecological cultural layer considered without primacy care must taken ensure knowledge power differential managed effectively methodology brought together stakeholder scientist co produce knowledge decision
102,The future of environmental networks-Governance and civil society in a global context,WOS:000311462100004,knowledge network recent innovation global environmental governance they provide mean local regional initiative aimed averting mitigating adapting trans boundary problem join together system permit sharing experience diffuses policy innovation across national border span divergent disciplinary boundary better communicate science local decision maker consider role currently played network possibility time soft power characteristic reliance value policy emulation may eventually place position globally coordinate local regional environmental policy innovation if successful effort might supplant need national action address even replace nation state system whose environmental management effort continue rely hard power use primarily economic incentive induce policy iclei provides technical consulting training information service build capacity share knowledge support local government implementation sustainable development local level our basic premise locally designed initiative provide effective cost efficient way achieve local national global sustainability objective international council local environmental initiative website 2010 when california passed global warming law two year ago island started forming partnership everywhere could teamed great britain province western northeastern state state like co host illinois florida kansa wisconsin and right first time official china india mexico brazil indonesia across world summit working toward goal reducing greenhouse gas emission growing green economy backyard governor arnold schwarzenegger global summit los angeles california november 18 2008
103,"I can migrate, but why should I?-voluntary non-migration despite creeping environmental risks",WOS:000920660400001,environmental non migration refers spatial continuity individual residence place despite environmental risk moreover largely researched topic especially within discourse increasingly coming attention scientist policymakers sustainable planning so far exists hardly conceptual methodical guideline environmental non migration considering gap explores environmental non migration based notion factor livelihood resilience partly explain decision non migration here livelihood resilience seen outcome interaction societal environmental condition individual household these condition inform decision stay migrate taken case hazard creeping environmental their influence generalises spectrum migration decision making stay migrate conceptualised four broad outcome categorised voluntary involuntary non migrant migrant analytical concept operationalised empirical example southwest coastal bangladesh result suggest livelihood resilience index lri relates voluntary nature migration decision made still household resilience cannot predict decision household make stay migrate concludes proposed analytical concept exemplary factor maybe initial mean holistically explore migration decision context natural hazard environmental however environmental non migration remains complex multi faceted assessment requires deeper examination various scale
104,"Retreating coastline, retreating government? Managing sea level rise in an age of austerity",WOS:000632183000001,recent trend governance england uk exemplified notion big society 2011 localism act seen local community individual encouraged take greater responsibility public policy issue previously seen largely exclusively state led examines case localism presumption applied estuary flood defence considers appropriateness localor community based initiative dealing sea level rise examine alde ore estuary suffolk england uk state retreated main decision maker consider impact governance approach semi structured interview undertaken local actor focusing perception governance flood defence plan b legitimacy decision reached
105,Making Climate Change Policy Work at the Local Level: Capacity-Building for Decentralized Policy Making in Japan,WOS:000311765200004,examine state local capacity building local japan mitigation need led global strategy national mandate integrated way impact manifested locally adaptive capacity determined local condition first lay basic component local capacity decentralized policy making ass current local capacity view japan policy bulk data employed derived existing date government database it found largest municipality well prefecture governing capacity develop comprehensive approach medium sized municipality potential take participatory approach policy it argues pioneering locality realize potential take initiative political leadership locality act piecemeal fashion according clear national level guidance
106,Iterative driver-response dynamics of human-environment interactions in the Arizona-Sonora borderlands,WOS:000327305900002,in complex social ecological system human physical process mutually condition one another co multiple scale local global for modified driver response conceptual model social ecological interaction considering degree binary set process human physical simultaneously driver response global process understood mutually conditioned offered greater potential compared solely social ecological community adapt demographic economic one hand water resource ecosystem dynamic by considering case material united state mexico border region characterized social ecological interaction along continuum acting exclusively driver others reacting primarily response considered water resource integrate multiple global process including variability ecosystem resilience human water demand variety purpose thus examined detail two watershed arizona sonora borderland representing mutually conditioned social ecological system first rio magdalena sonora represented illustrative case smallholder agriculture rural livelihood engaged social ecological interaction exhibited driver response element centered reflexive low impact adaptive strategy second ambo nogales relying santa cruz river associated aquifer urban growth equity water access human purpose environmental quality represented especially pressing challenge here human impact ecosystem predominant driver although growing concern medium longer term implication adaption planning ambo nogales centered infrastructure based solution including inter basin water transfer connection rio magdalena wastewater flow riparian corridor posed particular challenge human environment interaction cross border collaboration represents important opportunity based mutually conditioned interaction presented summarized analysis case raising conceptual question enquiry planning generic borderland beyond
107,Using collaborative hackathons to coproduce knowledge on local climate adaptation governance,WOS:000903708800011,while coproduction knowledge growing popularity social science especially still need better understand coproduce knowledge in explore collaborative hackathons coproduce local knowledge method reveals local gover nance data derives two collaborative hackathons called klimathons attracted 73 98 par ticipants bergen norway participant practitioner decision maker local regional national institution well researcher natural social science collaborative group work volved around challenge solution local planning uncovered diversity key actor understand local work norway these intervention revealed significant disagreement divergent understanding relevant law regulation responsibility practitioner working within governance system though cross sectorial interaction dissolve divergence allow actor renegotiate boundary divergent knowledge community klimathons helped u navigate com plexity local shifting focus different actor make sense work showing intertwining interdependence potential driver
108,Multidimensional Legal Research on the Transfer of Environmentally Sound Technologies in China,WOS:000929647100001,transfer environmentally sound technology always focus controversy combat global essence transfer environmentally sound technology coordination interest among region aim mitigating adapting global realization environmentally sound technology transfer mainly reflects game control freedom coordination public interest private interest equilibrium theory supply demand faced current situation weak law transfer environmentally sound technology suggested china need establish improve relevant legal system four dimension technology transfer law environmental law intellectual property law investment law improve legal system realize transfer environmentally sound technology strengthen connection china law relevant international law rule at time order improve management mechanism environmentally sound technology transfer suggested china propose legal measure optimize institutional system environmentally sound technology transfer three dimension namely state social organization individual form governance model multi actor cooperative management promote transfer environmentally sound technology china country achieve goal coping protect global environment
109,"Planning for resettlement: building partnerships for, by, and with Indigenous peoples",WOS:000710868000002,effort united state plan implement relocation response risk struggled improve material condition participant incorporate local knowledge keep community intact mixed methodology community geography provide opportunity dialogue knowledge sharing collaboratively diagnose challenge led community in advance participatory practice model co creation knowledge initiated two day workshop member biloxi chitimacha choctaw tribe isle de jean charles louisiana yup ik people newtok village alaska researcher mit resilient community lab building prior scholarship indigenizing share experience workshop support knowledge exchange dialogue goal understanding build participatory non extractive community academic partnership reflect community value principle used guide workshop inform inclusive co produced partnership pedagogy improve assist self determination group impacted workshop presentation discussion highlight interconnected theme resource system structure regulatory imbalance resilience underpin resettlement reflect narrative presented member indigenous tribe ngo partner illustrate shortcoming resettlement planning practice past present perpetuating existing inequality in response structured knowledge exchange identify potential role community academic partnership aim improve equity existing resettlement model propose approach incorporating traditional knowledge pedagogy discourse practice academic planning program
110,Climate data and information needs of indigenous communities on reservation lands: insights from stakeholders in the Southwestern United States,WOS:000734778800002,indigenous community reservation land across usa continue demonstrate leadership resilience active engagement co producing interdisciplinary solution these initiative however often ask indigenous people provide knowledge resource assist effort beyond community limit capacity act locally trusting expertise utilize participatory approach asks tribal government employee agriculturalist researcher outreach professional prioritize information data perceive necessary enhance resilience water resource indigenous community in provides empirical evidence specific need indigenous community reservation land arid southwestern usa respondent prioritize information data serve ass local impact enhance food security integrate protect traditional knowledge community in arid predominantly rural region respondent prioritize water quality data highest need followed streamflow air temperature data they frequently access respective tribal government source information data these result indicate localized data information highly prioritized future action alleviate information data gap account relevance accessibility protection resource prioritizing method ensure indigenous sovereignty self determination rather knowledge extraction
111,The Role of Collective Efficacy in Climate Change Adaptation in India,WOS:000376134000001,adaptive capacity often focus economics technology despite evidence social science finding socially shared belief norm network critical increasing individual community adaptive capacity drawing upon social cognitive theory build first author ph d dissertation examines role collective efficacy people shared belief group capability accomplish collective task influencing indian capacity adapt drinking water scarcity condition likely exacerbated future using data national survey n 4031 individual robust collective efficacy belief found likely participate community activity intended ensure adequacy water supply relationship found stronger community high level community collective efficacy compared community low level community collective efficacy in addition community collective efficacy positively associated self reported community response public education campaign aimed increasing collective efficacy belief likely increase adaptive capacity
112,Adapted to Climate Change? Issue Portfolios of Environmental Nongovernmental Organizations in the Americas,WOS:000937428100001,to extent traditional environmental nongovernmental organization engos tackle issue what explains variation among engos regarding attention issue to answer question use original dataset comprising 293 engos affiliated international union conservation nature based north central south america find generalist engos higher likelihood tackling issue even indicating priority area work however also find issue area specialist engos whether align action explain variation across engos based different country compared wildlife focused engos especially working nature protection sustainability likely tackle issue interview data confirmed engo leader make informed decision organization goal
113,Indigenous-Settler Climate Change Boundary Organizations Contending With US Colonialism,WOS:000652215600001,indigenous people taking action issue formed network intersect indigenous knowledge various environmental science field these organization work across many boundary science politics culture asks large scale u s boundary organization convene indigenous non indigenous practitioner contend ongoing colonialism analysis indicates indigenous settler network offer avenue indigenous value practiced collaborative science such organization also provide limited opportunity utilize science tribal while boundary organization aim build meaningful cross cultural mentoring relationship uneven power dynamic resource also permeate partnership these structural inequality cause tension arise tension arise us new terminology navigate longstanding struggle place political sovereignty human relationship natural world i argue decolonial environmental framework discerns role indigenous governance attending anthropogenic approach broadens sociological understanding examining attempt indigenous non indigenous actor build network
114,Towards Sustainable Transport Planning in the United States,WOS:000435954800003,provides analysis sustainability concept currently addressed within broad framework surface transportation planning united state u first discus overall transportation planning process u role key agency actor followed brief assessment sustainability addressed part national policy program present case u federal highway administration invest infrastructure voluntary evaluation sustainability tool application four agency in general finding indicate acknowledgement triple bottom line sustainability consideration transportation planning though cohesive unified approach lacking also note presence planning initiative discourse implicitly address sustainability issue targeting related consideration liveability health quality life economic opportunity
115,Alter-geopolitics and the feminist challenge to the securitization of climate policy,WOS:000481320200001,in united state beyond challenge global increasingly governed via militarization nation state border rather addition mitigation carbon emission collective strategy in apply concept geopopulationism introduced bhatia et al issue think zero sum manichaean logic traditional geopolitical calculation way become applied governance via securitization related migration in order disrupt securitization policy draw insight feminist geopolitics koopman call alter geopolitics consider contemporary grassroots movement like sanctuary movement blacklivesmatter made connection political economic environmental vulnerability developing relationship solidarity care broaden disseminate distribute regenerate security expansive inclusive project conclude considering way scholar continue ally contribute grassroots effort
116,"Indigenous communities and climate change: a Recognition, Empowerment and Devolution (RED) framework in the Murray-Darling Basin, Australia",WOS:000374410900013,directly threatens indigenous culture livelihood across murray darling basin mdb using modified grounded theory methodology draw depth interview indigenous leader elder across mdb highlight variability extraction water resource agricultural user directly threatens integrity aquatic system a consequence indigenous culture livelihood reliant natural system risk interviewee identify range systemic barrier entrench vulnerability indigenous people ip mdb building insight literature interview recognition empowerment devolution red framework developed establish possible pathway support rural ip fundamental red framework need non indigenous socio institutional structure create space allow ip ability adapt way impact
