,title,wos,clean_abstract
86,"Suicide and drought in New South Wales, Australia, 1970-2007",WOS:000308565300023,there concern drought substantially increase incidence suicide rural population particularly among male farmer family investigated possibility state new south wale nsw 1970 2007 analyzing data suicide previously established climatic drought index using generalized additive model controlled season region long term suicide trend found increased relative risk suicide 15 95 confidence interval 8 22 rural male aged 30 49 drought index rose first quartile third quartile in contrast risk suicide rural female aged 30 declined increased value drought index also observed increased risk suicide spring early summer in addition smaller association unusually warm month time year spring suicide increase well documented nontropical location although cause unknown possible increased risk suicide drought rural warrant public health focus concern annual predictable increase seen spring early summer suicide complex phenomenon many interacting social environmental biological causal factor relationship drought suicide best understood using holistic framework projection suggest increased frequency severity drought nsw accompanied exacerbated rising temperature elucidating relationship drought mental health help facilitate
87,How useful and reliable are disaster databases in the context of climate and global change? A comparative case study analysis in Peru,WOS:000352160900009,damage caused weather related disaster increased past decade growing exposure wealth identified main driver increase disaster database primary tool analysis disaster characteristic trend global national scale support disaster risk reduction however quality consistency completeness different disaster database highly variable even though variation critically influence outcome comparative analysis different database still rare date furthermore unequal geographic distribution current disaster trend study developing country underrepresented here analyze three different disaster database developing country context peru global database emergency event database em dat multinational latin american database desinventar national database peruvian national information system prevention disaster sinpad analysis performed across three dimension 1 spatial scale local regional provincial national scale 2 timescales single event decadal trend 3 disaster category metric including number single disaster event occurrence people killed affected result show limited change disaster occurrence cusco apurimac region southern peru past four decade strong positive trend people affected national scale furthermore found large variation disaster metric studied different spatial temporal scale depending disaster database analyzed conclude recommend type method source documentation carefully evaluated analysis disaster database reporting criterion improved documentation effort strengthened
88,ASSESSMENT OF CLIMATE CHANGE RISKS TO NATURAL RESOURCES IN THE REPUBLIC OF SERBIA,WOS:000588493100021,a temperature rise extreme weather condition consequence negatively impact quality life town region serbia challenge yet faced future in order prepare country adequately altered condition well successful implementation adaptive measure necessary determine vulnerability well assessment risk certain sector estimate show since 2000 republic serbia faced several significant extreme weather event caused loss human life considerable material consequence degradation natural environment consequence various depending part country us example raska administrative district cover area 3 918 km 2 309 258 resident aim ass vulnerability assessment risk natural resource agricultural forest land raska administrative district based methodology future city compass 1 developed part eu project future city using result 9 different model rcp 8 5 scenario concluded agriculture forest would high risk heat wave drought extreme precipitation well medium level risk extreme cold applicative character represents starting point process adapting also result significant impact planning spatial development defining planned solution must correlation possibility adapting sector different condition thus realistic concept spatial development
89,Embracing uncertainty: A discursive approach to understanding pathways for climate adaptation in Senegal,WOS:000477615300006,threatens increase frequency intensity drought flood there large uncertainty related unknown around future society response threat uncertainty word prefix un unknown untold unrest often negative connotation yet uncertainty manifested virtually everything to many science uncertainty akin error minimised lack knowledge need rectified argue uncertainty rather embraced starting point discussing pathway here follow definition pathway representing set proactive change present move people climatically unsafe place position safety self defined representing freedom harm adverse effect applies inter discursive analytical approach un certainty un safety used deepen understanding around position people senegal livelihood respect hazard examine discursive socio cultural value active adaptive space our finding show people adaptive decision often based information discursive value emotion guided direction response felt right conclude acknowledging different understanding perception uncertainty goal achieving safety allows issue power discussed contend process help illuminate navigate pathway impact variability
90,How Global Warming Changes the Difficulty of Synoptic Weather Forecasting,WOS:000462612900066,global warming projection point wide range impact system including change storm track activity frequent intense extreme weather event little however known whether global warming may affect atmosphere predictability thus ability produce accurate weather forecast here combine state art state art ensemble weather prediction model show business usual 21st century setting global warming could significantly predictability atmosphere defined via expected error weather prediction predictability synoptic weather situation could significantly increase especially northern hemisphere explained decrease meridional temperature gradient contrarily summertime predictability weekly rainfall sum might significantly decrease region plain language summary due chaotic nature atmosphere impossible make weather forecast completely accurate therefore weather forecast inherently uncertain certain degree however uncertainty thus difficulty making good forecastsis forecast open highly important question whether global warming affect difficulty weather forecast due enormous socioeconomic importance accurate weather forecast essential know whether adaption policy also need take account potential change difficulty accuracy weather forecast show warmer world easier predict field temperature pressure contrarily harder make accurate precipitation forecast might strongly affect disaster prevention rainfall dependent industry energy sector heavily rely accurate precipitation forecast additionally show uncertainty prediction pressure field large extent controlled fluctuation temperature difference north pole equator new important insight fundamental weather forecast uncertainty
91,Neglecting acclimation of photosynthesis under drought can cause significant errors in predicting leaf photosynthesis in wheat,WOS:000873896900001,extreme climatic event heat wave cold snap drought spell related global become frequent intense recent year acclimation plant physiological process change environmental condition key component plant assessed temperature response leaf photosynthetic parameter wheat grown contrasting water regime growth temperature t growth two independent experiment conducted controlled condition in experiment 1 two wheat genotype subjected well watered drought stressed treatment experiment 2 two water regime combined high medium low t growth imposed one genotype parameter biochemical
92,Nature Based Solutions for Climate Adaptation - Paying Farmers for Flood Control,WOS:000582804400001,expected lead frequent severe fluvial flood event northern europe nature based solution increasingly recognised natural insurance flood risk vulnerable area requires collaboration landscape scale provider beneficiary flood control in particular mechanism incentivise owner land could potentially offer cost effective way reduce damage urban infrastructure conduct choice experiment among farmer located vicinity river ass willingness accept contract would allow local danish municipality periodically flood farmland reduce urban flood risk result indicate farmer average hesitant entering abatement contract especially prior experience crop loss due extreme weather event if agree contract would prefer separate compensation lost crop collective negotiation higher rather lower yearly payment surprisingly data show significant preference requirement grow flood resistant crop result suggest contract separate damage compensation based individual negotiation would average require annual payment 290euro ha farmer prior experience crop loss 469euro ha farmer experienced crop loss discus potential limitation landscape scale nature based solution
93,Identifying Strengths and Obstacles to Climate Change Adaptation in the German Agricultural Sector: A Group Model Building Approach,WOS:000773037300001,in past 30 year significant increase drought event europe it expected make drought frequent intense situation particularly concerning area drought management culture focus north east lower saxony nels important agricultural region northern implement novel approach group model building ass preparedness nels deal drought our novel approach includes creation preliminary model based individual interview triangulation information workshop conclude stakeholder aware insufficient attention given adaptive solution mainly require high initial investment given existing political infrastructure region potential adjust with efficient government body already place beneficial update could made established water withdrawal regulation
94,Spatially and temporally consistent prediction of heavy precipitation from mean values,WOS:000306249500021,extreme precipitation cause flooding result substantial damage detrimental effect ecosystem 1 2 must therefore account greatest precipitation amount may expected certain time span 3 recurrence extreme heavy precipitation notoriously hard predict yet cost benefit estimate mitigation successful need reliable information percentile daily precipitation here present new simple formula relates wet day mean precipitation heavy precipitation providing method predicting downscaling daily precipitation statistic examined 32 857 daily rain gauge record around world evaluation method demonstrated wet day precipitation percentile predicted high accuracy evaluation independent data demonstrated high skill space time indicating highly robust methodology
95,Modeling blue and green water resources availability at the basin and sub-basin level under changing climate in the Weyb River basin in Ethiopia,WOS:000658473100077,weyb river basin water utilized diverse water resource scheme one important river ethiopia however increase temperature magnitude spatiotemporal distribution rainfall changing adversely affecting freshwater resource availability aim model blue green water resource availability changing within weyb river basin ethiopia basin sub basin level using arcswat hydrologic model all water balance component including blue water flow sum water yield deep aquifer recharge green water flow actual evapotranspiration green water storage soil water entire basin sub basin level examined result reveal mean annual blue water flow green water flow green water storage exhibit rise entire basin sub basin representative concentration pathway rcp 8 5 4 5 2 6 scenario mean annual blue green water flow increase 28 30 rcp8 5 20 29 89 rcp4 5 17 28 65 rcp2 6 scenario respectively mean annual green water storage rise 13 87 13 62 13 60 rcp8 5 rcp4 5 rcp2 6 scenario respectively entire basin sub basin level analysis reveals spatial variation blue green water resource availability six sub basin high compared entire basin analysis rcp scenario provided significant insight freshwater availability sub basin level future changing paramount important develop mitigation strategy sub basin level optimum planning management freshwater availability within weyb river basin upcoming period
96,Standardized precipitation evaporation index (SPEI)-based drought assessment in semi-arid south Texas,WOS:000331970100002,coastal semi arid region south texas known erratic fluctuates long period drought extremely wet hurricane induced storm standard precipitation index spi standard precipitation evaporation index spei used conjunction precipitation temperature projection two general circulation model gcms namely national center atmospheric ncar parallel model pcm uk meteorological office hadley centre model hcm two emission scenario a1b similar 720 ppm co2 stabilization b1 similar 550 ppm co2 stabilization six major urban center south texas spanning five climatic zone both model predict progressively increasing aridity region throughout twenty first century spi exhibit greater variability available moisture first half twenty first century spei depicts downward trend caused increasing temperature however drought latter half twenty first century due increasing temperature decreasing precipitation these result suggest drought first half twenty first century likely caused meteorological demand temperature potential evapotranspiration pet controlled latter half likely critical curtail moisture supply region large period time precipitation pet controlled drought effect pronounced a1b scenario b1 scenario spatial pattern always consistent effect generally felt strongly hinterland coastal area projected increased warming region along potential decrease precipitation point toward increased reliance groundwater resource noted buffer drought however need human greater commitment groundwater conservation development large scale regional aquifer storage recovery asr facility capable long term storage order sustain groundwater availability groundwater resource manager planner must confront possibility increased potential prolonged multi year drought develop innovative strategy effectively integrate water augmentation technology conservation oriented policy ensure sustainability aquifer resource well next century
97,Towards a radar-and observation-based hail climatology for Germany,WOS:000385510100008,in german strategy hail identified one major subject concern regarding transport infrastructure moreover hailstorm major threat e g agriculture automobile industry causing significant economical damage loss despite significant hail related meteorological risk comprehensive observation based hail climatology exists in present new approach task combining radar data different kind hail report ground observation agricultural insurance data preprocessing ensures applicability radar data presented climatological analysis in sense number detection method applied filter artefact especially clutter pixel spoke disrupt radar measurement to construct reliable hail climatology process information 10 year based annual average number hail day 1 km x 1 km grid using two path hail criterion while first path combine threshold 50 dbz hail report second path based 55 dbz threshold by adding radar data increase spatial representativity ground based hail report gain additional information region lack observational data overall result mainly determined event derived first path 68 a validation dataset 65 station deutscher wetterdienst show method slightly underestimate number hail day especially mountainous region result better adaption hail criterion lowland resulting hail frequency map show increase average number hail day per year north south in particular hailstorm occur le frequently central north german plain mecklenburg coastal lowland whereas highest number hail day occurs mostly upland black forest swabian jura also rhenish massif alpine foreland lower rhine plain moreover feldberg region southern black forest show highest number hail day per year
98,"Projected Rainfall Triggered Landslide Susceptibility Changes in the Hengduan Mountain Region, Southwest China under 1.5-4.0 degrees C Warming Scenarios Based on CMIP6 Models",WOS:000938217800001,landslide one prevalent environmental disaster hengduan mountain region landslide lead severe economic damage property loss well fatality furthermore tend increase context purpose comprehensively ass landslide susceptibility across hengduan mountain region southwest china specifically analysis focused eastern boundary tibetan plateau within context future scenario based latest coupled model intercomparison project phase 6 cmip6 global model ensemble generalized additive model gam random forest rf light gradient boosting machine lightgbm selected order map landslide susceptibility within context 1 5 4 0 degree
99,Rainwater harvesting as an adaptation to climate change,WOS:000184219200016,extreme event aridity drought flood cyclone stormy rainfall expected leave impact human society they also expected generate widespread response adapt mitigate suffering associated extreme societal cultural response prolonged drought include population dislocation cultural separation habitation abandonment societal collapse a typical response local aridity human migration safer productive area however culture interact numerous way hypothesize people may resort modify dwelling environment adapting new strategy optimize utility available water harvesting rain rather migrating newer area recent palaeoclimatological evidence holocene match data archaeological historical record test rainwater harvest hypothesis find correlation heightened historical human effort construction rainwater harvesting structure across region response abrupt fluctuation like aridity drought historical societal adaptation fluctuation may provide insight potential response modern society future bearing water resource food production management natural system
100,East African population exposure to precipitation extremes under 1.5 degrees C and 2.0 degrees C warming levels based on CMIP6 models,WOS:000774503500001,understanding population exposure precipitation related extreme event important effective mitigation measure analyze extreme precipitation using index epi including consecutive dry day cdd annual total precipitation simple daily intensity number extremely wet day past future climatic condition east africa exposure east african population extreme event 1 5 degree
101,Adapting Railway Maintenance to Climate Change,WOS:000742868800001,railway infrastructure vulnerable extreme weather event elevated temperature flooding storm intense wind sea level rise poor visibility etc these event extreme consequence dependability railway infrastructure acceptable level service infrastructure manager stakeholder it quite complex difficult quantify consequence railway infrastructure inherent nature railway hence main aim work qualitatively identify ass impact railway infrastructure associated risk consequence a qualitative methodology employed using questionnaire tool information gathering expert several municipality sweden swedish transport infrastructure manager maintenance organization train operator outcome questionnaire revealed lower level awareness impact various facet railway infrastructure furthermore work identifies challenge barrier railway infrastructure suggests recommended action improve resilience towards it also provides recommendation including option ensure effective efficient railway transport service
102,Retrofitting England's suburbs to adapt to climate change,WOS:000321886600003,majority english population life suburb impact significantly affect people domestic life heat stress respiratory problem flooding drought deterioration green space damage storm a recognized need exists adapt suburb home garden public space physically mitigate adapt inevitable weather pattern a number potential option addressing different risk identified tested using range method including modelling workshop resident professional institutional stakeholder best solution reduce risk within context local adaptive capacity solution effective acceptable feasible given type suburb location microclimate housing type risk face socio economic composition resident attitude resource governance condition it essential consider totality suburban environment combined effect mitigation measure however biggest challenge implementation entail better understanding problem range stakeholder supportive policy context resource clearer responsibility
103,Increased Maintenance Costs of Extreme Weather Events Preparing for Climate Change Adaptation,WOS:000313316700003,increasingly department transportation dot subjected higher maintenance cost extreme weather event maintenance manager imagining thing amount rainfall intense precipitation increased 20 past century a survey dot show maintenance demand response flooding snowfall increased precipitously many state began discussion 2011 aashto maintenance meeting proceeded inquiry 50 state scan growth extreme weather event impact dot experienced impact increase wind dust storm snow ice flooding event discussed attention devoted impact rising sea level erosion case study reported extreme weather event offer place start ass potential cost least initial year plan recommendation dot maintenance operation manager respond extreme weather event also summarized
104,Characteristics of the extreme precipitation and its impacts on ecosystem services in the Wuhan Urban Agglomeration,WOS:000910131600001,summer extreme precipitation one frequent intense influential extreme weather event occurs frequently wuhan urban agglomeration wua preventing meteorological disaster coping necessitate understanding characteristic cause extreme precipitation impact ecosystem in spatiotemporal characteristic summer extreme precipitation wua analysed 1961 2020 then ncep reanalysis data relevant circulation index used explore cause extreme pre cipitation finally extreme precipitation influence key ecosystem service water yield water regulation soil conservation investigated result reveal 1 extreme precipitation wua shown obvious upwards trend past 60 year huanggang xianning huangshi wuhan e zhou city demonstrate highest value extreme precipitation increased significantly 1980s especially r97 5p prcptot rate 12 1 mm 10a 18 82 mm 10a respectively 2 atmospheric circulation variation dominant factor affecting extreme precipitation wua cause meridional distribution wave train eastern china intensity location western pacific subtropical high closely related extreme precip itation furthermore weakening east asian summer monsoon circulation also conducive occurrence extreme precipitation 3 spatial distribution water yield runoff retention abnormal extreme precip itation year similar variation pattern total amount extreme precipitation water yield runoff retention high value extreme precipitation year higher low value extreme precipitation year soil conservation show difference in addition ecosystem service synergistic relationship high value area trade relationship low value area contribute understanding extreme precipitation wua interaction ecosystem service
105,Climate change adaptation strategies for smallholder farmers in the Brazilian Sertao,WOS:000342427700005,model agree semi arid region around world likely experience increased rainfall variability longer drought coming decade in region dependent agriculture change threaten aggravate existing food insecurity economic underdevelopment push migration urban area in brazilian semi arid region sertao farmer vulnerability past present future stem several factor including low yielding production practice reliance scarce seasonally variable water resource using interpolated local data show since 1962 bacia jacuipe one poorest region sertao bahia state average temperature increased similar 2 degree
106,Internationally coordinated multi-mission planning is now critical to sustain the space-based rainfall observations needed for managing floods globally,WOS:000350573500012,at present 4 10 dedicated rainfall observing satellite system exceeded design life decade here show operational implication flood management collapse space based rainfall observing infrastructure well high value opportunity globally coordinated portfolio satellite mission data service result show current portfolio rainfall mission fails meet operational data need flood management even assuming perfectly coordinated data product current rainfall focused mission e full portfolio in full portfolio satellite based rainfall data deficit vary across globe may preclude location vulnerable increasing flood risk moreover removing satellite currently beyond design life e reduced portfolio dramatically increase data deficit globally could cause entire high intensity flood event unobserved recovery reduced portfolio possible internationally coordinated replenishment 2 4 satellite system beyond design life yielding rainfall data coverage outperform current full portfolio e optimized portfolio eight satellite outperform ten satellite work demonstrates potential internationally coordinated satellite replenishment data service substantially enhance cost effectiveness sustainability operational value space based rainfall observation managing evolving flood risk
