,title,wos,clean_abstract
0,Integrating social learning into climate change adaptation public policy cycle: Building upon from experiences in Brazil and the United Kingdom,WOS:000520030200004,outline good practice serf guide promote social learning elaboration implementation process public policy local level it based multiple case covering 18 experience united kingdom brazil analysis existing contribution social learning socio environmental governance public policy regarding wicked problem well empirical information collected workshop held part development adaptaclima platform from literature key aspect social learning identified active participation co production knowledge development capacity iterative reflection action these compared four phase public policy implementation cycle preparation engagement ii analysis impact vulnerability iii planning iv implementation monitoring used analyse empirical information gathered result bring practical example include key social learning aspect phase finding may apply different context especially useful developing country
1,Climate change adaptation in Europe and the United States: A comparative approach to urban green spaces in Bilbao and New York City,WOS:000454378800015,policy united state europe common aim different initial focus while united state principal factor establishing plan program based risk control criterion european country directly linked strategy urban regeneration sustainability in case city taking initiative define strategy without waiting state legislative act focus analysis ability urban green space promote risk control urban regeneration resource with analysis two urban regeneration case studied zone affected red hook new york zorrotzaurre bilbao policy united state europe studied these case allow focus city capacity establish initiative specific measure include urban green space final conclusion reveal according extreme event expected location composition urban green space key adaptive strategy city facing
2,Multilateral Governance for Climate Change Adaptation in S. Korea: The Mechanisms of Formulating Adaptation Policies,WOS:000408861800079,explores current trajectory multilateral governance s korea characterised vertical horizontal governance highlight characteristic governance realised effectively grassroot activity metropolitan local government level in particular thorough examination implemented measure national scheme national centre ansim village project well limitation national local level carried ultimately result suggests effective multilateral governance enhancing multilateral partnership national government local government facilitating horizontal governance within department local government managing horizontal governance sector according characteristic risk establishing sustainable governance ansim village
3,Advancements of sustainable development goals in co-production for climate change adaptation research,WOS:000806489000002,united nation sustainable development goal sdgs new discursive regime encompasses global environmental challenge sustainability science including co production knowledge become key intrinsic component sustainability science in investigate sdg agenda included application participatory approach co production knowledge finding process project whose objective foster context sdgs categorize method employed forward co production investigate 1 whether co production approach localize sdg target address tradeoff synergy 2 whether focus power asymmetry political dimension participatory process 3 whether literature show sdg agenda contributes shift role researcher towards interventionist approach co production our result show little evidence sdg agenda contributes shift towards interventionist transformative approach within further identified missed opportunity exclusion social sdgs sdg 5 10 discussion co production sgds most importantly find participatory effort including co production knowledge localizing sdg goal resolving tradeoff benefit salient aspect tie three co production sdg agenda together such participatory localizing process great potential facilitating long enduring empowerment legitimacy effort
4,Online participation in climate change adaptation: A case study of agricultural adaptation measures in Northern Italy,WOS:000355715600002,new eu strategy suggests flexible participatory approach face face contact although involves time consuming procedure limited audience often considered effective participatory approach in recent year however increase visibility different citizen initiative online world strengthens possibility greater citizen agency investigates whether internet ensure efficient public participation meaningful engagement in elucidating issue regarding developed eparticipation framework explore capacity agriculture northern italy farmer mobilised using pre existing online network first took part online questionnaire revealing perception reaction impact ongoing change agriculture used result suggest portfolio policy measure set evaluation criterion farmer evaluated policy option using multi criterion analysis tool simple user friendly interface our result showed eparticipation efficient support rapid data collection involving high number participant moreover demonstrated digital divide decreasingly obstacle using online space public engagement present eparticipation panacea rather eparticipation implemented well established participatory approach validate result consequently communicate meaningful message local agricultural practice regional decision maker feedback regional decision maker showed interest using eparticipation improve communication farmer future expect internet proliferation eparticipation may allow inclusion representative sample would contribute informed legitimate decision making process
5,Multilevel networks for climate change adaptation - what works?,WOS:000461571700003,purpose aim compare evaluate two norwegian municipal network see network initiated implemented mean achieving measure within municipality design methodology approach finding based 12 qualitative interview taken two case study result explained relation multilevel network framework environmental psychology finding multilevel network promote learning identification specific action connection aim establish interdisciplinarity participant least two authority level representative position enable introduce acquired knowledge organization influence application a network requires organizational commitment initial phase throughout follow process municipal leader mayor must aware network act signatory relevant document familiar participating representative commitment knowledge application within organization also requires participant understand work strategically convert new idea action practical implication present practical based guideline management network municipal county national authority level originality value combine political science environmental psychology perspective mean analysing network achievement a psychological approach may help promote greater understanding network knowledge transferred
6,"Scale, colonisation and adapting to climate change: Insights from the Arabana people, South Australia",WOS:000543361000014,role knowledge assisting indigenous people adapt gaining increasing attention local study provide rich insight knowledge used report result qualitative cross cultural collaboration arabana indigenous people south find arabana people corpus observed historical knowledge forged sustained period colonial invasion offer fine level detail likely impact captured regional scientific projection knowledge includes actual observation recent variability well change flora fauna land cultural site historical knowledge observation environment important arabana people ancestral traditional knowledge informing contemporary policy affect surroundings arabana knowledge set impact also found intimately interconnected regional socio economic activity pastoralism mining legacy colonisation cannot divorced cultural perception discussion impact conclude order forge appropriate response impact dialogue policy maker arabana need acknowledge legitimacy arabana knowledge particularly historical knowledge grafted colonial dispossession
7,The Paradox of Public Trust Shaping Local Climate Change Adaptation,WOS:000622143400001,growing attention directed towards understanding way policy shaped action interest local government explores connection local government effort uphold maintain public trust consideration associated water management document analysis 24 interview local public official used shed light consideration three small municipality central pennsylvania chambersburg carlisle gettysburg analysis provides indication paradox public trust lead public official pursuing action consideration consistent recognizing implication governing mindset outreach policy explored suggestion countering logic inaction expressed public official justified lack identified potential state federal intervention stimulate context like local government explored
8,The role of the private sector and citizens in urban climate change adaptation: Evidence from a global assessment of large cities,WOS:000455061900011,expectation cooperation local authority private sector citizen city high involvement many actor seen critical success scholar policymakers argue private sector could efficient public authority implementing measure argue need engage citizen ensure legitimacy inclusion locally relevant knowledge to extent city address private sector citizen initiative what mode governance use what kind city likely address private sector citizen going beyond existing case approach answer question using large n data set covering 402 city around world find majority initiative focus exclusively public sector address private sector citizen in case private sector often governed partnership participation whereas citizen participation relatively rare initiative involving citizen rely often provision information encourages citizen adapt find advanced city process likely address private sector citizen initiative adapt whereas partnership participation private sector influence urban arrangement broader scale provision information allows citizen implement individual measure according capacity
9,"Prioritizing climate change adaptation and local level resilience in Durban, South Africa",WOS:000283511400007,describes institutional resource challenge opportunity getting different sector ethekwini municipality local government responsible planning managing city durban recognize respond role headline strategy launched municipality 2006 catalyze development sectoral plan significantly influence integrated development plan key document municipal government set implement development priority possible causal factor include limited human financial resource immediate urgent development need to address situation municipality environmental planning protection department encouraged supported three pilot sector develop municipal plan sectoral approach encouraged greater interaction among sector provided clearer understanding need role perspective it also highlighted could used tool address development priority work extended cost benefit durban early adapter work also begun community based including support reforestation project provide green job response slow onset disaster food security water constraint
10,Indigenous climate change adaptation: New directions for emerging scholarship,WOS:000849068200001,although indigenous people perspective concern always accommodated practice burgeoning literature helping reframe decolonise line indigenous people lived experience in bring together decolonising intersectional scholarship chart progress made better analysing responding indigenous context identify wealth literature helping decolonise scholarship praxis attending colonial neo colonial injustice implicated indigenous people vulnerability taking seriously indigenous people relational ontology promoting draw indigenous capacity aspiration self determination cultural continuity despite call interrogate heterogenous experience within indigenous community decolonising scholarship made limited advance area examine small body take intersectional approach explores multiple subjectivity identity indigenous people occupy produce unique vulnerability capacity encounter policy suggest field might expanded drawing related study indigenous development natural resource management conservation feminism health food sovereignty greater engagement intersectionality work drive innovation decolonising scholarship practice it mitigate risk maladaptation avoid entrenchment inequitable power dynamic ensures even marginal group within indigenous community benefit policy programme
11,Indicators to Guide and Monitor Climate Change Adaptation in the US Pacific Northwest,WOS:000514829500025,objective to develop set indicator guide monitor u state local health department method performed narrative literature indicator public health service capacity mapped finding onto activity grouped center disease control prevention ten essential service drafted potential indicator discus practitioner refined indicator key informant interview 17 health department official u pacific northwest fall 2018 result informant identified need clarity regarding state local public health role integration existing program strengthening communication partnership response capacity increase resilience propose set indicator applicable state local health department conclusion with additional context specific refinement proposed indicator aid agency tracking effort generalizability robustness relevance proposed indicator explored setting broader set stakeholder
12,"Nature Protection Organizations and Climate Change in the Netherlands, Germany, and the United States",WOS:000343267900002,investigates message ten nature protection organization netherlands united state communicate member public internet site member magazine annual report based analysis content conclude organization address varying extent differing way all organization note major problem significant impact nature addressed mainly via mitigation with partial exception dutch group also inform member domestic politics other theme including international dimension consumer behavior collaboration criticism business effort pressure business government received le emphasis overall how much emphasis organization gave theme conditioned tradition constituency national context international affiliation
13,Science-practice interactions linked to climate adaptation in two contexts: municipal planning and forestry in Sweden,WOS:000345569000007,examines science practice interface process adapting society analysis science based stakeholder dialogue scientist municipal officer private individual forest owner sweden examines local expert share scientific knowledge experience integrate work strategy practice result demonstrate local expert jointly conceptualise scientific knowledge domesticated among local expert dialogue scientific expert emergence anchoring device boundary spanning function work respective sector
14,From water footprint to climate change adaptation: Capacity development with teenagers to save water,WOS:000453339200049,present bottom approach attempt link water footprint wf concept capacity development approach developed tested cooperation partner school austria aiming provide starting point wf assessment formulate improvement response pupil reduced wf 9 became agent approach assist young people develop self efficacy discovering connection individual action local level aspect global level it provides tool increase understanding contribute distant impact reduce vulnerability
15,"Climate Change Mitigation, Adaptation Practices, and Business Performance in Brazilian Industrial Companies",WOS:000856717300001,sought analyze level adopted mitigation practice relationship performance brazilian industrial company data collected e survey 40 brazilian industrial company linked carbon disclosure project cdp analyzed using univariate multivariate statistical method mitigation practice adopted independent variable performance parameter financial innovative production market export performance included dependent variable our finding indicate brazilian industrial company adopting corporate practice mitigation show relationship mitigation practice different dimension corporate performance contributes scientific advancement developing theoretical model address integrated manner managing mitigation practice corporate performance
16,Enhancing Resilience and Justice in Climate Adaptation Laws,WOS:000462865800005,resilience thinking approach understanding managing increasingly central law policy yet influence law policy distribution impact often overlooked study socio ecological resilience demonstrates environmental justice scholarship help address gap literature relating law resilience drawing existing literature identifies four principle promote resilience justice law law must prepare respond ii address distributive effect iii promote participation process iv cross sector scale each criterion implemented part existing legal process might also supported incremental law reform developing resilience justice dimension enhance effectiveness law addressing impact
17,"Framing climate change adaptation learning and action: the case of Lahore, Pakistan",WOS:000290180800005,purpose purpose identify critically examine framing key characteristic learning action context urban pakistani local government design methodology approach employed combination approach predominantly literature interview methodology recognising need understand iterative learning process literature concentrated organisational policy learning special consideration given characteristic pertinent urban governance pakistani context analysis furthered primary data collated series interview city district government lahore chosen case piece initial scoping interview followed series depth semi structured interview local government official assessment process used examine conceptual evidence finding pakistani urban context a total 21 pakistani professional working variety role local government subject interview process finding from critical analysis conceptual real world evidence author identified six discrete characteristic could used frame context learning action pakistani urban local government context these categorised leadership vision culture good governance innovation creativity resource originality value value several fold applies learning perspective debate identifies framing key characteristic learning action us actor based approach examine key conceptual idea pakistani urban context
18,Social learning for adaptation to climate change in developing countries: insights from Vietnam,WOS:000378052600007,social learning concept developed country often recommended implementing strategy developing country effectiveness replication questionable necessary align set learning process social economic environmental condition local context in compare theory social learning learning alliance working group can tho city vietnam see far possible extrapolate current social learning concept developed country developing country working group facilitates participation process among stakeholder use produce knowledge work together problem develop solution mostly similar social learning form learning alliance however interaction among stakeholder working group evolve much formal way lead several problem caused relative inflexibility top stipulation stakeholder participation planning procedure solution approach to overcome challenge recommend introducing element learning alliance working group order stimulate open dialogue incentive extension action practice approach
19,Adapting bridge infrastructure to climate change: institutionalizing resilience in intergovernmental transportation planning processes in the Northeastern USA,WOS:000393036700011,multi level governance network provide opportunity challenge mainstream due routine decision making coordination process explores institutionalizing resilience intergovernmental transportation planning process address bridge infrastructure northeastern united state usa specifically vermont maine presented relies nine interview policy maker planner survey transportation project prioritization criterion development longitudinal bridge funding database integration publicly available geospatial data it present novel spatial analysis methodology modified version could adopted transportation agency prioritizing scarce fund although transportation agency undertaking variety mitigation activity address business usual need resilience effort remain underprioritized global concern impact vary dramatically region require localized solution bridge culvert especially vulnerable induced flooding impact complex maintenance design process subject convoluted planning procedure critical gap resource knowledge barrier improved planning restructuring transportation project prioritization procedure used planning organization explicitly include may provide novel strategy institutionalize resilience transportation these procedure must considered context intergovernmental network exist support transportation infrastructure although network likely vary across country approach introduced address transportation infrastructure may applied many setting
20,Some challenges of interdisciplinarity Working with different experts in adaptation to climate change stakeholders' teams,WOS:000644314600006,piece explores dialogue analysis inside particular ongoing collective work regional action project southern part quebec province memphremagog mrc first precision given better understand mean work interdisciplinary context one continuing development terminology able better identify collaboration different professional these problem expressed two case study dialogue documented project
21,Policy Capacity and the Ability to Adapt to Climate Change: Canadian and U.S. Case Studies,WOS:000313490900001,special issue contributes extant empirical scholarship assessing governmental capacity meet significant policy challenge case related includes detailed examination five policy sectorsfinance infrastructure energy forestry transportationin two country united statesin order determine kind governance arrangement analytical capacity exist area changing interrelate status evolution outcome sector article provide comprehensive sampling policy network structure behavior organizational mandate resource actual job duty training policy actor across sector federal subnational level government
22,Mobile Adaptation and Sticky Experiments: Circulating Best Practices and Lessons Learned in Climate Change Adaptation,WOS:000349968300003,engages recent geographical literature policy mobility order examine world bank mobilizes best practice drawing relational case kiribati project community resilience disaster risk solomon island project explores complex intensive work required mobilizing lesson practice analytical work required building kiribati project world bank success story policy model worthy replication new site demonstrated however heeding call within policy mobility literature avoid fetishizing mobility attending contradiction global flow local institutional specificity find limited evidence replication noted site emulation instead compulsive citation publication circulation experience success within world bank operates build internal external legitimacy
23,Cross-level linkages in an ecology of climate change adaptation policy games,WOS:000437397400040,social ecological outcome environmental governance system shaped interplay across spatial level policy actor decision making forum operate focus condition actor participate policy forum operating higher lower level actor level draw upon theory network science transaction cost formulate test prediction overall prevalence cross level linkage well condition policy actor engage linkage estimate exponential random graph model using data collected survey policy actor participating decision making forum operating different spatial level within lake victoria region east africa within governance system effort improve adaptive capacity across national boundary diverse vulnerable population hinge well policy forum operating regional higher level attract participation actor access information local condition efficiency actor disseminate funding technical resource local policy forum well process occur via cross level linkage find actor le likely engage cross level linkage compared within level linkage conditioning general tendency actor even le likely participate forum operating lower level collaborator also participate by contrast actor likely participate forum operating lower level influential actor jointly participate these finding highlight distinct role social political capital cross level forum participation implication effort improve governance lake victoria region well multilevel governance system
24,The regional level as boundary organization? An analysis of climate change adaptation governance in Norway,WOS:000362603400018,investigates requirement regional government coordinate planning interpreted implemented using theory boundary organization applied multi level context using four county western norway case develops framework assessing regional level governance actor support local level implementation boundary work even though treated salient issue municipality studied regional level coordination effort creating hybrid management space aid mediation local knowledge expert knowledge they thus hold potential better local level planning
