,title,wos,clean_abstract
0,Spatial Planning in the Climate Change Adaptation and Turkey in the Framework of Smart Governance,WOS:000672708700011,aim examine smart governance order increase effectiveness spatial planning city one domain discus current situation smart governance turkey within framework for purpose firstly effect defined two stage literature conducted in first stage order understand relationship spatial planning indicator spatial planning evaluated examined prominent issue spatial identified including spatial policy governance model implementation level participation role technology in second stage literature reviewed prominent issue smart governance obtained then scope smart governance approach spatial turkey discussed spatial planning principle participation local level technology content analysis method allows descriptive evaluation literature used method a result spatial planning principle relevant actor identified local level deficiency use technology determined therefore asserted smart governance spatial turkey potential open development yet reached sufficient scope
1,The relative importance of subjective and structural factors for individual adaptation to climate change by forest owners in Sweden,WOS:000424643300018,a growing body literature argues subjective factor accurately explain individual objective measurer adaptive capacity recent study shown personal belief affect much better explaining awareness action income education gender focus process individual it ass compare influence cognitive experiential structural factor individual view intention regarding data come survey 836 forest owner sweden ordinal binary logistic regression used test hypothesis different factor result show cognitive factor namely personal level trust science belief salience risk assessment statistically significant factor directly explain individual intention adapt sense urgency finding also suggest structural socio demographic factor statistically significant influence decision making among swedish forest owner also offer valuable insight communication intervention promote finding strongly suggest communication intervention focus strongly building trust addressing stakeholder individual need experience
2,"Climate Change, Adaptation Planning and Institutional Integration: A Literature Review and Framework",WOS:000755778000001,scale scope triggered widespread acknowledgement need adapt out recent work attempting understand define contribute family concept related effort considerable contribution emerged yet field constantly grapple complex idea whose relational interplay always clear similarly understanding applied effort unfold planning process embedded broader institutional setting difficult apprehend present important theory theme term evident literature spatial planning integrate synthesize conceptual framework illustrating dynamic interplay lead consideration institution urban governance practice planning involved evolving shaping effort while examining practice planning useful framing core concept related role institutional process shaping defining concept planning remains complex our framework present useful tool approaching improving understanding interactive relationship central concept implication future work focused within domain planning institution addressing challenge era
3,Benefit transfer of climate change adaptation policies in island tourist destinations,WOS:000805327700010,benefit transfer non market valuation method offer quick cost effective alternative costly valuation method assessing economic value environmental good policy tourism ass validity benefit transfer method policy adapt impact across tourist destination to discrete choice experiment designed conducted simultaneously across seven island destination similar sociological environmental characteristic result show policy valued others tourist destination attract higher preference environmental action test give significant support validity transfer benefit policy across destination thereby providing alternative economic assessment benefit non market good policy tourism worldwide information cost benefit involved tourism policy decision making become increasingly available
4,Climate change adaptation under a social capital approach - An analytical framework for small islands,WOS:000356755700005,small island vulnerable impact continental region however island also feature high degree resilience resource dense social network collective action norm reciprocity relation trust therefore argue resource generally defined social capital particularly relevant small island current role social capital community cover many different aspect local knowledge economic development political capacity but effective relies understanding role social capital aspect connection specific impact holistic approach needed based empirical case study developed analytical framework provides step step approach help analyse potential social capital island specific case study these step among others include assessment social capital hazard mapping analysis political economic capacity moreover framework suggests method analyse step
5,"Climate Change Adaptation, Food Security, and Attitudes toward Risk among Smallholder Coffee Farmers in Nicaragua",WOS:000570349600001,farmer livelihood uniquely vulnerable taking adaptive measure changing environmental condition constitutes one important pathway protecting their willingness capacity adopt improved practice technology cognitive behavioural preference institutional response mechanism go long way determining success present result analysis vulnerability smallholder coffee producer nicaragua i use descriptive analysis experimental risk game evaluate preference attitude coffee producer context i show food insecure household risk averse food secure household much work needed sector ensure equity improve institutional capacity for household chronic poverty conventional risk management strategy simply may enough institutional arrangement must put place enable coffee growing household engage practice result improved capacity
6,Brief communication: Strengthening coherence between climate change adaptation and disaster risk reduction,WOS:000451028100001,reducing disaster risk adapting ever important policy goal europe worldwide commitment 2030 agenda sustainable development complementary multilateral framework including sendai framework disaster risk reduction 2015 2030 paris agreement galvanized pursuit policy coherence report disaster risk reduction europe enhancing coherence knowledge base policy practice european environment agency identified several way coherence silience built knowledge sharing collaboration investment
7,A framework for assessing community adaptation to climate change in a fisheries context,WOS:000457509100003,there rapidly growing body scholarship diverse context globally despite community level received adequate conceptual attention limited number analytical framework available assessing place specific adaptation particularly fishery context use conceptual material social ecological system s resilience human development resilience build integrated framework evaluating community adaptation fishery setting framework defines resilience combined result coping adapting transforming recognizing resilience system capacity process understanding resilience integrates three development resilience concept resistance rootedness resourcefulness develop place based element refer collective action institution agency indigenous local knowledge system proposed framework capture local setting place specific attribute relating well individual household community integration s human development conceptualization address key critique notion resilience proposed framework application context specific environment including fishery mean assessing community adaptation
8,"Governmentalities, hydrosocial territories & recognition politics: The making of objects and subjects for climate change adaptation in Ecuador",WOS:000561343700009,become major policy project focus donor government globally in provide insight project mobilize distinct imaginary knowledge claim create territory intervention object well targeted population subject sustain drawing two emblematic project ecuador show object subject created knowledge production process creates discursive rationale b sidestep uncertainty related impact
9,INDIGENOUS CLIMATE CHANGE ADAPTATION PLANNING USING A VALUES-FOCUSED APPROACH: A CASE STUDY WITH THE GITGA'AT NATION,WOS:000346193200008,local value knowledge important component creating robust strategy marginalized community incorporating local value planning process structured way effectively using local knowledge improves identification priority action also support successful implementation much planning recent year identifies action derived expert driven vulnerability assessment action yet value community influence impact perceived action locally acceptable local buy implementation thus important planning incorporates local value goal successful provides one approach addressing participatory value based process planning approach contextualized case gitga nation located northern coastal british columbia key value found culturally important food source culture environmental resource self sufficiency health infrastructure enable u live well gitga pride cooperation these value used throughout planning process contextualize impact gitga member way life develop evaluate action it hoped case provides proof utility value based planning context planning marginalized community
10,"Multilevel Climate Governance, Anticipatory Adaptation, and the Vulnerability-Readiness Nexus",WOS:000630524100001,adapting social economic environmental health threat resulting requires successful multilevel governance improved decision making process in evaluate explanatory relationship support based existing literature develop apply mixed method approach examine refined driver vulnerability readiness nexus examines context multilevel governance role anticipatory coping risk county level u s mississippi river basin 1990 2010 our focus within context multilevel governance our result suggest anticipatory higher level regional capacity particularly effective adapting
11,Ecosystem-based approaches to climate change adaptation: progress and challenges,WOS:000343646900005,resilient ecosystem vital human well increasingly recognised critical supporting community effort adapt governing body convention biological diversity united nation framework convention encouraging party adopt ecosystem based eba approach utilise biodiversity ecosystem service support these approach wide ranging include mangrove restoration buffer storm surge watershed management protect drought flood rangeland management prevent desertification sustainable management fishery forest ensure food security examines emergence eba international legal framework biodiversity progress towards implementation eba concept potentially powerful catalysing international national commitment act due key defining feature focus societal rather ecocentricism targeting immediate need poorest vulnerable community adversely affected however examination national policy practice two least developed country samoa cambodia reveals institutional legal barrier national level pose significant challenge operationalising eba achieve objective
12,Role-play simulations for climate change adaptation education and engagement,WOS:000382134800010,in order effectively adapt public official stakeholder need rapidly enhance understanding local risk ability collaboratively adaptively respond argue science based role play simulation exercise type serious game involving face face mock decision making considerable potential education engagement tool enhancing readiness adapt prior suggests role play simulation serious game foster public learning encourage collective action public policy making context however effectiveness exercise context education engagement heretofore underexplored share result two project demonstrate effectiveness role play simulation cultivating literacy enhancing collaborative capacity facilitating social learning based finding suggest exercise widely embraced part professional education engagement toolkits
13,An activity theoretic analysis of the mediating role of information systems in tackling climate change adaptation,WOS:000400273000003,demonstrates information system is researcher practitioner make significant contribution grand challenge sustainability light global in take novel perspective going beyond dominant emphasis green is literature mitigation focus to demonstrate is researcher practitioner engage grand challenge sustainability report finding investigation role is programme government new south wale canonical action informed activity theory proved appropriate methodology investigation combining iterative collaborative engagement rigorous scholarly reflection activity theory previously successfully used is framework inquiry description prediction raised question addressed whether activity theory could used guide intervention make sense impact finding reveal activity theory provides appropriate balance scope detail accommodate complex process planning implementing programme conclude complex activity theory specifically five dynamic dimension deep sense making inform intervention project most significantly demonstrate is expert make positive contribution addressing one important grand challenge time
14,"Understandings, Practices and Human-Environment Relationships-A Meta-Ethnographic Analysis of Local and Indigenous Climate Change Adaptation and Mitigation Strategies in Selected Pacific Island States",WOS:000606374300001,local indigenous knowledge system worldwide indicate mitigation strategy particularly region massively affected climatic change pacific island state need increased combined role knowledge system play internationally for reason provides synthesis empirical result approach local indigenous mitigation strategy selected south pacific island state using meta ethnographic approach reviewed literature associated sub disciplinary perspective anthropology result meta ethnographic analysis discussed based three thematic focal point first empirical ground local understanding theoretical conceptualization constituted second result practice synthesized presented detail throughout one example third synthesis mitigation practice outlined specific focus human environment relationship
15,Increasing the effectiveness of environmental decision support systems: lessons from climate change adaptation projects in Canada and Australia,WOS:000429358700020,there need increase regional community level action towards natural resource manager planner make challenging decision within complex uncertain arena environmental decision support system eds developed assist stakeholder effective decision making management complex natural resource problem eds combine community engagement developing future scenario computer based land use planning modeling tool used internationally reported effective yet often used development phase to gain understanding effectiveness tool interviewed end user eds used project another end user tool key informant yet perspective lacking sustainability science literature finding show neither eds used project ended however majority end user project valued eds confirming tool resulted direct activity influenced thinking work habit end user eds report lesson learned two case study make recommendation regarding process structure required increase effectiveness eds long term use legacy learning embodied within
16,Accommodating the Challenges of Climate Change Adaptation and Governance in Conventional Risk Management: Adaptive Collaborative Risk Management (ACRM),WOS:000289081200037,risk management well established tool it facing new challenge end stationarity need meaningfully engage people governance issue way conventional approach risk management respond challenge explored conventional approach risk management summarized manner advanced tool described emerging theme risk management adaption documented it argued conventional risk management benefit insight experience adaptive co management a hybrid approach termed adaptive collaborative risk management thus envisaged enriches conventional risk management critical feature adaptive co management e collaboration adaptive collaborative risk management overcomes challenge conventional risk management build upon complement approach community innovatively address technical governance concern single integrated process
17,Method Development for Identifying and Analysing Stakeholders in Climate Change Adaptation Processes,WOS:000307926400002,it widely recognized stakeholder interaction dialogue essential improve decision awareness term stakeholder broad researcher practitioner may interrelated contrasting view stakeholder responsible to engage stakeholder project thus requires careful mapping stakeholder landscape identification relevant actor different level through case approach based study two swedish urban region stockholm gothenburg proposes systematic method analyse identify role responsibility stakeholder landscape initial mapping exercise complemented participatory study local regional stakeholder perception involved significance respective region result indicate value careful stakeholder analysis sustainable effective planned flexible also systematic enough fulfil practical scientific requirement advancement ongoing process implementation
18,Learning from cross-border arrangements to support climate change adaptation in Australia,WOS:000333928600003,focus learning existing cross border governance arrangement view strengthening improving within australian context using institutional learning framework offer critical analysis two australian cross border case 1 murray darling basin 2 australian alp finding focus issue geographic place administrative space political territory fragmentation key concept underpin integrated environmental planning management practice there significant implication evolving cross border region scale highlight
19,The discursive construction of adaptation subjects via the Ada Sea Defense System in the Volta River Delta of Ghana,WOS:000755970900010,a gain international prominence one mean addressing remains critical equitable outcome maintained technology deployed across various target population in vein subjectivity problematized scholar concept need attention understand political nature extending framework environmentality case engage term subject distinguish individual whose interest desire align broader understanding goal in situate co production livelihood intervention project rule understand subject formation such analysis allows move beyond econocentric framing livelihood privilege material outcome also engage socio political reality livelihood broadly apply livelihood intimate government approach case ada sea defense system ada east district volta river delta ghana project rule order illustrate way technology discursively construct different resident subject understanding ada sea defense system technology constituted socio political practice potential promote justice equity designing implementing evaluating technology future
20,Deploying artificial intelligence for climate change adaptation,WOS:000795933700003,artificial intelligence ai believed significant potential use tackling explores connection ai whole usefulness effort particular using systematic literature application ai questionnaire survey multinational interdisciplinary team researcher show various mean via ai support diverse region contribute effort towards surveyed article classified nine area e g global earth related water related issue agriculture 95 related area attracted study ai application water related management issue 38 in term survey result robust agreement noted concerning capacity digitisation ai strengthen governance practice afford policy coherence evidence gathered suggests provided due care taken use ai provide welcome support global effort better understand handle many challenge associated changing
21,Systematic review approaches for climate change adaptation research,WOS:000354404600002,recent controversy led call increased standardization transparency method used synthesize though debate focused largely biophysical dimension human dimension equally need improved methodological approach synthesis systematic approach recently realist method used within health science decade guide synthesis despite penetration approach social environmental science limited here present analysis approach systematic synthesis examine applicability context customized framework informed systematic approach synthesis provide conceptually appropriate practical opportunity increasing methodological transparency rigor synthesizing tracking highlight innovative application systematic approach focus unique challenge integrating multiple data source format reviewing policy practice present guideline key consideration recommendation systematic social science general particular conclude calling increased conceptual methodological development systematic approach address methodological challenge synthesizing tracking
22,"Like the plains people losing the buffalo: perceptions of climate change impacts, fisheries management, and adaptation actions by Indigenous peoples in coastal British Columbia, Canada",WOS:000603995100036,rapidly developing complex impact profound implication coastal community demanding action social ecological system along coast british columbia indigenous people developed tightly coupled social ecological system interrupted arrival settler colonialism 1800s although impact colonization well studied little examined theme interact condition may support prevent people ability adapt social ecological change emerge through collaborative partnership four first nation umbrella organization technical support examined people perception social ecological aspect using semistructured interview n 50 four key strategy emerged critical 1 strengthening indigenous governance autonomy authority 2 promoting knowledge sharing practice within among community 3 promoting adaptive comanagement among governance scale 4 developing learning platform impact adaptive strategy action typically proposed non indigenous government including marine protected area ecosystem based management prioritized found diverse attitude toward impact indicating people perception strategy strongly influenced exposure observable impact social ecological context live perception governance self determination our suggests supporting indigenous people ability adapt require transforming current governance model one acknowledges indigenous social cultural food need relate marine resource territorial management right
23,"Ecosystem-based adaptation to climate change: what role for policy-makers, society and scientists?",WOS:000282554300001,in developing country economy livelihood depend largely ecosystem service policy take account role service increasing resilience society ecosystem based approach focus international workshop role ecosystem service held november 2008 costa rica present key message workshop
24,"Unpacking multilevel adaptation to climate change in the Great Barrier Reef, Australia",WOS:000321157600010,multilevel governance regarded promising approach deal multidimensional nature however policy context implemented often complex fragmented characterised interacting non strategy an understanding multilevel decision making governance particularly important desired outcome achieved examines take place complex multilevel system governance context great barrier reef gbr region it examines one hundred strategy federal state regional local level term type manifestation purposefulness driver trigger geographic temporal scope interaction strategy investigated level governance across governance level demonstrates multilevel approach necessary sufficient condition responding complex multiscale multisector issue short term measure predominant incremental sectoral top approach lack framework managing interaction major threat effective gbr region coping threat require long term transformative action establishing enabling condition support local important creating maintaining strategic interaction among strategy coordinating integrating non strategy across jurisdiction policy sector significant challenging task multilevel governance gbr region elsewhere
25,Inter- and Transdisciplinary Research for Planning Climate Change Adaptation Responses: The Example of Santiago de Chile,WOS:000346141100005,give insight inter transdisciplinary approach designed enhance planning response urban regional level what make interdisciplinary approach action unique ability unravel complexity interwoven process entail it planning aspect make stakeholder involvement crucial hence contemporary science policy interface take centre stage generating response capacity exchanging usable information decision maker within framework transdisciplinary approach action plan strategy example potential unite sector level decision making around integrated planning approach discus challenge constraint inter transdisciplinary approach developed metropolitan region santiago de chile mr
