,title,wos,clean_abstract
107,Climate change is increasing the risk of a California megaflood,WOS:000841491100033,despite recent prevalence severe drought california face broadly underappreciated risk severe flood here investigate physical characteristic plausible worst case scenario extreme storm sequence capable giving rise megaflood condition using combination model data high resolution weather modeling using data community earth system model large ensemble find already doubled likelihood event capable producing catastrophic flooding larger future increase likely due continued warming find runoff future extreme storm scenario 200 400 greater historical value sierra nevada increased precipitation rate decreased snow fraction these finding direct implication flood emergency management well broader implication hazard mitigation activity
108,Modelling economic impacts and adaptation to extreme events: Insights from European case studies,WOS:000282558900008,europe recently become true policy concern management extreme event one priority item irrespective future climatic change increasing need systematic evaluation management extreme weather related disaster already today pose substantial burden household business government adam project identified substantial direct risk term potential crop asset loss due combined drought heatwave well flood hazard southern eastern europe respectively focus indirect medium longer term economic risk triggered direct risk mediated policy response present selection three economic impact assessment modelling study undertaken extreme event europe responding need economically based assessment address relatively unresearched issue understanding past role market response impact well government ability plan share extreme event risk first analysis undertakes empirical exploration observed impact agricultural sector uk comparing impact consecutive extreme event time order determine whether occurred past whether used inform future estimate rate find farmer agricultural sector clearly adapted extreme event time whether rate maintained future unclear autonomous enacted seemed rather easy taken market may mediate amplify impact second analysis use economic general equilibrium model ass economic effect reduction agricultural production due drought heatwave risk exposed region spain analysis suggests modelled loss local economy serious large scale scenario neighbouring province also affected drought heatwave event due supply side induced price increase leading passing disaster cost consumer simulation highlight importance paying particular attention spatial distributional effect weather extreme possibly change therein induced may incur finally discus national government may better plan disaster liability resulting need manage relief reconstruction activity post event using risk based economic planning model assessing fiscal consequence associated coping natural extreme identify large weather related disaster contingent liability particularly key flood hot spot country austria romania hungary such substantial disaster liability hidden disaster deficit interacting weak fiscal condition may lead substantial additional stress government budget reduced fiscal space funding relevant public investment project overall suggests importance respecting specific spatial temporal characteristic extreme event risk generating information decision a decision considered using sovereign risk financing instrument associated rather short time horizon analysis largely focus management today extreme event discus detail projctions risk future such projection raise important issue uncertainty instance may actually render future projection non robust constraint kept mind addressing longer term decision time account also socioeconomic
109,"Adaptation to climate change impacts on urban storm water: a case study in Arvika, Sweden",WOS:000312715500005,already today functionality many sewer storm water system required standard consequently flooding problem experienced case heavy storm system upgrade required however complicated expected future increase short term rainfall intensity result in case focusing town arvika sweden issue investigated three main step in first extreme value analysis 30 min rainfall ensemble projection carried estimate future increase generate future design storm in second existing system response today future design storm simulated coarse sewer model setup mouse detailed coupled surface sewer model setup tsr in third final step system upgrade designed evaluated model result indicate increase 10 30 today short term rainfall extreme end century upgrading system achieve satisfactory performance future design storm would cost approximately twice much upgrade based today design storm
110,Weather variability in urban Philippines: a gender analysis of household impacts,WOS:000361799100010,weather variability affect many part philippine threaten human health well may become frequent intense due compared visible extreme weather event e g typhoon seasonal inter annual weather variation e g precipitation wind temperature associated otherwise normal weather system le often incorporated planning to better inform planning examines self reported household impact atypical rainy dry season focus gender by collecting data woman men randomly sampled household contributes innovative intrahousehold analysis growing body work nexus gender weather find gendered difference reported impact rainier usual rainy season difference drier longer usual dry season plan incorporate seasonal inter annual weather variability seek participatory input woman men diversity concern addressed
111,Enabling Risk Management and Adaptation to Climate Change through a Network of Peruvian Universities,WOS:000904349700001,in recent decade latin america la frequently severely affected flood landslide there urgency adopting comprehensive disaster risk management crm in 2016 group peruvian university established network gestion integral del riesgo de desastres adaptacion al cambio climatico gird acc committed principle crm compiles evaluates network result plan action a qualitative methodological strategy reported featuring bibliographic network documentary account event led start development network case three university network result show network help deepening knowledge forging culture risk prevention incorporating risk management awareness professional training intensive activity meet un sustainable development goal sdgs 11 13 17 result indicate importance gaining consensus notoriously difficult task la authority operational department role university social responsibility incorporating sustainability risk management theme mainstream curriculum developing network learning similar grouping across la improve crm within university
112,Selecting and analysing climate change adaptation measures at six research sites across Europe,WOS:000672861900003,a europe faced increasing drought extreme precipitation country taking measure adapt change it challenging however navigate wide range possible measure taking account efficacy economic impact social justice aspect measure well governance requirement implementing present approach selecting analysing measure increasing extreme weather event caused ongoing developed applied h2020 project bingo bringing innovation ongoing water management purpose project develop integrated participatory approach selecting evaluating measure b apply evaluate approach across six case river basin across europe
113,COVID-19 response in Africa: impacts and lessons for environmental management and climate change adaptation,WOS:000919963400001,covid 19 pandemic add pressure africa vulnerable continent impact threatening realization sustainable development goal sdgs continent witnessing increase intensity frequency extreme weather event environmental covid 19 managed relatively well across continent providing lesson impetus environmental management addressing work examines possible impact covid 19 pandemic environment analysis management draw lesson response africa data finding lesson drawn peer reviewed article credible grey literature covid 19 africa covid 19 pandemic spread quickly causing loss life stagnation global economy overshadowing current crisis pandemic managed swift response top political leadership innovation across africa providing possible solution covid 19 challenge redirection fund manage pandemic well coordinated covid 19 containment strategy african center disease control prevention increased sharing resource including data success limiting spread virus these strategy among others proved effective limiting spread impact covid 19 finding provide lesson stakeholder policy maker leverage management environment address these approach require solid commitment practical oriented leadership
114,"How Does Digitization Succeed in the Municipal Water Sector? The WaterExe4.0 Meta-Study Identifies Barriers as well as Success Factors, and Reveals Expectations for the Future",WOS:000724916500001,water increasingly taking center stage come coping especially urban area negative consequence heavy rainfall event prolonged dry period rising worldwide in past various task urban water management performed different department often cooperate water supply wastewater disposal green space irrigation etc required water supply question available water volume already changing case even dramatically more necessary consider distribute available water resource urban area especially dry period since wastewater treatment also becoming complex costly in future urban water management examine water use term various objective need provide alternative water resource different purpose groundwater river water storm water treated wastewater etc necessary technological interconnection requires intelligent digital system furthermore water industry must also play role global co2 reduction make procedural treatment process efficient also succeed adequate digital system although digitization experienced enormous surge development last five year numerous solution available address challenge described previously still large gap scope offering implementation researcher hof university applied science investigated reason imbalance part waterexe4 0 first meta digitization german speaking water industry funded german federal ministry education only 11 roughly 700 identified product project study relate real application for example surveyed expert water sector stated everyday problem considered little hardly new solution greatly overburden user furthermore see adequate possibility systematic analysis new idea identify significant obstacle find best way start implement digitization project result four methodologically different sub survey literature market survey expert interview workshop provide reliable overview current situation german speaking water industry expectation future result also transferable country
115,Adapting to climate change: an integrated biophysical and economic assessment for Mozambique,WOS:000292041500003,mozambique like many african country already highly susceptible variability extreme weather event threatens heighten vulnerability in order evaluate potential impact option mozambique develop integrated modeling framework translates atmospheric change general circulation model projection biophysical outcome via detailed hydrologic crop hydropower infrastructure model these sector model simulate historical baseline four extreme scenario sector result passed dynamic computable general equilibrium model used estimate economy wide impact national welfare well total cost damage caused potential damage without change policy significant discounted estimate range u 2 3 u 7 4 billion 2003 2050 our analysis identifies improved road design agricultural sector investment key regret measure alongside intensified effort develop flexible resilient society our finding also support need cooperative river basin management regional coordination strategy
116,BUILDING FARM-LEVEL CAPACITIES IN IRRIGATION WATER MANAGEMENT TO ADAPT TO CLIMATE CHANGE,WOS:000424838700006,characterized global warming become hotspot recent year water resource agriculture ecology discipline in india study shown increasing trend surface temperature decreasing trend rainfall farmer also affected variability serious influence production income climaadapt programme implemented 2012 2016 build farm level capacity enhance adaptive capacity agricultural water sector krishna basin andhra pradesh telangana state water saving intervention direct seeded rice modified system rice intensification alternate wetting drying awd rice implemented cluster approach enhanced water productivity training implementation programme increased awareness farmer water measurement carried using flume ultrasonic sensor area direct seeded rice increased 64 district 77 trained farmer adopting practice capacity building implementation science policy linkage key pillar programme improve adaptive capacity scaling water management practice
117,A Bayesian network approach for multi-sectoral flood damage assessment and multi-scenario analysis,WOS:000777762300004,extreme weather related event river flooding drought tropical cyclone likely become severe frequent coming decade damage caused event felt across sector society in face threat policy decision maker increasingly calling new approach tool support risk management pathway capture full extent impact in frame gi based bayesian network bn approach presented capturing modelling multi sectoral flooding damage future scenario building risk based conceptual framework bn model trained validated exploiting data collected 2014 secchia river flooding event well contextual variable moreover novel approach defining structure bn performed reconfiguring model according expert judgment data based validation model showed good predictive capacity damage agricultural industrial residential sector predicting severity damage classification accuracy 60 assessment endpoint what scenario analysis performed understand potential impact future change land use pattern ii increasing flood depth resulting severe flood event output model showed rising probability experiencing high monetary damage scenario in spite constraint within case dataset result appraisal show good promise together designed bn model represent valuable support disaster risk management reduction action extreme river flooding event enabling better informed decision making
118,Impact of Climate Change on Crop Yields: Evidence from Irrigated and Dry Land Cultivation in Semi-Arid Region of India,WOS:000520035800002,with population pressure constantly growing india crop productivity struggling hard catch erratic rainfall steady rise temperature create widely uncertain outcome farming community against backdrop present used dataset constructed finer spatial level southern indian state namely karnataka analyze yield response rice maize crop using time period 1992 2012 panel dataset made district level fixed effect regression result show rice maize productivity impacted adversely due steady rise temperature state extent damage found 7 10 further also probed role irrigation strategy found adverse yield impact reduced presence irrigation these finding provide specific direction policy framing curb yield damage arising variability
119,Understanding Climate Hazard Patterns and Urban Adaptation Measures in China,WOS:000737450000001,related risk pose great threat urban safety infrastructure stability socioeconomic sustainability china country cross diverse geomorphic climatic region world frequently affected various hazard in propose comprehensive analysis spatial pattern major hazard china 1991 2020 including rainstorm drought heatwaves coldwaves typhoon snowstorm generate integrated sketch map multi hazard zone it detectable south yangtze river danger heatwaves rainstorm typhoon north china plain likely suffer drought coldwaves snowstorm freezing mainly affect northeast china northwest china qinghai tibet plateau in view governance city hotspot affected intensified hazard warmer there urgent need incorporate strategy future city construction improve social resilience mitigate impact rapid urbanization process specific measure developed perspective land use planning prevention standard risk assessment emergency response facilitate understanding resilience urban sustainability
120,Adapting to climate change in the Godavari River basin of India by restoring traditional water storage systems,WOS:000207915500005,food water crisis interrelated interdependent projected significantly alter rainfall pattern implication annual runoff godavari river basin indian subcontinent agriculture especially rain fed agriculture particularly affected due change periodicity intensity rainfall describes field intervention 2005 2007 designed restore traditional water management system form water tank wetland embedded semi arid region aim mitigating effect increased variability frequency weather extreme our finding suggest traditional water management method socially economically effective coping variability precipitation pattern decentralizing management institution improving crop productivity increasing groundwater recharge approach preferable large project increasing water storage capacity expanding area irrigation expensive displace people degrade ecosystem
121,Experience of extreme weather affects climate change mitigation and adaptation responses,WOS:000392425900005,winter 2013 2014 saw series severe storm hit uk leading widespread flooding major emergency response extensive medium exposure previous indicates experiencing extreme weather event potential heighten engagement however process occurs remains largely unknown establishing clear causal relationship experience perception methodologically challenging uk winter flooding offered natural experiment examine question detail compare individual personally affected flooding n 162 nationally representative sample n 975 show direct experience flooding lead overall increased salience pronounced emotional response greater perceived personal vulnerability risk perception also present first evidence direct flooding experience give rise behavioural intention beyond individual sustainability action including support mitigation policy personal matter unrelated direct experience
122,Increased Compound Droughts and Heatwaves in a Double Pack in Central Asia,WOS:000824011000001,compound drought heatwaves cdhws likely cause severe natural disaster single extreme event exacerbated rapid global warming based high resolution grid data combine daily scale era5 land dataset monthly scale spei dataset multiple indicator analyze cdhws calculated analyzed temporal spatial modal distribution cdhws central asia 1981 2018 discus sequence relationship drought event heatwave event cdhws result show number cdhws region increased time expanded term area especially eastern southwestern central asia tsum total frequency cdhws 0 5 time higher total heatwave frequency increased rate 0 17 yr maximum duration tmax maximum duration cdhws day 17 day furthermore occurrence rate tmax 96 67 ah cdhws accumulated heat rate 97 78 upon examination spatial trend pattern accounted largest increase term area also found tah cdhws average temperature anomaly spei 0 5 show obvious seasonality increase winter spring significantly greater increase summer autumn intensity cdhws stronger single extreme event temperature anomaly higher average 0 4 0 8 degree
123,Adapting to climate change: reducing water-related risks in Europe - EU policy and research considerations,WOS:000295658500002,impact hydrological cycle e g leading change precipitation pattern observed several decade higher water temperature change extreme hydrometeorological event including flood drought likely exacerbate different type pressure water resource possible negative impact ecosystem human health in addition sea level rise expected extend area salinisation groundwater estuary resulting decrease freshwater availability human ecosystem coastal area furthermore related change water quantity quality expected affect food availability water access utilisation especially arid semi arid area well operation water infrastructure e g hydropower flood defence irrigation system serf introduction special issue environment science policy dealing impact water related disaster it provides brief background relevant eu water policy example eu funded trend illustrate going effort improve understanding modelling change related hydrological cycle scale relevant decision making possibly linked policy
124,Response of El Nino sea surface temperature variability to greenhouse warming,WOS:000341569700019,destructive environmental socio economic impact el nino southern oscillation 1 2 enso demand improved understanding enso future greenhouse warming robust projected change certain aspect enso recently established 3 5 however yet consensus magnitude associated sea surface temperature sst variability 6 8 commonly used represent enso amplitude 1 6 despite strong effect marine ecosystem rainfall worldwide 1 4 9 here show response enso sst amplitude time varying increasing trend enso amplitude 2040 followed decreasing trend thereafter attribute previous lack consensus expectation trend enso amplitude entire twenty first century unidirectional unrealistic model dynamic tropical pacific sst variability examine complex process across 22 model coupled model intercomparison project phase 5 cmip5 database 10 forced historical greenhouse warming condition nine realistic model identified show strong consensus time varying response reveal non unidirectional behaviour linked longitudinal difference surface warming rate across indo pacific basin our result carry important implication projection pathway
125,Impacts and Climate Change Adaptation of Agrometeorological Services among the Maize Farmers of West Tamil Nadu,WOS:000902059900001,often linked record breaking heavy poor rainfall event unprecedented storm extreme day night time temperature etc it may marked impact sensitive sector associated livelihood block level weather forecasting new fangled dimension agrometeorological service aa country getting popularized smart farming strategy study economic impact microlevel advisory uncommon agromet advisory service aa play critical role early warning service preparedness among maize farmer parambikulam aliyar basin area still need widen deepen aws network reach village level in response maize farmer parambikulam aliyar basin aa analyzed aa provided early late rabi farmer year 2020 2022 an automatic weather station installed farmer field understand real time weather forecast data india meteorological department imd used provide agromet advisory service therefore present deserves special focus social medium ict tool used aa dissemination purpose a crop simulation model csm dssat4 7cereal maize used assessing maize yield present scenario elevated ghgs scenario our finding suggest aa significantly supported farmer sustaining production aa helpful farmer dry spell late samba 2021 2022 provide critical irrigation heavy rainfall event event harvest early late rabi 2021 22 published article verification weather forecast south india scanty also try understand reliability forecast finding verification suggest rainfall represented fairly good forecast season though erratic accuracy score hi score 0 77 hk score 0 60 probability detection pod hit found 0 91 verification show forecasted relative humidity observed showed fairly good correlation r 2 value 0 52 these finding suggest enhancing model forecast accuracy enhance reliability utility aa smart option recommends aa act valuable input alleviate impact hydrometeorological disaster maize crop production basin there huge demand quality weather forecast respect accuracy resolution lead time increasing across country externally funded study added advantage bridge gap aa dissemination great extent
126,Ground water and climate change,WOS:000319400400008,a world largest distributed store fresh water ground water play central part sustaining ecosystem enabling human variability strategic importance ground water global water food security probably intensify frequent intense extreme drought flood increase variability precipitation soil moisture surface water here critically recent assessing impact ground water natural human induced process well groundwater driven feedback system furthermore examine possible opportunity challenge using sustaining groundwater resource strategy highlight lack groundwater observation present limit understanding dynamic relationship ground water
127,A Global Data Set for Economic Losses of Extreme Hydrological Events During 1960-2014,WOS:000477616900038,a comprehensive data set extreme hydrological event ehes flood drought consisting 2 171 occurrence worldwide 1960 2014 compiled economic loss normalized using price index u s dollar data set showed significant increasing trend ehes 2000 slight post 2000 decline correspondingly ehe caused economic loss increased obviously 2000 followed slight decrease post 2000 decline could partially attributed decrease drought flood prone area practice spatially asia experienced ehes 969 corresponding largest share economic loss approximately 868 billion flood 50 billion drought respectively oceania least ehes 102 least economic loss approximately 19 billion flood 45 billion drought five country highest ehe caused economic loss china united state india country suffered highest flood caused economic loss china united state data set provides quantitative linkage science economic loss global scale beneficial regional climatic impact assessment strategical development mitigating impact
