,title,wos,clean_abstract
76,The European Media Portrayal of Climate Change: Implications for the Social Mobilization towards Climate Action,WOS:000583069400001,beyond social actor policymakers scholar common citizen also expected actively engage adopting sustainable action supporting environmental policy however despite actual growing environment related social movement kind inertia still prevails social society medium play key role promoting among common individual adoption new sustainable practice however argued medium seems failing effectively address crisis a aim identify main weakness medium communication discus possible opportunity communication improvement for 1609 news article published 2017 2018 five european country analyzed depth quantitative content analysis news general characteristic specifically reported theme specificity actor discourse taken account analysis it verified european medium tends report using distant e g future focused outcome e g threatening message framing based non resilient scientific political narrative whilst overlooking role civil society adapting these result demonstrate instead promoting society action medium may contributing widespread social apathy disengagement individual regarding environment related matter evidence based form improving medium communication discussed
77,Temperature effects on sorption of dissolved organic matter on ferrihydrite under dynamic flow and batch conditions,WOS:000750906500001,accurately predicting effect temperature soil
78,Household adaptive capacity: a social networks approach in rural South Africa,WOS:000427832500004,explores social network analysis sna mean revise expand concept adaptive capacity household level sna recently integrated adaptive capacity global science often household level methodology relies heavily measuring food money wood water labour information disease exchange household referenced previous work developing world regional focus rural eastern cape south africa result wider geographic application result bring question assumption adaptive capacity relationship network centrality one common measure sna particularly exchange wood water information disease concerned in case former result controvert contemporary work livelihood natural resource dependence latter point need clarification household share information ill health use network variable combined method may allow concrete understanding household adaptive capacity rural developing world
79,Tradeoffs and Synergies Across Global Climate Change Adaptations in the Food-Energy-Water Nexus,WOS:000782429400001,food energy water few system increasingly vulnerable natural hazard risk yet human depend system daily need wellbeing survival investigated adaptation related few vulnerability occurring global community learn interaction across adaptation conducted global analysis data set derived scientific literature present first large scale assessment n 1 204 evidence based few related adaptation found frequently reported adaptation few vulnerability continent occurred africa n 495 asia n 492 adaptation targeting food security robustly documented relevant water energy security suggesting greater global demand address food security determining statistically significant association found network connection variable characterizing few related adaptation showed interconnectedness variety natural hazard exposure sector actor cross cutting topic geographic location connectivity found vulnerability food security water community sustainability response sea level rise across city settlement key infrastructure sector additionally generalized linear regression model revealed potential synergy tradeoff among few adaptation necessity synergistically adapt system protect food water security tradeoff simultaneously addressing exposure consumption production v poverty result qualitative thematic coding showcased adaptation documented targeting multiple exposure still limited considering interconnectivity system applying nexus approach response these result suggest adopting nexus approach future few related adaptation profound benefit management scarce resource financial constraint
80,PRIORITIZING LAND AND WATER INTERVENTIONS FOR CLIMATE-SMART VILLAGES,WOS:000479946400001,smart village mean implementing portfolio best locally suited smart agricultural practice integrated manner build resilience local community land water intervention form crucial part smart agricultural practice portfolio water availability key limiting factor crop growth to aid decision making process prioritizing land water intervention simple robust spreadsheet tool based water balance developed tool integrates simulates impact land water intervention water balance determine impact across smart agricultural objective agricultural productivity mitigation tool implemented two village state madhya pradesh india tool performs well simulating village water balance impact yield rainfed irrigated crop area result show considerable difference exist within portfolio land water intervention combination supply demand moisture conservation practice able help achieve smart agricultural objective in best case scenario yield increased 10 greenhouse gas emission intensity reduced 17 comparison stakeholder perception analysis highlight utility tool providing additional quantitative information decision making process
81,An Assessment of the Ecological Landscape Quality (ELQ) of Nature-Based Solutions (NBS) Based on Existing Elements of Green and Blue Infrastructure (GBI),WOS:000718477800001,nature based solution nb positively impact ecological landscape quality elq providing multiple benefit including enhancing natural capital promoting biodiversity mitigating water runoff increasing water retention contributing adaptation carbon sequestration to analyze specific contribution different nb type assessed 14 elq indicator based application spatial data five nb based existing element green blue infrastructure gbi analyzed city level lublin poland including park ups forest ufs water body uws allotment garden ag wood w analysis revealed different nb contribute contrasting way improvement various dimension elq ufs made biggest contribution maintenance ecological process stability well aesthetic value w together ag crucial maintaining high level diversity landscape scale also contributed preserving ecological structure uws ups outstanding impact elq mainly due high level anthropogenic transformation application spatial indicator proved useful providing approximate information ecological value different type nb data type either unavailable available high cost considerable time effort
82,Developing China's National Emission Trading Scheme: Experiences from Existing Global Schemes and China's Pilot Programs,WOS:000427501300008,market based emission trading scheme etss widely used developed world reduce greenhouse gas ghg emission perceived source global china largest ghg emitter world committed introducing ets reduce emission here reviewed existing etss sustainable energy policy worldwide well china pilot program these study conducted order propose recommendation national initiative strategy implemented china relation mitigation it shown setting emission cap context national emission intensity target difficult however implementing reliable system measurement reporting verification emission essential a two level management system central provincial government carbon trading beneficial ensure uniform standard compliance maintaining flexibility persistent political support effective coordination policy government crucial in addition strengthening institutional innovation establishment national ghg emission information system equal importance vital information could provide great opportunity china define economic growth take global leadership combatting
83,Some climate-change aspects to be considered for the survival of living organisms: a systematic literature review,WOS:000576631500002,introduction problem global planet experiencing must continually shown country achieve objective consistent view plan policy environmental management expeditiously developed aim provide consolidated date basis information considered decision making concerning impact survival material method work based literature aspect survival life earth physical library virtual biremc medline pudmed sciclo database queried purpose result five key element highlighted evidence medium construction impact health global policy ecosystem conservation latin america discussion based broad theoretical framework must shown concise date manner contribute decision making mitigation adverse impact survival life earth conclusion any action prevention mitigation requires current information ensure success implementation due diversity impact vulnerability suffered population different region around world
84,"Resilience of informal settlements to climate change in the mountainous areas of Konso, Ethiopia and QwaQwa, South Africa",WOS:000521310700001,managing essential human survival thus importance adapting increasingly recognised researcher government alike reflected growing literature imperative action including building resilience socio ecological system despite large body exists study considered resilience informal rural peri urban settlement mountainous region considered resilience two rural settlement mountainous area namely konso ethiopia qwaqwa south africa influence based asset available author obtained local community perception risk throsugh interview community leader survey 384 resident divided equally settlement furthermore resilience community assessed basis environmental social economic human institutional physical capital using resilience indicator finding showed community faced major challenge particularly drought poverty found community retained form indigenous knowledge greater application konso appeared improve resilience greater extent qwaqwa played lesser role community dependent government however indigenous knowledge alone sufficient support community long term given growing aridity region approach also necessary including government support enhance grow capital
85,Three green financial policies to address climate risks,WOS:000670129000002,which policy increase resilience financial system risk recent evidence significant impact natural disaster firm bank financial institution call prompt policy response in employ macro financial agent based model interaction credit economic dynamic test mix policy interven tions first show financial constraint exacerbate impact shock economy time damage firm make banking sector prone crisis find credit provision increase firm productivity financial fragility trade exacerbated effect test set green finance policy addressing risk fostering mitigation green basel type capital requirement ii green public guarantee credit iii carbon risk adjustment credit rating all policy reduce carbon emission resulting impact though moderately however effect financial real dynamic straightforwardly positive some combination policy fuel credit boom exacerbating financial instability increasing public debt show combination three policy lead virtuous cycle mild emission reduction stable financial sector high economic growth additional tool would needed fully adapt hence result point need complement financial policy cooling related risk mitigation policy curbing emission real economic activity
86,Ecosystem-based adaptation in Lake Victoria Basin; synergies and trade-offs,WOS:000659147800001,healthy ecosystem forest wetland great potential support foundation sustainable livelihood ecosystem based eba help protect maintain healthy ecosystem providing resilience impact explores role eba reconciling socio economic development conservation restoration nature lake victoria basin kenya east africa using selected ecosystem lake region identifies key eba approach explores trade offs synergy spatial temporal scale different stakeholder method used include site visit key informant interview focus group discussion participatory workshop literature review an analytical framework applied advance understanding eba approach lead synergy trade offs ecosystem service provision spatial temporal scale multiple stakeholder our result show eba approach ecosystem restoration potential generate multiple benefit well synergy trade offs occurring different temporal spatial scale affecting various stakeholder group our underscore need identify eba trade offs synergy explore way distributed space time different stakeholder design better environmental development programme
87,"Ecosystem-Based Adaptation Projects, More than just Adaptation: Analysis of Social Benefits and Costs in Colombia",WOS:000498842000194,ecosystem based eba project increasingly flourishing throughout globe ground eba constitutes particularly community friendly solution brings array co benefit however promotion eba project development agency conservation ngo remains blurry yet contrasted evidence effectiveness delivering benefit employing political ecology perspective applied conceptual framework allows assessment social benefit cost eba project generate reinforce factor influence distribution social benefit cost done regard two eba project colombia one andes focusing water provision service paramos coastal mangrove focusing regulation service extreme coastal event based data collected qualitative multi method approach find evidence assessed eba project generate wide range perceived social benefit cost local community living vicinity project site furthermore identify agent level e capital preference well structural factor communication participation local institutional context influence generation distribution social benefit cost finally illustrates contradiction tension eba project implemented may end affecting adaptive capacity community involved eba project
88,"Climate change vulnerability assessment using a GIS modelling approach in ASAL ecosystem: a case study of Upper Ewaso Nyiro basin, Kenya",WOS:000502120800002,investment community water resource increasingly benefiting vulnerability mapping such mapping reveal hotspot area related threat provide useful information needed resilience building effort arid semi arid land kenya volatile pastoralists region highly dependent sensitive natural resource sustain livelihood hence affect negatively sought ass vulnerability upper ewaso nyiro basin area using ipcc approach defines vulnerability three component exposure sensitivity adaptive capacity twelve indicator selected based proximity component measured normalization indicator done ensure consistency scale ranging 0 100 illustrating linear relationship vulnerability 100 vulnerable relied averaging approach indicator derive component vulnerability score process spatial integration result observed high vulnerability area exhibiting similar trend high exposure lack adaptive capacity well high sensitivity highest vulnerability observed korr ngurunit ward marsabit county approximately 45 45 population noted highly vulnerable impact 54 55 population noted moderately vulnerable recommends county government national government build targeted resilience effort within highly vulnerable community since would improve community livelihood
89,A proposal of hygienic and sanitary standards for the new Building Code in Italy,WOS:000588763100007,traditional emphasis public health type quality housing today merges wider determinant health neighbourhood community place home located also policy make access healthy home within everyone reach at neighbourhood scale context related aspect heavily influence internal quality real usability building particular reference factor quality site relationship building context presence quality greenery open space surrounding building well measure make possible reduce building impact environment protect environmental pollution manage building integrated manner maintenance purpose creating healthy living environment mean referring different dimension mentioned requires attention public health operator also implies integration vision objective among various professional skill competence put health center policy proposal start analysis existing local hygiene regulation scientific literature aim take stock number area considered fundamental assessment building hygiene aspect particular reference eco sustainability building aspect identified considered starting point preparation integrated building hygiene regulation based documented effective practice protection public health
90,Exploring the financing and allocating schemes for the Chinese Green Climate Fund,WOS:000750362100001,chinese green fund gcf expected launch government foreseeable future support local government adaption mitigation lesson experience international financing allocating mechanism provide valuable reference establishing chinese gcf aim explore feasibility several well recognized scheme financing allocating chinese gcf among china 30 province these include financing scheme historical emission responsibility hr ability pay ap preference score compromise psc well allocating scheme carbon emission intensity ci carbon emission per capital cc gdp per capital gc psc derives several important finding firstly given different financing scheme coastal economically developed province including shandong jiangsu guangdong zhejiang would collectively shoulder financing responsibility almost 70 total play central role financing shandong province present high financing responsibility mainly due export trade primary product rely development high polluted industry other three province show high financing responsibility mainly due rapid growth industry petrochemical steel building material electric power etc economic development secondly inland economically backward province including shanxi ningxia guizhou xinjiang gansu would top five largest recipient fund obtaining 30 total disbursement innovation contribution present follows firstly systematically explored feasibility alternative scheme chinese gcf first time further introduces psc method based diversified approach explore suitable financing allocating scheme scheme proposed would establish theoretical foundation chinese gcf would also promote development kind financing china country similar economic feature
91,Understanding the value and limits of nature-based solutions to climate change and other global challenges,WOS:000509531700018,there growing awareness nature based solution nb help protect u impact slowing warming supporting biodiversity securing ecosystem service however potential nb provide intended benefit rigorously assessed there concern reliability cost effectiveness compared engineered alternative resilience trade offs arise mitigation policy encourages nb low biodiversity value afforestation non native monoculture result maladaptation especially rapidly changing world biodiversity based resilience multi functional landscape key here highlight rise nb policy focusing potential well mitigation discus barrier evidence based implementation outline major financial governance challenge implementing nb scale highlighting avenue a policy turn increasingly towards greenhouse gas removal approach afforestation stress urgent need natural social scientist engage policy maker they must ensure nb achieve potential tackle biodiversity crisis also contributing sustainable development require systemic way conduct run institution part theme issue ecosystem threat opportunity solution
92,Partitioning the impacts of land use/land cover change and climate variability on water supply over the source region of the Blue Nile Basin,WOS:000564540100001,water play vital role sustaining natural functioning entire ecosystem support life earth it play key role well society numerous way however variability land use land cover lulc caused spatiotemporal water supply variation disentangling effect variability lulc water supply crucial sustainable water resource management main purpose therefore disentangle relative contribution lulc variability overall average annual water supply variation residual trend analysis combined integrated valuation environmental service tradeoff invest annual water yield model adopted perform simulation disentangle relative impact variability lulc ground satellite data used area experienced significant increasing wetness trend significant lulc dynamic 2003 2017 a result increasing water supply observed due joint effect variability lulc watershed 203 mm contribution variability 94 whereas lulc contributes 6 2003 2017 variability negatively led water supply variation lulc contributed positively 2010 2017 although ongoing soil water conservation swc practice improved vegetation cover water retention watershed variability main driver water supply variation therefore swc practice incorporate ecosystem based strategy scale community based integrated watershed management sustain water supply
93,Local perceptions of climate change and adaptation needs in the Ifugao Rice Terraces (Northern Philippines),WOS:000407267400001,ifugao rice terrace philippine recognized worldwide sustainable landscape human live harmony nature success ifugao rice terrace largely depends attunement local farmer environment ability adapt perceived change manifested complex body traditional ecological climatic knowledge examines local perception challenge sustainability focus group discussion farmer traditional knowledge holder our main finding summarized follows ifugao farmer able observe climatic change recent year change intimately linked broader environmental socio cultural change ifugao social ecological system ii climatic change qualitatively observed farmer agreement trend datasets commonly used scientific assessment although agreement depends spatial temporal resolution dataset type statistical analysis performed iii ifugaos stressed importance traditional knowledge culture preferred measure could increase internal adaptive capacity addressing broader source community vulnerability our result support call recognize indigenous western science equally valid way knowing discussion farmer revealed ifugao context may better framed context multiple stressor rural livelihood integrated broader development objective our finding also emphasize need greater engagement indigenous ifugao people planning process order identify strategy culturally appropriate equitable effective responding local need
94,"The impact of political, socio-economic and cultural factors on implementing environment friendly techniques for sustainable land management and climate change mitigation in Romania",WOS:000458630100042,throughout history romania political decision socio economic measure cultural traditional character affected implementation environment friendly technique eft policy in context eft defined solution use land resource aiming increasing good meeting changing human need neutral positive environmental impact change political regime always visible impact eft issue romania eft gone several major phase political impact eft implementation mainly affected sustainable land management slm small extent end communist era partly capitalist period dimate mitigation throughout history political factor dominated influenced capacity eft implementation process responding socio economic stimulus in addition quality life rural urban urban rural migration poverty education level impact status eft according governance political reflection agrarian reform last two century based socioeconomic demand strongly influenced capacity implement eft positively negatively however cultural factor least affected political socio economic change stability factor ensuring continued implementation eft currently strong need reconsider eft sustainability tool romanian agriculture cope sustainable land management slm demand present brief history eft romania benefit achieving slm equilibrium describing impact political decision socio economic measure cultural feature implementing etes policy
95,Public perceptions of climate change adaptation in Singapore dealing with forecasted sea level rise,WOS:000550708600002,perception populace play central decisive role advancing pro environmental policy to attitude perception towards environmental measure apply several item new ecological paradigm nep value belief norm vbn theory cross examine public perception urban city state singapore analysis quantitative questionnaire qualitative semi structured interview perception explored ecological orientation two dimension nep level concern self reported knowledge environmental behavior two dimension vbn acceptance support national measure confidence there moderate high concern general sea level rise flooding particular concern expected increase future individual indicated higher level concern likely accepting supportive measure also majority populace amenable legislative measure government enacting pro environmental law agreeable accepting cut living standard opposed paying price tax ecological orientation translate directly environmental behavior highlighting gulf perception behavior singapore
