,title,wos,clean_abstract
0,"Socioeconomic determinants of climate change adaptations in the flood-prone rural community of Indus Basin, Pakistan",WOS:000632548100008,threatens global sustainability especially rural community developing country in pakistan severe impact become evident recent past large scale flood indus river system caused massive damage past decade also frequent drought heatwaves among consequence changing country understanding perspective local community regarding strategy pivotal effective policymaking surveyed rural community indus basin southern punjab pakistan ass adaptation currently practiced found respondent perceive drought flood disease outbreak frequently followed flooding event major induced threat respondent used flood drought resistant crop variety field boundary spate irrigation migration safe place loan key strategy also assessed socioeconomic determinant behaviour using binary logistic regression model gender occupation education influenced adaptation present highlight need monetary support flood prone community better medical facility provision drought flood resistant crop variety awareness campaign enhance adaptive capacity area
1,AWARENESS OF CLIMATE CHANGE ADAPTATIONS AMONG DUTCH HOUSING ASSOCIATIONS,WOS:000313387800007,question anymore happens impact effect drought heat wave increased precipitation quality life city office house a significant share northern european housing stock owned maintained large stock owner housing association it responsibility aware change risk might challenge quality life tenant moreover order provide housing good market value future longer overlooked with aim discover level awareness among dutch housing association content analysis undertaken policy plan annual report 25 largest housing association subsequently classified according level awareness analysis returned topic directly referred implies housing association categorised unaware therefore order reach higher level awareness incentivize implementation measure appropriate governance strategy need developed future define characteristic strategy relation level awareness housing association adoption measure could easier measure combined maintenance activity case mitigation measure
2,Adapting to climate change through anticipatory action: The potential use of weather-based early warnings,WOS:000871107700004,a crucially needed united nation plan expand early warning system ew extreme weather cover everyone earth given growing interest solution ass well weather early warning perform extreme event different part world first carry forecast verification weather forecast national oceanic atmospheric administration noaa 95th percentile extreme heat extreme precipitation globally 0 5 degree resolution three day lead time present result alongside similar verification result ecmwf forecast chirp gefs forecast identify region world consistent forecast skill overlay skill short term weather forecast top projection increasing frequency extreme event based result offer policy implication ew investment different region find much tropic weather forecast relatively poor skill forecasting extreme temperature precipitation event calling investment predictability in extra tropic extreme heat extreme precipitation event correctly forecasted better result multi day event shorter lead time while room improve predictability end end investment ew region focus use existing skillful forecast finally world land area projected see increase magnitude extreme heat precipitation event ew investment region prepare unprecedented extreme changing vulnerability these result provide foundation localized ew different part world well evidence policy donor best invest ew different region
3,Adaptation to Climate Change in Swedish Forestry,WOS:000371896900017,forestry become growing concern part due impact storm event raised awareness risk amongst forest owner sweden one europe densely forested country sector playing major role economically however large extent limited provision recommendation forest manager partially implemented summarizes direct implication within forestry sector sweden focus based particular providing example adaptation illustrate specific swedish orientation line relatively intensive forest management system thus illustrates specific swedish orientation active management contrasted approach forestry system particular limited management management based maintaining natural forest particular
4,"Geohazards, Tropical Cyclones and Disaster Risk Management in the Philippines: Adaptation in a Changing Climate Regime",WOS:000328874900010,involving natural variability anthropogenic global warming major worldwide concern particularly publication fourth assessment report ar4 intergovernmental panel considering archipelagic nature philippine minor emitter greenhouse gas government national policy importance expediting related measure highlighted string geo meteorological related disaster specifically triggered landslide flood consequent typhoon parma hit country 2009 present geologic condition rendered affected area especially northwestern luzon extremely vulnerable existent hazard meteorological condition set disaster different initiative government local community taken prepare people possible future disaster recognition pertinent issue extant challenge point urgent need mainstreaming geo meteorological related disaster risk management measure light changing condition
5,The Influences of Political Affiliation and Weather-Related Impacts on Climate Change Adaptation in US Cities,WOS:000905271600020,examines influence state local political affiliation local exposure weather related impact local government effort 88 u s city although take place city replace critical infrastructure damaged severe weather event little known influence political affiliation severe weather event broader sense using multiple linear regression model analyzes variation local government effort function local gross domestic product control variable historical weather related factor e number extreme weather event weather related economic impact due property damage weather related human impact injury fatality state local political affiliation finding indicate local political affiliation significantly influence local government effort however state political affiliation further local weather related impact appear affect likelihood local government engage effort even accounting potential interaction local political affiliation these result support hypothesis local political affiliation strong robust predictor local u s city contributes literature aimed addressing widely acknowledged need understanding key barrier u s well role politics moderating action
6,"Integrating disaster risk reduction and climate change adaptation: key challenges-scales, knowledge, and norms",WOS:000279227200004,statistical data show increase disaster due natural hazard past 20 year part caused meteorological hydrological event increase largely assigned centre epidemiology disaster cred 2010 http www emdat database trend trend html related hazard major trigger majority disaster consequently obvious concern changing exacerbate situation future mcbean ajibade curr opin environ sustain 1 179 186 2009 however attribution single hazard event specific loss still difficult impossible due complexity factor generate disaster loss disaster risk product interaction hazard event vulnerability condition society element exposed a result need systematic linkage disaster risk reduction drr cca advance sustainable development finally human security discussed within ongoing negotiation well within disaster risk community example framework intergovernmental panel special report managing risk extreme event disaster advance however crucial difference drr cca exist widely limited hampered integration practice a existing literature topic current national local strategy well 38 expert interview conducted april may 2009 led author hypothesise difference challenge categorised respect different spatial temporal scale knowledge base norm system examines reason practical barrier linking cca drr according three aspect finally outline recommendation measure need adopted order overcome existing barrier in addition quality criterion formulated applied order constantly monitor evaluate strategy designed simultaneously meet drr requirement vice versa
7,Climate change and energy performance of European residential building stocks-A comprehensive impact assessment using climate big data from the coordinated regional climate downscaling experiment,WOS:000675856500001,in recent year corresponding expected extreme weather condition widely recognized potential problem building industry taking various action achieve sustainable development implement energy conservation strategy provide mitigation in addition mitigation crucial adapt investigate possible risk limitation mitigation strategy although importance well understood still challenge understanding modeling impact consequent risk extreme work provides comprehensive impact energy performance thermal comfort european residential building stock to perform unbiased assessment account uncertainty extreme event large set future data used 90 year period 2010 2099 data 38 european city five different zone downscaled rca4 regional model synthesized applied simulate respective energy performance residential building stock city result suggest larger need cooling building future le heating demand however difference variation rate zone city discomfort hour increase notably city within cooling dominated zone affected considerably city within heating dominated zone in addition long term change induced extreme considerably affect future energy demand especially cooling demand may become challenging building energy system
8,"In Situ Adaptation to Climatic Change: Mineral Industry Responses to Extreme Flooding Events in Queensland, Australia",WOS:000327865800002,extractive resource development necessitates direct immediate dependence upon environment particularly sensitive variability examines climatic change within mining industry case extreme flooding event 2007 2008 2010 2011 queensland with 47 state 57 coal mine impacted 2010 2011 flood vast infrastructure damage lost export earnings 2 billion consequent impact surrounding socioeconomic ecological landscape case demonstrates industry vulnerability climatic change importance planned future viability a mineral resource embedded within landscape must necessarily situ draw lesson case better inform sector wide strategy situ finding relevant industry sector tourism forestry geographical relocation available strategy
9,Adaptation Becoming Business as Usual: A Framework for Climate-Change-Ready Transport Infrastructure,WOS:000623623200003,extreme weather damage disrupts transport infrastructure multitude way heavy rainfall ensuing landslide flooding may lead road rail closure extreme heat damage road surface cause track signalling electronic equipment overheat thermal discomfort passenger a extreme weather expected occur frequently future transport infrastructure owner operator must increase preparedness order reduce weather related service disruption associated financial cost present two sided framework use organisation develop ready transport infrastructure regardless current level knowledge preparedness framework composed strategy implementation plan overarching ambition embed within organisational procedure becomes normal function business it advocate pathway e sequential adaptive action compromise future action circular iterative structure ensures new knowledge socio economic change may incorporated previous adaptation evaluated moreover framework aligns existing asset management procedure e g iso standard governmental organisational approach by adopting framework organisation self identify level readiness seek enhance
10,Adapting to climate change in a dryland mountain environment in Kenya,WOS:000234232200004,global warming likely lead variety change local climatic condition including potential increase frequency intensity extreme climatic event drought flood storm present capacity respond manage climatic variability including extreme event important component adjustment climatic change in particular identifying addressing constraint local mechanism whether political economic social nature critical developing effective policy drylands kenya present great survival challenge people living area hilltop drylands provide favorable resource adapting present examines role one particular hilltop endau kitui district eastern kenya play process local climatic variability drought project presented investigated conflict exclusion key hilltop resource constrain among population group living around hilltop constraint negotiated addressed even exacerbated institutional arrangement development activity
11,"Drought and the future of rural communities: Opportunities and challenges for climate change adaptation in regional Victoria, Australia",WOS:000328179400046,vulnerability variability highlighted recent drought e big dry millennium drought also recent flooding across much eastern 2011 2012 there also possibility frequency intensity duration drought may increase due anthropogenic stressing need robust drought strategy investigates socio economic impact drought past present drought measure future strategy required deal projected impact qualitative analysis presented record actual experience drought climatic extreme help advance knowledge best respond adapt condition might vary different location sector community it found effort needed address changing environment shifting notion drought crisis towards acknowledging variable availability water multi year drought unexpected may even become frequent action also taken revalue farming enterprise critical environmental economic cultural well also strong consensus value water recognised meaningful way e economic term finally across diverse stakeholder involved one point consistently reiterated drought exacerbating issue impact water security supply complexity agriculture industry global economics particular global market recent ongoing global financial crisis demographic change decreasing ageing population currently occurring across rural community social economic issue facing rural community product drought understand would underestimate extent problem inhibit ability coordinate holistic cross agency approach needed successful rural community
12,Adaptation to Climate Change in Rainfed Agriculture in the Global South: Soil Biodiversity as Natural Insurance,WOS:000425202700052,increased drought frequency many part world especially global south expected due accelerating present bioeconomic model unpacks role soil biodiversity contributing increasing stabilizing agricultural productivity low input rainfed farming system natural insurance value soil biodiversity mostly depends farmed risk preference well frequency drought event insured show probability drought increase soil biodiversity conservation optimal ecosystem based strategy however likely case given drought probability threshold natural insurance value soil biodiversity drought prone rainfed agricultural system depends combination key hydrological agronomic economic parameter
13,Nature-based solutions for climate change adaptation are not located where they are most needed across the Alps,WOS:000899418800001,impact social ecological system mountainous area increasing certain natural disaster changing nature contribution people ncp nature based solution nb increasingly implemented help local community adapt climatic hazard however relevance location relation hazard local ncp hardly addressed in portal pathway transformation alp project identified mapped portfolio 97 nb european alp most nb addressed drought soil instability aimed provide multiple ncp simultaneously wood production protective function landslide analysed whether nb located needed according current future intensity hazard aim address supply flow demand indicator ncp aim provide found location nb overall related current supply flow demand indicator ncp intensity hazard nevertheless nb addressing drought flood located area hazard intense match higher value ncp indicator conversely nb aiming produce wood provide protective function landslide located area greater level ncp regardless intensity hazard these result suggest hazard ncp indicator main driver nb implementation argue integrating local condition current ncp flow needed underpin macro regional strategy planning nb implementation
14,"Assessing climate change-induced flooding mitigation for adaptation in Boston's Charles River watershed, USA",WOS:000412959400003,projected increased temperature frequent intense rainfall northeast united state green infrastructure identified critical strategy stormwater management flooding mitigation well science play important role understanding range impact effect green infrastructure planning nevertheless lack scaled data place based assessment discouraged local community pursue plan proposed transdisciplinary planning framework assessing effect detention mitigating induced flooding using case charles river watershed massachusetts usa derived sensitivity test watershed 36 condition modeled using soil water assessment tool swat compared ipcc scenario statistical analysis revealed detention efficient reducing flooding hazard low moderate emission scenario high emission scenario a range extra land area designated detention would needed mitigating flood various scenario planning implication include need effective siting detention area combined soil conservation watershed planning innovation adaptive land planning urban design call integration science hydrological assessment transdisciplinary planning process better inform facilitate decision making using green infrastructure local community
15,"The potential of unused small-scale water reservoirs for climate change adaptation: A model- and scenario based analysis of a local water reservoir system in Thuringia, Germany",WOS:000873912900001,6th intergovernmental panel ipcc report 2021 stated hot extreme become frequent intense across land region past decade it projected changing climatic condition thuringia particular lead higher frequency drought event thus vital develop local strategy mitigate effect drought agriculture ensure future crop production water resource infrastructure critical role planning future measure sustainable a construction new dam reservoir controversial preferable use existing infrastructure suitable small scale water management reservoir built thuringia gdr german democratic republic decommissioned german reunification examined determine whether reuse could considered potential strategy for purpose three reservoir thuringia selected impact soil moisture water availability crop production use water reservoir meet future irrigation need modeled using water evaluation planning system weap modeled climatic change direct effect soil moisture status leading higher water demand local agriculture result show crop water need could double near future 2020 2040 distant future 2071 2100 however predicted decline yield mitigated irrigation modeling result indicate supplemental irrigation reservoir water mitigates projected loss even allows 6 2 13 5 crop production hence reuse reservoir worth considered strategy policymakers in addition cost benefit analysis future evaluation reservoir local user interest demand need included avoiding conflict water in general weap modeling tool finding show approach could used investigate potential adaptive capacity small scale water infrastructure
16,Revisiting Emergency Food Reserve Policy and Practice under Disaster and Extreme Climate Events,WOS:000455920000001,all food system continue affected disaster extreme event triggered recent food crisis around world concern government trying develop robust resilient food system one oldest option many government stockpile emergency food reserve purpose food security disaster preparedness in aftermath world food price crisis 2007 2008 2011 government asia maintaining emergency food reserve ensure greater supply price stability disaster extreme event help government justify emergency food reserve examined emergency food reserve policy indonesia philippine malaysia emergency food reserve emerged practice shared objective development disaster risk reduction demonstrated government finding suggest government maintain strong view adequate emergency food reserve buffer national food price shock shock disaster soften disruption trade due export ban time disaster emergency
17,Assessment of climate change impacts on water resources of the Purus Basin in the southwestern Amazon,WOS:000407362300005,knowledge water resource critical face long term change frequent extreme event occurrence during major drought 2005 2010 large epicenter located southwestern amazon purus river basin in sense conducted hydrological simulation basin ass impact water resource throughout 21st century water balance simulated using distributed hydrological model mhd inpe future projection simulated regional eta inpe model driven 4 member hadcm3 global model regarding a1b ar4 ipcc scenario greenhouse gas emission a simulated eta inpe hadcm3 4 member mean response a1b scenario represents rainfall reduction 11 1 temperature increase 4 4 degree
18,Analogues for the railway network of Great Britain,WOS:000393140000017,in recent year 2013 2016 extreme weather event caused substantial disruption great britain gb railway infrastructure in coming decade vulnerability unlikely subside effect become intense railway stakeholder gb strongly engaged understanding impact railway system industry could adapt impact since 2010 network rail rssb supported topic tomorrow railway programme under programme analogue performed determine whether lesson could learned country weather management two type analogue used identify suitable location first data 20 model coupled model intercomparison project phase 5 cmip5 used identify region similar present day projected gb future analogue location found largely insensitive indicator method used compare different location next railway network many country studied find similar physical operational characteristic gb network region railway analogue france netherlands belgium denmark a part wider aim support gb railway network weather resilience wr cca activity focused stakeholder engagement undertaken representative country railway targeted approach complementary broader collation existing wr cca measure used globally
19,Climate change and forestry: What policy for Canada?,WOS:000075079600010,on basis projected global expected experience large land use impact a indicated forestry agriculture likely net gainer whole possibly gaining global warming require shifting land forestry agricultural activity nonetheless cost effective mitigation strategy likely involve opposite planting tree agricultural land quandary decision maker whether pursue mitigation strategy could detriment future
20,The influence of socioeconomic factors on storm preparedness and experienced impacts in Finland,WOS:000634284200004,extreme weather event storm may cause material damage injury interfere day day operation society earlier natural hazard found demographic socioeconomic factor influence way individual prepare affected natural hazard however often focus area high exposure vulnerability low exposure vulnerability area scarcer to address gap ask socioeconomic demographic factor matter individual prepare affected storm finland our data consist internet survey n 1014 conducted severe winter storm hit finland beginning 2019 analyze data chi squared test logistic regression our result show respondent education level employment status connected whether took preparedness measure whether experienced harm instead type residential property play part in addition respondent experienced storm related harm recent year likely prepare in conclusion socio demographic factor seem marginal influence storm preparedness experienced impact finland contradicts earlier may stem relatively equal distribution well among population
21,"Drought, Tree Mortality, and Wildfire in Forests Adapted to Frequent Fire",WOS:000424878000005,massive tree mortality occurred rapidly frequent fire adapted forest sierra nevada california mortality product acute drought compounded long established removal key ecosystem process frequent low moderate intensity fire recent tree mortality many implication future forest ecological good service provide society future wildfire hazard following mortality generally characterized decreased crown fire potential increased surface fire intensity short intermediate term scale present tree mortality large greater potential mass fire exists coming decade driven amount continuity dry combustible large woody material could produce large severe fire for long term highlight importance moving beyond triage dead dying tree making green live forest resilient
22,"Identifying extreme event climate thresholds for greater Manchester, UK: examining the past to prepare for the future",WOS:000300976400006,extreme weather event severe consequence local environment population projected future change e g ukcp09 indicate north west england likely experience increasing frequency intensity meteorological extreme leading flooding heat wave storm consequently important region enhances preparedness event explores possibility developing quantifiable risk index case area greater manchester using combination archival statistical analysis past data for extreme function single meteorological variable e g heat wave pluvial flooding heavy snowfall threshold proved reliable skillful day maximum daily temperature greater equal 29 2 degree
